zgfybj201522032,0,"ISTIC,PKU",精子DNA碎片率、精子形态率与精子顶体酶之间的关系及其对妊娠结局影响的研究,10.7620/zgfybj.j.issn.1001-4411.2015.22.32,王箭;吴方贵;邹红艳;张敏旗;彭南妮;,[1]广东省深圳市罗湖区人民医院生殖医学中心 510000,中国妇幼保健,精子DNA碎片率;精子形态率;精子顶体酶;妊娠结局;,R711.6,2015,30,22
zgxdyyyy201601226,1,"ISTIC,PKU",不同低敏配方对牛奶蛋白过敏儿童体格生长的影响,10.14164/j.cnki.cn11-5581/r.2016.01.226,吕晓丹;张丹;谢映梅;张莉;刘巧红;,"[1]518172,深圳市龙岗区妇幼保健院",中国现代药物应用,低敏配方;牛奶蛋白过敏;体格生长;,,2016,10,1
zgsyyy201608082,0,"ISTIC,PKU",深圳市罗湖区人民医院老年病分院诺如病毒感染性腹泻流行现状及防控措施分析,10.14163/j.cnki.11-5547/r.2016.08.082,马花平;,"[1]518000,深圳市罗湖区人民医院老年病分院 原深圳市罗湖区社会福利中心老年护理院",中国实用医药,诺如病毒;感染性腹泻;流行现状;防控措施;,,2016,,8
ylbjqj201511010,1,"ISTIC,PKU",血清CRP、IL-6、PCT检测在新生儿败血症诊治中的价值,10.3969/j.issn.1674-4659.2015.11.1420,吕晓丹;刘巧红;张莉;,"[1]深圳市龙岗区妇幼保健院,广东深圳,518000",临床医学工程,新生儿败血症;C反应蛋白;白介素-6;降钙素原;意义;,R722.13+1,2015,22,11
ddyx201417043,3,"ISTIC,PKU",氟康唑在复发性假丝酵母菌性阴道炎中的临床治疗效果观察,10.3969/j.issn.1009-4393.2014.17.043,刘蓓;俞泓;徐珩;,[1]广东 518000 香港大学深圳医院妇产科 深圳市妇幼保健院妇产科,当代医学,氟康唑;复发性假丝酵母菌性阴道炎;临床效果;,,2014,,17
qqhryxyxb201613048,0,"ISTIC,PKU",益肾活血蠲痹法治疗强直性脊柱炎的护理研究,,刘小军[1];邹立华[2];陈小丹[2];,"[1]518055,广东省深圳市罗湖区中医院急诊科;[2]深圳市龙岗区人民医院中西医结合科;",齐齐哈尔医学院学报,益肾活血蠲痹法;强直性脊柱炎;护理;效果;,,2016,37,13
sdyy201618069,0,"ISTIC,PKU",HbAlc和GSP联合检测在妊娠期糖尿病中的应用,,林建春;王雪莉;黄和明;,[1]广东省深圳市龙岗区妇幼保健院 518172,首都食品与医药,妊娠期糖尿病;糖化血清蛋白;糖化血红蛋白;,R714.25,2016,23,18
cjj201602119,1,"ISTIC,PKU",新医院会计制度下如何加强医院内部控制,10.3969/j.issn.1009-2781.2016.02.119,张晓健;,[1]广东省深圳市宝安区妇幼保健院,财经界,会计制度;加强;内部控制;,,2016,,2
zyyk201618050,0,"ISTIC,PKU",布拉酵母菌散剂治疗小儿急性腹泻病的临床效果,10.3760/cma.j.issn.1674-4756.2016.18.050,饶福光;熊彪;汪培勤;王健容;黄从付;肖政祥;,"[1]518172,广东省深圳市龙岗区妇幼保健院儿科",中国实用医刊,小儿急性腹泻;微生态制剂;布拉酵母菌散剂;,,2016,43,18
qqhryxyxb201601015,1,"ISTIC,PKU",600例高龄产妇临床妊娠常见状况分析,,张瑜君;邬俏璇;,"[1]深圳市妇幼保健院产科门诊, 广东,518000",齐齐哈尔医学院学报,高龄产妇;情绪;分娩方式;妊娠合并症;分娩期并发症;妊娠结局;,,2016,37,1
zgxdyyyy201615197,0,"ISTIC,PKU",温阳活血法治疗慢性阻塞性肺疾病稳定期患者体会,10.14164/j.cnki.cn11-5581/r.2016.15.197,廖文生;,"[1]518000,深圳市罗湖区人民医院中医科",中国现代药物应用,慢性阻塞性肺疾病;肺脾肾阳虚夹瘀证;温阳活血;稳定期;,,2016,10,15
xdzdyzl201615018,0,"ISTIC,PKU",半夏泻心汤加减治疗痞满临床观察与证治分析,,廖文生;李卫青;马全庆;,"[1]深圳市罗湖区人民医院中医科,广东 深圳,518000",现代诊断与治疗,痞满;半夏泻心汤;莫沙必利;,R256.32,2016,27,15
xdzdyzl201615044,0,"ISTIC,PKU",光动力疗法对耐药性宫颈癌患者组织中GST-π、P-gp和Topo-Ⅱ表达的影响,,王海燕[1];周莉君[1];兰秀秀[1];姜侃[2];,"[1]深圳市宝安区妇幼保健院妇产科,广东 深圳,518100;[2]山东大学齐鲁医院妇产科,山东 济南,250012;",现代诊断与治疗,光动力疗法;耐药性宫颈癌;GST-π;P-gp;Topo-Ⅱ;,,2016,27,15
qqhryxyxb201414088,3,"ISTIC,PKU",饮食处方对妊娠期糖尿病患者血糖控制的影响效果观察,,李玉凤;曹静威;朱社宁;,"[1]518028,深圳市妇幼保健院",齐齐哈尔医学院学报,饮食处方;妊娠期糖尿病;血糖控制;,,2014,35,14
zgyyzn201413304,2,"ISTIC,PKU",五常法用于手术室高危药品的管理,,蔡荟;,"[1]广东省深圳市南山区妇幼保健院,广东 深圳,518052",中国医药指南,五常法;高危药品;手术室;,R97,2014,,13
zyyjk201405005,0,"ISTIC,PKU",现场培训在预防三氯乙烯药疹样皮炎中的应用,,张靖[1];卿文静[1];谭琼[1];朱志良[2];刘丽珍[1];,"[1]广东省深圳市龙华新区疾病预防控制中心,518131;[2]深圳市宝安区疾病预防控制中心;",职业与健康,现场培训;干预;三氯乙烯;效果;,R135.7,2014,30,5
zgmzmjyyzz201609060,0,"ISTIC,PKU",无痛性心肌缺血患者应用动态心电图诊断的价值分析,,肖淑珠[1];张平[2];林波[1];,"[1]深圳市龙岗区妇幼保健院,广东 深圳,518000;[2]深圳市第九人民医院,广东 深圳,518000;",中国民族民间医药,无痛性心肌缺血;动态心电图;价值分析;,R542.2,2016,25,9
jkr201506033,2,"ISTIC,PKU",完全性、部分、边缘性前置胎盘与妊娠结局的关系研究,,俞泓;周紫琼;,"[1]深圳市妇幼保健院产科,深圳,518000",中国当代医药,妊娠结局;前置胎盘;危险因素;关系;,R714.46,2015,,6
qqhryxyxb201504012,2,"ISTIC,PKU",GnRHa 对Ⅰ～Ⅱ期子宫内膜异位症伴不孕患者妊娠结局的影响分析,,陈小琳[1];金平[1];汤惠茹[2];张瑞女[2];,"[1]518017,深圳市妇幼保健院妇产科;[2]北京大学深圳医院妇产科;",齐齐哈尔医学院学报,促性腺激素释放激素激动剂( GnRHa);子宫内膜异位症;不孕;妊娠结局;影响;,,2015,,4
zyyk201507040,2,"ISTIC,PKU",欣普贝生用于足月胎膜早破引产的临床观察,10.3760/cma.j.issn.1674-4756.2015.07.040,洪小苹;,"[1]518000,广东省深圳市妇幼保健院产科",中国实用医刊,欣普贝生;足月胎膜早破;引产;临床效果;,,2015,42,7
jths201626009,0,"ISTIC,PKU",新生儿外周静脉短导管感染相关原因的研究现状及对策,10.3969/j.issn.1674-4748.2016.26.009,袁瑞琴;,"[1]广东省深圳市妇幼保健院,518001",全科护理,新生儿;外周静脉短导管;感染;,R473.72,2016,14,26
jths201626016,0,"ISTIC,PKU",母乳系统化管理提高超低出生体重儿住院期间母乳喂养率的实践研究,10.3969/j.issn.1674-4748.2016.26.016,熊小云;杨传忠;林伟斌;余霞娟;陈丽莲;,"[1]广东省深圳市妇幼保健院,518028",全科护理,超低出生体重儿;母乳喂养;母乳管理;,R473.71,2016,14,26
jths201626045,0,"ISTIC,PKU",1例新生儿肱动脉栓塞的护理,10.3969/j.issn.1674-4748.2016.26.045,张娟;熊小云;袁瑞琴;,"[1]广东省深圳市妇幼保健院,518028",全科护理,新生儿;肱动脉栓塞;护理;,R473.72,2016,14,26
zgyykx201521044,1,"ISTIC,PKU",健康教育路径在子宫腺肌病患者中的应用效果,,袁迎九;后建丽;丁文清;,"[1]深圳市龙岗区妇幼保健院妇科,广东深圳,518000",中国医药科学,子宫腺肌病;健康教育路径;效果;,R473.71,2015,,21
qqhryxyxb201535006,1,"ISTIC,PKU",儿童麻疹疫苗接种后远期抗体水平,,王健容;汪培勤;饶福光;朱春婵;,"[1]518172,广东省深圳市龙岗区妇幼保健院儿科",齐齐哈尔医学院学报,儿童;麻疹疫苗;免疫接种;远期效果;抗体;,,2015,,35
qqhryxyxb201534055,1,"ISTIC,PKU",集束化护理策略在新生儿雾化吸入中的应用,,梁丽清;汤菊妹;李丽娟;谢映梅;刘巧红;,"[1]518172,广东省深圳市龙岗区妇幼保健院新生儿科",齐齐哈尔医学院学报,集束化护理策略;新生儿;雾化吸入;效果;,,2015,36,34
qqhryxyxb201530040,1,"ISTIC,PKU",儿童恒前牙外伤冠折露髓后采用活髓切断术的临床观察,,陈向深;,"[1]518000,深圳市妇幼保健院",齐齐哈尔医学院学报,儿童;恒前牙;外伤;冠折露髓;活髓切断术;,,2015,36,30
cdyxyxb201406040,1,"ISTIC,PKU",地佐辛联合氟比洛芬脂对妇科腹腔镜手术全麻插管苏醒期的影响,,蒋爱华;,"[1]深圳市罗湖区妇幼保健院,广东深圳,518000",承德医学院学报,地佐辛;氟比洛芬脂;妇科;腹腔镜;全麻苏醒期;,R473.6,2014,,6
sylcyx201509003,1,"ISTIC,PKU",西医联合血府逐瘀汤治疗冠心病72例的疗效,10.13764/j.cnki.lcsy.2015.09.003,罗明[1];袁春梅[2];吴芝勋[1];马超伦[1];,"[1]深圳市福田区妇幼保健院急诊科;[2]深圳市盐田区人民医院麻醉科,广东 深圳,518045;",实用临床医学,血府逐瘀汤;中西医结合;冠心病;疗效;,R541.4,2015,,9
zgmtgyyxzz201404018,0,"ISTIC,PKU",超声引导下腰丛-坐骨神经阻滞与连续硬膜外麻醉在膝关节手术中的应用,10.11723/mtgyyx1007-9564 201404018,伍捡林;刘安林;黄波;伍捡雄;陈明富;郭超;,"[1]广州医科大学附属深圳沙井医院,广东省深圳市,518104",中国煤炭工业医学杂志,腰丛-坐骨神经阻滞;连续硬膜外麻醉;膝关节;,R614.4,2014,17,4
bfyx201607089,0,"ISTIC,PKU",咪达唑仑肌注与安定静推治疗小儿急性惊厥的疗效观察,,汪月娟;邹新英;许哲洪;杨宇;,[1]深圳市妇幼保健院 深圳518028,北方药学,咪达唑仑;安定;惊厥;儿童;,R720.597,2016,13,7
haixyx201607036,0,"ISTIC,PKU",某妇幼保健院处方合理性评价与分析,10.3969/j.issn.1006-3765.2016.07.036,邱双凤;祁兢晶;,[1]深圳市龙岗区妇幼保健院药剂科深圳518172,海峡药学,合理用药;处方分析;妇幼保健;,R969.4,2016,,7
syzyyzz201607043,0,"ISTIC,PKU",茵栀黄口服液联合熊去氧胆酸片治疗妊娠期肝内胆汁淤积症疗效分析,10.3969/j.issn.1004-2814.2016.07.043,吴敏;杨洁;,"[1]广东省深圳市宝安区妇幼保健院产科,广东 深圳,518000",实用中医药杂志,妊娠期;肝内胆汁淤积症;茵栀黄口服液;熊去氧胆酸片;,R714.25,2016,32,7
slyyxzz201607004,0,"ISTIC,PKU",维生素D缺乏在小儿毛细支气管炎发病中的作用,10.3969/j.issn.1004-4337.2016.07.004,庄哈娜;刘海英;刘瑜;赵宏霞;,[1]深圳市妇幼保健院 深圳 518000,数理医药学杂志,毛细支气管炎;维生素D;25-(OH)D3;,R725.6,2016,29,7
slyyxzz201607040,0,"ISTIC,PKU",新生儿严重快速心律失常应用胺碘酮治疗的临床分析,10.3969/j.issn.1004-4337.2016.07.040,张莉;,[1]深圳市龙岗区妇幼保健院 深圳 518172,数理医药学杂志,新生儿;严重快速心律失常;胺碘酮;临床效果;,R722.1,2016,29,7
xdzdyzl201614055,0,,纳米羟基磷灰石及其复合材料对牙周膜细胞的影响,,陈向深;,"[1]深圳市妇幼保健院,广东 深圳,518000",现代诊断与治疗,纳米羟基灰石;复合材料;牙周膜细胞;,R781.4,2016,27,14
djjk-x201607248,0,,预见性护理措施在小儿哮喘的应用效果分析,10.3969/j.issn.1009-6019.2016.07.248,吴红霞;苏小兰;揭育雁;,[1]深圳市宝安区妇幼保健院儿一区 广东 深圳 518101,大家健康（下旬版）,预见性;护理;小儿;哮喘;措施;,R473.72,2016,10,7
zgsyyy201625024,0,,妊娠期妇女转铁蛋白状况分析,10.14163/j.cnki.11-5547/r.2016.25.024,林建春;缪秋明;,"[1]518721,深圳市龙岗区妇幼保健院检验科",中国实用医药,转铁蛋白;妊娠期;妇女;,,2016,11,25
tsyxyxb201604036,0,,不同孕周分娩及分娩方式对早产儿预后的影响,10.3969/j.issn.1004-7115.2016.04.036,陈秋珍[1];白军[2];梁兰芳[1];,"[1]深圳市龙岗区妇幼保健院产科,广东深圳,518172;[2]深圳市人民医院妇科,广东深圳,518172;",泰山医学院学报,孕周;分娩方式;早产儿;预后;,R714,2016,37,4
zgyykx201503012,2,,脂肪细胞因子chemerin与胰岛素抵抗关系的研究,,李会琴;任利容;,"[1]深圳市宝安区妇幼保健院,广东深圳,518000",中国医药科学,Chemerin;脂肪因子;胰岛素抵抗;,R587,2015,,3
zhckjjdzzz201501011,2,,产科弥散性血管内凝血的临床诊治,10.3877/cma.j.issn.2095-3259.2015.01.011,程黎;王晨虹;,"[1]518017,深圳市妇幼保健院产科",中华产科急救电子杂志,"弥漫性血管内凝血;妊娠,高危;诊断;疾病管理;",,2015,,1
zyyk201523063,1,,不同LEEP术式对宫颈上皮内瘤变的应用效果,10.3760/cma.j.issn.1674-4756.2015.23.063,林晴;,"[1]518028,广东省深圳市妇幼保健院妇科",中国实用医刊,LEEP手术;宫颈上皮内瘤样病变;应用效果;,,2015,42,23
qqhryxyxb201523080,1,,门诊输液室中预约服务的应用效果分析,,胡芳;杨友菊;,"[1]518028,南方医科大学附属深圳市妇幼保健院",齐齐哈尔医学院学报,门诊输液;预约服务;疗效;患儿;,,2015,,23
zgmzmjyyzz201520084,1,,重症感染病原菌的临床分布与药敏分析,,吕丽燕;,"[1]深圳市罗湖区人民医院,广东 深圳,518001",中国民族民间医药,重症感染;病原菌;临床分布;药敏试验;,R446.5,2015,,20
zyyjk201414003,0,,深圳辖区内电镀企业主要职业病危害因素检测结果,,张胜[1];陈金茹[1];涂晓志[1];宾海华[1];何必隆[1];赵转地[1];徐新云[2];,"[1]广东省深圳市宝安区松岗预防保健所,518100;[2]深圳市疾病预防控制中心;",职业与健康,电镀;职业卫生;职业危害;监测;,R134,2014,30,14
ylbjqj201510020,1,,叶酸健康宣教对备孕期女性叶酸服用情况及母婴健康状况的影响,10.3969/j.issn.1674-4659.2015.10.1298,黄星;李文蕾;葛绍明;冯东霞;,"[1]深圳市福田区妇幼保健院产科,广东深圳,518026",临床医学工程,备孕期女性;叶酸;健康宣教;优良率;母婴健康状况;,R153.1,2015,,10
hnyxyj201608137,0,,社区干预对高血压患者血液流变学指标及生活质量的影响,10.3969/j.issn.1004-437X.2016.08.137,吴培杰;,[1]福田区妇幼保健院 广东 深圳 518000,河南医学研究,社区干预;高血压;血液流变学;生活质量;,R473.5,2016,25,8
zgxdyyyy201616045,0,,利普液基细胞制片、液基超薄细胞制片机制片及传统巴氏涂片在宫颈细胞学检查中的比较分析,10.14164/j.cnki.cn11-5581/r.2016.16.045,陈国艳;卢翔宇;黄新翼;陈莹莹;,"[1]518048,深圳市妇幼保健院",中国现代药物应用,利普液基细胞制片;巴氏涂片;液基超薄细胞制片机制片;宫颈细胞学;临床价值;,,2016,10,16
sdyy201616036,0,,腹腔镜治疗卵巢肿瘤的临床病例分析与报告,,王海燕;周莉君;兰秀秀;,[1]广东省深圳市宝安区妇幼保健院 518100,首都食品与医药,腹腔镜;卵巢肿瘤;临床疗效;开腹手术;,R737.71,2016,23,16
sdyy201616037,0,,川崎病患儿临床特征、易被延误诊断的原因及治疗策略,,付永萍;,[1]南方医科大学附属深圳市妇幼保健院 518028,首都食品与医药,川崎病;延误诊断;治疗方法;,R725.4,2016,23,16
jths201624022,0,,循证护理在新生儿胆红素脑病中的应用效果,10.3969/j.issn.1674-4748.2016.24.019,李仙梅;,"[1]广东省深圳市福田区妇幼保健院,518000",全科护理,胆红素脑病;新生儿;循证护理;,R473.72,2016,14,24
zgzkjs201406060,3,,新会计制度下医院财务风险控制措施探讨,10.3969/j.issn.1672-576X.2014.06.060,何瑜;,[1]深圳市妇幼保健院,中国总会计师,医院;财务管理;风险防控;,,2014,,6
zgxdyyyy201412115,3,,产科硬膜外分娩镇痛转行硬膜外剖宫产麻醉失败的危险因素探讨,,苏娇玲;李亚文;吴铭广;,"[1]518000,深圳市妇幼保健院",中国现代药物应用,硬膜外分娩镇痛;剖宫产;硬膜外麻醉;,,2014,,12
scyxzz201613027,0,,腹腔镜与经腹子宫肌瘤剔除术在子宫肌瘤患者中的应用效果分析,10.13214/j.cnki.cjotadm.2016.13.027,林晴;,"[1]深圳市妇幼保健院妇科,广东深圳,518028",中国伤残医学,腹腔镜;传统子宫肌瘤剔除术;子宫肌瘤;,R713.4,2016,24,13
zyyk201613014,0,,产科发生急性肺水肿的相关因素分析,10.3760/cma.j.issn.1674-4756.2016.13.014,周紫琼;,"[1]南方医科大学附属深圳妇幼保健院产科, 广东深圳,518028",中国实用医刊,产科;急性肺水肿;妊娠;并发症;,,2016,43,13
gmzy201504067,1,,电针配合矫形压力套治疗产后拇长屈肌腱狭窄性腱鞘炎疗效观察,10.3969/j.issn.1003-8914.2015.04.059,张谦[1];吴家满[2];卓缘圆[3];钟宇玲[2];,[1]广东省深圳市福利中心康复医院 深圳 518032;[2]广东深圳市妇幼保健院 深圳 518028;[3]广东省深圳市中医院 深圳 518033;,光明中医,电针;矫形压力套;产后;狭窄性腱鞘炎;,,2015,,4
zggdyxjy201501006,2,,情感支持对儿科实习护生焦虑状况的影响,10.3969/j.issn.1002-1701.2015.01.006,杨颖杰;杨卫联;,"[1]深圳市宝安区妇幼保健院,广东深圳,518000",中国高等医学教育,情感支持;护生;焦虑;儿科;,R47-4,2015,,1
qqhryxyxb201623008,0,,热敏灸任督脉联合超短波在慢性盆腔炎患者中的应用,,凌文丽;陈鹏典;刘芳;陈洁;邱婷婷;邱晓玲;,"[1]深圳市妇幼保健院, 广东,518028",齐齐哈尔医学院学报,慢性盆腔炎;热敏灸;任脉;督脉;超短波;,,2016,37,23
ykxjz201503016t,0,"ISTIC,PKU",雷珠单抗联合Ahmed青光眼阀植入术治疗新生血管性青光眼,10.13389/j.cnki.rao.2015.0070,刘斌[1];杨玉霞[2];刘杏[3];李伟力[1];莫正政[2];,"[1]深圳爱视眼科专科门诊部, 广东省深圳市,518000;[2]深圳市罗湖区人民医院眼科, 广东省深圳市,518000;[3]510060 广东省广州市,中山大学中山眼科中心,眼科学国家重点实验室;",眼科新进展,雷珠单抗;Ahmed青光眼阀;新生血管性青光眼;,,2015,35,3
zgxxgbyj201511011,1,"ISTIC,PKU",不同分级高血压患者体内血清同型半胱氨酸的临床变化研究,10.3969/j.issn.1672-5301.2015.11.011,郭雨青[1];邬俏璇[2];,"[1]广东药学院附属第一医院心血管内科, 广东省广州市,510080;[2]深圳市妇幼保健院科室;",中国心血管病研究,分级;高血压;血清;同型半胱氨酸;变化;,R544.1,2015,13,11
lcpwkdzzz201602011,0,"ISTIC,PKU",腹腔镜胆囊切除术和开腹手术对机体血清应激指标的影响,,江红志;,"[1]深圳市坪山新区妇幼保健院 外科,广东 深圳,518000",临床普外科电子杂志,腹腔镜胆囊切除术;开腹手术;血清应激指标;,,2016,4,2
sxzy201606026,0,"ISTIC,PKU",感染后咳嗽中西医研究进展,10.3969/j.issn.1000-7156.2016.06.026,王衍华[1];李卫青[2];,[1]湖北中医药大学 武汉 430006;[2]广东省深圳市罗湖区人民医院;,山西中医,感染后咳嗽;病因病机;治疗;综述;,R256.11,2016,32,6
bfyx201606110,0,"ISTIC,PKU",小儿常用药不良反应调查及用药指导的干预价值研究,,樊丹怡;常宏;邓少洁;蒋绍艳;,[1]深圳市妇幼保健院药剂科 深圳 518028,北方药学,患儿;ADR;分析;用药指导;,R985,2016,13,6
bfyx201606131,0,"ISTIC,PKU",金葡球菌和肺炎链球菌在体内对莫西沙星耐药性分析,,梁霞;,[1]深圳市宝安区妇幼保健院 深圳 518100,北方药学,金葡球菌;肺炎链球菌;莫西沙星;耐药性;,R965,2016,13,6
lcyx201606012,0,"ISTIC,PKU",三种交叉配血方法在新生儿输血中的应用,,黄丽清;张慧莲;周喜友;,"[1]广东省深圳市宝安区妇幼保健院检验科,深圳,518133",临床医学,交叉配血;凝聚胺法;微柱凝胶抗人球蛋白法;,,2016,36,6
jilinyx201606096,0,"ISTIC,PKU",布地奈德雾化吸入治疗儿童上呼吸道感染疗效观察,10.3969/j.issn.1004-0412.2016.06.096,梁春晓;陈婉兰;,"[1]广东省深圳福田妇幼保健院赤尾社康中心,广东 深圳,518033",吉林医学,布地奈德;雾化吸入;儿童;上呼吸道感染;,,2016,37,6
jkr201528031,1,"ISTIC,PKU",卡前列素氨丁三醇注射液联合Foleys导尿管宫腔填塞在宫缩乏力性产后出血中的临床应用,,黄燕;周紫琼;江丽萍;,"[1]深圳市妇幼保健院产科,深圳,518000",中国当代医药,卡前列素氨丁三醇注射液;Foleys导尿管;宫腔填塞;宫缩乏力;产后出血;,R714.46+1,2015,,28
sylcyx201606022,0,"ISTIC,PKU",极低出生体质量新生儿血浆Uu-DNA 拷贝数和 IL-6检测的临床意义,10.13764/j.cnki.lcsy.2016.06.022,张丹;李秀云;吕晓丹;陈诚;,"[1]深圳市龙岗区妇幼保健院新生儿科,广东 深圳,518172",实用临床医学,极低出生体质量新生儿;解脲脲原体菌血症;早产儿并发症;解脲脲原体-DNA;IL-6;,R722.1,2016,17,6
ylbjqj201606014,0,"ISTIC,PKU",主动免疫疗法对复发性流产患者子宫内膜黄体期淋巴细胞各免疫表型的影响,10.3969/j.issn.1674-4659.2016.06.0721,李军;刘庆芝;姚吉龙;,"[1]南方医科大学附属深圳妇幼保健院妇科,广东深圳,518000",临床医学工程,主动免疫治疗;原因不明复发性流产;子宫内膜;黄体期;淋巴细胞;,R714.21,2016,23,6
tsyxyxb201606030,0,"ISTIC,PKU",多囊卵巢综合征应用二甲双胍片及炔雌醇环丙孕酮的临床研究,10.3969/j.issn.1004-7115.2016.06.027,丁文清;,"[1]深圳市龙岗区妇幼保健院,广东 深圳,518172",泰山医学院学报,多囊卵巢综合征;二甲双胍片;炔雌醇环丙孕酮;,R711,2016,37,6
tsyxyxb201606042,0,"ISTIC,PKU",新生儿无创呼吸机治疗鼻部并发症应用水胶体敷料的预防效果分析,10.3969/j.issn.1004-7115.2016.06.039,汤菊妹;,"[1]深圳市龙岗区妇幼保健院新生儿科,广东 深圳,518172",泰山医学院学报,新生儿;无创呼吸机;鼻部并发症;水胶体敷料;,R473,2016,37,6
lchlzz201603015,0,"ISTIC,PKU",标准化营养干预对维持性血液透析患者微炎症状态及生活质量的影响,10.3969/j.issn.1671-8933.2016.03.015,李靖丽;丁殊节;杨璞;张慧;,"[1]518000,深圳市罗湖区人民医院肾内科 深圳",临床护理杂志,标准化营养干预;肾透析;微炎症状态;生活质量;,R459.5  R459.3  R692.5,2016,15,3
mdjyxyxb201603044,0,"ISTIC,PKU",孕中期血清学筛查唐氏综合症高风险与不良妊娠结局的相关性,,李玉哲;杨虹;王晨虹;,"[1]深圳市妇幼保健院产科,广东深圳,518000",牡丹江医学院学报,唐氏综合症;血清学筛查;妊娠结局;相关性;,R71,2016,37,3
syzdyzlzz201511026,5,"ISTIC,PKU",C肽与糖化血红蛋白及脂联素水平对妊娠期糖尿病产后随访的价值,10.13507/j.issn.1674-3474.2015.11.026,孙红杰;许可可;雷厉秀;周芸;杨海燕;,"[1]深圳市罗湖区人民医院妇产科,广东深圳,518001",中华实用诊断与治疗杂志,妊娠期糖尿病;C肽;脂联素;,,2015,29,11
zgyytj201603009,0,"ISTIC,PKU",育龄妇女人群多囊卵巢综合征发病危险因素调查分析,10.3969/j.issn.1006-5253.2016.03.009,钟文明[1];宁伶俐[2];刘晓娟[1];,"[1]518133,深圳市宝安区妇幼保健院信息科;[2]深圳市福田区中医院妇产科;",中国医院统计,多囊卵巢综合征;育龄妇女;危险因素;影响因素;病例对照研究;,,2016,23,3
zgyxwz-jlxfc201603028,0,"ISTIC,PKU",病友互助模式在儿科快速诊断呼吸道病原体中的应用价值,10.3969/j.issn.1674-3768.2016.03.025,杨慧敏;,"[1]深圳市福田区妇幼保健院儿科, 广东深圳,518000",中国临床护理,病友互助;吸痰;九联检;呼吸道;病原体;小儿;,,2016,8,3
hebyy201603013,0,"ISTIC,PKU",孕期血清微量元素浓度与产后出血状况相关性研究,,张瑜君;邬俏璇;杨虹;,"[1]深圳市妇幼保健院,广东 深圳,518000",哈尔滨医药,孕妇;微量元素;产后出血;,R714.46+1,2016,36,3
qqhryxyxb201622004,0,"ISTIC,PKU",妊娠期糖尿病孕妇在不同孕期及产后Chemerin、RBP4的表达及意义,,杜习羽;董玉楠;,"[1]南方医科大学附属深圳妇幼保健院, 广东,518000",齐齐哈尔医学院学报,妊娠期糖尿病;Chemerin;RBP4;,,2016,37,22
zgsyyy201507143,0,"ISTIC,PKU",自制黄艾汤用于子宫不同位置药物流产后的临床效果观察,10.14163/j.cnki.11-5547/r.2015.07.143,王秀香[1];韩定英[1];卓有珍[2];,"[1]518019,广东省深圳市罗湖区计划生育服务中心;[2]广东省深圳市罗湖区妇幼保健院;",中国实用医药,自制黄艾汤;药物流产;流产率;子宫位置;,,2015,,7
zgyyzn201501110,2,"ISTIC,PKU",中孕引产清宫术中放置三种宫内节育器的疗效分析,,鲁小波;黄泓;徐玲;张璇;徐小瑜;,"[1]深圳市龙岗区妇幼保健院,广东深圳,518000",中国医药指南,中期妊娠清宫术;宫内节育器;吉尼环;宫形环;,R169.41,2015,,1
jilinyx201501034,2,"ISTIC,PKU",丙泊酚与七氟醚在妇科腹腔镜中的麻醉效果比较,10.3969/j.issn.1004-0412.2015.01.034,胡薇;孟馨;黄晓雷;齐晓非;苏娇玲;,"[1]南方医科大学附属深圳市妇幼保健院,广东 深圳,518000",吉林医学,丙泊酚;七氟醚;妇科腹腔镜;麻醉效果;,,2015,,1
zgsyyy201621002,0,"ISTIC,PKU",α1受体阻滞剂治疗男性神经原性逼尿肌尿道外括约肌功能失调的疗效和安全性分析,10.14163/j.cnki.11-5547/r.2016.21.002,蒲江波;朱文杰;李雪梅;,"[1]518048,南方医科大学附属深圳市妇幼保健院",中国实用医药,男性神经原性逼尿肌尿道外括约肌功能失调;α1 受体阻滞剂;安全性;,,2016,11,21
zgxdyyyy201614045,0,"ISTIC,PKU",未结合胆红素升高对新生儿甲状腺激素水平的影响,10.14164/j.cnki.cn11-5581/r.2016.14.045,林建春;阳红梅;张旋;,"[1]518000,深圳市龙岗区妇幼保健院检验科",中国现代药物应用,新生儿;未结合胆红素;甲状腺激素;,,2016,10,14
zgxdyyyy201614055,0,"ISTIC,PKU",子宫颈上皮内瘤变经宫颈环型电切术治疗后近期疗效的分析,10.14164/j.cnki.cn11-5581/r.2016.14.055,陈国斌;刘小玲;刘植华;,"[1]518028,深圳市妇幼保健院妇科",中国现代药物应用,子宫颈环型电切术;子宫颈上皮内瘤变;疗效;,,2016,10,14
nmgzyy201607057,0,"ISTIC,PKU",中西医结合治疗复发性自然流产效果观察,10.3969/j.issn.1006-0979.2016.07.057,苏卫兰;,[1]广东省深圳市妇幼保健院 528000,内蒙古中医药,中西结合疗法;复发性自然流产;临床效果;,R271,2016,35,7
