sdyy201614056,0,,研究优质护理服务在老年脑梗阻患者临床护理中的效果,,喻文碧;,[1]广东省深圳市大鹏新区妇幼保健院 518120,首都食品与医药,优质护理服务;老年脑梗阻;效果;临床护理;,R473.74,2016,,14
zgyykx201611013,0,,规范化培训在护士评判性思维能力中的应用,,喻文碧;,"[1]深圳市大鹏新区妇幼保健院,广东深圳,518120",中国医药科学,规范化培训;评判性思维能力;护士;,R47,2016,6,11
xdzdyzl201611097,0,,宫颈癌前病变及宫颈癌人乳头瘤病毒（HPV）感染类型研究,,钟丽群[1];李凤葵[1];陆丽屏[1];徐佳佳[2];,"[1]鹤山市妇幼保健院,广东 鹤山,529700;[2]深圳华大基因研究院,广东 深圳,518083;",现代诊断与治疗,人乳头瘤病毒;宫颈癌前病变;宫颈癌;基因型;,R711.74,2016,27,11
ykxjz201501013t,0,"ISTIC,PKU",玻璃体内注射Lucentis治疗糖尿病黄斑水肿,10.13389/j.cnki.rao.2015.0013,刘斌[1];杨玉霞[2];刘杏[3];李伟力[1];莫正政[2];,"[1]深圳爱视眼科专科门诊部, 广东省深圳市,518000;[2]深圳市罗湖区人民医院眼科, 广东省深圳市,518000;[3]510060 广东省广州市,中山大学中山眼科中心,眼科学国家重点实验室;",眼科新进展,Lucentis;糖尿病黄斑水肿;玻璃体内注射;,,2015,35,1
gmzy201611050,0,"ISTIC,PKU",中西医结合治疗围绝经期崩漏临床观察,10.3969/j.issn.1003-8914.2016.11.050,滕辉;刘昱磊;王俊玲;,"[1]广东省深圳市妇幼保健院中医科,深圳,518048",光明中医,异常子宫出血;气虚失摄;围绝经期;,,2016,31,11
zgmzmjyyzz201611049,0,"ISTIC,PKU",宫腔镜治疗术后宫腔粘连80例临床体会,,沈丹婷;麦慧芬;孙静;,"[1]深圳市宝安区妇幼保健院妇科,广东 深圳,518000",中国民族民间医药,人流术后宫腔粘连;宫腔镜;子宫内膜厚度;月经改善情况;,R711.74,2016,25,11
zgmzmjyyzz201611074,0,"ISTIC,PKU",心理干预在预防产后抑郁41例中的应用,,胡芹;苏华;邓晓霞;,"[1]深圳市福田区妇幼保健院福保社康,广东 深圳,518000",中国民族民间医药,家庭医生;心理干预;产后抑郁;预防效果;,R714.7,2016,25,11
amydy201611041,0,"ISTIC,PKU",舒适护理在血液透析护理中的应用效果观察,,杨静;,"[1]深圳市罗湖区人民医院,广东深圳,518000",按摩与康复医学,血液透析;舒适护理;效果;并发症;,R473.5,2016,7,11
zwkjzlml-yyws201407014,2,"ISTIC,PKU",随机尿白蛋白/肌酐比值用于子痫前期诊断的价值,,司冬梅;,"[1]深圳市南山区妇幼保健院产科,广东深圳,518000",中国现代医生,随机尿;尿蛋白;先兆子痫;尿白蛋白/肌酐比;,R714.245,2014,52,7
gnyxyxb201602008,0,"ISTIC,PKU",磁共振信号强度比值在足月新生儿胆红素脑病中的研究,10.3969/j.issn.1001-5779.2016.02.008,胡根文[1];梁久平[2];柏燕[1];符式新[1];,"[1]深圳市宝安区妇幼保健院影像科;[2]深圳市宝安区人民医院影像科,广东深圳,518000;",赣南医学院学报,胆红素脑病;磁共振成像;信号强度比;,R445.2,2016,36,2
yxxxzz201616263,0,"ISTIC,PKU",二维及三维超声对胎儿心房异构的研究,10.3969/j.issn.1006-1959.2016.16.263,陈香洁;郑洪平;林李梅;胡志刚;樊宜珍;,"[1]广东深圳市龙岗区妇幼保健院,广东 深圳,518172",医学信息,心房异构;心耳;二维超声;三维超声;反转成像;,,2016,29,16
zwyxyj201616037,0,"ISTIC,PKU",腹腔镜下腹膜代阴道成形术的手术护理配合,10.14033/j.cnki.cfmr.2016.16.035,王晓华;,[1]深圳市罗湖区人民医院 广东 深圳 518000,中外医学研究,阴道成形术;腹腔镜;护理;腹膜;,R713.3,2016,14,16
jkr201616024,0,"ISTIC,PKU",胫骨远端髓内钉与胫骨远端锁定接骨板治疗胫腓骨远端骨折的临床效果,,徐豪斌;林平信;苏中文;,"[1]深圳市坪山新区妇幼保健院外科,深圳,518122",中国当代医药,髓内钉;锁定接骨板;胫腓骨远端骨折;临床疗效;,R687.3,2016,23,16
jkr201616057,0,"ISTIC,PKU",新生儿脐带消毒与局部清洁干燥引起脐部感染的随机对照研究,,耿琳华;林少英;,"[1]深圳市宝安区妇幼保健院产科,深圳,518133",中国当代医药,脐带消毒;脐炎;新生儿;医院;,R473.72,2016,23,16
zgxdyyyy201424129,2,"ISTIC,PKU",循证护理在老年股骨颈骨折患者中应用效果分析及体会,,何秀丽;,"[1]518000,深圳市罗湖区人民医院",中国现代药物应用,循证护理;老年;股骨颈骨折;效果分析;体会;,,2014,,24
scyxzz201414251,2,"ISTIC,PKU",银屑病关节炎的治疗分析与护理探讨,10.13214/j.cnki.cjotadm.2014.14.250,凌素环;许秀;,"[1]深圳市大鹏新区妇幼保健院,广东 深圳,518120",中国伤残医学,银屑病关节炎;治疗;护理;,R473,2014,,14
zgyxcx201410004,3,"ISTIC,PKU",病毒性脑炎患儿发生心律失常危险因素分析,10.3969/j.issn.1674-4985.2014.10.004,刘亚秋;林海波;陆必森;刘喜;,[1]广东省深圳市宝安区妇幼保健院 广东 深圳 518133,中国医学创新,病毒性脑炎;心律失常;危险因素;Logistic回归分析;,,2014,,10
qqhryxyxb201620036,0,"ISTIC,PKU",肺炎克雷伯菌属感染新生患儿的细菌耐药性分析,,李际红;王健;资捷;,[1]518048 深圳市福田区妇幼保健院药剂科，新生儿科，检验科,齐齐哈尔医学院学报,肺炎;克雷伯菌;新生儿;细菌耐药性;,,2016,37,20
zgxdyxzz201433021t,0,"ISTIC,PKU",控制性超排卵中提前发育卵泡处理方案研究,,孙波澜;吴方贵;,"[1]深圳市罗湖区人民医院生殖医学中心,广东深圳,518001",中国现代医学杂志,控制性超排卵;提前发育卵泡;卵泡穿刺;,R711.6,2014,24,33
zgsyyy201620185,0,"ISTIC,PKU",儿童哮喘控制现状及家长对疾病认知水平的调查研究,10.14163/j.cnki.11-5547/r.2016.20.185,谢秋艳;方映玲;郭彤;,"[1]518028,深圳市妇幼保健院",中国实用医药,儿童哮喘;家长;疾病认知;控制现状;,,2016,11,20
zgxdyyyy201520122,1,"ISTIC,PKU",小儿风热感冒的中西医治疗方案临床对照研究,10.14164/j.cnki.cn11-5581/r.2015.20.122,陈丽杏;苏华;钟杏花;,"[1]518000,广东省 深圳市福田区妇幼保健院",中国现代药物应用,小儿;风热感冒;中医方案;西医方案;治疗效果;,,2015,9,20
qqhryxyxb201520092,1,"ISTIC,PKU",针对性护理干预在胎膜早破孕妇中的临床应用效果,,黄小红;,"[1]宝安妇幼保健院, 广东深圳,518100",齐齐哈尔医学院学报,针对性护理;胎膜早破;母婴结局;,,2015,,20
sdyy201520034,1,"ISTIC,PKU",枯草杆菌二联活菌联合双嘧达莫治疗小儿上感型腹泻临床疗效观察,,钟明;郭惠娟;洪先欧;,[1]广东省深圳市宝安区妇幼保健院 518133,首都食品与医药,上呼吸道感染;腹泻;妈咪爱;双嘧达莫;,R725.7,2015,,20
sylcyx201507006,1,"ISTIC,PKU",血清 PCT 和 CRP 联合检测对肺部疾病患者抗生素应用的指导,10.13764/j.cnki.lcsy.2015.07.06,罗明[1];王莉平[1];袁春梅[2];孙晓勉[1];王健[1];吴芝勋[1];蒋彦[1];陈红[1];,"[1]深圳市福田区妇幼保健院内科;[2]深圳市盐田区人民医院 ICU,广东 深圳,518045;",实用临床医学,肺部疾病;血清降钙素原;C反应蛋白;抗生素;,R563,2015,,7
zgxdyyyy201613189,0,"ISTIC,PKU",循证护理在妇科肿瘤疾病患者中的应用研究,10.14164/j.cnki.cn11-5581/r.2016.13.189,甘小清;,"[1]518028,深圳市妇幼保健院",中国现代药物应用,妇科肿瘤;循证护理;疼痛;心理状态;并发症;,,2016,10,13
zyyk201613017,0,"ISTIC,PKU",正畸和修复联合治疗牙缺损伴牙颌畸形,10.3760/cma.j.issn.1674-4756.2016.13.017,刘娜;胡玉莹;朱玉凤;,"[1]518000,广东省深圳市福田区妇幼保健院口腔科",中国实用医刊,正畸;修复;联合;牙缺损伴牙颌畸形;,,2016,43,13
zyyk201613047,0,"ISTIC,PKU",正常早孕产妇同稽留流产患者胰岛素样生长因子Ⅱ的对比分析,10.3760/cma.j.issn.1674-4756.2016.13.047,沈丹婷;麦慧芬;吴丽雅;孙静;,"[1]518000,广东省深圳市宝安区妇幼保健院妇科",中国实用医刊,稽留流产;胰岛素样生长因子Ⅱ;绒毛组织;免疫检测;,,2016,43,13
syzxyjhlc201605031,0,"ISTIC,PKU",呼吸系统疾病患儿诊治中肺功能检查的临床意义分析,10.13638/j.issn.1671-4040.2016.05.031,庄哈娜;许美;刘瑜;赵宏霞;,[1]广东省深圳市妇幼保健院 深圳518000,实用中西医结合临床,呼吸系统疾病;儿童;肺功能检查;,R725.6,2016,16,5
nmgyxzz201605031,0,"ISTIC,PKU",胎盘早剥超声诊断与临床对照分析,10.16096/J.cnki.nmgyxzz.2016.48.05.031,张彦华;蔡博宇;雷少霞;,"[1]深圳宝安区妇幼保健院超声医学科、病理科、产科,深圳,518100",内蒙古医学杂志,胎盘早剥;超声诊断;妊娠;,R714.56,2016,48,5
bfyx201605118,0,"ISTIC,PKU",孟鲁司特钠联合布地奈德吸入对哮喘患儿的疗效及安全性分析,,杨宇;,[1]南方医科大学附属深圳市妇幼保健院急诊科 深圳 518028,北方药学,孟鲁司特钠;布地奈德;哮喘患儿;肺功能;,R725.6,2016,13,5
hbzyzz201605034,0,"ISTIC,PKU",无刺根乙醇提取物抗乙肝病毒体外实验研究,,陈梅玲;陈夏静;李果;张友恒;,"[1]广东省深圳市罗湖区人民医院,广东深圳,518001",湖北中医杂志,无刺根;乙醇提取物;2215细胞;HBV;,R285,2016,38,5
hjyjkzz201506013,1,"ISTIC,PKU",重金属重点防控区儿童血镉水平与肾功能损伤的研究,10.16241/j.cnki.1001-5914.2015.06.013,季佳佳[1];余淑苑[1];刘国红[1];张慧敏[1];周丽[1];蓝涛[1];刘桂华[1];孙群露[2];林奕芝[3];,"[1]深圳市疾病预防控制中心,广东,518055;[2]深圳市宝安区疾病预防控制中心;[3]深圳市福田区疾病预防控制中心;",环境与健康杂志,血镉;尿β2-微球蛋白;尿视黄醇结合蛋白;儿童;,R181.3,2015,32,6
zgmzmjyyzz201610049,0,"ISTIC,PKU",宫腹腔镜联合治疗输卵管性不孕45例临床观察,,张玉霞;胡燕飞;甘小清;,"[1]南方医科大学附属深圳市妇幼保健院妇科,广东深圳,518028",中国民族民间医药,宫腔镜;腹腔镜;输卵管性不孕;妊娠;,R713,2016,25,10
ylbjqj201605036,0,"ISTIC,PKU",妊娠高血压疾病并发胎盘早剥患者的临床分析,10.3969/j.issn.1674-4659.2016.05.0623,黄燕;,"[1]深圳市妇幼保健院产科,广东深圳,518000",临床医学工程,妊娠高血压疾病;胎盘早剥;临床特征;妊娠结局;,R714.25,2016,23,5
xdzdyzl201610002,0,"ISTIC,PKU",龙岗区妊娠妇女25-羟基维生素D状况分析,,林建春;缪秋明;张旋;,"[1]深圳市龙岗区妇幼保健院检验科,广东 深圳,518172",现代诊断与治疗,妊娠;25-羟基维生素D;缺乏;,R591.44,2016,27,10
xdzdyzl201610060,0,"ISTIC,PKU",毛细支气管炎患儿血清25-羟维生素D3水平测定,,庄哈娜;刘瑜;许美;赵宏霞;,"[1]深圳市妇幼保健院,广东 深圳,518000",现代诊断与治疗,毛细支气管炎;维生素D;25-(OH)D3;,R562.21,2016,27,10
zwkjzlml-yyws201409049,3,"ISTIC,PKU",舌下含服米索前列醇在无痛人流产前、后终止早孕的意义,,夏蓉;,"[1]深圳市妇幼保健院妇科,广东深圳,518000",中国现代医生,米索前列醇;无痛人流;早孕;,R169.42,2014,52,9
jkr201409060,3,"ISTIC,PKU",爱婴区母乳喂养咨询的专业指导对纯母乳喂养的影响效果,,梁玮伦;钟远梅;郑萍萍;,"[1]深圳市福田区妇幼保健院,深圳,518000",中国当代医药,纯母乳喂养;支持系统;指导;,R715.2,2014,21,9
zgsyyy201619204,0,"ISTIC,PKU",产程活跃期使用电动奶泵刺激乳房对产后母乳喂养的影响,10.14163/j.cnki.11-5547/r.2016.19.204,李永英;陈兰;陈侨华;,"[1]518133,深圳市宝安区妇幼保健院",中国实用医药,产程活跃期;奶泵刺激;纯母乳喂养;,,2016,11,19
yygllt201501003,2,"ISTIC,PKU",改革背景下公立医院绩效考核的成效与困境,,王合森;,[1]深圳市龙岗区妇幼保健院,医院管理论坛,绩效考核;改革;公立医院;,,2015,,1
qqhryxyxb201502066,2,"ISTIC,PKU",社区护理流程管理对脑卒中患者社区护理质量控制的影响,,罗建群;,"[1]深圳市坪山新区妇幼保健院, 广东,518122",齐齐哈尔医学院学报,社区护理;流程管理;脑卒中;社区护理质量;,,2015,,2
jkr201614024,0,"ISTIC,PKU",sCD40L在子痫前期孕妇中的动态表达及其意义,,曾月娥;陈国庆;王忠;王晨虹;,"[1]深圳市妇幼保健院产科,深圳,518028",中国当代医药,sCD40L;子痫前期;酶联免疫吸附试验;跨膜蛋白;,R714.24+4,2016,23,14
bfyx201508126,1,"ISTIC,PKU",地西泮液灌肠救治350例小儿热性惊厥的回顾性分析,,李仙梅;,[1]深圳市福田区妇幼保健院儿科 深圳 518000,北方药学,地西泮液灌肠;小儿热性惊厥;,R720.597,2015,,8
ylbjqj201508004,1,"ISTIC,PKU",彩超监测胎儿肾动脉血流对胎儿宫内窘迫的预测价值,10.3969/j.issn.1674-4659.2015.08.0968,冯胜武;,"[1]深圳市宝安区妇幼保健院,广东深圳,518133",临床医学工程,宫内窘迫;彩超;肾动脉血流;预后;,R445.1,2015,22,8
ylbjqj201508024,1,"ISTIC,PKU",不同浓度罗哌卡因复合芬太尼剖宫产术后镇痛效果及对血清泌乳素的影响,10.3969/j.issn.1674-4659.2015.08.1012,王亮;李元涛;李戈辉;,"[1]南方医科大学附属深圳市妇幼保健院麻醉科,广东深圳,518000",临床医学工程,不同浓度;罗哌卡因;芬太尼;镇痛;,R614,2015,22,8
jkr201408070,3,"ISTIC,PKU",中年男性2型糖尿病血清促甲状腺激素对骨代谢影响的研究,,蔚文礼;,"[1]深圳市罗湖区人民医院全科医学科,深圳,518000",中国当代医药,中年男性;糖尿病;血清促甲状腺激素;骨代谢;,R781.6+4,2014,21,8
zgxxws201412014,8,"ISTIC,PKU",长沙市大学生健康素养状况及相关因素分析,,欧阳江[1];牟劲松[1];赵淑英[1];颜伊莎[1];罗珍胄[2];罗家有[3];,"[1]长沙医学院公共卫生系,湖南410219;[2]深圳市南山区慢性病防治院;[3]中南大学公共卫生学院儿少卫生与妇幼保健系;",中国学校卫生,健康教育;回归分析;学生;,G479  R195,2014,35,12
gjyywsdb201523008,0,"ISTIC,PKU",深圳市某区医护人员HIV/AIDS职业暴露防治知识知晓率及职业防护调查分析,10.3760/cma.j.issn.1007-1245.2015.23.008,陈国翠[1];唐嘉诚[2];彭志敏[1];张绍芳[2];,"[1]518001,深圳市罗湖区疾病控制中心;[2]518001,深圳市罗湖区人民医院;",国际医药卫生导报,医护人员;HIV/AIDS职业暴露;知晓率;职业防护;,,2015,21,23
qqhryxyxb201618006,0,"ISTIC,PKU",探讨产后压力性尿失禁应用盆底功能康复疗法的可行性,,董玉楠;冷秀兰;龙敏;,"[1]南方医科大学附属深圳妇幼保健院妇女健康科, 广东,518028",齐齐哈尔医学院学报,盆底功能康复疗法;产后;压力性尿失禁;可行性;,,2016,37,18
zgxdyyyy201612002,0,,阴道乳酸杆菌与宫颈 HPV 感染及子宫颈癌前病变的相关性研究,10.14164/j.cnki.cn11-5581/r.2016.12.002,陈国斌;王颖;刘植华;,"[1]518028,深圳市妇幼保健院",中国现代药物应用,乳酸杆菌;人类乳头瘤病毒感染;子宫颈癌前病变;,,2016,10,12
bqnjyxyxb201603018,0,,重症肺炎儿童肠道微生态的调查,10.16485/j.issn.2095-7858.2016.03.017,杨艳霞;刘纯义;陈水文;吴丽娟;刘喜;,"[1]518133,广东省深圳市宝安区妇幼保健院儿科",白求恩医学杂志,重症肺炎;乳酸杆菌;大肠杆菌;内毒素;,R725.6,2016,14,3
zglcsyyx201603020,0,,临床决策辅助对产妇硬膜外分娩镇痛效果的影响,10.3760/cma.j.issn.1673-8799.2016.03.020,崔睿;陈丽华;张文娇;黄穗萍;陈鹏典;王亮;张蓓;欧阳春辉;,"[1]518028,广东省深圳市妇幼保健院麻醉科",中国临床实用医学,分娩;镇痛;临床辅助决策;,,2016,7,3
zgmzmjyyzz201609037,0,,亚麻醉剂量氯胺酮联合芬太尼在小儿区域麻醉62例中的应用,,卢慧勤;郭影靓;颜学滔;,"[1]深圳市宝安区妇幼保健院麻醉科,广东 深圳,518100",中国民族民间医药,亚麻醉剂量;氯胺酮;芬太尼;麻醉;,R971+.1,2016,25,9
xdzdyzl201609098,0,,彩色多普勒超声筛查中孕期胎儿心脏畸形的临床价值分析,,张婷;贺小红;汪芷先;倪滨;,"[1]深圳市宝安区妇幼保健院超声科,广东 深圳,518100",现代诊断与治疗,胎儿心脏畸形;中孕期;彩色多普勒超声;诊断效果;,R714.53,2016,27,9
jkr201613015,0,,松龄血脉康胶囊辅助治疗原发性高血压的效果及对患者生活质量的影响,,李艳莉;,"[1]深圳市福田区妇幼保健院内科,深圳,518017",中国当代医药,松龄血脉康胶囊;原发性高血压;厄贝沙坦片;生活质量;,R544.1,2016,23,13
jkr201613028,0,,川崎病患儿血脂水平的变化,,付永萍;,"[1]南方医科大学附属深圳妇幼保健院儿科,深圳,518028",中国当代医药,川崎病;血脂异常;儿童;,R725.9,2016,23,13
zghtyyzz201509025,1,,产前出血对妊娠结局的影响分析,10.3969/j.issn.1672-9463.2015.09.017,孙洁;,"[1]518000,广东省深圳市妇幼保健院产科",中国现代医药杂志,,,2015,,9
ddyx201411020,3,,新生儿高胆红素血症与剖宫产及其它高危因素相关性分析,10.3969/j.issn.1009-4393.2014.11.020,洪涛;叶安青;,[1]广东 518133 深圳市宝安区妇幼保健院,当代医学,新生儿高胆红素血症;剖宫产;高危因素;,,2014,,11
zgxdyyyy201611017,0,,女性下生殖道感染的实验室诊断,10.14164/j.cnki.cn11-5581/r.2016.11.017,招湛静;杨翠红;杨素娟;,"[1]518120,深圳市大鹏新区妇幼保健院检验科",中国现代药物应用,细菌性阴道病;实验室检查;临床特征;,,2016,10,11
xdzdyzl201608048,0,,左旋甲状腺素在妊娠期甲状腺功能减退患者中临床应用分析,,吴敏;陈旭日;陈明芳;,"[1]深圳市宝安区妇幼保健院产科,广东 深圳,518000",现代诊断与治疗,左旋甲状腺素;妊娠期甲状腺功能减退;应用;,R714.25,2016,27,8
hjyjkzz201506014,0,,重金属重点防控区儿童血铅水平及其对神经行为功能的影响,10.16241/j.cnki.1001-5914.2015.06.014,季佳佳[1];余淑苑[1];刘国红[1];张慧敏[1];蓝涛[1];刘桂华[1];孙群露[2];林奕芝[3];彭朝琼[1];,"[1]深圳市疾病预防控制中心,广东,518055;[2]深圳市宝安区疾病预防控制中心;[3]深圳市福田区疾病预防控制中心;",环境与健康杂志,血铅;神经行为功能;智商;儿童;,R181.3,2015,32,6
xdzdyzl201608076,0,,数字化钼靶X线与彩超应用BI-RADS分级诊断早期乳腺癌的价值比较,,林少毓;蒋飞宇;叶志;陈玲;,"[1]深圳市龙岗区妇幼保健院,广东 深圳,518172",现代诊断与治疗,乳腺癌;钼靶X线;彩超;BI-RADS分级;,R445  R737.9,2016,27,8
nmgzyy201604007,0,,探讨三金排石方对泌尿系统结石的治疗效果及安全性,10.3969/j.issn.1006-0979.2016.04.007,陈美红;刘亿龙;陈晶晶;余杏林;刘莹;,[1]深圳市盐田区盐港医院沿港社康中心 广东深圳 518083;江西省丰城市妇幼保健院儿童保健科 江西丰城 331100,内蒙古中医药,泌尿系统结石;中医;三金排石方;安全性;,R256.4,2016,35,4
ylbjqj201604021,0,,丙泊酚联合芬太尼不同给药方式在无痛人流中的应用效果分析,10.3969/j.issn.1674-4659.2016.04.0445,苏春华;杨高升;,"[1]深圳市坪山新区妇幼保健院,广东深圳,518122",临床医学工程,丙泊酚;芬太尼;静脉麻醉;无痛人流;,R169.42  R614,2016,23,4
sdyygc201604001,0,,配伍对麻黄甘草药对中麻黄类生物碱在大鼠体内组织分布的影响,10.13506/j.cnki.jpr.2016.04.001,卫平[1];马钦海[2];任孟月[2];罗佳波[2];,"[1]深圳市坪山新区妇幼保健院,广东 深圳,518122;[2]南方医科大学中医药学院，广东省中药制剂重点实验室，广东 广州 510515;",药学研究,麻黄;甘草;麻黄类生物碱;超高效液相色谱 - 串联质谱;配伍;组织分布;,R285.5,2016,35,4
zgyxcx201612038,0,,含氟涂料和含氟泡沫对儿童乳牙龋的预防效果比较,10.3969/j.issn.1674-4985.2016.12.038,南小思;陈周焕;王唯希;,[1]广东省深圳市龙岗区妇幼保健院 广东深圳518172,中国医学创新,儿童;乳牙龋;含氟涂料;含氟泡沫;预防;,,2016,13,12
zgcjwsbj201604010,0,,深圳市福田区女性人乳头瘤病毒感染情况调查分析,10.3969/j.issn.1001-568X.2016.04.0010,朱丹玲;马健;廖慧霞;肖福香;,[1]深圳市福田区妇幼保健院 广东 深圳 518048,中国初级卫生保健,HPV;感染率;年龄分布;基因型分布;深圳;,R759,2016,30,4
yjmzyxyxb201401033,3,,全数字化乳腺钼靶X线检查实施质量控制后对图像质量的影响,10.3969/j.issn.1001-5817.2014.01.033,邹万姣;曹满瑞;朱志军;,"[1]南方医科大学附属深圳市妇幼保健院放射科,广东,深圳,518017",右江民族医学院学报,乳房X线摄影术;钼靶;质量控制;,R445.3,2014,36,1
zgsyyy201616007,0,,新生儿呼吸机相关性肺炎的临床高危因素及病原学状况分析,10.14163/j.cnki.11-5547/r.2016.16.007,邓为彬;邹新英;,"[1]518028,深圳市妇幼保健院",中国实用医药,呼吸机相关性肺炎;高危因素;新生儿;病原学;,,2016,11,16
zgsyyy201616199,0,,对生育妇女分娩计划的初步探索,10.14163/j.cnki.11-5547/r.2016.16.199,耿琳华;陈兰;,"[1]518133,深圳宝安妇幼保健院",中国实用医药,生育妇女;分娩计划;产前健康教育;,,2016,11,16
yxllysj201421093,2,,急诊科临床护理个性化带教方法的应用,,胡芳;,"[1]南方医科大学附属深圳市妇幼保健院,广东省深圳市,518028",医学理论与实践,急诊科;临床护理;个性化带教;常规带教;实际效果;,G424.1,2014,,21
zgyxzb201408042,2,,TBA-120FR全自动生化分析仪的故障分析及维修,10.3969/J.ISSN.1672-8270.2014.08.042,周丽华[1];牟强善[2];吴浙君[3];武娟[4];,[1]深圳市龙岗中心医院设备科 广州深圳518116;[2]日照市东港区人民院设备科 山东日照276800;[3]余杭区第五人民医院设备科 浙江杭州311100;[4]深圳市龙岗区妇幼保健院 广东深圳518116;,中国医学装备,,R197.39,2014,11,8
zgwsbzgl201611158,0,,过于监督对护理工作绩效的影响,10.3969/j.issn.1674-9316.2016.11.158,艾艳[1];周明建[2];吴昊[2];,"[1]珠海市妇幼保健院妇产科,广东 珠海,519000;[2]哈尔滨工业大学深圳研究生院,广东 深圳,518055;",中国卫生标准管理,过于监督;护理;工作绩效;工作重要性;,R47,2016,7,11
haixyx201507075,1,,宫颈炎康栓联合LEEP刀对宫颈糜烂患者的临床疗效观察,10.3969/j.issn.1006-3765.2015.07.075,李际红;,[1]广东省深圳市福田区妇幼保健院深圳518000,海峡药学,宫颈炎康栓;LEEP刀;宫颈糜烂;疗效;,R969.4,2015,,7
xdzdyzl201514090,1,,晚期早产儿中小于胎龄儿的临床特点分析,,叶素芬;,"[1]南方医科大学附属深圳妇幼保健院,广东 深圳,518000",现代诊断与治疗,小于胎龄儿;适于胎龄儿;晚期早产儿;,R722.1,2015,26,14
syzdyzlzz201410029,16,,瘢痕子宫再次足月妊娠阴道分娩临床分析,10.13507/j.issn.1674-3474.2014.10.029,罗力冰;吴婷;,"[1]深圳市南山区妇幼保健院妇产科,广东深圳518000",中华实用诊断与治疗杂志,瘢痕子宫;足月妊娠;阴道分娩;,,2014,28,10
jilinyx201515136,0,,注意缺陷多动障碍儿童的临床护理分析,10.3969/j.issn.1004-0412.2015.15.136,陈冬梅;贺嘉音;詹萍;,"[1]广东省深圳市罗湖区妇幼保健院,广东 深圳,518019",吉林医学,注意缺陷多动障碍;护理干预;分析;,,2015,,15
qqhryxyxb201507007,1,,甲状腺微小癌高频超声影像学特征及诊断价值,,张凤华[1];李英[1];吴平巧[2];,"[1]518001,深圳市罗湖区中医院超声科;[2]730030,甘肃省第二人民医院超声科;",齐齐哈尔医学院学报,甲状腺微小癌;高频超声;影像学特征;,,2015,,7
xdzdyzl201420129,2,,稽留流产术后服用屈螺酮炔雌醇片的临床观察,,龙娜;吴丽雅;,"[1]深圳市宝安区妇幼保健院生殖健康科,广东 深圳,518100",现代诊断与治疗,稽留流产;屈螺酮炔雌醇片;复方短效避孕药;,R714.4,2014,,20
zgwscy201520063,1,,脑血管病患神经介入治疗的麻醉管理,10.16659/j.cnki.1672-5654.2015.20.178,胥亮;,"[1]深圳市罗湖区人民医院麻醉科,广东深圳,518001",中国卫生产业,脑血管疾病;神经介入治疗;麻醉管理;用药规范;治疗效果;,R739.4,2015,,20
zgsyyy201614016,0,,重症感染患儿抗生素相关性腹泻临床分析,10.14163/j.cnki.11-5547/r.2016.14.016,杨宇;林冰纯;邹新英;,"[1]518000,南方医科大学附属深圳市妇幼保健院",中国实用医药,儿童;重症感染;抗生素相关性腹泻;,,2016,11,14
zgxdyyyy201516052,1,,三种预防再粘连方法在宫腔镜下宫颈粘连分离术后的应用效果,10.14164/j.cnki.cn11-5581/r.2015.16.052,王耀楷;,"[1]518028,南方医科大学附属深圳市妇幼保健院妇产科",中国现代药物应用,宫腔粘连;宫腔镜;手术治疗;宫腔再粘连;,,2015,,16
zgbjyy-kp201513437,1,,中医治疗月经不调的疗效观察,,罗江萍;,"[1]深圳市罗湖区人民医院中医科,广东深圳,518000",中国保健营养,中医;月经不调;疗效观察;,R246.3,2015,25,13
bqnjyxyxb201504017,1,,可重复使用手术器械应用除锈剂及润滑防锈液清洗效果的评价,10.16485/j.issn.2095-7858.2015.04.015,张韵;姚艳君;刘艳嫦;,"[1]518000,广东省深圳市红荔路妇幼保健院手术室",白求恩医学杂志,重复使用手术器械;清洗;速洁汰;润滑防锈;,R187,2015,,4
txsj201513079,1,,堡垒机在医院信息系统的运用,10.3969/j.issn.1006-4222.2015.13.079,黄瑞涛[1];陈劲松[2];,"[1]香港大学深圳医院资讯科技部,518053;[2]深圳市妇幼保健院,518017;",通讯世界,堡垒机;运维审计;医院信息系统;,TP309,2015,,13
xdzdyzl201606095,0,,婴幼儿迁延性腹泻补锌临床疗效分析,,吴培杰;,"[1]深圳市福田区妇幼保健院,广东 深圳,518000",现代诊断与治疗,婴幼儿;迁延性腹泻;补锌;,R725.7,2016,27,6
