lcfkzz201508040,1,,2009-2013年深圳市宝安区非结防机构疑似肺结核患者转诊追踪情况,10.3969/j.issn.1009-6663.2015.08.040,赵梅桂[1];王云霞[1];刘振扬[1];吴春眉[2];张璇[1];卢祖洵[3];,"[1]518102,广东 深圳 深圳市宝安区慢性病防治院结核病防治科 深圳市宝安区结核病防治医学重点学科;[2]430030 湖北 武汉 华中科技大学同济医学院公共卫生学院; 341000 江西 赣州 赣南医学院基础医学院;[3]430030,湖北 武汉 华中科技大学同济医学院公共卫生学院;",临床肺科杂志,结核;肺/预防和控制;病人转诊;深圳市;,,2015,,8
xdzdyzl201513011,1,,中医辨证对治疗耐多药肺结核的效果分析,,郭惠环[1];胡春华[2];罗洁[3];,"[1]深圳宝安区福永人民医院塘尾社区健康服务中心,广东 深圳,518103;[2]深圳市坪山新区妇幼保健院沙田社区健康服务中心,广东 深圳,518118;[3]深圳市坪山新区人民医院坪环社区健康服务中心,广东 深圳,518118;",现代诊断与治疗,中医辨证;耐多药肺结核病;淋巴细胞亚群变化;,R521,2015,26,13
zjlczz201601013,0,,提插补泻血海穴对下肢胫前、胫后动脉血流变化的影响,,曾进[1];张丽[1];温小秋[1];张现豪[1];陈绮[1];李育兰[1];张娟娟[1];王慧[2];钟旋[3];,"[1]广东省深圳市宝安区慢性病防治院,广东深圳,518126;[2]深圳市社会福利中心,广东深圳,518013;[3]深圳市罗湖区中医院,广东深圳,518049;",针灸临床杂志,Lifting and thrusting the needle;Xuehai point;Anterior tibial artery;Posterior tibial artery;Chan-ges of blood flow velocity;,提插补泻                                                      血海穴                                                      胫前动脉                                                      胫后动脉                                                      血流变化,,,
zgsyzdx201508019,2,"ISTIC,PKU",120株复发肺结核患者结核分枝杆菌耐药性分析,,温贵华;,,中国实验诊断学,复发肺结核;结核分枝杆菌;多耐药性;广泛耐药性;利福平;,R521,2015,,8
syfsxzz201611010,0,"ISTIC,PKU",肺结核抗痨过程中病灶进展的影像学表现及误诊分析,10.3969/j.issn.1002-1671.2016.11.010,曾令延;陈根铭;黄福城;朱少乾;温兆意;,,实用放射学杂志,肺结核;耐多药;放射摄影术;计算机体层成像;,R521  R814.42,2016,32,11
qywh-x201511069,0,"ISTIC,PKU",思想政治工作融入工会工作相关方法的探讨,,李艳;,,企业文化（下旬刊）,思想政治工作;工会;改革;,,2015,,11
dfqywh201410131,2,"ISTIC,PKU",关于事业单位纪检监察工作难点与对策,,李艳;,,东方企业文化,事业单位;纪检监察;难点;决策;,F27,2014,,10
jzyx201410003,9,"ISTIC,PKU",急性胰腺炎的分级、诊断与治疗,10.3760/cma.j.issn.1671-0282.2014.10.003,张文武;,,中华急诊医学杂志,@@;,,2014,23,10
lcfkzz201512008,2,"ISTIC,PKU",深圳市宝安区结核病人社会支持评定量表测试结果分析,10.3969/j.issn.1009-6663.2015.12.008,赵梅桂[1];汪文新[2];唐瑛[1];王云霞[1];赵安贵[1];,"[1]深圳宝安区慢性病防治院, 广东 深圳,518133;[2]江苏大学工商管理学院, 江苏 镇江,212013;",临床肺科杂志,结核病患者;社会支持;评定量表;,,2015,,12
lnjzyxzz201504012,0,"ISTIC,PKU",急性呼吸窘迫综合征患者血清氨基末端B型脑钠肽前体水平的意义,10.3969/j.issn.1671-301X.2015.04.012,张月辉[1];林锦乐[2];张文武[2];田方[1];王伟[1];苏盛元[1];王立军[1];,[1]南方医科大学附属深圳宝安医院 重症医学科 518101;[2]南方医科大学附属深圳宝安医院 急诊科 518101;,岭南急诊医学杂志,急性呼吸窘迫综合征;氨基末端B型脑钠肽前体;,,2015,,4
jiangxyxjy201503005,0,"ISTIC,PKU",S基因进化树分析证实乙型肝炎病毒存在性传播途径,10.3969/j.issn.1674-1129.2015.03.005,李康[1];颜和芳[2];赵蔚[1];罗艺[1];徐文莉[1];廖长征[1];张洪德[1];,"[1]龙岗中心医院,深圳 龙岗,518116;[2]宝安区慢性病防治院,深圳 宝安,518126;",实验与检验医学,乙型肝炎病毒;性传播;序列比对;基因进化树;,R512.6+2,2015,,3
hsjxzz201506004,7,"ISTIC,PKU",追踪法在临床护理安全质量检查中效果评价,,张友惠;杨云智;易小青;曾蓉;,,护士进修杂志,追踪法;护理安全质量检查;效果评价;,R472,2015,,6
lcfkzz201507021,1,"ISTIC,PKU",miR-150-5 p/362-5 p在结核菌潜伏感染者外周血单核细胞中的表达及诊断价值,10.3969/j.issn.1009-6663.2015.07.020,林巧[1];邹容容[2];邱勇龙[1];钟红剑[1];张国良[2];陈心春[2];周伯平[2];唐瑛[1];,"[1]深圳市宝安区慢性病防治院综合门诊, 广东 深圳,518126;[2]深圳市第三人民医院肝病研究所, 广东 深圳,518112;",临床肺科杂志,结核菌潜伏感染;单核细胞;微小RNA;,,2015,,7
jilinyx201512005,2,"ISTIC,PKU",先兆流产合并绒毛膜下血肿293例妊娠结局分析,10.3969/j.issn.1004-0412.2015.12.005,陆洋;李慧;李晓红;,,吉林医学,绒毛膜下血肿;B超;先兆流产;,,2015,,12
ddhs-zkb201504094,2,"ISTIC,PKU",儿科护理带教难点及其对策的研究,,李秀银;杨柳;张春丽;,,当代护士（下旬刊）,儿科;护理;临床带教;,G642  R472.72,2015,,4
jkr2015030060,2,,新生儿细菌性结膜炎的细菌分布及耐药情况分析,,张萌[1];王媛[2];邬丽霞[1];谢镜花[1];,"[1]深圳市宝安区妇幼保健院眼科,深圳,518133;[2]深圳市眼科医院眼科,深圳,518005;",中国当代医药,新生儿细菌性结膜炎;细菌分布;耐药状况;,R777.31,2015,,3
jkr2015030060,2,,新生儿细菌性结膜炎的细菌分布及耐药情况分析,,张萌[1];王媛[2];邬丽霞[1];谢镜花[1];,"[1]深圳市宝安区妇幼保健院眼科,深圳,518133;[2]深圳市眼科医院眼科,深圳,518005;",中国当代医药,新生儿细菌性结膜炎;细菌分布;耐药状况;,R777.31,2015,,3
sxzy201511017,1,,任督脉热敏灸联合耳穴压豆治疗失眠症临床观察,10.3969/j.issn.1000-7156.2015.11.017,刘建新[1];马金顺[1];陈鹏典[2];,"[1]北京大学深圳医院,深圳,518036;[2]深圳市妇幼保健院;",山西中医,失眠;热敏灸;任脉;督脉;耳穴;,R256.23,2015,31,11
zgxdyyyy201621116,0,,护理干预对腰硬联合麻醉剖宫产手术中低血压不良反应的影响,10.14164/j.cnki.cn11-5581/r.2016.21.116,佘宝钻;,,中国现代药物应用,,护理干预                                                      腰硬联合麻醉                                                      剖宫产手术                                                      低血压,,,
zgbjyy-kp201627110,0,,低钠合并低蛋白血症与慢性心衰患者心功能及预后的关系,,叶庭芳;,,中国保健营养,低钠血症;低蛋白血症;慢性心衰;心功能;预后;,R541.6,2016,26,27
zgbjyy-kp201627110,0,,低钠合并低蛋白血症与慢性心衰患者心功能及预后的关系,,叶庭芳;,"[1]深圳市罗湖区人民医院,广东深圳,518000",中国保健营养,低钠血症;低蛋白血症;慢性心衰;心功能;预后;,R541.6,2016,26,27
zgbjyy-kp201627179,0,,内镜黏膜下剥离术治疗广基的结直肠息肉的疗效评价,,卢先红;,"[1]深圳市罗湖区人民医院,广东深圳,518000",中国保健营养,疗效;广基的结直肠息肉;内镜黏膜下剥离术;,R656,2016,26,27
zyyjk201504043,0,,原材料中挥发性有机物分析存在的风险及对策,,尹江伟;付斌;李行方;徐小作;,"[1]广东省深圳市宝安区疾病预防控制中心,518101",职业与健康,挥发性有机物;分析;风险;对策;,R135,2015,31,4
ynzyzyzz201609030,0,,柴枳理中汤治疗脾胃气虚型功能性消化不良33例疗效观察,,廖文生;,"[1]深圳市罗湖区人民医院,广东深圳,518000",云南中医中药杂志,柴枳理中汤;脾胃气虚型;功能性消化不良;中医药疗法;,R256.3,2016,37,9
gdwlyskx201609015,0,,经阴道剖宫产瘢痕部位妊娠病灶清除术58例的临床体会,,丁文清;,"[1]深圳市龙岗区妇幼保健院,深圳,518172",广东微量元素科学,剖宫产术后;子宫瘢痕部位妊娠;治疗;,R719.8,2016,23,9
haixyx201609151,0,,应用PDCA循环提高科室外备用药管理,10.3969/j.issn.1006-3765.2016.09.151,邹绮雯;曹伟灵;,[1]广东省深圳市罗湖区人民医院深圳518001,海峡药学,PDCA循环;科室外备用药;规范化管理;,R95,2016,28,9
zgsyyy201627008,0,,高频彩色多普勒超声引导下髋部滑囊炎的介入治疗探讨,10.14163/j.cnki.11-5547/r.2016.27.008,王平[1];李武[1];梁小华[1];鄂占森[2];,"[1]518120,深圳市大鹏新区妇幼保健院外科;[2]深圳市龙岗中心医院;",中国实用医药,高频彩色多普勒;超声引导下;髋部滑囊炎;介入治疗;,,2016,11,27
amydy201407113,3,,儿科输液细节护理效果评价,,黄爱娣;范圳南;刘晓芬;,"[1]南方医科大学附属深圳妇幼保健院,广东深圳,518028",按摩与康复医学,儿科输液;细节护理;护理效果;满意度;,R473.72,2014,,7
qqhryxyxb201631003,0,,调节性 T细胞对宫颈上皮内瘤变Ⅰ级患者预后的影响,10.3969/j.issn.1002-1256.2016.31.003,李一冰;姚秀华;,"[1]518028,南方医科大学附属深圳市妇幼保健院妇产科",齐齐哈尔医学院学报,调节性T细胞;宫颈上皮内瘤样病变;预后;影响;,,2016,37,31
qqhryxyxb201631012,0,,超声诊断卵巢囊肿蒂扭转的临床价值与影像学表现分析,10.3969/j.issn.1002-1256.2016.31.012,蒋艳艳;,"[1]518122,深圳市坪山新区妇幼保健院功能科",齐齐哈尔医学院学报,卵巢囊肿;蒂扭转;腹部超声;经阴道超声;,,2016,37,31
jths201631035,0,,工作坊形式培训护士静脉输液治疗的效果,10.3969/j.issn.1674-4748.2016.31.033,袁瑞琴;熊小云;方映玲;钟春嫦;,"[1]南方医科大学附属深圳市妇幼保健院,518028",全科护理,静脉输液;工作坊;培训;效果;,R197.323,2016,14,31
xdyy201606037,0,,护士长的道德型领导力与护士义务感对护士工作结果的影响,10.3969/j.issn.1671-332X.2016.06.037,艾艳[1];杨舒广[2];周明建[3];刘娜[3];,[1]珠海市妇幼保健院 广东珠海519001;[2]深圳市光明新区人民医院 广东深圳518106;[3]哈尔滨工业大学深圳研究生院 广东深圳518055;,现代医院,护士长的道德型领导力;护士义务感;组织公民行为;任务绩效;,R192.6,2016,16,6
hljyx201606010,0,,纤维桩联合树脂核全冠修复后牙大面积缺损的效果,10.3969/j.issn.1004-5775.2016.06.009,邱健青[1];刘娜[2];许伟强[1];,"[1]深圳市宝安区福永人民医院和平社区健康服务中心,广东深圳,518103;[2]深圳市福田区妇幼保健院口腔科,广东深圳,518000;",黑龙江医学,后牙缺损;纤维桩;树脂核;全冠修复;,R781.05,2016,40,6
xdzdyzl201612043,0,,孤独症儿童数字化干预的疗效分析,,李坚旭[1];李慧娟[2];汪月娟[1];胡效荣[2];崔敏[2];,"[1]深圳市妇幼保健院,广东 深圳,518021;[2]深圳远东妇儿科医院,广东 深圳,518021;",现代诊断与治疗,数字化治疗;仿生学;海豚辅助治疗;孤独性障碍;,R395,2016,27,12
tsyxyxb201606023,0,,不同孕周分娩及分娩方式对早产儿预后的影响,10.3969/j.issn.1004-7115.2016.06.020,陈秋珍[1];白军[2];梁兰芳[1];,"[1]深圳市龙岗区妇幼保健院产科,广东深圳,518172;[2]深圳市人民医院妇科,广东 深圳,518172;",泰山医学院学报,孕周;分娩方式;早产儿;预后;,R714,2016,37,6
lchlzz201603002,0,,护士义务感与工作自由度及其联合效应对任务绩效的影响,10.3969/j.issn.1671-8933.2016.03.002,艾艳[1];杨舒广[2];周明建[3];谢志玲[1];,"[1]519001,珠海市妇幼保健院 珠海;[2]518106,深圳市光明新区人民医院 深圳;[3]518055,哈尔滨工业大学深圳研究生院 深圳;",临床护理杂志,护士;义务感;工作自由度;绩效;,R192.6,2016,15,3
qqhryxyxb201510083,2,,盆底功能康复训练预防产后压力性尿失禁的疗效观察,,冷秀兰;董玉楠;阮莉妮;,"[1]518048,南方医科大学附属医院深圳市妇幼保健院妇女健康中心",齐齐哈尔医学院学报,压力性尿失禁;剖宫产术后;盆底功能康复训练;,,2015,,10
zyyjk201524043,0,,2015年深圳市宝安区首例人感染H7N9禽流感的流行病学调查,,陈兵;马智超;熊田甜;,"[1]广东省深圳市宝安区疾病预防控制中心,518101",职业与健康,人感染H7N9禽流感;现场流行病学;个案调查;暴露因素;,R181.3+1,2015,31,24
xdzdyzl201611013,0,,浮针疗法联合中药湿热敷治疗周围性面神经麻痹的临床研究,,廖志英[1];顾红[2];陈婉[1];,"[1]深圳市罗湖区人民医院推拿科,广东 深圳,518000;[2]深圳市保安区中医院 康复科,广东 深圳,518000;",现代诊断与治疗,浮针疗法;中药;周围性面神经麻痹;临床效果;,R746.3,2016,27,11
ylbjqj201512017,1,,胎儿游离CYP11A-mRNA表达水平对子痫前期的预测价值,10.3969/j.issn.1674-4659.2015.12.1581,朱雄珊;,"[1]深圳市妇幼保健院产五区,广东深圳,518000",临床医学工程,子痫前期;妊娠;胎儿;胆固醇侧链裂解酶基因;,R714.2,2015,22,12
djjk-x201512006,1,,家庭医生团队专职健康教育护士对2型糖尿病患者健康教育效果评价,10.3969/j.issn.1009-6019.2015.12.006,王雪玩;赖万玉;黄威婷;,[1]深圳市坪山新区妇幼保健院 广东 深圳 518122,大家健康（下旬版）,家庭医生团队;健康教育专职护士;2 型糖尿病;健康教育;,R473.2,2015,,12
slyyxzz201511028,1,,乙型肝炎患者免疫球蛋白检验的临床价值分析,10.3969/j.issn.1004-4337.2015.11.028,潘永利[1];吴培[2];,[1]广东省深圳市罗湖区计生中心 深圳 518019;[2]广东省深圳市宝安区人民医院;,数理医药学杂志,免疫球蛋白;乙型肝炎;检验;,R512.62,2015,,11
qqhryxyxb201604014,1,,喉罩在院前紧急困难气道的应用效果分析,,梁进;高志发;王德海;,"[1]深圳坪山新区妇幼保健院, 广东,518122",齐齐哈尔医学院学报,喉罩;院前急救;困难气道;气管插管;,,2016,37,4
zgyykx201617063,0,,抗幽门螺杆菌的序贯治疗与传统治疗的疗效分析,,丛璇;胡春梅;,"[1]深圳市罗湖区人民医院儿科,广东深圳,518000",中国医药科学,儿童幽门螺杆菌;序贯治疗;传统治疗;疗效;,R573,2016,6,17
ddyx201424028,3,,腹腔镜治疗剖宫产瘢痕部位妊娠临床分析,10.3969/j.issn.1009-4393.2014.24.028,杨艳;,[1]广东 518172 深圳市龙岗区妇幼保健院,当代医学,腹腔镜;剖宫产瘢痕妊娠;异位妊娠;,,2014,,24
hljyy201605108,0,,针对性护理干预在提高毛细支气管炎患儿临床治疗效果中的意义,10.14035/j.cnki.hljyy.2016.05.108,吴红霞;苏小兰;揭育雁;,[1]广东省深圳市宝安区妇幼保健院儿一区 518100,黑龙江医药,护理干预;毛细支气管炎;临床效果;,R725.6,2016,29,5
zgyxcx201621022,0,,健康教育和护理干预对儿童膝关节暂时性滑膜炎综合治疗效果的影响,10.3969/j.issn.1674-4985.2016.21.021,谭颖[1];黄金河[2];温贺龙[2];,[1]广东省深圳市盐田区妇幼保健院 广东 深圳 518081;[2]广东省深圳市盐田区人民医院;,中国医学创新,健康教育;护理干预;儿童膝关节暂时性滑膜炎;综合治疗效果;,,2016,13,21
fzysh201630098,0,,大数据时代的医疗风险管理模式创新,10.19387/j.cnki.1009-0592.2016.10.386,林川;,[1]深圳市妇幼保健院,法制与社会,大数据;医疗风险;管理模式;,C931,2016,,30
zylcyj201625004,0,,中医体质辨证保健对社区更年期综合征男性生活质量的影响,10.3969/j.issn.1674-7860.2016.25.003,陈婉兰;,[1]深圳市福田区妇幼保健院赤尾社康中心，广东 深圳，518033,中医临床研究,社区更年期综合征;中医体质辨证保健;生活质量;,R212.7,2016,8,25
xdyyws201509026,2,,瘢痕子宫经阴道分娩120例可行性和安全性分析,10.3969/j.issn.1009-5519.2015.09.026,艾婷华[1];白军[1];陈秋珍[1];陈砚芬[2];李姣玲[3];,"[1]龙岗区妇幼保健院妇产科,广东深圳,518172;[2]武汉市妇女儿童医疗保健中心妇产科,湖北,430000;[3]广州市妇女儿童医疗中心超声科,广东,510120;",现代医药卫生,子宫/病理学;产式;剖宫产术;自然分娩;瘢痕;,,2015,,9
qqhryxyxb201509084,2,,手术室工作中优质护理的临床应用,,黄美坚;,"[1]坪山新区妇幼保健院, 广东深圳,518122",齐齐哈尔医学院学报,手术室工作;临床效果;优质护理;常规护理;,,2015,,9
zwyxyj201419035,3,,PDCA循环管理模式在哮喘中西医护理模式中的应用效果分析,,李丽红;刘晓媚;曾碧峰;,[1]深圳市罗湖区人民医院 广东 深圳 518001,中外医学研究,护理流程再造;哮喘;中西医护理;优质护理;PDCA循环管理;,R562.2,2014,,19
zgrdyx201501032,3,,sTfR联合红细胞参数检测在成人β-地中海贫血筛查中的应用,,钟达宏[1];王红芳[2];钟伟宏[3];,"[1]深圳市南山区西丽人民医院桃源社区健康服务中心,广东深圳518000;[2]深圳市罗湖区人民医院肿瘤内科,广东深圳518001;[3]深圳市妇幼保健院药剂科,广东深圳518000;",中国热带医学,成人轻型β-地中海贫血;可溶性转铁蛋白受体;红细胞参数;,R-331,2015,15,1
yxxxzz201503537,1,,盐酸利托君与硫酸镁治疗先兆早产的疗效对比观察,10.3969/j.issn.1006-1959.2015.03.537,赵红阳;,"[1]深圳市罗湖区妇幼保健院,广东 深圳,518019",医学信息,新生儿稿胆红素血症;护理因素;护理对策;,,2015,,3
zgwsbzgl201607147,0,,输血前检测传染性指标对降低患者医院性感染的意义,10.3969/j.issn.1674-9316.2016.07.147,吴琼[1];曾月嫦[2];李一鸣[3];黄文娟[1];,"[1]深圳市血液中心献血服务科,广东深圳,518000;[2]深圳市宝安妇幼保健院儿科,广东深圳,518100;[3]深圳市血液中心成分科,广东深圳,518000;",中国卫生标准管理,输血;传染性指标;感染;,R331,2016,7,7
hljyx201608012,0,,抗栓治疗在低危和中危非瓣膜性房颤中的疗效分析,10.3969/j.issn.1004-5775.2016.08.012,林文海;陈曦;湛晴宇;,"[1]深圳市罗湖区人民医院,广东深圳,518001",黑龙江医学,抗栓治疗;低危;中危;非瓣膜性房颤;,R541.7,2016,40,8
zgmzmjyyzz201616035,0,,自动免疫组化染色与人工染色对CerbB－2的影响,,陈国艳;卢翔宇;陈莹莹;刘远欢;,"[1]深圳市妇幼保健院病理科,广东 深圳,518000",中国民族民间医药,CerbB-2;全自动免疫组化染色;人工操作;病理诊断;,R446.62,2016,25,16
hnyxyj201608100,0,,腹腔镜治疗胃肠穿孔的临床效果及安全性分析,10.3969/j.issn.1004-437X.2016.08.100,陈丽杏;,[1]深圳市福田区妇幼保健院 广东 深圳 518000,河南医学研究,腹腔镜;穿孔修补术;胃肠穿孔;安全性;,R656.6,2016,25,8
jkr201624030,0,,INSURE策略与机械通气治疗NRDS的效果及对VAP发生率的影响,,李万乐;黄从付;唐艳丽;李博;马莹莹;,"[1]深圳市龙岗区妇幼保健院儿科住院部,深圳,518172",中国当代医药,INSURE策略;新生儿呼吸窘迫综合征;呼吸机相关肺炎;,R725.6,2016,23,24
jkr201624038,0,,头孢哌酮钠/舒巴坦钠(舒普深)治疗老年人肺部感染的临床分析,,马花平;,"[1]深圳市罗湖区人民医院老年病分院老年科,深圳,518020",中国当代医药,舒普深;老年人;肺部感染;盐酸左氧氟沙星注射液;炎症因子;,R978.1+1,2016,23,24
jkr201624056,0,,早期护理干预对更年期妇女血糖血压的影响,,黄亮;,"[1]深圳市盐田区妇幼保健院妇产科,深圳,518081",中国当代医药,早期护理干预;更年期妇女;血糖血压;,R473.71,2016,23,24
syzyyzz201608006,0,,天癸胶囊治疗多囊卵巢综合征合并不孕症疗效观察,10.3969/j.issn.1004-2814.2016.08.006,王海燕;,"[1]广东省深圳市宝安区妇幼保健院妇产科,广东 深圳,518000",实用中医药杂志,多囊卵巢综合征;不孕症;天癸胶囊;,R271.141.6,2016,32,8
ylbjqj201608032,0,,产后不同时期盆底康复治疗的效果比较,10.3969/j.issn.1674-4659.2016.08.1055,李文蕾;刘萍;王云霞;,"[1]深圳市福田区妇幼保健院妇产科,广东深圳,518026",临床医学工程,盆底康复治疗;时机;生物反馈;盆底功能;,R714.46,2016,23,8
ylbjqj201608049,0,,门冬胰岛素和生物合成人胰岛素治疗妊娠期糖尿病疗效及妊娠结局的分析,10.3969/j.issn.1674-4659.2016.08.1089,龙隽;许可可;刘海英;,"[1]广东省深圳市罗湖区人民医院妇产科,广东深圳,518100",临床医学工程,妊娠期糖尿病;门冬胰岛素;生物合成人胰岛素;,R714.256,2016,23,8
djjk-x201608262,0,,氧气驱动雾化吸入辅助治疗小儿喘息型肺炎的全程系统化护理效果分析,10.3969/j.issn.1009-6019.2016.08.262,苏小兰;吴红霞;,[1]深圳市宝安区妇幼保健院儿一区 广东 深圳 518101,大家健康（下旬版）,氧气驱动雾化吸入;喘息型肺炎;小儿;全程系统化护理;疗效;,R473.72,2016,10,8
bfyx201608089,0,,多奈哌齐联合胞磷胆碱钠治疗轻中度阿尔茨海默病临床研究,,张明之;,[1]广东省深圳市罗湖区人民医院神经内科 深圳 518000,北方药学,多奈哌齐;胞磷胆碱钠;阿尔茨海默病;,R749.1+6,2016,13,8
nmgzyy201608072,0,,天麻钩藤饮联合甲磺酸氨氯地平治疗肝阳上亢型高血压的临床疗效观察,10.3969/j.issn.1006-0979.2016.08.072,李艳莉;,[1]广东省深圳市福田区妇幼保健院 深圳518000,内蒙古中医药,天麻钩藤饮;甲磺酸氨氯地平;肝阳上亢型高血压;临床疗效;,R544.1,2016,35,8
zyyjk201421038,0,,深圳市宝安区职业病健康教育现状及对策,,潘志斌[1];陈倩盈[2];殷霄[3];香丽娟[1];谢谦怀[1];,"[1]广东省深圳市宝安区福永预防保健所,518103;[2]深圳市光明新区疾病预防控制中心;[3]广东省职业病防治院;",职业与健康,职业病;健康教育;现况;对策;,R181.3+1,2014,30,21
zwyxyj201418020,3,,多囊卵巢综合征采用二甲双胍治疗对促排卵作用探讨,,江丽萍;邱诗贤;林逸飞;,[1]深圳市妇幼保健院 广东 深圳 518028,中外医学研究,多囊卵巢综合征;二甲双胍;促排卵作用;,R588.6,2014,,18
zgyyzn201418125,3,,社区产后访视对新生儿健康的影响,,苏华;,"[1]深圳福田区妇幼保健院圩镇社康中心,广东深圳,518000",中国医药指南,社区;产后访视;新生儿;健康;,R473,2014,,18
qlyxjy201604021,0,,妊娠期糖尿病患者晚孕期血脂水平检测的临床意义,10.3969/j.issn.1673-5013.2016.04.021,张昆;,"[1]广东省深圳市宝安区妇幼保健院产科,广东深圳,518000",医学检验与临床,,,2016,27,4
zgyxwz-ekxfc201604028,0,,利巴韦林联合柴桂退热颗粒治疗儿童上呼吸道感染疗效观察,10.3969/j.issn.1674-3865.2016.04.026,杜江滨;蔡泽波;罗嘉静;,"[1]深圳市福田区妇幼保健院儿科, 广东 深圳,518048",中国中西医结合儿科学,上呼吸道感染;柴桂退热颗粒;利巴韦林;儿童;,R725.6,2016,8,4
hsjbzz201604001,0,,肥胖儿童血抵抗素与代谢指标的关系,10.3969/j.issn.1009-3257.2016.04.001,陆喜燕;董国庆;陈昱;刘婉趋;钟丽华;,[1]南方医科大学附属深圳妇幼保健院儿科 广东 深圳 518028,罕少疾病杂志,抵抗素;肥胖;代谢指标;儿童;,R723.14,2016,23,4
hsjbzz201604008,0,,重组组织型纤溶酶原激活剂静脉溶栓治疗急性脑梗死的疗效及安全性,10.3969/j.issn.1009-3257.2016.04.008,张明之;,[1]深圳市罗湖区人民医院神经内科 广东 深圳 518000,罕少疾病杂志,重组组织型纤溶酶原激活剂;静脉溶栓治疗;急性脑梗死;,R651.1,2016,23,4
fzzdyzlzz201604006,0,,地中海贫血实验室筛查指标评价,10.3969/j.issn.1674-6929.2016.04.006,陈熙;肖克林;罗茗月;麦光兴;夏勇;,"[1]深圳市宝安区妇幼保健院中心实验室,广东,深圳518133",分子诊断与治疗杂志,地中海贫血;平均红细胞体积;平均血红蛋白含量;血红蛋白;,,2016,8,4
zgyxwz-jlxfc201604024,0,,单绒毛膜双羊膜囊双胎选择性胎儿生长受限的护理干预,10.3969/j.issn.1674-3768.2016.04.024,何琼霞;郑春花;,"[1]深圳市妇幼保健院消毒供应中心, 广东深圳,518000",中国临床护理,妊娠结局;单绒毛膜双胎;宫内生长受限;护理;,,2016,8,4
zgyxwz-jlxfc201604032,0,,品管圈在住院患者特殊检查前准备工作中的应用,10.3969/j.issn.1674-3768.2016.04.032,武文亚;李晓妍;梁珑;陈丽平;,"[1]深圳市罗湖区人民医院肿瘤外科, 广东深圳,518000",中国临床护理,品管圈;住院患者;特殊检查;,,2016,8,4
mdjyxyxb201604029,0,,右旋美托咪啶对重度子痫前期患者术后的镇痛效果,,卢慧勤;卢群;郭影靓;,"[1]深圳市宝安区妇幼保健院麻醉科,广东 深圳,518100",牡丹江医学院学报,术后镇痛;重度子痫前期;术后;右旋美托咪啶;,R395.9,2016,37,4
zgsyyy201628182,0,,早期肠内营养护理改善重症胰腺炎合并感染患者营养状态的效果研究,10.14163/j.cnki.11-5547/r.2016.28.182,邹梅霞;赖爱萍;张立平;,"[1]518120,深圳市大鹏新区妇幼保健院",中国实用医药,早期肠内营养护理;重症胰腺炎;感染;营养状况;,,2016,11,28
zgylqxxx201610017,0,,新生儿同步置换输血系统研制,,孙继蕃[1];杨传忠[2];易明军[1];,[1]深圳圣诺医疗设备股份有限公司 广东深圳 518055;[2]深圳市妇幼保健院 广东深圳 518017;,中国医疗器械信息,换血;新生儿;同步;,R197.39,2016,22,10
qqhryxyxb201602027,1,,降钙素原在新生儿感染性疾病诊断中的研究,,张莉;吕晓丹;卢仕仰;,"[1]深圳市龙岗区妇幼保健院, 广东,518172",齐齐哈尔医学院学报,降钙素原;新生儿;感染;临床诊断;,,2016,37,2
