qqhryxyxb201512035,5,,孟鲁司特及酮替芬治疗支气管哮喘的临床价值分析,,黄玮琼[1];黄志强[2];,"[1]宝安中心医院银田社区健康服务中心, 广东深圳,518102;[2]宝安区西乡卫生监督所 慢性病防治科, 广东深圳,518102;",齐齐哈尔医学院学报,孟鲁司特;酮替芬;支气管哮喘;,,2015,,12
zgjkjy201407024,1,,深圳市宝安区企业工人对正己烷职业危害防护的认知状况调查,,鲜敏[1];张群芳[2];,"[1]深圳市宝安区疾病预防控制中心,广东深圳,518101;[2]深圳市宝安区西乡卫生监督所(预防保健所),广东深圳,518101;",中国健康教育,工人;正己烷;认知;调查;,R193  R135,2014,30,7
syyfyx201610039,0,,2015年深圳宝安区流动人口艾滋病知识知晓情况及影响因素分析,10.3969/j.issn.1006-3110.2016.10.039,方芳[1];孙群露[2];詹志强[2];邢福溪[3];饶展宏[2];林爱华[1];,"[1]中山大学公共卫生学院,广东广州,510080;[2]深圳市宝安区疾病预防控制中心;[3]深圳市宝安区西乡卫生监督所;",实用预防医学,艾滋病;流动人口;知晓率;影响因素;,R512.91,2016,23,10
lnpfxbkzz201601003,0,,422例终止妊娠的梅毒患者既往随访结果分析,10.3969/j.issn.1674-8468.2016.01.003,鲁东平[1];鲁菊香[2];秦琴[3];付敏[4];张荣[1];李湘辉[1];贾婕[1];,"[1]深圳市宝安区慢性病防治院皮肤科,广东 深圳,518133;[2]广州市越秀区儿童医院,广东 广州,510115;[3]深圳市宝安区人民医院皮肤科,广东 深圳,518133;[4]深圳市宝安区沙井人民医院,广东 深圳,518104;",皮肤性病诊疗学杂志,Pregnancy termination;Syphilis;Follow-up;,终止妊娠                                                      梅毒                                                      随访,,,
lnpfxbkzz201401014,1,,认知疗法对梅毒血清固定女性患者焦虑抑郁情绪的影响,10.3969/j.issn.1674-8468.2014.01.011,鲁东平[1];付敏[2];鲁菊香[3];张荣[1];梁冬梅[1];李湘辉[1];陈卓英[4];,"[1]深圳市宝安区慢性病防治院,广东 深圳,518133;[2]深圳市宝安区沙井人民医院,广东 深圳,518104;[3]广州市越秀区儿童医院,广东 广州,510115;[4]深圳市宝安区石岩预防保健所,广东 深圳,518108;",皮肤性病诊疗学杂志,认知疗法;梅毒血清固定;焦虑抑郁;,R759.1,2014,,1
gwyx-shyx201403021,0,,深圳市劳务工人格特征及影响因素的研究,10.3969/j.issn.1673-5625.2014.03.018,唐建军[1];苏展[2];张泉水[1];邓秀良[1];苏海云[1];侯粤虎[1];,[1]深圳市宝安区慢性病防治院心理卫生中心，广东 深圳，518102;[2]深圳市光明新区疾病预防控制中心，广东 深圳，518106;,中国社会医学杂志,劳务工;人格;社会支持;,R395.6,2014,,3
wsrkx201607007,0,,深圳市社区健康服务中心基本情况调查分析,10.3969/j.issn.1003-2800.2016.07.007,邓辉萍[1];陈虾[2];侯万里[1];赵志广[1];欧阳芳芳[3];赵鹏[4];程锦泉[1];,"[1]深圳市疾病预防控制中心,广东深圳,518055;[2]深圳市妇幼保健院,广东深圳,518017;[3]深圳市宝安区沙井人民医院,广东深圳,518104;[4]深圳市宝安区西乡人民医院,广东深圳,518102;",卫生软科学,社区卫生服务中心;基本情况;人员配置;财政支出;,R197.61,2016,30,7
lcsxjbzz201401018,2,,深圳市劳务工社会支持状况调查,10.3969/j.issn.1672-187X.2014.01.016-0041-03,唐建军[1];苏展[2];张泉水[1];邓秀良[1];侯粤虎[1];苏海云[1];,"[1]518101,广东 深圳 深圳市宝安区慢性病防治院;[2]518106,广东 深圳 深圳市光明新区疾病预防控制中心;",临床心身疾病杂志,劳务工;农民工;社会支持;社会支持量表;影响因素;,R395.6,2014,,1
tnbxsj201413065,0,,社区糖尿病慢性并发症检出率及其影响因素,10.3969/j.issn.1672-4062.2014.13.065,吴家东[1];陈少清[2];黄灵坚[3];,"[1]广东省深圳市宝安区西乡人民医院后瑞社康中心,广东深圳,518128;[2]广东省深圳市宝安区石岩卫生监督所,广东深圳,518108;[3]广东省深圳市龙华新区人民医院,广东深圳,518109;",糖尿病新世界,社区;糖尿病;慢性并发症;检出率;影响因素;,R587.1,2014,,13
zgyxcx201511053,6,,左旋氨氯地平片与阿托伐他汀钙片在治疗高血压病中的临床价值,10.3969/j.issn.1674-4985.2015.11.053,黄伟琼[1];黄志强[2];,[1]广东省深圳市宝安中心医院银田社区健康服务中心 广东 深圳518102;[2]广东省深圳市宝安区西乡卫生监督所;,中国医学创新,高血压;冠心病;左旋氨氯地平;阿托伐他汀钙片;,,2015,,11
gzzyydxxb201405019,7,,穴位贴敷联合大青龙汤治疗小儿哮喘外寒内热证的临床研究,10.13359/j.cnki.gzxbtcm.2014.05.015,许佩群[1];余德奎[2];许双虹[3];陈毓丽[4];李宏[5];钟格玲[1];,"[1]深圳市龙岗区第三人民医院,广东深圳,518115;[2]深圳市坪山新区妇幼保健院,广东深圳,518122;[3]深圳市中医院,广东深圳,518033;[4]深圳市罗湖区中医院,广东深圳,518021;[5]珠海市人民医院,广东珠海,519070;",广州中医药大学学报,小儿支气管哮喘;外寒内热证;大青龙汤;穴位敷贴;,R264.4,2014,,5
syyfyx201406006,4,,2004-2013年深圳中小企业工作场所三氯乙烯动态监测分析,10.3969/j.issn.1006-3110.2014.06.006,黄微微;江志荣;陈小波;林妹芳;朱岸平;,,实用预防医学,三氯乙烯;职业危害;动态监测;中小企业;基本职业卫生服务(BOHS);,R135,2014,21,6
jkr201409045,12,,一次性根管治疗急性牙髓炎116例护理体会,,李秀芬[1];冯晓蕾[2];李望雄[2];,"[1]深圳市宝安区慢性病防治院,深圳,518019;[2]深圳市罗湖区妇幼保健院,深圳,518019;",中国当代医药,一次性根管;急性牙髓炎;护理措施;,R781.31,2014,21,9
zgrdyx201512008,0,,疑似先天梅毒新生儿血浆梅毒螺旋体DNA定量检测及随防,10.13604/j.cnki.46-1064/r.2015.12.08,鲁东平[1];沈全才[2];秦琴[3];付敏[4];杨鹏[5];张荣[1];李湘辉[1];贾婕[1];,"[1]深圳市宝安区慢性病防治院皮肤科,广东深圳,518133;[2]深圳市宝安区松岗人民医院急诊科,广东深圳,518105;[3]深圳市宝安区人民医院皮肤科,广东深圳,518133;[4]深圳市宝安区沙井人民医院,广东深圳,518104;[5]深圳美莱医疗美容医院,广东深圳,518000;",中国热带医学,疑似先天梅毒;新生儿;血浆;荧光定量PCR;阴转时间;,R759.1,2015,15,12
hainanyx201515042,1,,中西医康复结合药物治疗带状疱疹的临床观察,10.3969/j.issn.1003-6350.2015.15.0832,叶有兴[1];康丽[2];梁明华[1];焦睿[1];,"[1]深圳市坪山新区人民医院皮肤科,广东 深圳,518118;[2]深圳市宝安区沙井人民医院皮肤科广东 深圳 518105;",海南医学,中西医;药物;带状疱疹;神经性疼痛;,R752.1+2,2015,,15
zgjcyy201603014,1,,孕妇尿碘监测的临床意义,10.3760/cma.j.issn.1008-6706.2016.03.014,谢昌辉[1];刘瑶[2];池莲祥[3];朱琳[3];李秀江[1];刘日信[1];冼碧霞[1];,"[1]南方医科大学附属宝安医院核医学科, 广东省深圳,518101;[2]南方医科大学附属宝安医院产科, 广东省深圳,518101;[3]南方医科大学附属宝安医院内分泌科, 广东省深圳,518101;",中国基层医药,Pregnant women;Iodine;Diet;Health Education;,孕妇                                                      碘                                                      膳食                                                      健康教育,,,
zhlxbx201408010,3,"ISTIC,PKU",广东省2009-2011年鼠伤寒沙门菌监测及菌株分子分型的研究,10.3760/cma.j.issn.0254-6450.2014.08.010,黄燕惠[1];柯碧霞[2];孙九峰[3];何冬梅[2];陈清[4];柯昌文[2];俞守义[4];,"[1]510515广州,南方医科大学公共卫生与热带医学学院流行病学系;深圳市宝安区慢性病防治院皮肤性病防治科;[2]广东省疾病预防控制中心;[3]广东省公共卫生研究院;[4]南方医科大学公共卫生与热带医学学院流行病学系,广州,510515;",中华流行病学杂志,鼠伤寒沙门菌;加强监测;分子分型;,,2014,35,8
zhldwszyb201604015,0,"ISTIC,PKU",职业接触1-溴丙烷致周围神经损伤4例,10.3760/cma.j.issn.1001-9391.2016.04.015,余新天[1];缪荣明[2];张健杰[3];边寰锋[1];张素丽[1];朱志良[4];贺锋[1];吴长龙[1];,"[1]518100,深圳市宝安区沙井预防保健所;[2]无锡市第八人民医院;[3]深圳市职业病防治院;[4]深圳市宝安区疾病预防控制中心;",中华劳动卫生职业病杂志,@@;,,2016,34,4
ddyx201522101,0,"ISTIC,PKU",多排螺旋CT在社区肺部疾病临床诊断效果比较,10.3969/j.issn.1009-4393.2015.22.101,吴家东[1];陈少清[2];黄灵坚[3];,"[1]广东 518128 广东省深圳市宝安区西乡人民医院后瑞社康中心;[2]518108,广东省深圳市宝安区石岩卫生监督所;[3]518109,广东省深圳市龙华新区人民医院;",当代医学,社区肺部疾病;多排螺旋CT;常规方法;诊断效果;,,2015,,22
jyyxylc201507018,1,"ISTIC,PKU",银屑病患者血清去氢表雄酮和硫酸去氢表雄酮水平的测定及临床意义,10.3969/j.issn.1672-9455.2015.07.017,叶有兴[1];康丽[2];李莉[1];,[1]广东省深圳市坪山新区人民医院皮肤科 518118;[2]广东省深圳市沙井人民医院 518105;,检验医学与临床,银屑病;去氢表雄酮;硫酸去氢表雄酮;,,2015,,7
zfysjjbzz201605012,3,"ISTIC,PKU",养血清脑颗粒治疗卒中后抑郁的疗效及对脑白质结构改变的影响,,许孝南[1];马婷[2];陈旭辉[1];虢周科[3];朱治山[4];刘淑云[5];李梅笑[6];李晶[7];刘相城[5];,"[1]北京大学深圳医院神经内科,广东深圳,518036;[2]哈尔滨工业大学深圳研究生院,广东深圳,518055;[3]深圳市中医院神经内科,广东深圳,518033;[4]深圳市罗湖区人民医院神经内科,广东深圳,518001;[5]深圳市龙华新区人民医院神经内科,广东深圳,518110;[6]深圳市龙岗区人民医院神经内科,广东深圳,518172;[7]深圳市宝安区沙井人民医院神经内科,广东深圳,518104;",中风与神经疾病杂志,卒中后抑郁;弥散张量成像;疗效;养血清脑颗粒;,R743.3,2016,33,5
zgyykx201510008,3,"ISTIC,PKU",糖尿病合并肺结核患者TNF-α、IFN-γ及IL-10的表达及意义,,李济金[1];胡春华[2];罗洁[3];,"[1]深圳市坪山新区妇幼保健院金沙社区健康服务中心,广东深圳,518118;[2]深圳市坪山新区妇幼保健院沙田社区健康服务中心,广东深圳,518118;[3]深圳市坪山新区人民医院坪环社区健康服务中心,广东深圳,518118;",中国医药科学,结核;肺结核;糖尿病;白介素-10;γ干扰素;肿瘤坏死因子-α;,R521  R587.1,2015,,10
hljyx201507059,4,"ISTIC,PKU",国外家庭医生服务模式对中国的启示,10.3969/j.issn.1004-5775.2015.07.059,孙婷[1];石欧敏[2];王洪锐[3];邱创良[3];孙玉立[3];甘勇[2];邓剑[3];夏挺松[4];卢祖洵[2];,"[1]深圳市宝安区慢性病防治院,广东深圳,518133;[2]华中科技大学同济医学院,湖北武汉,430032;[3]深圳市宝安区福永人民医院,广东深圳,518103;[4]深圳市宝安区卫计局,广东深圳,518101;",黑龙江医学,国外;家庭医生制度;启示;,R197.1,2015,,7
zgyykx201515049,2,"ISTIC,PKU",IGF-1和TGF-β1与糖尿病视网膜病变关系的研究,,罗洁[1];李济金[2];胡春华[3];,"[1]深圳市坪山新区人民医院坪环社区健康服务中心,广东深圳,518118;[2]深圳市坪山新区妇幼保健院金沙社区健康服务中心,广东深圳,518118;[3]深圳市坪山新区妇幼保健院沙田社区健康服务中心,广东深圳,518118;",中国医药科学,胰岛素样生长因子;转化生长因子β1;糖尿病;视网膜病变;,R587.2,2015,,15
yxxxzz201508380,0,"ISTIC,PKU",慢性非传染病疾病负担研究与分析,10.3969/j.issn.1006-1959.2015.08.380,廖辉陵[1];陈丽华[2];王进娣[3];,"[1]深圳宝安区石岩预防保健所慢性病防治科,广东深圳,518108;[2]深圳宝安区石岩预防保健所疾病控制科,广东深圳,518108;[3]深圳宝安区石岩医院体检科,广东深圳,518108;",医学信息,慢性非传染性疾病;疾病负担;评价方法;,,2015,28,8
hainanyx201615055,1,"ISTIC,PKU",妊娠意愿的影响因素及其对母婴结局的影响,10.3969/j.issn.1003-6350.2016.15.055,杨煜霞[1];闵娟[1];张艳萍[1];袁贵红[1];丁德先[2];王丽娜[3];,"[1]深圳市坪山新区妇幼保健院妇产科,广东 深圳,518122;[2]深圳市大鹏新区葵涌人民医院妇产科,广东 深圳,518121;[3]深圳市坪山新区人民医院妇产科,广东 深圳,518123;",海南医学,Intended pregnancy;Unintended pregnancy;Influencing factors;Maternal and infant outcomes;,妊娠意愿                                                      非意愿妊娠                                                      影响因素                                                      母婴结局,,,
xdzdyzl201513056,1,"ISTIC,PKU",槐杞黄颗粒对儿童支气管哮喘患者T淋巴细胞亚群检测的影响,,李济金[1];胡春华[2];罗洁[3];,"[1]深圳市坪山新区妇幼保健院金沙社区健康服务中心,广东 深圳,518118;[2]深圳市坪山新区妇幼保健院沙田社区健康服务中心 广东 深圳 518118;[3]深圳市坪山新区人民医院坪环社区健康服务中心,广东 深圳,518118;",现代诊断与治疗,槐杞黄颗粒;儿童;支气管哮喘患;T淋巴细胞亚群;,R725.6,2015,26,13
shandyy201520016,11,"ISTIC,PKU",支气管哮喘患者外周血 T 细胞亚群 Th1、Th2及其相关细胞因子水平变化及意义,10.3969/j.issn.1002-266X.2015.20.014,黄伟强[1];李惠[2];袁梅[2];陈小丹[2];,"[1]深圳市坪山新区妇幼保健院,广东深圳,518122;[2]深圳市龙岗区人民医院;",山东医药,支气管哮喘;CD+4 辅助性T细胞;细胞因子;白细胞介素;肿瘤坏死因子α;γ干扰素;,R562.2,2015,,20
zgzyyx201502021,4,"ISTIC,PKU",《职业性手臂振动病的诊断》标准修订说明,10.11763/j.issn.2095-2619.2015.02.021,陈嘉斌[1];陈青松[1];王建新[2];史懋功[3];孙道远[4];战波[3];肖斌[1];宋莉[5];郎丽[1];江志荣[6];江嘉欣[1];张群芳[6];,"[1]广东省职业病防治院，广东省职业病防治重点实验室，广东广州510300;[2]北京市预防医学研究中心,北京,100013;[3]烟台市职业病防治院,山东烟台,264000;[4]上海市肺科医院，上海市职业病防治院，上海200433;[5]黑龙江省第二医院,黑龙江哈尔滨,150010;[6]深圳市宝安区西乡卫生监督所,深圳,518102;",中国职业医学,职业性手臂振动病;手传振动;标准修订;诊断标准;,R135.4,2015,,2
zwyxyj201416005,2,"ISTIC,PKU",复方丹参滴丸对冠心病心绞痛MCP-1及IL-6的影响,,李济金[1];胡春华[2];罗洁[3];,[1]深圳市坪山新区妇幼保健院金沙社区健康服务中心广东 深圳 518118;[2]深圳市坪山新区妇幼保健院沙田社区健康服务中心;[3]深圳市坪山新区人民医院坪环社区健康服务中心;,中外医学研究,复方丹参滴丸;冠心病;心绞痛;单核细胞趋化蛋白-1;白介素-6;,R259.4,2014,,16
xdyy201510057,1,"ISTIC,PKU",深圳市宝安区儿童安全座椅认知及使用现况调查,10.3969/j.issn.1671-332X.2015.10.057,陈韦冰[1];唐瑛[1];徐小红[2];郭艳芳[1];刘成锋[1];刘峥[1];张升超[3];,[1]深圳市宝安区慢性病防治院 广东深圳 518103;[2]深圳市宝安区人民医院 广东深圳 518103;[3]深圳市宝安区中心医院 广东深圳 518103;,现代医院,儿童;安全座椅;认知情况;调查;,,2015,,10
zgwzbjjyx201504002,16,"ISTIC,PKU",急性百草枯中毒的国内诊治进展,10.3760/cma.j.issn.2095-4352.2015.04.002,张文武;,,中华危重病急救医学,,,2015,,4
zgncws2014z2086,1,"ISTIC,PKU",基于信息化对高血压病管理的研究,,罗洁[1];李济金[2];胡春华[3];,[1]深圳市坪山新区人民医院坪环社区健康服务中心 518118;[2]深圳市坪山新区妇幼保健院金沙社区健康服务中心 518118;[3]深圳市坪山新区妇幼保健院沙田社区健康服务中心 518118;,中国农村卫生,信息平台;高血压病管理;知晓率;服药率;控制率基于信息化对高血压病管理的研究;,R544.1,2014,,z2
zgncws2014z1197,1,"ISTIC,PKU",紫云金联合雷公藤多苷片治疗类风湿性关节炎疗效及安全性观察,,罗洁[1];李济金[2];胡春华[3];,[1]深圳市坪山新区人民医院坪环社区健康服务中心 518118;[2]深圳市坪山新区妇幼保健院金沙社区健康服务中心 518118;[3]深圳市坪山新区妇幼保健院沙田社区健康服务中心 518118;,中国农村卫生,类风湿性关节炎;复方紫云金;雷公藤;疗效;安全性;,R969,2014,,z1
xdzdyzl201513014,0,"ISTIC,PKU",清肝降酶汤对急性乙型肝炎患者血清中IL-16和IL-19及肝功能指标的影响,,罗洁[1];李济金[2];胡春华[3];,"[1]深圳市坪山新区人民医院六联社区健康服务中心;[2]深圳市坪山新区妇幼保健院金沙社区健康服务中心;[3]深圳市坪山新区妇幼保健院沙田社区健康服务中心,广东 深圳,518118;",现代诊断与治疗,清肝降酶汤;乙型肝炎;肝功能;白细胞介素16;白细胞介素19;,R512.62,2015,26,13
zwyxyj201429012,1,"ISTIC,PKU",孟鲁司特联合艾灸治疗儿童咳嗽变异性哮喘的疗效,,胡春华[1];罗洁[2];李济金[3];,[1]深圳市坪山新区妇幼保健院沙田社区健康服务中心广东 深圳 518118;[2]深圳市坪山新区人民医院坪环社区健康服务中心;[3]深圳市坪山新区妇幼保健院金沙社区健康服务中心;,中外医学研究,孟鲁斯特钠;艾灸;儿童;咳嗽变异性哮喘;,R974,2014,,29
xsekzz201504009,9,"ISTIC,PKU",不同机械通气方式治疗重症新生儿呼吸窘迫综合征近远期效果观察,10.3969/j.issn.1673-6710.2015.04.009,龚兆荣[1];王艳丽[2];陈运彬[2];吴满红[3];,"[1]510010 广州医科大学附属广东省妇儿医院广东省妇幼保健院新生儿科;518104深圳,广州医科大学附属深圳沙井医院儿科;[2]510010,广州医科大学附属广东省妇儿医院广东省妇幼保健院新生儿科;[3]510010,广州医科大学附属广东省妇儿医院广东省妇幼保健院神经康复科;",中国新生儿科杂志,"呼吸窘迫综合征,新生儿;高频通气;婴儿,早产;",,2015,30,4
jkr201510052,0,"ISTIC,PKU",灌肠方治疗小儿腹泻的临床效果,,胡春华[1];罗洁[2];李济金[3];,"[1]深圳市坪山新区妇幼保健院沙田社区健康服务中心,深圳,518118;[2]深圳市坪山新区人民医院坪环社区健康服务中心,深圳,518118;[3]深圳市坪山新区妇幼保健院金沙社区健康服务中心,深圳,518118;",中国当代医药,腹泻;小儿;灌肠方;,R725.7,2015,,10
xdzdyzl201506005,0,"ISTIC,PKU",环境污染与慢性支气管炎患儿免疫功能的相关性研究,,胡春华[1];罗洁[2];李济金[3];,"[1]深圳市坪山新区妇幼保健院沙田社区健康服务中心,广东 深圳,518118;[2]深圳市坪山新区人民医院坪环社区健康服务中心,广东 深圳,518118;[3]深圳市坪山新区妇幼保健院金沙社区健康服务中心,广东 深圳,518118;",现代诊断与治疗,支气管炎;环境污染;患儿;免疫功能;相关性研究;,R725.6,2015,,6
xdzdyzl201511128,0,"ISTIC,PKU",肝硬化患者血清SOD和VWF水平变化及意义,,胡春华[1];罗洁[2];李济金[3];,"[1]深圳市坪山新区妇幼保健院沙田社区健康服务中心;[2]深圳市坪山新区人民医院坪环社区健康服务中心;[3]深圳市坪山新区妇幼保健院金沙社区健康服务中心,广东 深圳,518118;",现代诊断与治疗,肝硬化;超氧化物歧化酶;血管性血友病因子;意义;,R446.1,2015,,11
zgxdyyyy201512153,0,"ISTIC,PKU",糖尿病合并肺结核的初治效果及护理干预应用探析,10.14164/j.cnki.cn11-5581/r.2015.12.153,刘怡[1];邓益帼[1];李燕芬[2];黄玲[3];张丽[4];,"[1]518133,广东省深圳市宝安区慢性病防治院感染管理科;[2]518133,广东省深圳市宝安区慢性病防治院内科门诊;[3]518133,广东省深圳市宝安区慢性病防治院客服中心;[4]518133,广东省深圳市宝安区慢性病防治院功能检查科;",中国现代药物应用,糖尿病合并肺结核;初治效果;护理干预;,,2015,,12
zgncws2014z1118,0,"ISTIC,PKU",家庭医生团队对社区Ⅱ型糖尿病患者管理的临床效果评估,,李济金[1];胡春华[2];罗洁[3];,[1]深圳市坪山新区妇幼保健院金沙社区健康服务中心 518118;[2]深圳市坪山新区妇幼保健院沙田社区健康服务中心 518118;[3]深圳市坪山新区人民医院坪环社区健康服务中心 518118;,中国农村卫生,社区;糖尿病;家庭医生;管理;,R19,2014,,z1
hljyx201407019,0,"ISTIC,PKU",辛伐他汀与灯盏花素联合治疗对冠心病患者血液流变学及LPO、SOD的影响,10.3969/j.issn.1004-5775.2014.07.019,罗洁[1];李济金[2];胡春华[3];,"[1]深圳市坪山新区人民医院坪环社区健康服务中心,广东 深圳,518118;[2]深圳市坪山新区妇幼保健院金沙社区健康服务中心,广东 深圳,518118;[3]深圳市坪山新区妇幼保健院沙田社区健康服务中心,广东 深圳,518118;",黑龙江医学,灯盏花素;辛伐他汀;冠心病(CHD);血液流变学;血清脂质过氧化物(LPO);超氧化物歧化酶(SOD);,R541.4,2014,,7
zywsyyjjy201605002,0,"ISTIC,PKU",深圳市西部地区手外伤特征及相关因素分析,10.16369/j.oher.issn.1007-1326.2016.05.002,叶林繁[1];陈倩盈[2];冒荣荣[2];,"[1]深圳市宝安区松岗预防保健所慢性病防治科,广东 深圳,518105;[2]深圳市光明新区疾病预防控制中心,广东 深圳,518106;",职业卫生与应急救援,hand injury;risk factors;cutting injury;logistic regression analysis;,手外伤                                                      危险因素                                                      切割伤                                                      回归分析,,,
gwyx-shyx201406024,1,"ISTIC,PKU",深圳市毒品及药物滥用的流行趋势研究,10.3969/j.issn.1673-5625.2014.06.24,张泉水[1];夏莉[1];蔡翠兰[1];邓秀良[1];高纯良[2];任小龙[2];,"[1]深圳市宝安区慢性病防治院,广东深圳,518126;[2]深圳市宝安区公安局强制隔离戒毒所,广东深圳,518126;",中国社会医学杂志,毒品;药物滥用;合成毒品;甲基苯丙胺;流行病学;,B845.4,2014,31,6
zgmfpfbzz201508013,0,"ISTIC,PKU",深圳市宝安区1991－2012年麻风流行病学分析,,黄志明[1];刘枫[1];周佳慧[1];黄俊新[2];刘晖[2];,[1]深圳市宝安区慢性病防治院，广东深圳，518126;[2]深圳市慢性病防治中心，广东深圳，518020;,中国麻风皮肤病杂志,麻风;流行病学;防治策略;,,2015,,8
zgjcyy201413070,1,"ISTIC,PKU",预算配置制为基础的护理岗位管理模式在优质护理中的建立及运行,10.3760/cma.j.issn.1008-6706.2014.13.070,孙涛[1];李思琴[1];石锦波[2];李彩珍[3];尤小娜[4];徐莲香[5];彭少茹[6];,"[1]深圳市坪山新区人民医院产科, 广东省深圳,518118;[2]深圳市坪山新区人民医院手术室, 广东省深圳,518118;[3]深圳市坪山新区人民医院泌尿外科, 广东省深圳,518118;[4]深圳市坪山新区人民医院脑外科, 广东省深圳,518118;[5]深圳市坪山新区人民医院儿科, 广东省深圳,518118;[6]深圳市坪山新区人民医院妇科, 广东省深圳,518118;",中国基层医药,预算;资源分配;人员开发;护理管理研究;,,2014,21,13
lcfkzz201509005,2,"ISTIC,PKU",深圳市宝安区居民结核病防治知信行现状调查研究,10.3969/j.issn.1009-6663.2015.09.005,赵梅桂[1];汪文新[2];唐瑛[1];王云霞[1];赵安贵[1];,"[1]518133,广东 深圳 深圳市宝安区慢性病防治院结防科、深圳市宝安区结核病防治医学重点学科;[2]江苏大学工商管理学院, 江苏 镇江,212013;",临床肺科杂志,居民;知识;态度;行为;四象限分析法;,,2015,,9
hsjxzz201416008,12,"ISTIC,PKU",术前心理护理对术中知晓相关创伤后应激障碍的防治作用研究,,李向荣[1];王正英[1];李英姿[1];张维[2];金玉珍[2];刘艳春[2];,"[1]南方医科大学附属深圳市宝安医院,广东深圳,518101;[2]广东医学院附属深圳市西乡医院,广东深圳,518102;",护士进修杂志,全身麻醉;创伤后应激障碍;心理护理;,R471,2014,29,16
lcfkzz201511005,1,"ISTIC,PKU",医务人员结核病防治知识及诊疗行为调查研究,10.3969/j.issn.1009-6663.2015.11.005,赵梅桂[1];汪文新[2];唐瑛[1];王云霞[1];赵安贵[1];赵宇[2];,"[1]深圳市宝安区慢性病防治院结防科---深圳市宝安区结核病防治医学重点学科, 广东 深圳,518133;[2]江苏大学管理学院, 江苏 镇江,212013;",临床肺科杂志,结核病;医务人员;防治知识;诊疗行为;,,2015,,11
hainanyx201521036,0,,小早产儿支气管肺发育不良危险因素及预后分析,10.3969/j.issn.1003-6350.2015.21.1171,江雄[1];冯战桂[1];黄中成[2];,"[1]深圳市坪山新区妇幼保健院儿科,广东 深圳,518122;[2]深圳市坪山新区人民医院儿科,广东 深圳,518118;",海南医学,小早产儿;支气管肺发育不良;危险因素;,R722,2015,26,21
gwyx-shyx201603004,0,,提高结核病医疗保险保障水平的必要性及可行性研究,10.3969/j.issn.1673-5625.2016.03.004,刘开钳[1];汪文新[2];赵梅桂[1];王云霞[1];赵安贵[1];卢祖洵[3];,[1]深圳市宝安区慢性病防治院结防科/深圳市宝安区结核病防治医学重点学科，广东 深圳，518133;[2]江苏大学管理学院，江苏 镇江，212013;[3]华中科技大学同济医学院，湖北 武汉，430030;,中国社会医学杂志,Tuberculosis;Social medical insurance;Necessity;Feasibility;,结核病                                                      社会医疗保险                                                      必要性                                                      可行性,,,
