dejydxxb201404010,8,"ISTIC,PKU",羟基喜树碱对肝纤维化大鼠肝组织Bax、Bcl-2基因和α-SMA蛋白表达及肝纤维化的影响,10.3724/SP.J.1008.2014.00399,邵佳亮[1];胡国信[2];郑洁[3];万赞燕[4];姜瑞娇[5];,"[1]江苏省高邮市人民医院消化科,高邮225600;[2]北京大学深圳医院感染科,深圳518036;[3]北京大学深圳医院中医科,深圳518036;[4]江西省胸科医院感染科,南昌330006;[5]河北省赵县人民医院病理科,石家庄051530;",第二军医大学学报,肝纤维化;肝星状细胞;细胞凋亡;羟基喜树碱;,R575.2,2014,35,4
gwyx-fzsw201605007,1,"ISTIC,PKU",红斑型银屑病患者他克莫司治疗前后IL-17 A、 IL-22和IL-6的变化分析,10.3870/j.issn.1672-8009.2016.05.007,樊超[1];向华国[1];陈宏翔[2];阳生光[1];洪文彬[1];,"[1]深圳市福永人民医院皮肤科 广东省深圳市,518103;[2]华中科技大学同济医学院附属协和医院皮肤科 武汉市,430022;",医学分子生物学杂志,银屑病;辅助性T细胞17;白细胞介素17A;白细胞介素22;他克莫司;,R392.114,2016,13,5
hebykdxxb201405014,3,"ISTIC,PKU",不同年龄2型糖尿病患者非酒精性脂肪肝与颈动脉内膜厚度的关系,,卢东晖;张帆;连晓芬;,"[1]北京大学深圳医院内分泌科,广东深圳,518036",哈尔滨医科大学学报,2型糖尿病;非酒精性脂肪肝;颈动脉内膜厚度;年龄;,R587.1,2014,,5
shanxzy201512012,5,"ISTIC,PKU",加味连朴饮治疗湿热阻胃型胃溃疡的临床研究,10.3969/j.issn.1000-7369.2015.12.012,冯群虎[1];赵文博[2];冯桂成[3];,[1]深圳市宝安区中医院 深圳518133;[2]河南省辉县市中医院 辉县453600;[3]深圳市罗湖区中医院 深圳518000;,陕西中医,胃溃疡/中西医结合疗法;连朴饮/治疗应用;湿热阻胃;,R256.4,2015,,12
zgwsbzgl201606110,1,"ISTIC,PKU",观察我院1000例孕妇妊娠期间血液常规的变化及其临床指导价值,10.3969/j.issn.1674-9316.2016.06.110,刘政枝;,"[1]深圳市福田妇幼保健院检验科,广东 深圳,518045",中国卫生标准管理,孕妇;妊娠期;血常规;,R714.24,2016,7,6
zgqkyx201518009,1,"ISTIC,PKU",自动调节持续气道正压通气治疗对肥胖型重度阻塞性睡眠呼吸暂停低通气综合征患者减肥效果的影响,10.3969/j.issn.1007-9572.2015.18.007,莫建明;尹慧;宋卫东;,"[1]北京大学深圳医院呼吸内科, 广东省深圳市,518034",中国全科医学,"连续气道正压通气;睡眠呼吸暂停,阻塞性;肥胖低通气综合征;",R441.8,2015,,18
qlhlzz201309046,12,"ISTIC,PKU",循证护理在冠心病合并心肌梗死患者PCI术后再灌注损伤中的应用,10.3969/j.issn.1006-7256.2013.09.046,张友爱;,"[1]深圳市龙华新区观澜人民医院,广东深圳,518110",齐鲁护理杂志,循证护理;经皮冠状动脉介入;再灌注损伤;,R473.5,2013,19,9
zgqkyx201530001,0,"ISTIC,PKU",2015年美国疾病控制中心性传播疾病诊断和治疗指南更新内容和解读（续完）,10.3969/j.issn.1007-9572.2015.30.001,樊尚荣;,"[1]北京大学深圳医院妇产科, 广东省深圳市,518036",中国全科医学,性传播疾病;美国疾病控制中心;诊断;治疗;指南;,R531.71,2015,,30
jilinyx201606096,0,"ISTIC,PKU",布地奈德雾化吸入治疗儿童上呼吸道感染疗效观察,10.3969/j.issn.1004-0412.2016.06.096,梁春晓;陈婉兰;,"[1]广东省深圳福田妇幼保健院赤尾社康中心,广东 深圳,518033",吉林医学,布地奈德;雾化吸入;儿童;上呼吸道感染;,,2016,37,6
jbkzzz201504030,7,"ISTIC,PKU",流动人口艾滋病知识、态度、行为现状研究,10.16462/j.cnki.zhjbkz.2015.04.030,房丽;王琦;,"[1]安徽医科大学北京大学深圳医院临床学院院办,广东深圳,518036",中华疾病控制杂志,获得性免疫缺陷综合征;流行病学研究;健康教育;,R181.1  R512.91,2015,19,4
hxkqyxzz201505008,0,"ISTIC,PKU",牙齿漂白专用比色板的设计方法初探,10.7518/hxkq.2015.05.008,徐英新;,"[1]北京大学深圳医院口腔科,深圳,518036",华西口腔医学杂志,牙齿漂白;色度值;比色;比色板;系统聚类分析;,R783.2,2015,33,5
hainanyx201605022,0,"ISTIC,PKU",梅毒孕妇与其配偶梅毒血清学试验的相关性分析,10.3969/j.issn.1003-6350.2016.05.022,伍晓飞[1];林新秀[1];吴灵敏[1];郭龙华[2];,"[1]深圳市光明新区人民医院田寮社康中心,广东 深圳,518106;[2]深圳市龙华新区人民医院检验科,广东 深圳,518109;",海南医学,梅毒;血清学试验;孕妇;阳性率;妊娠;,R759.1+54,2016,27,5
tlsjyyj201611079,2,"ISTIC,PKU",社区护理干预对老年人生活方式和生活质量的影响,10.3969/j.issn.1672-9676.2016.11.072,章丽芳;林春谷;,"[1]518103,深圳市 深圳市宝安区福永人民医院",护理实践与研究,社区护理干预;老年人;生活方式;生活质量;,,2016,13,11
zgqkyx201529002,0,"ISTIC,PKU",2015年美国疾病控制中心性传播疾病的诊断和治疗指南（续）--性侵犯/虐待受害者性传播疾病的诊断和治疗指南,10.3969/j.issn.1007-9572.2015.29.002,樊尚荣[1];张甜甜[2];,"[1]北京大学深圳医院妇产科, 广东省深圳市,518036;[2]安徽医科大学;",中国全科医学,性侵犯;性传播疾病;诊断;治疗;暴露后预防;,R246.7,2015,,29
zgjjssxzz201403021,5,"ISTIC,PKU",Cage植骨联合椎弓根螺钉内固定融合治疗腰椎滑脱的疗效观察,10.11659/jjssx.1672-5042.201403021,刘岗;辛立文;梁源清;唐祖林;唐勇涛;,"[1]深圳市光明新区人民医院骨科,广东 深圳,518000",局解手术学杂志,腰椎滑脱;植骨融合;治疗效果;,R683.2,2014,,3
xdlchl201312013,8,"ISTIC,PKU",中医五音疗法在慢性疲劳综合征患者中的应用,10.3969/j.issn.1671-8283.2013.12.012,吴玉娟;郑盛惠;吴杰倩;贾院春;席蓉;胡秋侠;姜健;,[1]深圳市福田区中医院，广东深圳，518034,现代临床护理,慢性疲劳综合征;情绪;疼痛;五音疗法;,R246,2013,,12
yycyzx201302054,12,"ISTIC,PKU",护理干预对老年普外手术患者症状及自我效能影响的研究,10.3969/j.issn.1673-7210.2013.02.054,吴杰清;,"[1]广东省深圳市宝安区福永人民医院,广东深圳,518103",中国医药导报,护理干预;循证护理;普外手术;自我效能;,R473.6,2013,10,2
zgyyzn201320122,16,"ISTIC,PKU",甲状腺肿瘤普外科手术治疗的临床特点分析,10.3969/j.issn.1671-8194.2013.20.122,陆峻逵;刘芳君;陈镇杰;,"[1]深圳市龙岗区大鹏人民医院外科,广东 深圳,518120",中国医药指南,甲状腺肿瘤;普外科手术治疗;临床特点;,R736.1,2013,,20
bxblbl201303011,0,"ISTIC,PKU",异基因造血干细胞移植后患者胸腺输出功能研究,10.3760/cma.j.issn.1009-9921.2013.03.011,赵林俊[1];孙丽华[1];龙霞[2];许蕾[1];姚志娟[1];王钧[1];孟庆祥[1];,"[1]518036,北京大学深圳医院血液科;[2]518036,北京大学深圳医院中心实验室;",白血病·淋巴瘤,造血干细胞移植;sjTREC;胸腺输出;聚合酶链反应;,,2013,22,3
rdyxzz201210010,1,,乙型肝炎病毒感染者血清HBV DNA水平与HDL-C的相关性,,陈群蓉[1];谢春英[2];孙顺昌[2];曹建华[2];彭运生[2];,"[1]深圳市宝安区人民医院输血科,广东深圳,518101;[2]深圳市宝安区人民医院检验科,广东深圳,518101;",热带医学杂志,乙型肝炎病毒;DNA拷贝数;高密度脂蛋白胆固醇;,R512.62,2012,12,10
zhlcyszz201306077,0,,树突状细胞在慢性阻塞性肺疾病中的作用,10.3877/cma.j.issn.1674-0785.2013.06.077,张力予[1];宋卫东[2];,"[1]518036 北京大学深圳医院呼吸科; 安徽医科大学;[2]518036,北京大学深圳医院呼吸科;",中华临床医师杂志（电子版）,,,2013,,6
sxyxjy201601045,0,,不同类型慢性肝炎人群戊型病毒性肝炎感染率现状调查研究,10.3969/j.issn.1671-7414.2016.01.045,刘苑欢[1];刘爱胜[1];文艳[2];,"[1]深圳市龙华新区人民医院检验科,广东深圳,518109;[2]深圳市光明新区人民医院 ICU,广东深圳,518106;",现代检验医学杂志,戊型病毒性肝炎;乙型病毒性肝炎;丙型病毒性肝炎;感染率;,R512.65  R446.6,2016,,1
zgyy201208028,1,,不同厂家复方丹参片的有效成分含量考察,10.3969/j.issn.1006-4931.2012.08.028,杨春智;徐玉红;李玉珍;姚苑梅;黄瑞英;,"[1]广东医学院附属福田医院,广东深圳,518033",中国药业,复方丹参片;有效成分;高效液相色谱法;含量测定;含量稳定性;,R284.1  R86.0,2012,21,8
wnyxyxb201204012,0,,经皮前路腰骶轴向融合的骶前影像学及解剖学研究,10.3969/j.issn.1002-0217.2012.04.012,靳松[1];彭建强[1];徐宏光[2];刘平[2];陈学武[2];李怀斌[3];,"[1]广东医学院附属福田医院,骨外科,深圳,518033;[2]皖南医学院附属弋矶山医院,脊柱外科,安徽,芜湖,241001;[3]皖南医学院,解剖学教研室,安徽,芜湖,241002;",皖南医学院学报,经皮前路腰骶轴向融合术;解剖学;影像;骶前间隙;,R687.3  R681.5,2012,31,4
ahyy201608013,0,,异型南五味子总三萜对类风湿关节炎小鼠抗炎镇痛药效学研究,10.3969/j.issn.1009-6469.2016.08.013,邓鸣;张炜宁;,"[1]深圳市福田区中医院,广东 深圳,518034",安徽医药,"地血香/药理学;关节炎,类风湿;小鼠;",,2016,20,8
gwyx-lcsw201616030,0,,实时定量PC R在血流感染病原体快速检测中的应用,10.3969/j.issn.1673-4130.2016.16.028,范世珍;林松青;莫莉;,[1]广东省深圳市福田区中医院 518034,国际检验医学杂志,血流感染;脓毒血症;实时定量PCR;,,2016,37,16
sxyxjy201604034,0,,VITEK2 Compact全自动微生物分析仪对黏液型和非黏液型铜绿假单胞菌药敏检测评价,10.3969/j.issn.1671-7414.2016.04.034,李瑜珍[1];曾学辉[1];莫莉[2];蓝志明[1];丁丽娜[1];,"[1]深圳市中医院检验科,广东深圳,518034;[2]深圳市福田区中医院检验科,广东深圳,518033;",现代检验医学杂志,铜绿假单胞菌;药敏试验;准确性;VITEK2 Compact;,R446.5,2016,31,4
zhsjk201509011,0,"ISTIC,PKU",远端型小窝蛋白病患者的临床、病理及基因研究,10.3760/cma.j.issn.1006-7876.2015.09.011,陈涓涓;曾文双;韩春锡;吴军;童晓欣;张海鸥;,"[1]518036,北京大学深圳医院神经内科",中华神经科杂志,远端型肌营养不良症;小窝蛋白3;活组织检查;基因检测;,,2015,48,9
lcysyblxzz201505024,1,"ISTIC,PKU",三阴型乳腺癌中 HMGA2高表达及其与乳腺癌转移的相关性,10.13315/j.cnki.cjcep.2015.05.018,罗明华[1];李剑[1];邵牧民[2];余光银[1];尹为华[1];,"[1]北京大学深圳医院病理科,深圳,518036;[2]广州中医药大学深圳附属医院病理科,深圳,518033;",临床与实验病理学杂志,乳腺肿瘤;分子分型;HMGA2;免疫组织化学;,R737.9,2015,,5
syzdyzlzz201507019,0,"ISTIC,PKU",组胺H4受体在特应性皮炎中的表达,10.13507/j.issn.1674-3474.2015.07.019,张杰[1];陈办成[1];陈娟[2];吴云[2];于波[1];邵勇[1];窦侠[1];彭曦[1];黄海艳[1];,"[1]北京大学深圳医院皮肤科,深圳,518036;[2]北京大学深圳医院检验科,深圳,518036;",中华实用诊断与治疗杂志,特应性皮炎;组胺H4受体;总IgE;,,2015,29,7
zgsyzdx201505034,1,"ISTIC,PKU",阴道彩色多普勒超声监测卵巢及子宫血流的临床意义探讨,,吕晓艳[1];杨晓东[2];,"[1]深圳市龙华新区人民医院 妇产超声科,广东 深圳,518109;[2]北京大学深圳医院 超声科;",中国实验诊断学,,,2015,,5
ynzyxyxb201301002,8,"ISTIC,PKU",针刺轻度认知障碍患者人中穴的静息态功能磁共振研究,10.3969/j.issn.1000-2723.2013.01.002,陈尚杰[1];徐茂盛[1];彭旭明[2];黄居科[1];杨文德[1];许琼瑜[1];朱芬[1];石学敏[3];,"[1]深圳市宝安人民医院,广东深圳,518101;[2]广州中医药大学,广东广州,510405;[3]天津中医药大学,天津,300193;",云南中医学院学报,针刺;人中穴;穴位特异性;轻度认知障碍;功能磁共振;,R246.6,2013,36,1
gwyx-hlxfc201523015,2,"ISTIC,PKU",助产士全程责任制联合无痛分娩对足月产妇分娩结局及满意度的影响,10.3760/cma.j.issn.1673-4351.2015.23.015,伍咏梅;单菲;陈延龄;,[1]518000 广东省深圳市福田区中医院妇产科; 深圳市盐田区第二人民医院妇产科 广东 深圳518000,国际护理学杂志,足月产妇;助产士全程责任制;无痛分娩;满意度;剖腹产;,R473.71,2015,,23
zgqkyx201526001,0,"ISTIC,PKU",2015年美国疾病控制中心性传播疾病的诊断和治疗指南（续）--淋病的诊断和治疗指南,10.3969/j.issn.1007-9572.2015.26.001,樊尚荣[1];周小芳[2];,"[1]北京大学深圳医院妇产科,广东省深圳市,518036;[2]安徽医科大学;",中国全科医学,淋病;诊断;治疗;,R759.2,2015,,26
zgqkyx201526002,0,"ISTIC,PKU",2015年美国疾病控制中心性传播疾病的诊断和治疗指南（续）--沙眼衣原体感染的诊断和治疗指南,10.3969/j.issn.1007-9572.2015.26.002,樊尚荣[1];周小芳[2];,"[1]北京大学深圳医院妇产科,广东省深圳市,518036;[2]安徽医科大学;",中国全科医学,沙眼衣原体;诊断;治疗;,R374.1,2015,,26
syyxzz201517039,0,"ISTIC,PKU",右美托咪定对人中性粒细胞凋亡和呼吸爆发功能的影响,10.3969/j.issn.1006-5725.2015.17.038,吴新海;邓若熹;万帆;,"[1]518036,北京大学深圳医院麻醉科",实用医学杂志,右美托咪定;中性粒细胞;凋亡;呼吸爆发;,,2015,,17
gwyx-pfxbx201301009,0,"ISTIC,PKU",恶性黑素瘤DNA甲基化的研究进展,10.3760/cma.j.issn.1673-4173.2013.01.009,张明爽[1];李建军[2];,"[1]518036深圳,北京大学深圳医院皮肤科;北京大学医学部;[2]北京大学深圳医院皮肤科,深圳,518036;",国际皮肤性病学杂志,黑色素瘤;DNA甲基化;遗传学;,,2013,39,1
syxnfxgbzz201601009,0,"ISTIC,PKU",前交通动脉瘤夹闭术后预后的影响因素研究,10.3969/j.issn.1008-5971.2016.01.009,胡志卿;李明;党伟;曾振东;,[1]518106广东省深圳市光明新区人民医院神经外科,实用心脑肺血管病杂志,颅内动脉瘤;预后;影响因素分析;,R743.9,2016,,1
szyxzz201302010,0,"ISTIC,PKU",抑癌基因RB1在小鼠不同发育阶段卵母细胞中的表达及甲基化状态的研究,10.3969/j.issn.1004-3845.2013.02.010,黄品秀[1];李蓉[2];林洪波[2];赵善飞[2];刘波澜[2];,"[1]北京大学深圳医院生殖医学科,深圳518036;广西省柳州市妇幼保健院生殖健康助孕中心,广西柳州545001;[2]北京大学深圳医院生殖医学科,深圳,518036;",生殖医学杂志,胚胎植入;遗传学;卵母细胞;RB1;甲基化;,,2013,22,2
zgetbjzz201406005,0,"ISTIC,PKU",城市16～20岁务工青少年心理社会能力及其影响因素分析,10.11852/zgetbjzz2014-22-06-05,吕冰琪[1];余小鸣[1];高素红[2];张淑平[3];周晓梅[4];曾芳玲[5];,"[1]北京大学公共卫生学院,儿童青少年卫生研究所,北京 100191;[2]北京市海淀区妇幼保健院,北京 100080;[3]济南市妇幼保健院,山东济南 250001;[4]深圳市福田区妇幼保健院,广东深圳 518045;[5]广州市妇女儿童医疗中心,广东广州 510623;",中国儿童保健杂志,务工青少年;心理社会能力;自尊;应对方式;内外控制源;,R749.94,2014,22,6
zgqkyx201525015,0,"ISTIC,PKU",脑创伤女性患者尿失禁的发生率及危险因素研究,10.3969/j.issn.1007-9572.2015.25.013,邓小林[1];张震宇[2];黎衍敏[1];黄建荣[1];郭树林[1];宋乐明[1];关志忱[3];,"[1]南昌大学附属赣州医院泌尿外科, 江西省赣州市,341000;[2]南昌大学附属赣州医院神经外科, 江西省赣州市,341000;[3]北京大学深圳医院泌尿外科;",中国全科医学,"头部损伤,穿透性;女性;尿失禁;危险因素;",R651.15,2015,,25
xsekzz201504012,0,"ISTIC,PKU",降钙素基因相关肽对氧化应激肺损伤保护作用的Wnt7b/β-catenin信号机制,10.3969/j.issn.1673-6710.2015.04.012,王少华[1];邹冬梅[1];李龙辉[1];李丽[1];党红星[2];许峰[2];,"[1]518045,南华大学深圳市福田区妇幼保健院儿科;[2]重庆医科大学儿童医院PICU;",中国新生儿科杂志,降钙素基因相关肽;氧化性应激;肺损伤;Wnt7b;β-连环蛋白;,,2015,30,4
bjykdxxx201302019,7,"ISTIC,PKU",2011年ACR/EULAR类风湿关节炎缓解标准与其他常用标准的比较,10.3969/j.issn.1671-167X.2013.02.019,路晓燕[1];李春[2];赵金霞[3];栗占国[2];,"[1]北京大学深圳医院风湿免疫科,深圳,518036;[2]北京大学人民医院风湿免疫科,北京,100044;[3]北京大学第三医院风湿免疫科,北京,100191;",北京大学学报（医学版）,"关节炎,类风湿;疾病严重程度指数;缓解诱导;诊疗准则;",R593.22,2013,45,2
xyx201207002,0,"ISTIC,PKU",厌食、上腹胀痛、嗜睡——查房选录(361),10.3969/g.issn.0253-9802.2012.07.002,张晶;陆泽元;赖丽萍;庄雄杰;蒋凤秀;,"[1]深圳广东医学院附属福田医院内分泌科,518033",新医学,,R584,2012,43,7
xdzxyjhzz201423033,3,"ISTIC,PKU",非营养性吸吮缓解新生儿疼痛的临床研究,10.3969/j.issn.1008-8849.2014.23.033,陈子江[1];陈浪[1];谢凤兰[2];,"[1]广东省深圳市福田区妇幼保健院,广东 深圳,518026;[2]中山大学附属第一医院,广东 广州,510080;",现代中西医结合杂志,新生儿疼痛;非营养性吸吮;新生儿黄疸;,R722.1,2014,,23
bjmyfxylc201607029,0,"ISTIC,PKU",pEGFP-N1-PGC-1α重组质粒的构建及体外表达,10.11748/bjmy.issn.1006-1703.2016.07.029,于波海[1];范世珍[2];张萌[3];柴淼[3];苏丽菊[3];郑力辉[3];韩笑[3];毕佳冰[3];腾旭[4];,"[1]哈尔滨医科大学生物学博士后流动站,黑龙江哈尔滨150081;哈尔滨市第一医院检验科,黑龙江哈尔滨150010;[2]深圳市福田区中医院检验科,广东深圳,518034;[3]哈尔滨市第一医院检验科,黑龙江哈尔滨,150010;[4]哈尔滨医科大学生物学博士后流动站,黑龙江哈尔滨,150081;",标记免疫分析与临床,PGC-1α;pEGFP-N1 真核表达载体;huh-7细胞;,,2016,23,7
tlsjyyj201614038,0,"ISTIC,PKU",情境领导工作模式对护士工作满意度的影响,10.3969/j.issn.1672-9676.2016.14.038,陈赟;谢宇锋;钟印芹;叶美霞;,"[1]518034,深圳市 广东省深圳市福田区中医院护理教研室",护理实践与研究,情境领导模式;护士;工作满意度;,,2016,13,14
hainanyxyxb201624027,0,"ISTIC,PKU",BIS监测下小剂量咪达唑仑联合丙泊酚靶控输注的麻醉诱导效果及RAAS系统活性,10.13210/j.cnki.jhmu.20160831.028,卢文珊[1];王从辉[2];谢婵英[1];吕波[1];吴世民[1];,"[1]广东省深圳市宝安区福永人民医院,广东深圳,518103;[2]广东省深圳市龙岗区第三人民医院,广东深圳,518115;",海南医学院学报,咪达唑仑;丙泊酚;肾素;血管紧张素-Ⅱ;醛固酮;,R614,2016,22,24
szyby201406013,0,"ISTIC,PKU",硫氧还蛋白和硫氧还蛋白结合蛋白-2在子宫内膜异位症的表达及意义,10.7669/j.issn.0253-357X.2014.06.0501,周晓梅[1];张海[1];方锦川[2];资捷[2];,"[1]深圳市福阳区中医院,深圳,518034;[2]深圳市福田区妇幼保健院,深圳,518045;",生殖与避孕,子宫内膜异位症(EMs);硫氧还蛋白(TRX);硫氧还蛋白结合蛋白-2(TBP-2);血清;腹水;,R711.71,2014,34,6
xdkf201452024,2,"ISTIC,PKU",壳聚糖支架应用在组织工程中：组成复合支架及改性支架的前景,,王腾彬;朱辉;李天石;,"[1]北京大学深圳医院,广东省深圳市,518000",中国组织工程研究,生物材料;骨生物材料;壳聚糖;衍生物;支架;组织工程;广东省自然科学基金;,R318,2014,,52
xdkf201452025,2,"ISTIC,PKU",甲壳素及其衍生物抑制瘢痕形成：研究与进展,,李天石;曾文妮;何君君;,"[1]北京大学深圳医院整形外科,广东省深圳市,518035",中国组织工程研究,生物材料;材料相容性;甲壳素;衍生物;抑制;瘢痕形成;,R318,2014,,52
nhdxxb-yxb201606013,0,"ISTIC,PKU",3D腹腔镜在经口腔前庭入路甲状腺手术中的临床应用,10.15972/j.cnki.43-1509/r.2016.06.011,易石坚[1];吴杨[2];涂文斌[2];,"[1]深圳大学附属医院,广东 深圳,518055;[2]深圳市福永人民医院;",中南医学科学杂志,3D腹腔镜;口腔前庭;甲状腺手术;,R581,2016,44,6
zhfck201508011,0,"ISTIC,PKU",生殖道畸形合并消化道及泌尿系统畸形一例报告及文献复习,10.3760/cma.j.issn.0529-567x.2015.08.011,尉楠[1];孙智晶[2];朱兰[2];,[1]518036北京大学深圳医院深圳女性重大疾病早期诊断技术重点实验室;[2]中国医学科学院北京协和医学院北京协和医院妇产科;,中华妇产科杂志,,,2015,,8
zgcsyxzz201508022,0,"ISTIC,PKU",三维超声断层成像结合VCI技术评价阴道前壁脱垂网片植入术的初步探讨,,王玥;曲侠;张雁;佘颖;张蒂荣;,"[1]北京大学深圳医院超声影像科, 广东省深圳市,518036",中国超声医学杂志,断层超声成像;容积对比成像;网片;,,2015,31,8
xdlchl201407012,11,"ISTIC,PKU",两种不同手术方法治疗宫颈糜烂的效果观察及护理,10.3969/j.issn.1671-8283.2014.07.009,曾晓娟;李瑞云;任带娇;杨芳;,[1]深圳市第四 福田 人民医院妇产科门诊，广东深圳，518033,现代临床护理,高频电波刀;微波;宫颈糜烂;,R473.71,2014,,7
zgyxjsjcx201502018,1,"ISTIC,PKU",磁共振弹性成像与扩散加权成像在肝脏纤维化分期中的对比研究,,邹立秋[1];阮继银[1];冯飞[1];成官迅[1];江锦赵[2];,[1]北京大学深圳医院医学影像科;[2]香港大学深圳医院放射科;,中国医学计算机成像杂志,肝脏纤维化;磁共振弹性成像;扩散加权成像;肝脏硬度;,R445.2,2015,21,2
gdyx201215044,9,"ISTIC,PKU",深圳市成人脂肪肝与代谢综合征的关系,10.3969/j.issn.1001-9448.2012.15.044,王红卫[1];陆红[2];朱翠凤[1];邵桂霞[1];谢谦[1];吴云[1];李伟[1];,"[1]北京大学深圳医院体检科,广东深圳,518036;[2]新疆医科大学第五附属医院内科,乌鲁木齐,830000;",广东医学,脂肪肝;代谢综合征;危险因素;患病率;,R4,2012,33,15
hnzyydb201209003,14,"ISTIC,PKU",498例原发性高血压病患者中医体质特点及与证候的关系,10.3969/j.issn.1672-951X.2012.09.003,宋银枝;叶仁群;宋群利;尹建平;曹媛;彭俊杰;,"[1]深圳市宝安区中医院,广东深圳,518133",中医药导报,原发性高血压病;中医体质;体质分类;中医证候;,R255.7,2012,18,9
rdyxzz201510007,0,"ISTIC,PKU",下呼吸道分离的多重耐药铜绿假单胞菌的外排泵基因检测,,徐羽中;何臣;孙顺昌;向开富;袁利;,"[1]南方医科大学附属深圳宝安人民医院,广东深圳,518101",热带医学杂志,铜绿假单胞菌;耐药性;外排泵基因;,R378.99,2015,,10
syyxzz201515009,0,"ISTIC,PKU",舒芬太尼后处理对大鼠心肌缺血再灌注损伤的保护作用,10.3969/j.issn.1006-5725.2015.15.009,张燕[1];吴新海[1];黄飞[1];徐向辉[1];张晓晖[2];,"[1]北京大学深圳医院麻醉科, 深圳市,518036;[2]518000,深圳市中医院中医药研究所;",实用医学杂志,舒芬太尼;药物后处理;心肌缺血再灌注损伤;PI3K;,,2015,31,15
jxyxyxb201205013,2,"ISTIC,PKU",伴有与无肾组织乙肝病毒抗原沉积的IgA肾病患者临床和病理对比分析,10.3969/j.issn.1000-2294.2012.05.013,熊子波[1];梁伟[1];郑爱萍[2];熊祖应[1];贺丽娟[1];罗琼[1];,"[1]北京大学深圳医院肾内科,广东,深圳,518036;[2]北京大学深圳医院病理科,广东,深圳,518036;",南昌大学学报（医学版）,"IgA肾病;抗原沉积;乙肝病毒;肾组织活检;HBV感染标志物,血清;临床特征;病理特征;",R692  R373.2+1,2012,52,5
zylcyj201522048,2,"ISTIC,PKU",玉屏风散配合天灸法治疗过敏性鼻炎的临床观察,10.3969/j.issn.1674-7860.2015.22.048,万莉华;,[1]深圳市福田妇幼保健院，广东 深圳，518000,中医临床研究,玉屏风散;天灸;过敏性鼻炎;肺脾气虚型;疗效;,R322.3+1,2015,,22
hainanyx201516019,1,"ISTIC,PKU",深圳地区三级区属医院铜绿假单胞菌感染分布及耐药性分析,10.3969/j.issn.1003-6350.2015.16.0864,施俊柱[1];刘爱胜[2];文艳[3];,"[1]深圳市龙华新区中心医院检验科,广东 深圳,518110;[2]深圳市龙华新区人民医院检验科,广东 深圳,518109;[3]深圳市光明新区人民医院ICU,广东 深圳,518106;",海南医学,铜绿假单胞菌;分离率;分布;耐药性;,R378.99+1,2015,,16
sxyxjy201502037,2,"ISTIC,PKU",ICU 危重病患者深部真菌感染血清中降钙素原和（1，3）-β-D 葡聚糖联合检测的临床意义,10.3969/j.issn.1671-7414.2015.02.037,文艳[1];刘爱胜[2];张勇[3];李伟[3];,"[1]深圳市光明新区人民医院ICU,广东深圳,518106;[2]深圳市龙华新区人民医院检验科,广东深圳,518109;[3]深圳市龙华新区中心医院检验科,广东深圳,518110;",现代检验医学杂志,"降钙素原;(1,3)-β-D 葡聚糖;重症监护室;深部真菌感染;价值;",R379  R446.112,2015,,2
lccsyxzz201507018,0,"ISTIC,PKU",声辐射力联合磁场介导载miRNA多功能纳米气泡靶向Lin28和Oct4诱导卵巢癌干细胞凋亡,,林亨丽;,"[1]518045,深圳市福田区妇幼保健院影像科",临床超声医学杂志,声辐射力;肿瘤干细胞;miRNA;凋亡;纳米气泡;,R445.1,2015,17,7
zgyyyypjyfx201507025,0,"ISTIC,PKU",万古霉素在革兰阳性菌感染新生儿中血药浓度的监测与应用分析,10.14009/j.issn.1672-2124.2015.07.025,李际红;,"[1]深圳市福田区妇幼保健院药剂科,广东深圳,518045",中国医院用药评价与分析,新生儿;革兰阳性菌感染;万古霉素;血药浓度监测;临床用药分析;,R978.1,2015,,7
zhsywk201307007,6,"ISTIC,PKU",转化生长因子-β1对骨髓干细胞分化过程中Wnt信号通路相关基因表达的影响,10.3760/cma.j.issn.1001-9030.2013.07.007,曾晖;肖德明;陶可;熊奡;翁鉴;辛风;,"[1]北京大学深圳医院骨关节科,深圳,518036",中华实验外科杂志,转化生长因子-β1;骨髓干细胞;Wnt信号通路;糖胺聚糖;,,2013,30,7
