dyjydxxb201307015,13,"ISTIC,PKU",艾司西酞普兰干预干扰素治疗慢性丙型病毒性肝炎引发的精神症状,10.3969/j.issn.1673-4254.2013.07.15,齐明华[1];周斌[2];苏梅蕾[3];潘集阳[4];张浩[2];张艳茹[2];张健[2];李威[2];王俊洁[2];,"[1]南方医科大学南方医院感染内科,广东广州510515;北京大学深圳医院感染性疾病科,广东深圳518036;[2]南方医科大学南方医院感染内科,广东广州,510515;[3]南方医科大学南方医院心理科,广东广州,510515;[4]暨南大学附属第一医院心理科,广东广州,510630;",南方医科大学学报,艾司西酞普兰;聚乙二醇干扰素;慢性丙型病毒性肝炎;精神症状;,,2013,33,7
gdyx201607003,0,"ISTIC,PKU",解没食子酸链球菌巴氏亚种腹膜炎1例,,梁仟[1];童新灯[2];王银君[1];,"[1]北京大学深圳医院肾内科,广东深圳,518036;[2]北京大学深圳医院感染科,广东深圳,518036;",广东医学,,,2016,37,7
zhyygl201307005,2,"ISTIC,PKU",社区卫生服务机构基本药物制度实施现状与变化趋势分析,10.3760/cma.j.issn.1000-6672.2013.07.005,周指明[1];徐欢[2];殷晓旭[2];龚言红[2];曹世义[2];卢祖洵[2];,"[1]深圳市宝安区人民医院社区卫生服务管理中心;[2]华中科技大学同济医学院公共卫生学院,武汉,430030;",中华医院管理杂志,,,2013,29,7
lccsyxzz2015010003,1,"ISTIC,PKU",超声声学定量评估大鼠坐骨神经卡压程度的实验研究,,宫琳[1];陈颐[1];古汉南[2];余光银[3];,"[1]北京大学深圳医院超声科, 深圳市,518036;[2]深圳市龙岗中心医院显微手外科;[3]北京大学深圳医院病理科, 深圳市,518036;",临床超声医学杂志,超声检查;回声强度;病理;神经卡压;大鼠;,R445.1,2015,,1
zdblxzz201402015,2,"ISTIC,PKU",囊性肠系膜纤维瘤病1例报道,10.3969/j.issn.1007-8096.2014.02.015,任俊奇[1];掌娟[2];李明华[2];刘少雄[2];凌铭[2];,"[1]广东医学院附属福田医院病理科,广东深圳,518033;[2]广东医学院附属南山医院病理科,广东深圳,518052;",诊断病理学杂志,肠系膜;纤维瘤病;临床病理;,R735.4,2014,21,2
xdkf201513001,8,"ISTIC,PKU",全髋关节置换后下肢深静脉血栓形成的4项危险因素,10.3969/j.issn.2095-4344.2015.13.001,张晟;解笑宸;姚粤峰;韦良臣;,"[1]北京大学深圳医院骨关节科,广东省深圳市,518036",中国组织工程研究,植入物;人工假体;全髋关节置换;下肢深静脉血栓形成;危险因素;假体类型;骨水泥;,R318,2015,,13
qlhlzz201216017,21,"ISTIC,PKU",延续护理对脑梗死患者出院后生活质量的影响,10.3969/j.issn.1006-7256.2012.16.017,何秋娴;陈少群;高莉梅;,"[1]深圳市宝安区观澜人民医院,广东深圳,518110",齐鲁护理杂志,延续护理;脑梗死;生活质量;,R473.5,2012,18,16
zyzz201322016,5,"ISTIC,PKU",艾灸对大鼠胃黏膜损伤修复相关细胞信号蛋白质的影响,,杨宗保[1];王晨光[2];龚安[2];谢宇锋[3];刘琼[2];,"[1]厦门大学医学院,福建省厦门市思明南路422号,361005;[2]江西中医药大学;[3]深圳市福田区中医院;",中医杂志,艾灸;蛋白质指纹图谱;胃黏膜;信号蛋白质;,,2013,54,22
lcfkzz201410056,0,"ISTIC,PKU",成人支气管尖锐异物钳取经验与体会,10.3969/j.issn.1009-6663.2014.010.056,周一平;夏利萍;陈小可;刘慧;喻海琼;刘念;陈霞;李艾芬;,[1]518033 广东 深圳，广东医学院附属福田医院呼吸科，支气管镜室,临床肺科杂志,,,2014,,10
xejjyx201403001,1,"ISTIC,PKU",新型呼吸道病毒在PICU的检出及其临床意义,10.3760/cma.j.issn.1673-4912.2014.03.001,林广裕[1];蔡晓莹[1];蔡志伟[2];林创兴[1];陈派镇[1];周晓华[1];肖泽曦[1];陆学东[3];,"[1]汕头大学医学院第二附属医院儿科,汕头,515041;[2]汕头大学医学院第二附属医院转化医学中心,汕头,515041;[3]广东医学院附属福田医院检验科,深圳,518033;",中国小儿急救医学,新型病毒;呼吸道病毒;儿科重症监护室;,,2014,21,3
crbxx201403004,1,"ISTIC,PKU",碳青霉烯类抗生素耐药及治疗挑战,,聂署萍;陆学东;,"[1]广东医学院附属福田医院检验医学部, 深圳,518033",传染病信息,青霉属;抗菌药;药物耐受性;治疗学;,R379,2014,,3
zgjcyy201319032,3,"ISTIC,PKU",老年2型糖尿病患者548例危险因素分析,10.3760/cma.j.issn.1008-6706.2013.19.032,田华伟[1];刘盛元[2];郑南[1];孙艳[1];马宁[1];,"[1]广东医学院附属福田医院预防保健科, 广东省深圳,518033;[2]深圳市南山区慢性病防治院慢性非传染性疾病控制科;",中国基层医药,"糖尿病,2型;危险因素;",,2013,20,19
hbyy201302081,19,"ISTIC,PKU",个体化饮食干预妊娠期糖尿病患者的作用分析,10.3969/j.issn.1002-7386.2013.02.081,黄利兰;邹清如;蔡芬兰;黄国清;宋薇;,"[1]广东省深圳市龙华新区观澜人民医院妇产科,518110",河北医药,妊娠糖尿病;个体化;饮食干预;,R781.64,2013,35,2
ctta201303001,5,"ISTIC,PKU",能谱 CT 诊断腹部多发病灶同源性的初步研究?,,杨伟洪[1];沈新平[2];潘娜[2];向先俊[3];胡小红[3];,"[1]香港大学深圳医院医学影像科，广东 深圳 518053; 北京大学深圳医院医学影像科，广东 深圳 518035;[2]香港大学深圳医院医学影像科,广东 深圳,518053;[3]北京大学深圳医院医学影像科,广东 深圳,518035;",CT理论与应用研究,能谱CT;同源性;多发病灶;,R814,2013,,3
gdywkzz201306007,4,"ISTIC,PKU",胆囊结石家族史对胆囊排空功能的影响,,黄耘[1];钟立明[2];,"[1]北京大学深圳医院肝胆外科,广东深圳518036;汕头大学医学院,广东汕头515041;[2]北京大学深圳医院肝胆外科,广东深圳,518036;",肝胆胰外科杂志,胆囊排空功能;胆囊结石;家族史;,R657.4+2,2013,25,6
zhmzxzz98201306023,2,"ISTIC,PKU",不同复苏方法用于重度非控制性失血性休克犬早期复苏效果的比较,10.3760/cma.j.issn.0254-1416.2013.06.023,江山[1];车邦民[2];何绍明[3];,"[1]南京市胸科医院麻醉科;[2]深圳市宝安区人民医院麻醉科;[3]解放军第四五四医院麻醉科, 南京市,210002;",中华麻醉学杂志,"休克,出血性;垂体激素类,后叶;盐水,高渗;羟乙基淀粉;补液疗法;",,2013,33,6
gwyx-mnxt201502002,0,"ISTIC,PKU",低钙透析液对腹膜透析患者颈动脉弹性的影响,10.3760/cma.j.issn.1673-4416.2015.02.002,何颖颖[1];徐春华[1];黄珍砾[2];王青[1];,"[1]深圳 北京大学深圳医院肾内科,广东,518000;[2]深圳 北京大学深圳医院超声科,广东,518000;",国际泌尿系统杂志,腹膜透析;透析液;钙;颈动脉;,R459.51,2015,35,2
zgzj201503006,1,"ISTIC,PKU",压敏点恢刺法治疗枕神经痛60例,10.13703/j.0255-2930.2015.03.006,谢宇锋[1];陈赟[1];冯军[1];杨宗保[2];王晨光[3];刘琼[3];,"[1]深圳市福田区中医院针灸推拿科,广东深圳,518000;[2]厦门大学医学院中医系,福建厦门,361005;[3]江西中医药大学;",中国针灸,枕神经痛;恢刺;压敏点;,R246.6,2015,35,3
hnyx201405007,1,"ISTIC,PKU",含有ap2启动子／增强子、AQP7 cDNA的腺病毒载体的构建及鉴定,10.3969/j.issn.1671-7171.2014.05.007,白晓苏;陆泽元;邵豪;,"[1]广东医学院附属福田医院内分泌科,广东 深圳,518033",医学临床研究,腺病毒科;遗传载体;,R511.8,2014,,5
wcbxhgbxzz201405023,1,"ISTIC,PKU",肝曲结肠癌侵犯十二指肠并内瘘形成1例,10.3969/j.issn.1006-5709.2014.05.023,黄健;黄群;夏韶华;,"[1]广东医学院附属福田医院消化内科,广东深圳,518033",胃肠病学和肝病学杂志,结肠癌;十二指肠;内瘘;,R735.3+5,2014,23,5
zgmryxzz201206054,32,"ISTIC,PKU",微型种植体支抗在成人口腔正畸中的应用,10.3969/j.issn.1008-6455.2012.06.054,靳爱萍;胡晓聪;黄月燕;,[1]深圳市宝安区人民医院口腔科 广东 深圳 518101,中国美容医学,微型;种植体;口腔正畸;,R783.5,2012,21,6
zgjjyx201309024,1,"ISTIC,PKU",Clara细胞蛋白16与临床相关性疾病的研究进展,10.3969/j.issn.1002-1949.2013.9.024,林锦乐;,"[1]深圳市宝安区人民医院急诊科,广东深圳,518101",中国急救医学,Clara细胞蛋白16;急性呼吸窘迫综合征(ARDS);临床相关疾病;,,2013,33,9
hainanyx201506003,0,"ISTIC,PKU",伏立康唑雾化吸入对侵袭性肺曲霉病患者细胞因子及肺纤维化的影响,10.3969/j.issn.1003-6350.2015.06.003,张贵宁[1];危之屏[2];叶明霞[3];,"[1]深圳市眼科医院药剂科,广东 深圳,518040;[2]北京大学深圳医院药剂科,广东 深圳,518036;[3]北京大学深圳医院呼吸内科,广东 深圳,518036;",海南医学,侵袭性肺曲霉病;伏立康唑;雾化吸入;肺纤维化;细胞因子;,R379.6,2015,,6
zgqkyx201525012,6,"ISTIC,PKU",2015年美国疾病控制中心阴道感染诊断和治疗指南,10.3969/j.issn.1007-9572.2015.25.010,樊尚荣[1];黎婷[2];,"[1]北京大学深圳医院妇产科, 广东省深圳市,518036;[2]汕头大学医学院;",中国全科医学,"阴道病,细菌性;滴虫病;念珠菌病,外阴阴道;诊断;治疗;",R531.71  R519.3,2015,,25
lcjyzz201406009,0,"ISTIC,PKU",汉族人群BCL11A基因内含子2表达调控相关区序列分析,10.13602/j.cnki.jcls.2014.06.09,孙顺昌;陈曦;彭运生;,"[1]深圳市宝安区人民医院中心实验室,广东深圳,518101",临床检验杂志,B细胞淋巴瘤/白血病11A基因;内含子;序列;,R541.4,2014,32,6
zgttyxzz201406012,2,"ISTIC,PKU",应用SPECT评价HANS数码针刺治疗ADHD的疗效,10.3969/j.issn.1006-9852.2014.06.012,张嘉辉[1];杨红杰[2];贾少微[2];胡疏[2];王彤[3];赵正勤[2];,"[1]北京大学深圳医院核医学科,深圳518036;汕头大学医学院,汕头515041;[2]北京大学深圳医院核医学科,深圳,518036;[3]清华大学深圳研究生院,深圳,518055;",中国疼痛医学杂志,注意力缺陷多动障碍(ADHD);单光子发射型计算机断层显像(SPECT);韩氏穴位神经刺激仪(HANS);针刺治疗;,,2014,20,6
lcwkzz201410022,1,"ISTIC,PKU",神经肽Y应用对颗粒脂肪移植存活率的影响,10.3969/j.issn.1005-6483.2014.10.021,崔永言[1];朱辉[1];郑海霞[2];麦凯欣[1];,"[1]518000,北京大学深圳医院整形外科;[2]北京大学深圳医院体检科;",临床外科杂志,脂肪移植;脂肪生成;神经肽Y;,R622,2014,,10
zgfybj201335010,8,"ISTIC,PKU",早产儿家庭健康教育需求及影响因素分析,10.7620/zgfybj.j.issn.1001-4411.2013.35.10,杨云智[1];林倩清[2];张友惠[1];赖伏虎[1];雷艳[1];,[1]深圳市宝安区人民医院 518101;[2]广东省妇幼保健院;,中国妇幼保健,早产儿;健康教育;家庭需求;影响因素;,R173,2013,28,35
hlxzz201314043,3,"ISTIC,PKU",应用微型营养评定法指导饮食干预的效果观察,10.3870/hlxzz.2013.14.089,周敏;李爱东;赵洁;董慧娟;陈月馨;,"[1]广东医学院风湿病研究所/广东医学院附属福田医院香蜜湖风湿病分院康复科,广东深圳,518040",护理学杂志,脑卒中;脑外伤;营养风险;营养不良;微型营养评定法;饮食干预;,R473.3,2013,28,14
shyxjyzz201604015,4,"ISTIC,PKU",毛细管电泳法糖化血红蛋白检测系统在缺铁性贫血患者中的应用,10.3969/j.issn.1673-8640.2016.04.012,徐安平;纪玲;陈卫东;夏勇;喻晶;周宇;李璐;,"[1]北京大学深圳医院检验科,北京,100000",检验医学,糖化血红蛋白;血红蛋白 A2;毛细管电泳法;缺铁性贫血;,R446.1,2016,31,4
zgyyzn201209213,0,"ISTIC,PKU",105例重症手足口病患儿的临床护理体会,10.3969/j.issn.1671-8194.2012.09.213,钟碧玲[1];李奕[2];,"[1]广东省深圳市宝安人民医院门诊输液室,广东深圳,518101;[2]广东省深圳市宝安人民医院手术室,广东深圳,518101;",中国医药指南,手足口病;重症;护理;,R473.72,2012,10,9
gwyx-shyx201302014,14,"ISTIC,PKU",基于家庭医生团队的社区护理模式探讨,10.3969/j.issn.1673-5625.2013.02.014,巫云辉[1];曹世义[2];邱德星[1];李惠霞[1];麦艳冰[1];王贤初[1];陈谨[1];邓剑[2];卢祖洵[2];,"[1]深圳市光明新区人民医院社区健康服务管理中心,广东,深圳,518106;[2]华中科技大学同济医学院公共卫生学院社会医学与卫生事业管理系,湖北,武汉,430030;",中国社会医学杂志,社区护理;服务模式;家庭医生;,R473.2,2013,30,2
hainanyx201210006,8,"ISTIC,PKU",慢性荨麻疹患者甲状腺自身抗体检测及自体血清皮肤试验的意义,10.3969/j.issn.1003-6350.2012.10.006,胡小平[1];谢谦[2];于波[1];邵勇[1];张杰[1];钟绮丽[1];马刚[1];,"[1]北京大学深圳医院皮肤科,广东深圳,518036;[2]北京大学深圳医院内分泌科,广东深圳,518036;",海南医学,慢性荨麻疹;甲亢;甲状腺自身抗体;自体血清皮肤试验;,R758.24,2012,23,10
zgjjyx201203010,5,"ISTIC,PKU",黄芪注射液对急性肺损伤大鼠热休克蛋白70核转录因子-κB表达的影响,10.3969/j.issn.1002-1949.2012.03.010,陶伍元[1];张文武[2];,"[1]温岭市第一人民医院ICU,浙江温岭,317500;[2]深圳市宝安区人民医院急诊科,广东深圳,518101;",中国急救医学,黄芪注射液;急性肺损伤;热休克蛋白70;核转录因子-κB;,R472.2,2012,32,3
zhyxjy201211006,3,"ISTIC,PKU",非小细胞肺癌患者外周血EGFR基因突变富集液相芯片检测方法的建立,10.3760/cma.j.issn.1009-9158.2012.11.006,郑丽霞[1];何臣[2];刘明[1];周倍贤[1];徐军[1];,"[1]510120,广州医学院第一附属医院广州呼吸疾病研究所呼吸疾病国家重点实验室肿瘤血液中心;[2]深圳市宝安区人民医院南方医科大学附属深圳宝安医院呼吸内科;",中华检验医学杂志,"癌,非小细胞肺;受体,表皮生长因子;突变;芯片分析技术;",,2012,,11
yyswlx201401013,1,"ISTIC,PKU",基于血液流量波及Womersley算法的动脉血液脉动流研究,,杜健航[1];伍贵富[2];郑振声[3];戴刚[3];冯铭哲[3];,"[1]广东海洋大学工程学院,广东湛江524088;中山大学卫生部辅助循环重点实验室,广州510080;[2]中山大学卫生部辅助循环重点实验室,广州510080;广东医学院附属福田医院,广东深圳518033;[3]中山大学卫生部辅助循环重点实验室,广州,510080;",医用生物力学,血液脉动流;壁面切应力分布;振荡剪切指数;增强型体外反搏;血流动力学;,R318.01,2014,29,1
zyyjk201517039,1,"ISTIC,PKU",婴幼儿孤独症早期筛查及其影响因素,,李秋燕[1];王培席[2];曹燕娟[3];王家骥[2];,"[1]广州医科大学研究生课程进修班,广东省广州市510182;深圳市光明新区人民医院;[2]广州医科大学研究生课程进修班,广东省广州市,510182;[3]深圳市光明新区人民医院;",职业与健康,孤独症;婴幼儿;沟通与象征性行为发展量表;影响因素;,R181.3+7,2015,31,17
tws201402006,2,"ISTIC,PKU",氯胺酮依赖脑内作用靶点的可视化研究,10.7538/tws.2014.27.02.0093,杨红杰[1];胡疏[2];贾少微[2];高宙[2];王彤[3];赵正勤[2];,"[1]北京大学深圳医院,广东深圳518036;北京大学医学部,北京100191;[2]北京大学深圳医院,广东深圳,518036;[3]清华大学深圳研究生院,广东深圳,518055;",同位素,氯胺酮依赖;单光子发射型计算机断层显像仪(SPECT);多巴胺转运体;99Tcm-TRODAT-1;,R741.049,2014,27,2
zhwk201402008,10,"ISTIC,PKU",乳腺癌临床病理分类与临床病理特征研究,10.3760/cma.j.issn.0529-5815.2014.02.008,胡慧[1];刘倩[2];徐玲[2];叶京明[2];赵建新[2];段学宁[2];刘荫华[2];,"[1]北京大学深圳医院乳腺外科;[2]100034,北京大学第一医院乳腺中心;",中华外科杂志,乳腺肿瘤;肿瘤分期;免疫组织化学;,,2014,52,2
zgzxyjhsbzz201408038,1,"ISTIC,PKU",维持性血液透析与C反应蛋白关系研究进展,10.3969/j.issn.1009-587X.2014.08.038,吴萌[1];熊祖应[2];,"[1]安徽医科大学,北京大学深圳医院临床学院 深圳,518036;[2]北京大学深圳医院肾内科 深圳 518036;",中国中西医结合肾病杂志,,,2014,,8
gwyx-myxfc201303016,1,"ISTIC,PKU",姜黄素对MRL/lpr狼疮鼠肾组织富含脯氨酸的酪氨酸激酶2信号转导途径表达的影响,10.3760/cma.j.issn.1673-4394.2013.03.016,王梅英;邹世海;,"[1]深圳市宝安区人民医院肾脏风湿内科,518101",国际免疫学杂志,姜黄素;富含脯氨酸的酪氨酸激酶2;MRL/lpr;狼疮肾炎;,,2013,36,3
sxzlyx201412001,0,"ISTIC,PKU",nm23-H1转染对肺癌细胞钙调素和基质金属蛋白酶表达的影响,10.3969/j.issn.1672-4992.2014.12.01,郑海霞[1];申东兰[2];彭安[2];何艳玲[2];,"[1]北京大学深圳医院体检科,广东深圳,518036;[2]北京大学深圳医院肿瘤内科,广东深圳,518036;",现代肿瘤医学,nm23-H1;肺癌细胞;钙调素;MMP-9;肿瘤转移;,R730.23  R734.2,2014,22,12
zgylqxzz201406010,0,"ISTIC,PKU",重离子肿瘤治疗装置的基本构成,10.3969/j.issn.1671-7104.2014.06.008,王彤[1];肖平[2];贾少微[2];袁克虹[3];杨红杰[2];,"[1]北京大学深圳医院,深圳市,518036;清华大学深圳研究生院,深圳市,518055;[2]北京大学深圳医院,深圳市,518036;[3]清华大学深圳研究生院,深圳市,518055;",中国医疗器械杂志,重离子;肿瘤治疗;加速器;旋转机架;,TH774,2014,38,6
hainanyx201402008,1,"ISTIC,PKU",系统性红斑狼疮与药物变态反应的临床研究,10.3969/j.issn.1003-6350.2014.02.0068,何伟珍;尹志华;孔卫红;叶志中;陈雅硕;戴莉萍;陈新鹏;张会昌;,"[1]广东医学院附属福田医院香蜜湖风湿病分院广东医学院风湿病研究所,广东 深圳,518040",海南医学,红斑狼疮;系统性;药物变态反应;慢性病;,R593.24+1,2014,25,2
zgyydk201405041,0,"ISTIC,PKU",老年系统性红斑狼疮47例临床特点分析,,陈雅硕;叶志中;余凤嫦;尹志华;何伟珍;,[1]广东医学院附属福田医院香蜜湖风湿病分院风湿病科，广东医学院风湿病研究所，深圳518040,中国医药导刊,老年系统性红斑狼疮;临床特点;,R593.241,2014,,5
zgsyzdx201606009,3,"ISTIC,PKU",缺铁性贫血对不同基因型α地中海贫血筛查的影响,,陈卫东;周宇;王秋;,"[1]北京大学深圳医院 检验科,广东 深圳,518036",中国实验诊断学,α地中海贫血;HbH病;缺铁性贫血;血红蛋白电泳;基因型;铁蛋白;,R556.3,2016,20,6
zhyygrxzz201523035,2,"ISTIC,PKU",伏立康唑治疗严重烧伤患者真菌感染临床疗效分析,10.11816/cn.ni.2015-151617,黄志斌;柳晖;陈武鹏;彭炳生;胡检;,"[1]深圳市宝安区人民医院烧伤整形外科,广东深圳,518100",中华医院感染学杂志,伏立康唑;烧伤;真菌;感染;,R978.1,2015,,23
yxzs201418054,8,"ISTIC,PKU",医院-社区综合管理模式对原发性高血压控制效果影响分析,10.3969/j.issn.1006-2084.2014.18.054,张立恒;,"[1]深圳市福田区妇幼保健院全科,广东深圳,518000",医学综述,"高血压;综合干预,健康教育;疗效评估;",R544,2014,20,18
lchsyyxzz201510021,6,"ISTIC,PKU",促性腺激素释放激素激动剂联合反向添加治疗保守性手术后中、重度子宫内膜异位症的临床效果,10.3969/j.issn.1671-4695.2015.010.021,邹璐;龙礼华;唐丽霞;贾晓婕;,[1]深圳市福田区妇幼保健院妇产科 广东 深圳 518000,临床和实验医学杂志,子宫内膜异位症;促性腺激素释放激素;反向添加治疗;,,2015,,10
zgqkyx201528013,5,"ISTIC,PKU",2015年美国疾病控制中心性传播疾病诊断和治疗指南（续）--盆腔炎的诊断和治疗指南,10.3969/j.issn.1007-9572.2015.28.010,樊尚荣[1];黎婷[2];,"[1]北京大学深圳医院妇产科,广东省深圳市,518036;[2]汕头大学医学院;",中国全科医学,盆腔炎性疾病;诊断;治疗;,R711.33,2015,,28
hainanyx201612061,4,"ISTIC,PKU",输尿管镜联合钬激光治疗肾输尿管结石的临床护理,10.3969/j.issn.1003-6350.2016.12.061,林艳玲[1];祝妍华[2];肖丽华[3];,"[1]深圳市石岩人民医院院感科,广东 深圳,518108;[2]深圳市龙岗中心医院手术室,广东 深圳,518116;[3]深圳市光明新区人民医院院感科,广东 深圳,518106;",海南医学,肾结石;钬激光碎石术;输尿管软镜;护理;,R693+.4,2016,27,12
syyfyx201208006,22,"ISTIC,PKU",孕晚期妊娠糖尿病脂联素、瘦素与胰岛素抵抗的相关性,10.3969/j.issn.1006-3110.2012.08.006,赖丽萍;陆泽元;李翠吟;叶艺艺;蒋凤秀;庄雄杰;凤香清;,[1]深圳市第四(福田)人民医院内分泌科 广东深圳 518033,实用预防医学,妊娠糖尿病;脂联素;瘦素;胰岛素抵抗;,R714.256,2012,19,8
hsjbzz201301001,15,"ISTIC,PKU",CT能谱成像对肺部占位性病变鉴别诊断价值的初步研究,10.3969/j.issn.1009-3257.2013.01.001,陈燕[1];宋卫东[2];王成林[3];,"[1]北京大学深圳医院呼吸内科,广东深圳518000;汕头大学医学院,广东汕头515041;[2]北京大学深圳医院呼吸内科,广东深圳,518000;[3]北京大学深圳医院影像科,广东深圳,518000;",罕少疾病杂志,肺;能谱成像;单能量图像;碘基图像;,R814.42  R735.7,2013,20,1
zgsyzdx201505012,6,"ISTIC,PKU",酮咯酸氨丁三醇联合舒芬太尼用于直肠癌根治术术后镇痛的研究,,郑叶[1];陈丽[2];袁风雷[3];王先凤[1];赫兰蓄[1];王金兰[1];,"[1]吉林大学中日联谊医院 麻醉科,吉林 长春,130033;[2]吉林省妇幼保健院 麻醉科,吉林 长春,130021;[3]北京大学深圳医院 麻醉科,广东 深圳,518000;",中国实验诊断学,酮咯酸氨丁三醇;舒芬太尼;术后镇痛;,R614,2015,,5
zhyxjy201601007,4,"ISTIC,PKU",常见细菌药物敏感性试验报告规范中国专家共识,10.3760/cma.j.issn.1009-9158.2016.01.006,王辉[1];宁永忠[2];陈宏斌[1];俞云松[3];王明贵[4];胡必杰[5];陈佰义[6];马筱玲[7];胡继红[8];倪语星[9];徐英春[10];曹彬[11];陈家旭[12];褚云卓[6];归巧娣[13];韩立中[9];胡云建[14];胡志东[15];贾伟[16];李敏[17];李轶[18];廖康[19];刘颖梅[11];刘文恩[20];罗燕萍[21];单斌[22];孙宏莉[10];孙自镛[23];陶传敏[24];王大燕[25];魏莲花[26];吴文娟[27];徐修礼[28];杨虹[29];杨青[30];姚开虎[31];余方友[32];张莉萍[33];张嵘[34];赵建宏[35];赵宗珉[6];卓超[36];朱镭[37];,[1]100044北京大学人民医院检验科;[2]北京大学第三医院检验科;[3]浙江大学医学院附属邵逸夫医院感染科;[4]复旦大学附属华山医院抗生素研究所;[5]复旦大学附属中山医院感染科;[6]中国医科大学附属第一医院感染科、，检验科;[7]安徽省立医院检验科;[8]北京医院卫生部临床检验中心;[9]上海交通大学医学院附属瑞金医院临床微生物科;[10]中国医学科学院北京协和医院检验科;[11]中日友好医院呼吸与危重症医学科二部;[12]中国疾病预防控制中心寄生虫病预防控制所;[13]陕西省人民医院检验科;[14]北京医院检验科;[15]天津医科大学总医院检验科;[16]宁夏医科大学总医院医学实验中心;[17]上海交通大学医学院附属仁济医院检验科;[18]河南省人民医院检验科;[19]中山大学附属第一医院检验科;[20]中南大学湘雅医院检验科;[21]中国人民解放军总医院微生物科;[22]昆明医科大学第一附属医院检验科;[23]华中科技大学同济医学院附属同济医院检验科;[24]四川大学华西医院实验医学科;[25]中国疾病预防控制中心病毒病预防控制所;[26]甘肃省人民医院检验科;[27]同济大学附属东方医院南院医学检验科;[28]第四军医大学西京医院检验科;[29]北京大学深圳医院检验科;[30]浙江大学医学院附属第一医院检验科;[31]首都医科大学附属北京儿童医院儿研所微生物研究室;[32]温州医科大学附属第一医院检验科;[33]重庆医科大学附属第一医院检验科;[34]浙江大学医学院附属第二医院检验科;[35]河北省临床检验中心 河北医科大学第二医院检验科;[36]广州医科大学附属第一医院广州呼吸疾病研究所;[37]山西省儿童医院山西省妇幼保健院检验科;,中华检验医学杂志,,,2016,,1
zhlcyszz201213053,7,,VHL病的基因及临床研究进展,10.3877/cma.j.issn.1674-0785.2012.13.053,张虎[1];史本涛[2];邓小林[2];崔林[2];关志忱[2];,"[1]230022 合肥,安徽医科大学;北京大学深圳医院泌尿外科;[2]北京大学深圳医院泌尿外科;",中华临床医师杂志（电子版）,,R4,2012,06,13
hubeiykdxxb201303021,17,"ISTIC,PKU",右美托咪定联合丙泊酚在ICU中的应用,,张赤[1];王焱林[2];杜朝晖[2];张声[1];昌晓寒[1];张卫星[1];,[1]北京大学深圳医院重症监护病房 广东 深圳 518000;[2]武汉大学中南医院麻醉科/重症监护病房 湖北 武汉430071;,武汉大学学报（医学版）,右美托咪定;丙泊酚;镇静;重症监护病房;机械通气;,R614.2+4,2013,34,3
zfysjjbzz201605012,3,"ISTIC,PKU",养血清脑颗粒治疗卒中后抑郁的疗效及对脑白质结构改变的影响,,许孝南[1];马婷[2];陈旭辉[1];虢周科[3];朱治山[4];刘淑云[5];李梅笑[6];李晶[7];刘相城[5];,"[1]北京大学深圳医院神经内科,广东深圳,518036;[2]哈尔滨工业大学深圳研究生院,广东深圳,518055;[3]深圳市中医院神经内科,广东深圳,518033;[4]深圳市罗湖区人民医院神经内科,广东深圳,518001;[5]深圳市龙华新区人民医院神经内科,广东深圳,518110;[6]深圳市龙岗区人民医院神经内科,广东深圳,518172;[7]深圳市宝安区沙井人民医院神经内科,广东深圳,518104;",中风与神经疾病杂志,卒中后抑郁;弥散张量成像;疗效;养血清脑颗粒;,R743.3,2016,33,5
hbyy201402073,11,"ISTIC,PKU",舒适护理理念在新生儿脐部护理中应用效果观察,10.3969/j.issn.1002-7386.2014.02.068,钟丽晖;徐芮;,"[1]518106,广东省深圳市光明新区人民医院新生儿科",河北医药,舒适护理理念;新生儿;脐部护理;护理质量;,R473.72,2014,,2
