lnxxgbzz201305011,6,"ISTIC,PKU",主动脉内球囊反搏对急性重症心肌炎心力衰竭患者室性心律失常的影响,10.3969/j.issn.1007-9688.2013.05.011,谭振宇[1];杨大浩[1];廖春燕[2];,"[1]深圳市宝安区人民医院心血管内科,广东深圳,518101;[2]深圳市宝安区人民医院内分泌科,广东深圳,518101;",岭南心血管病杂志,室性心律失常;主动脉内球囊反搏;心力衰竭;,R541.7,2013,19,5
ytctyy201405041,3,,中医适宜技术社区应用研究,,何晶[1];何莉[2];何璐[3];,"[1]深圳市光明新区人民医院西田社区健康服务中心,广东深圳,518106;[2]深圳市福田区中医院,广东深圳,518000;[3]深圳市福田区妇幼保健院,广东深圳,518000;",亚太传统医药,中医适宜技术;社区应用;社区卫生服务;,R192,2014,10,5
xdyyws201407076,0,,浅析如何提高社区卫生服务质量,10.3969/j.issn.1009-5519.2014.07.076,何晶[1];何莉[2];何璐[3];,"[1]深圳市光明新区人民医院西田社区健康服务中心,广东深圳,518106;[2]深圳市福田区中医院体检中心,广东深圳,518000;[3]深圳市福田区妇幼保健院新生儿科,广东深圳,518000;",现代医药卫生,社区卫生服务;质量控制;提高;措施;,,2014,,7
jzyx201311017,4,"ISTIC,PKU",肠梗阻导管联合生长抑素治疗重症急性胰腺炎,10.3760/cma.j.issn.1671-0282.2013.11.017,阳生光[1];苏科[1];朱燕辉[2];陈锋[3];向华国[4];,"[1]深圳市福永人民医院急诊科,深圳,518103;[2]深圳市福永人民医院普外科,深圳,518103;[3]深圳市光明新区人民医院ICU;[4]深圳市福永人民医院检验科,深圳,518103;",中华急诊医学杂志,重症急性胰腺炎;导管;生长抑素;减压;治疗效果;,,2013,22,11
gwyx-lcsw201215030,7,"ISTIC,PKU",痰标本中结核分枝杆菌培养及药敏检测结果分析,10.3969/j.issn.1673-4130.2012.15.030,陈爱蓉[1];李建武[1];温贵华[2];,"[1]北京大学深圳医院,广东深圳,518035;[2]广东深圳宝安区慢病防治院,518036;",国际检验医学杂志,"分枝杆菌,结核;培养基;抗药性,细菌;",R446.5,2012,33,15
jkr201624025,0,"ISTIC,PKU",Activin A、β-hCG、P在异位妊娠早期诊断中的价值研究,,张雯[1];周秀英[2];颜美荣[3];陈莉[1];黎宁[1];,"[1]深圳市宝安中医院妇科,深圳,518000;[2]深圳市光明新区人民医院产科,深圳,518000;[3]深圳市光明新区人民医院妇产科,深圳,518000;",中国当代医药,Activin A;β-hCG;孕酮;异位妊娠;早期诊断;,R713.8,2016,23,24
shyxjyzz201407018,2,"ISTIC,PKU",75株碳青霉烯类耐药铜绿假单胞菌 ERIC-PCR菌种分型及其主要耐药机制研究,10.3969/j.issn.1673-8640.2014.07.015,张勇[1];刘爱胜[2];文艳[3];,"[1]深圳市龙华新区观澜人民医院检验科,广东 深圳,518110;[2]深圳市龙华新区人民医院检验科,广东 深圳,518109;[3]深圳市光明新区人民医院 ICU,广东 深圳,518106;",检验医学,铜绿假单胞菌;碳青霉烯类耐药;肠杆菌基因间重复一致序列为引物的聚合酶链反应;β-内酰胺酶;主动外排;,R446.5,2014,,7
jilinyx201221107,1,"ISTIC,PKU",经阴道三维超声输卵管造影在诊断不孕症的价值与手术病理对照,10.3969/j.issn.1004-0412.2012.21.107,徐甫[1];黄伟欣[2];邱华文[3];肖仕琪[1];郭文涛[3];黄清南[3];何涛君[4];,"[1]广东医学院附属深圳市福田人民医院体检科B超室,广东深圳,518033;[2]深圳市福田区妇幼保健院超声科,广东深圳,518033;[3]广东医学院附属深圳市福田人民医院外科,广东深圳,518033;[4]广东医学院附属深圳市福田人民医院检验医学部,广东深圳,518033;",吉林医学,不孕症;输卵管造影;手术病理;三维超声;,R711.6,2012,33,21
zgjjyx201302012,3,"ISTIC,PKU",1007CCV型心肺复苏器依照2010新指南在心肺复苏中的应用比较,10.3969/j.issn.1002-1949.2013.2.012,阳生光[1];苏科[1];宋登元[1];陈锋[2];何芳[1];吕义云[1];叶秀云[1];,"[1]深圳市福永人民医院急诊科,广东深圳,518103;[2]深圳市光明新区人民医院ICU,广东深圳,518106;",中国急救医学,心肺复苏(CPR)器;心搏、呼吸骤停(CPA);徒手CPR;传统CPR;,,2013,33,2
rdyxzz201410015,2,"ISTIC,PKU",黄芪消渴方联合二甲双胍片对气阴两虚型2型糖尿病患者血糖的影响,,曾纪斌[1];潘艳[1];黄寅銮[1];龚丽[2];谢嘉嘉[1];杨从意[1];,"[1]广东省深圳市宝安区中医院广州中医药大学附属深圳宝安中医院糖尿病科,广东深圳518101;[2]广州中医药大学附属深圳宝安中医院,广东深圳518101;",热带医学杂志,黄芪消渴方;气阴两虚;2型糖尿病;,R587.1,2014,14,10
jkr201620058,2,"ISTIC,PKU",循证护理在异位妊娠患者中的应用及效果评价,,颜美荣[1];钟富莲[2];张雯[3];周秀英[1];,"[1]深圳市光明新区人民医院产科,深圳,518106;[2]深圳市光明新区人民医院妇科,深圳,518106;[3]深圳市宝安区中医院产科,深圳,518000;",中国当代医药,异位妊娠;循证护理;临床效果;,R473.71,2016,23,20
jyyxylc201614063,1,"ISTIC,PKU",无乳链球菌的研究现状及进展,10.3969/j.issn.1672-9455.2016.14.063,刘泽滨(综述)[1];陆学东[2];林立鹏[1];聂署萍[2];邓凤娴(审校)[3];,"[1]广东省深圳市福田区妇幼保健院检验科 518000;[2]广东医学院附属福田医院检验医学部,广东深圳,518033;[3]广东医学院检验学院,广东东莞,523808;",检验医学与临床,无乳链球菌;二胎;孕妇;新生儿;,,2016,13,14
zgyxyxxzz201308001,9,"ISTIC,PKU",非增强磁共振血管成像对糖尿病下肢动脉狭窄的诊断价值,10.3969/j.issn.1005-5185.2013.08.001,郭红敏[1];戚玉龙[2];刘阳[2];冯飞[2];黄小红[3];张娜[3];,[1]广东医学院附属福田医院肌电图室 广东深圳518033;[2]北京大学深圳医院放射科 广东深圳518036;[3]中国科学院深圳先进技术研究院 广东深圳 518055;,中国医学影像学杂志,糖尿病并发症;动脉闭塞性疾病;下肢;磁共振血管造影术;,R543.5  R445.2,2013,21,8
ddyx201320110,8,"ISTIC,PKU",自拟中药汤剂与西医结合治疗复发性口腔溃疡疗效分析,10.3969/j.issn.1009-4393.2013.20.110,葛风华[1];唐世平[2];刘惠灵[1];张国明[3];刘春子[3];刘文娟[3];朱兰英[1];麦艳梅[1];,"[1]广东 518101 深圳市宝安区中医院灵芝园社康中心;[2]518107,深圳市光明新区人民医院口腔科;[3]518101,深圳市宝安区中医院口腔科;",当代医学,复发性口腔溃疡;自拟中药汤剂;西医常规疗法;疗效;,,2013,,20
zgyf201521016,0,"ISTIC,PKU",胺碘酮与普罗帕酮治疗慢性心房颤动复律的疗效与安全性比较,10.6039/j.issn.1001-0408.2015.21.14,谢展雄[1];梁翠霞[1];王庆文[2];陈桂红[3];廖朝峰[4];温中明[5];,"[1]深圳市龙华新区中心医院,广东深圳,518000;[2]深圳市龙华新区龙华人民医院,广东深圳,518109;[3]深圳市宝安区中心医院,广东深圳,518000;[4]深圳市宝安区人民医院,广东深圳,518000;[5]深圳市光明新区人民医院,广东深圳,518000;",中国药房,慢性心房颤动;心肌复律;胺碘酮;普罗帕酮;,R541,2015,,21
zwkjzlml-yyws201326023,3,"ISTIC,PKU",头孢美唑联合清开灵颗粒治疗小儿肺炎的临床分析,,沈时鹏[1];吴铁松[2];杜江滨[3];,"[1]深圳市福田区妇幼保健院药剂科,广东深圳,518026;[2]深圳市观澜人民医院药剂科,广东深圳,518000;[3]深圳市福田区妇幼保健院儿科,广东深圳,518026;",中国现代医生,中西药物;头孢美唑;清开灵;小儿肺炎;,R725.6,2013,51,26
sxyxjy201403026,3,"ISTIC,PKU",四种腹泻病毒抗原联检技术在临床儿童腹泻诊断中的应用价值,10.3969/j.issn.1671-7414.2014.03.026,刘泽滨[1];王琼[2];胡琴[3];陆学东[2];,"[1]广东医学院,广东湛江524000;深圳市福田区妇幼保健院检验科,广东深圳518000;[2]广东医学院附属福田医院检验医学部,广东深圳,518033;[3]深圳市龙岗区人民医院检验科,广东深圳,518000;",现代检验医学杂志,腹泻病毒;荧光免疫(四联法);酶免法;一致性;,R373.2  R392.11,2014,29,3
zgyy201313008,1,"ISTIC,PKU",高效液相色谱法测定金钱草胶囊中槲皮素的血药浓度,10.3969/j.issn.1006-4931.2013.13.008,王启平[1];王洪锐[2];李东[3];朱杰华[4];林永胜[5];冯雪科[2];陈玩珊[3];,"[1]广东省深圳市沙井人民医院,广东深圳,518104;[2]广东省深圳市福永人民医院,广东深圳,518103;[3]广东省深圳市人民医院·暨南大学第二临床医学院,广东深圳 518020;[4]广东省深圳市大鹏人民医院,广东深圳,518120;[5]广东省深圳市南澳人民医院,广东深圳,518121;",中国药业,金钱草胶囊;槲皮素;血药浓度;高效液相色谱法;,R284.1  R285.6  R286,2013,22,13
xnyxyxb201403008,0,"ISTIC,PKU",TLR2在慢性乙肝孕妇胎盘中的表达及与宫内感染的关系,,金素芳[1];方锦川[2];周晓梅[1];王梅[1];,"[1]深圳市福田区中医医院妇产科,广东深圳,518000;[2]深圳市福田区妇幼保健院妇产科;",湖北科技学院学报（医学版）,慢性乙肝;Toll样受体2;胎盘;宫内感染;,R714.251,2014,,3
zgfybj201603006,0,"ISTIC,PKU",育龄期多囊卵巢综合征妇女糖脂代谢的研究,10.7620/zgfybj.j.issn.1001-4411.2016.03.06,方锦川[1];金素芳[2];周燕妮[1];李丽萍[1];彭检妹[1];周晓梅[2];,"[1]深圳市福田区妇幼保健院妇产科,广东深圳,518048;[2]深圳市福田区中医院妇产科,广东深圳,518035;",中国妇幼保健,多囊卵巢综合征;胰岛素抵抗;糖脂代谢;血糖;血脂;,R711.75,2016,31,3
zgwscy201220122,2,"ISTIC,PKU",影响生殖道感染妇女利用社区卫生服务的多因素分析,,曾润颜[1];叶斌[2];杜明玉[3];,"[1]深圳市福田区妇幼保健院,水围社区健康服务中心,广东深圳 518034;[2]深圳市福田区中医院,社区健康服务部,广东深圳518020;[3]深圳市福田区妇幼保健院,赤尾社区健康服务中心妇科,广东深圳 518026;",中国卫生产业,生殖道感染;育龄妇女;社区卫生服务;卫生服务利用;,R711.3,2012,,20
tlsjyyj201308023,17,"ISTIC,PKU",预见性护理程序在颅骨缺损伴脑积水同期手术护理中的应用,10.3969/j.issn.1672-9676.2013.08.023,荣再香[1];李雪英[2];李艳华[2];,"[1]518106,广东省深圳市光明新区人民医院急诊科;[2]广东省深圳市观澜人民医院;",护理实践与研究,预见性护理;颅骨缺损伴脑积水;同期手术;效果;,,2013,10,8
gdyx201303010,2,"ISTIC,PKU",生态免疫营养对缺血再灌注的肝硬化大鼠肝脏保护的作用,10.3969/j.issn.1001-9448.2013.03.010,王庐荆[1];贺德[2];胡翔[3];顾元博[4];邓明武[4];,"[1]广东省深圳市宝安区福永人民医院外三科,518103;[2]广东省深圳市宝安区人民医院外一科,518101;[3]广东省深圳市宝安区石岩人民医院外二科,518108;[4]广东医学院研究生院,广东湛江,524023;",广东医学,生态免疫营养;肝硬化;缺血再灌注损伤;谷丙转氨酶;肿瘤坏死因子-α;,,2013,34,3
zgyszz201511032,1,"ISTIC,PKU",复发性流产患病危险因素的Logistic回归分析,10.3760/cma.j.issn.1008-1372.2015.11.032,方锦川[1];周燕妮[1];李丽萍[1];彭检妹[1];周晓梅[2];,"[1]深圳福田区妇幼保健院妇产科, 深圳,518000;[2]深圳福田区中医院妇产科;",中国医师杂志,"流产,习惯性;危险因素;Logistic模型;",,2015,17,11
lcsxyjy201606026,0,"ISTIC,PKU",不同类型慢性肝炎人群戊型病毒性肝炎IgG抗体流行状况,10.3969/j.issn.1671-2587.2016.06.026,刘晓鸽[1];刘爱胜[2];文艳[3];,"[1]广东省深圳市宝安区福永人民医院检验科, 深圳,518103;[2]深圳市龙华新区人民医院检验科;[3]深圳市光明新区人民医院ICU;",临床输血与检验,戊型病毒性肝炎;乙型病毒性肝炎;丙型病毒性肝炎;流行率;,R373.2+1  R446.61,2016,18,6
fsxsj201406044,4,"ISTIC,PKU",超声二维斑点追踪技术评价严重心收缩功能不全患者左室扭转及解旋研究,10.13609/j.cnki.1000-0313.2014.06.033,潘敏[1];刘俐[2];王双双[2];张蒂荣[2];陈芸[2];林栋[2];李国松[2];,"[1]深圳市福田区中医院超声科, 广东,518034;[2]北京大学深圳医院超声科, 广东,518026;",放射学实践,"超声检查;心肌收缩;心室功能障碍,左;",R331.31  R541  R446.9,2014,,6
zgyszz201508017,0,"ISTIC,PKU",脂联素受体1基因多态性和多囊卵巢综合征的初步研究,10.3760/cma.j.issn.1008-1372.2015.08.017,方锦川[1];周燕妮[1];李丽萍[1];金素芳[2];周晓梅[2];,"[1]深圳福田区妇幼保健院妇产科,深圳,518045;[2]深圳福田区中医院妇产科;",中国医师杂志,"受体,脂联素/遗传学;多囊卵巢综合征/遗传学;",,2015,17,8
shzjzz201602010,5,"ISTIC,PKU",头针配合背俞穴埋线治疗中风恢复期失眠症疗效观察,10.13460/j.issn.1005-0957.2016.02.0157,许倩[1];占大权[2];黄飞霞[3];,"[1]深圳市宝安区福永人民医院,深圳,518103;[2]深圳市宝安区中医院,深圳,518133;[3]香港大学深圳医院,深圳,518053;",上海针灸杂志,"头针;穴,背俞;埋线;中风并发症;失眠症;",R246.6,2016,35,2
sxyxjy201506027,1,"ISTIC,PKU",荧光探针PCR与膜芯片技术在女性生殖道HPV分型的对比研究,10.3969/j.issn.1671-7414.2015.06.027,刘小君[1];向华国[2];曾锦婷[2];李红春[3];,"[1]深圳市光明新区人民医院,广东深圳,518106;[2]深圳市宝安区福永人民医院,广东深圳,518103;[3]达州市中心医院,四川达州,635000;",现代检验医学杂志,人乳头状瘤病毒;荧光探针PCR;基因分型;,R373  Q503,2015,30,6
zgrdyx201505021,5,"ISTIC,PKU",ELISA法、荧光免疫法及PCR检测婴幼儿腹泻常见病毒,,刘泽滨[1];王琼[2];胡琴[3];陆学东[2];,"[1]深圳市福田区妇幼保健院检验科,广东深圳,518000;[2]广东医学院附属福田医院检验医学部,广东深圳,518033;[3]深圳市龙岗区人民医院检验科,广东深圳,518000;",中国热带医学,婴幼儿;多重RT-PCR;腹泻病毒;星状病毒;,R725.1,2015,15,5
gwyx-lcsw201306016,9,"ISTIC,PKU",孕妇血清中叶酸、维生素B12和铁蛋白水平的调查,10.3969/j.issn.1673-4130.2013.06.016,陈荣贵[1];刘爱胜[2];文艳[3];施俊柱[1];刘仁志[1];,"[1]深圳市龙华新区广东医学院附属观澜人民医院检验科,广东深圳,518110;[2]深圳市龙华人民医院检验科,广东深圳,518109;[3]深圳市光明新区人民医院ICU,广东深圳,518106;",国际检验医学杂志,孕妇;叶酸;维生素B12;铁蛋白质类;,,2013,34,6
gyzyxyxb201303008,8,"ISTIC,PKU",临床护理路径在颅骨缺损伴脑积水同期术患者中的应用,10.3969/j.issn.1002-1108.2013.03.0008,李艳华[1];荣再香[2];李雪英[1];,"[1]深圳市观澜人民医院,广东深圳,518110;[2]深圳市光明新区人民医院,广东深圳,518106;",贵阳中医学院学报,临床护理路径;颅骨缺损伴脑积水;同期手术;应用;效果;,R473.74,2013,35,3
sxzlyx201509011,0,"ISTIC,PKU",鼻咽癌组织中 DAPK 基因启动子甲基化的研究,10.3969/j.issn.1672-4992.2015.09.11,梁辉[1];李璐[2];陈群蓉[3];利显民[1];,"[1]深圳市宝安区人民医院耳鼻咽喉科,广东深圳,518101;[2]深圳市宝安区人民医院输血科,广东深圳,518101;[3]北京大学深圳医院检验科,广东 深圳,518036;",现代肿瘤医学,鼻咽癌;DAPK 基因;启动子;甲基化;,R739.63,2015,,9
zgjcyy201417026,0,"ISTIC,PKU",肝细胞生长因子、晚期糖基化终产物受体在妊娠期糖尿病胎盘中的表达及与母儿预后的关系,10.3760/cma.j.issn.1008-6706.2014.17.025,金素芳[1];周晓梅[1];方锦川[2];郭玉萍[1];,"[1]深圳市福田区中医院妇产科, 广东省深圳,518034;[2]福田区妇幼保健院妇产科;",中国基层医药,"糖尿病,妊娠;肝细胞生长因子;膜蛋白质类;预后;",,2014,,17
zgjcyy201408031,1,"ISTIC,PKU",对氧磷酶-1与多囊卵巢综合征的相关性研究,10.3760/cma.j.issn.1008-6706.2014.08.031,周晓梅[1];石溪[2];邹俐[3];方景川[2];资捷[2];,"[1]深圳市福田区中医院妇产科, 广东省深圳,518034;[2]深圳市福田区妇幼保健院;[3]惠州市计划生育技术服务中心;",中国基层医药,多囊卵巢综合征;对氧磷酶-1;动脉粥样硬化性心脏病;酶联免疫吸附法;,,2014,21,8
sxyxjy201502012,0,"ISTIC,PKU",鼻咽癌组织中 SYK 基因启动子区的甲基化分析,10.3969/j.issn.1671-7414.2015.02.012,李璐[1];梁辉[2];陈群蓉[3];,"[1]北京大学深圳医院检验科,广东深圳,518035;[2]深圳市宝安区人民医院耳鼻咽喉科,广东深圳,518101;[3]深圳市宝安区人民医院输血科,广东深圳,518101;",现代检验医学杂志,鼻咽癌;SYK 基因;启动子;甲基化;,R739.6  R730.43,2015,,2
lchsyyxzz201412032,3,"ISTIC,PKU",缺铁性贫血人群全血糖化血红蛋白含量水平分析及参考区间建立,10.3969/j.issn.1671-4695.2014.12.031,张勇[1];刘爱胜[2];文艳[3];,[1]深圳市龙华新区观澜人民医院检验科 广东 深圳 518110;[2]深圳市龙华新区人民医院检验科 广东 深圳 518109;[3]深圳市光明新区人民医院 ICU 广东 深圳 518106;,临床和实验医学杂志,缺铁性贫血;全血;糖化血红蛋白;参考区间;,,2014,,12
zwyxyj201426066,2,"ISTIC,PKU",戊酸雌二醇用药时间长短对难治性流产作用效果的临床观察,,吴庆莉[1];钟科[2];马剑霞[1];王云霞[3];袁海琳[1];,[1]深圳福永人民医院 广东 深圳 518103;[2]深圳南山区妇幼保健院;[3]深圳福田妇幼保健院;,中外医学研究,戊酸雌二醇;用药时间;难治性流产;,R714.21,2014,,26
xdfckjz201409011,2,"ISTIC,PKU",疤痕子宫间隔1年内妊娠再次足月剖宫产102例分析,10.13283/j.cnki.xdfckjz.2014.09.013,王云霞[1];余艳红[2];葛绍明[1];刘萍[1];吴庆莉[3];,"[1]深圳市福田区妇幼保健院,深圳,518045;[2]南方医科大学附属南方医院妇产科,广州,510515;[3]深圳市福永人民医院妇产科,深圳,518103;",现代妇产科进展,剖宫产术后;疤痕子宫;妊娠;子宫破裂;,R719.8,2014,,9
sxyxjy201401051,2,"ISTIC,PKU",深圳关外各社区妇女生殖道人乳头瘤病毒感染状况及亚型分析,10.3969/j.issn.1671-7414.2014.01.051,施俊柱[1];刘爱胜[2];文艳[3];陈荣贵[1];阳建[4];,"[1]龙华新区观澜人民医院检验科,广东深圳,518110;[2]龙华新区人民医院检验科,广东深圳,518109;[3]光明新区人民医院ICU,广东深圳,518106;[4]宝安区沙井人民医院检验科,广东深圳,518104;",现代检验医学杂志,宫颈癌;人乳头瘤病毒;感染;基因分型;,R373.9  R392.11,2014,29,1
lcsxyjy201402022,1,"ISTIC,PKU",75株碳青霉烯类耐药铜绿假单胞菌的检出及药敏分析,10.3969/j.issn.1671-2587.2014.02.022,张勇[1];刘爱胜[2];文艳[3];,"[1]518110,广东省深圳市龙华新区观澜人民医院检验科;[2]龙华新区人民医院检验科;[3]光明新区人民医院ICU;",临床输血与检验,碳青霉烯类耐药铜绿假单胞菌;耐药;亚胺培南;美罗培南;,R378.99+1,2014,16,2
lchsyyxzz201411010,1,"ISTIC,PKU",SF、LDH和γ-GT检测在乳腺癌诊断治疗中的临床应用价值,10.3969/j.issn.1671-4695.2014.11.010,张勇[1];刘爱胜[2];文艳[3];,[1]深圳龙华新区观澜人民医院检验科广东深圳 518110;[2]深圳龙华新区人民医院检验科广东深圳 518109;[3]深圳光明新区人民医院ICU广东深圳 518106;,临床和实验医学杂志,乳腺癌;SF;LDH;γ-GT;,,2014,,11
qlhlzz201309039,4,"ISTIC,PKU",护理干预在急诊胆石症患者中的应用,10.3969/j.issn.1006-7256.2013.09.039,荣再香[1];胡敏[2];,"[1]深圳市光明新区人民医院,广东深圳,518106;[2]深圳市观澜人民医院;",齐鲁护理杂志,胆石症;急诊;护理干预;,R473.5,2013,19,9
yxzs201410045,0,"ISTIC,PKU",热激蛋白47在瘢痕疙瘩发病机制中的研究,10.3969/j.issn.1006-2084.2014.10.045,曾凡杞[1];樊超[2];张志云[1];黄勇武[2];,"[1]深圳市光明新区人民医院皮肤科,518106广东深圳;[2]深圳市宝安区福永人民医院皮肤科,518103广东深圳;",医学综述,热激蛋白47;瘢痕疙瘩;Ⅰ型胶原;Ⅲ型胶原;,R861  R691.4,2014,20,10
sxyxjy201306050,2,"ISTIC,PKU",深圳关外各社区妇女生殖道人乳头瘤病毒感染状况及亚型分析,10.3969/j.issn.1671-7414.2013.06.050,施俊柱[1];刘爱胜[2];文艳[3];陈荣贵[1];阳建[4];,"[1]龙华新区观澜人民医院检验科,广东深圳,518110;[2]龙华新区人民医院检验科,广东深圳,518109;[3]光明新区人民医院ICU,广东深圳,518106;[4]宝安区沙井人民医院检验科,广东深圳,518104;",现代检验医学杂志,宫颈癌;人乳头瘤病毒;感染;基因分型;,R373.9  R392.11,2013,28,6
hnyx201301043,5,"ISTIC,PKU",改良经皮肾输尿管镜钬激光碎石术治疗复杂肾结石,10.3969/j.issn.1671-7171.2013.01.043,夏昕晖[1];何莉[2];王固新[1];张东方[1];孙旋[1];,"[1]广东医学院附属福田人民医院,广东,深圳,518033;[2]广东省深圳市福田区妇幼保健院质控科,广东,深圳,518033;",医学临床研究,"肾结石/治疗;输尿管镜检查,激光,固体;碎石术,激光;",R692.4,2013,30,1
hnyx201508007,0,"ISTIC,PKU",脑源性神经生长因子及酪氨酸激酶受体B在子宫内膜癌中的表达及其意义,10.3969/j.issn.1671-7171.2015.08.007,陈旭娜[1];叶志中[2];,"[1]深圳市福田区中医院检验科,广东 深圳,518034;[2]深圳市福田人民医院,广东 深圳,518034;",医学临床研究,脑源性神经营养因子/代谢;受体蛋白质酪氨酸激酶类/代谢;子宫内膜肿瘤/病理学;免疫组织化学;,R737.33,2015,,8
hainanyxyxb201302004,1,"ISTIC,PKU",两种剂型琥乙红霉素药动学及生物等效性研究,,沈时鹏[1];吴铁松[2];,"[1]深圳市福田区妇幼保健院药剂科,广东深圳,518026;[2]深圳市观澜人民医院,广东深圳,518000;",海南医学院学报,琥乙红霉素;药动学;生物等效性;,R97,2013,19,2
gdybfz201505012,5,"ISTIC,PKU",社区口腔健康教育对居民口腔菌斑控制的影响,,葛风华[1];唐世平[2];张国明[1];刘春子[1];曹晶[1];赖晓洁[1];刘惠灵[1];朱兰英[1];,"[1]深圳市宝安区中医院口腔科,广东深圳,518000;[2]深圳市光明新区人民医院口腔科;",广东牙病防治,口腔健康教育;社区;口腔菌斑;,R780.1,2015,23,5
zgxkx201606049,0,"ISTIC,PKU",大败毒胶囊对梅毒血清固定患者外周血Treg/Th17比例及CD4+CD25+T细胞水平的影响,10.3969/j.issn.1672-1993.2016.06.048,胡鹏飞[1];胡南[2];葛亮[3];任燕[1];冉灵芝[1];,"[1]深圳市光明新区人民医院皮肤性病科,广东深圳,518106;[2]深圳市宝安区人民医院,广东深圳,518102;[3]深圳市光明新区疾病预防控制中心,广东深圳,518106;",中国性科学,大败毒胶囊;梅毒血清固定;外周血Treg/Th17;CD4+ CD25+T细胞;,R759.1,2016,25,6
zgjcyy201205009,3,"ISTIC,PKU",不同体表面积小儿腹腔镜手术中最佳气腹压力探讨,10.3760/cma.j.issn.1008-6706.2012.05.009,易旦冰[1];丁建林[1];周晓梅[2];吴志华[1];许欣[1];任从才[1];,"[1]广东医学院附属深圳福田人民医院深圳市第四人民医院手术室,广东省深圳,518033;[2]深圳市福田区妇幼保健院妇产科;",中国基层医药,腹腔镜手术;小儿;气腹压力;体表面积;并发症;,R714.223,2012,19,5
tlsjyyj201622062,1,,中医康复护理在脑卒中患者中的应用,10.3969/j.issn.1672-9676.2016.22.062,吴海燕;曾瑶;,"[1]深圳市宝安区中医院脑病科, 深圳市 广东省深圳市宝安区人民医院消化内镜中心,518000",护理实践与研究,中医康复;脑卒中;针灸;按摩;护理;,,2016,13,22
zgzyjz201207092,1,,颈痛汤配合针灸治疗椎动脉型颈椎病68例,10.3969/j.issn.1004-745X.2012.07.092,郭福[1];罗柳阳[1];谢淑慧[2];,"[1]广东省深圳市宝安区中医院,广东深圳,518133;[2]广东省深圳市宝安区观澜人民医院,广东深圳,518133;",中国中医急症,椎动脉型颈椎病;颈痛汤;针灸治疗;,R681.5+5,2012,21,7
yycyzx201418008,6,,Ki67、GFAP在人脑恶性胶质瘤病理分级中的意义,,陈梅花[1];陈贵珍[1];贾万钧[1];邹桂华[2];,"[1]深圳市宝安区中医院病理科,广东深圳,518100;[2]深圳市宝安区人民医院病理科,广东深圳,518100;",中国医药导报,胶质瘤;Ki67;GFAP;,R73-3,2014,,18
sxyxjy201506029,0,,健康成人血浆D-二聚体免疫比浊法正常参考区间的建立,10.3969/j.issn.1671-7414.2015.06.029,刘晓鸽[1];姚伟[2];房笃智[3];,"[1]深圳市宝安区福永人民医院检验科,广东深圳,518103;[2]深圳市宝安区松岗人民医院检验科,广东深圳,518100;[3]深圳市宝安区人民医院检验科,广东深圳,518001;",现代检验医学杂志,健康成人;血浆D-二聚体;免疫比浊法;参考区间;,R446.112,2015,30,6
zhonggba201404022,0,,医院评审对病案统计工作质量的影响,10.3969/j.issn.1672-2566.2014.04.022,廖慧群[1];赖伏虎[2];,"[1]518106,深圳市 深圳市光明新区人民医院病案统计科;[2]518101,深圳市 深圳市宝安区人民医院信息统计科;",中国病案,医院评审;病案统计;工作质量;持续改进;,,2014,,4
gzyxyxb201303035,2,,中药沐足对改善中风后失眠患者睡眠质量疗效观察,10.3969/j.issn.1008-1836.2013.03.035,蔡军红[1];张宇霞[2];吴碧梅[1];彭海燕[1];卢艳芳[1];,"[1]深圳市宝安区人民医院,广东,深圳,518100;[2]深圳市宝安区中医院,广东,深圳,518100;",广州医学院学报,中药;中风后失眠;改善睡眠质量;,R743,2013,41,3
hljyx201606010,0,,纤维桩联合树脂核全冠修复后牙大面积缺损的效果,10.3969/j.issn.1004-5775.2016.06.009,邱健青[1];刘娜[2];许伟强[1];,"[1]深圳市宝安区福永人民医院和平社区健康服务中心,广东深圳,518103;[2]深圳市福田区妇幼保健院口腔科,广东深圳,518000;",黑龙江医学,后牙缺损;纤维桩;树脂核;全冠修复;,R781.05,2016,40,6
