zgwszcyj201602007,1,"ISTIC,PKU",深圳市劳务工和非劳务工社区卫生服务利用及满意度对比分析,10.3969/j.issn.1674-2982.2016.02.007,王洪锐[1];邱创良[1];邓剑[1];周艳凤[2];李丽清[3];董晓欣[2];卢祖洵[2];,[1]深圳市宝安区福永人民医院社区健康服务管理中心 广东深圳 518103;[2]华中科技大学同济医学院公共卫生学院 湖北武汉 430030;[3]华中科技大学同济医学院公共卫生学院 湖北武汉 430030; 江西科技师范大学经济管理学院 江西南昌 330031;,中国卫生政策研究,社区卫生服务;社区首诊;满意度;,R197,2016,9,2
gwyx-lcsw201613024,1,"ISTIC,PKU",应用实时荧光定量PCR技术分析 UGT1A1基因启动子区 A（TA）nTAA 多态性,10.3969/j.issn.1673-4130.2016.13.023,徐羽中[1];陈群蓉[2];孙顺昌[1];彭运生[1];,[1]广东省深圳市宝安区人民医院 检验科 518101;[2]广东省深圳市宝安区人民医院 输血科 518101;,国际检验医学杂志,UGT1A1基因;多态性;实时荧光定量PCR;,,2016,37,13
zglcyxyxzz201303019,11,"ISTIC,PKU",经阴道超声对宫外孕时妊娠黄体形态与位置的研究,10.3969/j.issn.1008-1062.2013.03.019,罗萍[1];黄毅华[2];周穗华[1];周杰辉[1];赖祝琴[1];寇燕妮[1];袁丽云[1];,"[1]深圳市宝安西乡人民医院超声诊断科,广东深圳,518102;[2]深圳市宝安区中医院,广东深圳,518133;",中国临床医学影像杂志,"妊娠,异位;黄体;超声检查;",R714.22  R445.1,2013,24,3
lczlxzz201502002,2,,nm23-H1基因转染对肺癌细胞 MMP-9和 TIMP-1表达的影响?,,郑海霞[1];崔永言[2];申东兰[3];彭安[3];何艳玲[3];,"[1]518036,广东深圳 北京大学深圳医院体检科;[2]518036,北京大学深圳医院整形外科;[3]518036,北京大学深圳医院肿瘤内科;",临床肿瘤学杂志,nm23-H1;肺癌细胞株;基质金属蛋白酶9;金属蛋白酶组织抑制物1;,R734.2,2015,,2
zgsjjsjbzz201407001,9,"ISTIC,PKU",增强型体外反搏对缺血性卒中患者动脉弹性的影响,10.3936/j.issn.1002-0152.2014.07.001,周国强;黄宗青;肖剑伟;王玉光;晏晓琨;,[1]深圳市福田人民医院神经内科 深圳 518033,中国神经精神疾病杂志,增强型体外反搏;脉搏波传导速度;心踝血管指数;缺血性卒中;,R743.3,2014,,7
gzzyydxxb201605004,0,"ISTIC,PKU",2型糖尿病肾病中医证型与TWEAK等炎症因子相关性试验研究,10.13359/j.cnki.gzxbtcm.2016.05.004,宋群利[1];孙惠力[2];李顺民[2];,"[1]广州中医药大学附属深圳市宝安区中医院,广东深圳,518000;[2]广州中医药大学附属深圳市中医院,广东深圳,518000;",广州中医药大学学报,糖尿病肾病;中医证型;炎症因子;肿瘤坏死样凋亡微弱诱导因子(TWEAK);白细胞介素-1β;白细胞介素-10;,R587.2,2016,33,5
hainanyx201616019,0,"ISTIC,PKU",社区卫生中心对2型糖尿病患者实施运动指导干预的效果与成本分析,10.3969/j.issn.1003-6350.2016.16.019,吴广[1];孙奕[2];黄斯夫[3];,"[1]武汉市华中科技大学同济医学院，湖北 武汉 430100; 深圳市宝安区人民医院社管中心，广东 深圳 518100;[2]深圳市宝安区人民医院社管中心,广东 深圳,518100;[3]武汉市华中科技大学同济医学院,湖北 武汉,430100;",海南医学,社区卫生中心;2型糖尿病;运动指导;效果;成本;,R587.1,2016,27,16
tjykdxxb201402023,3,"ISTIC,PKU",腺病毒介导的SOCS1对模拟银屑病小鼠模型的影响,10.3870/j.issn.1672-0741.2014.02.023,曾凡杞[1];廖明[2];张志云[1];李永双[1];胡波[3];,"[1]深圳市光明新区人民医院皮肤科,深圳,518106;[2]深圳市光明新区中心医院药剂科,深圳,518107;[3]中山大学附属第三医院检验科,广州,510630;",华中科技大学学报（医学版）,银屑病;细胞因子信号抑制因子1;腺病毒;,R758.63,2014,,2
shandyy201338017,4,"ISTIC,PKU",高频超声对下肢骨折并软组织挫伤患者下肢深静脉血栓形成的应用价值,10.3969/i.issn.1002-266X.2013.38.017,相广财;陈明;李桔莲;,"[1]深圳市宝安人民医院,广东深圳,518100",山东医药,高频超声;下肢静脉血栓;骨折;软组织挫伤;,R445.1,2013,53,38
syzdyzlzz201212044,21,"ISTIC,PKU",卡前列素氨丁三醇联合改良式B-Lynch缝合术治疗剖宫产产后出血40例临床分析,,韦瑞红;伍丽群;彭碧玲;,"[1]广东医学院附属福田医院妇产科,广东省深圳市,518033",中华实用诊断与治疗杂志,产后出血;卡前列素氨丁三醇;B-Lynch缝合术;,R719.9,2012,26,12
jgzz201504015,0,"ISTIC,PKU",基于量子点荧光标记技术检测SCCa方法的研究,10.14016/j.cnki.jgzz.2015.04.052,田峰[1];齐素文[2];,"[1]广东省深圳市光明新区人民医院检验科,广东深圳,518110;[2]深圳大学医学院生物医学工程系,广东深圳,518060;",激光杂志,量子点;荧光免疫;SCCa;,TN248,2015,36,4
zgsyzdx201205011,0,"ISTIC,PKU",T24膀胱癌细胞ARID1A基因的表达与细胞增殖活力相关性研究,10.3969/j.issn.1007-4287.2012.05.011,吴金斌[1];漆正宇[2];晏耀明[1];翟庆娜[1];余振东[1];,"[1]北京大学深圳医院,检验科;[2]北京大学深圳医院,男性生殖与遗传重点实验室,广东,深圳518036;",中国实验诊断学,膀胱移行细胞癌;T24;ARID1A;增殖;亚克隆细胞株;,R737.14,2012,16,5
abjbtb201502012,1,"ISTIC,PKU",nm23-H1基因转染对肺癌L9981细胞黏附分子表达的影响,10.3969/j.issn.1004-616x.2015.02.012,郑海霞[1];崔永言[2];申东兰[3];彭安[3];何艳玲[3];,"[1]北京大学深圳医院体检科,广东深圳,518036;[2]北京大学深圳医院整形外科,广东深圳,518036;[3]北京大学深圳医院肿瘤内科,广东深圳,518036;",癌变·畸变·突变,nm23-H1;肺癌细胞;钙调素;整合素;肿瘤转移;,R730.2,2015,27,2
zggzsszz201608014,0,"ISTIC,PKU",原发性骨质疏松症PRO量表的科学性考核,10.3969/j.issn.1006-7108.2016.08.014,孙友强[1];邵敏[2];何挺[3];曾振明[4];姜涛[1];汪钦生[2];王茂澎[5];刘庆思[2];陈雷雷[6];,"[1]广州中医药大学,广州,510405;[2]广州中医药大学第三附属医院,广州,501240;[3]广州市荔湾区骨伤科医院,广州,510140;[4]深圳市宝安区中医院,深圳,518133;[5]佛山市顺德中医院,佛山,528333;[6]广州中医药大学第一附属医院,广州,510405;",中国骨质疏松杂志,原发性骨质疏松症;患者报告的临床结局;量表;科学性考评;项目反应理论;,R681,2016,22,8
zhcsyx201508021,0,"ISTIC,PKU",聚焦超声开放血脑屏障治疗脑胶质瘤疗效的实验研究,10.3760/cma.j.issn.1004-4477.2015.08.021,潘敏[1];张天奉[1];王峰[2];邹超[3];万倩[3];吴碧峰[3];刘新[3];郑海荣[3];,"[1]518034,深圳市福田区中医院超声影像科;[2]深圳北京大学香港科技大学医学中心;[3]中国科学院深圳先进技术研究院;",中华超声影像学杂志,高强聚焦超声;血脑屏障;脂质体;微气泡;神经胶质瘤;,,2015,,8
zggzsszz201607002,0,"ISTIC,PKU",原发性骨质疏松症PRO量表的初步研制,10.3969/j.issn.1006-7108.2016.07.002,孙友强[1];邵敏[2];姜涛[1];曾振明[3];何挺[4];汪钦生[2];王茂澎[5];徐绍俊[1];黄建烽[1];,"[1]广州中医药大学,广州,510405;[2]广州中医药大学第三附属医院,广州,510240;[3]深圳市宝安区中医院,深圳,518133;[4]广州市荔湾区骨伤科医院,广州,510140;[5]佛山市顺德中医院,佛山,528333;",中国骨质疏松杂志,原发性骨质疏松症;患者报告结局量表;量表;研制;,R68,2016,22,7
zgnxgbzz201410003,2,"ISTIC,PKU",SPECT与CT影像融合在烟雾病血管重建术中的应用价值,10.3969/j.issn.1672-5921.2014.10.003,齐辉[1];赵雷[2];吴广源[1];郑思阳[1];黄达[1];尹卫[1];杨红杰[3];贾少微[3];,"[1]518000,北京大学深圳医院神经外科;[2]518000,北京大学深圳医院 特诊老年病科;[3]518000,北京大学深圳医院 核医学科;",中国脑血管病杂志,"脑底异常血管网病;体层摄影术,发射型计算机,单光子;体层摄影术,X线计算机;颞浅动脉-大脑中动脉旁路移植术;",,2014,,10
zgyyzn201317088,2,"ISTIC,PKU",胸腹严重多发创伤的临床救治研究,10.3969/j.issn.1671-8194.2013.17.088,彭家桃[1];李浩[2];陶珍[2];钟育红[1];张贵昌[1];周惠芬[1];,"[1]深圳市第四人民医院广东医学院附属福田医院急诊科,广东深圳,518033;[2]深圳市第四人民医院广东医学院附属福田医院重症医学科,广东深圳,518033;",中国医药指南,胸腹伤;多发创伤;救治;手术;,R605,2013,,17
zgpfxbxzz201202004,0,"ISTIC,PKU",卡泊三醇对小鼠黑素瘤B16细胞增殖及凋亡的影响,,叶蓉[1];周亮[2];胡小平[1];彭曦[1];,"[1]北京大学深圳医院皮肤科,广东深圳,518036;[2]北京大学深圳医院中心实验室,广东深圳,518036;",中国皮肤性病学杂志,卡泊三醇;小鼠黑素瘤B16;增殖抑制率;凋亡率;,R739.5,2012,26,2
zgyyyx201511017,0,"ISTIC,PKU",临床药师参与救治难治性李斯特菌脑膜炎病例分析,10.13286/j.cnki.chinhosppharmacyj.2015.11.17,徐仿周[1];张红宇[2];周学琴[1];鲁玉珍[1];何光明[1];,"[1]北京大学深圳医院药学部,广东深圳,518036;[2]北京大学深圳医院血液内科,广东深圳,518036;",中国医院药学杂志,难治性李斯特菌脑膜炎;临床药师;药学监护;免疫母细胞性T细胞淋巴瘤;,R969.3,2015,35,11
zhsjyxzz201503014,1,"ISTIC,PKU",婴儿患者脑肿瘤的MRI表现分析(附12例报道),10.3760/cma.j.issn.1671-8925.2015.03.014,冯吕金[1];王显龙[1];李慧燕[2];于昊[1];路世龙[1];蒋山姗[3];温志波[1];,"[1]南方医科大学珠江医院影像诊断科,广州,510282;[2]南方医科大学南方医院影像中心,广州,510515;[3]518034,深圳市福田区中医院放射科;",中华神经医学杂志,脑肿瘤;婴儿;磁共振成像;,R739.41,2015,14,3
tjykdxxb201506024,0,"ISTIC,PKU",白塞病患者外周血 CD4＋和 CD8＋T 细胞上ICOS 与 CD28共表达水平及与疾病的关系,10.3870/j.issn.1672-0741.2015.06.021,樊超[1];陈宏翔[2];,"[1]深圳市福永人民医院皮肤科,深圳,518103;[2]华中科技大学同济医学院附属协和医院皮肤科,武汉,430022;",华中科技大学学报（医学版）,白塞病;可诱导共刺激分子;细胞表面分子;,R593.2,2015,,6
zgcsyxzz201201023,0,"ISTIC,PKU",孕周影响超声引导下脐静脉穿刺成功率的研究,10.3969/j.issn.1002-0101.2012.01.023,石宇[1];张静媛[2];邓玉清[2];张蒂荣[1];,"[1]北京大学深圳医院超声影像科,广东省深圳市,518036;[2]北京大学深圳医院产前诊断中心,广东省深圳市,518036;",中国超声医学杂志,孕周;超声引导下脐静脉穿刺;,R446.11,2012,28,1
lcgdbzz201412045,1,"ISTIC,PKU",肝脏非实质细胞在肝脏缺血再灌注损伤中的作用,10.3969/j.issn.1001-5256.2014.12.033,吴刚[1];郑洁[2];胡国信[3];彭雁忠[3];,"[1]北京大学深圳医院 感染科，广东 深圳518036; 九江市第一人民医院 肝病科，江西 九江332000;[2]北京大学深圳医院 中医科,广东 深圳,518036;[3]北京大学深圳医院 感染科,广东 深圳,518036;",临床肝胆病杂志,肝疾病;再灌注损伤;枯否细胞;内皮细胞;树突细胞;综述;,R575,2014,,12
hgzy201324016,1,"ISTIC,PKU",消化科及肛肠科护士对克罗恩病专科相关知识的调查,,陈小华[1];黄健[1];刘付英聪[2];夏韶华[1];邓卫萍[1];,"[1]广东医学院附属福田医院消化内科,广东深圳,518033;[2]广东医学院附属福田医院肛肠分院,广东深圳,518033;",中外医疗,护士;克罗恩病;健康教育;,R192.6,2013,32,24
zgpfxbxzz201209021,10,"ISTIC,PKU",婴儿湿疹相关风险因素调查分析,,何大保[1];周国茂[2];李真[2];吴育庆[2];郭宁燕[2];,"[1]深圳市观澜人民医院,广东深圳,518110;[2]深圳市南山区慢性病防治院,广东深圳,518054;",中国皮肤性病学杂志,"婴儿湿疹,特应性;问卷调查;接种疫苗;糠秕马拉色菌;金黄色葡萄球菌;",R758.23,2012,26,9
syhlzz201323014,8,"ISTIC,PKU",耳穴埋豆结合情志护理对颈性眩晕病患者的效果评价,10.3760/cma.j.issn.1672-7088.2013.23.014,李美冰;钟慧红;李贺;,"[1]518103,广东省深圳市宝安区中医院",中国实用护理杂志,耳穴埋豆;颈性眩晕病;情志护理;,,2013,29,23
syhlzz201316015,19,"ISTIC,PKU",踝泵运动对预防外科术后患者深静脉血栓形成的临床研究,10.3760/cma.j.issn.1672-7088.2013.16.015,易小青;傅爱凤;付爱民;黎惠娟;曾秋霞;,"[1]518101,广东省深圳市宝安区人民医院",中国实用护理杂志,踝泵运动;外科;深静脉血栓形成;护理干预;,,2013,29,16
lcfsxzz201308003,13,"ISTIC,PKU",颅底软骨肉瘤与软骨瘤影像征象对照分析,,张水兴[1];郭建东[2];曾莎莎[2];陈文波[1];,"[1]广东省人民医院(广东省医学科学院)放射科,广州,510080;[2]518034,深圳市福田区中医院放射科;",临床放射学杂志,"颅底;软骨肉瘤;软骨瘤;体层摄影术,X线计算机;磁共振成像;",,2013,32,8
ytctyy201306052,1,"ISTIC,PKU",可冲洗负压封闭引流治疗腹部手术后感染伤口临床效果观察,10.3969/j.issn.1673-2197.2013.06.052,彭家桃[1];李浩[2];钟育红[1];张贵昌[1];周惠芬[1];刘兰香[1];,"[1]深圳市第四人民医院广东医学院附属福田医院急诊科,广东深圳,518033;[2]深圳市第四人民医院广东医学院附属福田医院重症医学科,广东深圳,518033;",亚太传统医药,腹部手术;术后伤口感染;可冲洗负压封闭引流;,R619+.3,2013,9,6
zgnkxzz201502002,0,"ISTIC,PKU",睾丸特异性基因BC051628在小鼠中的表达及生物信息学分析,10.3969/j.issn.1008-0848.2015.02.002,李俞池[1];林首任[2];罗满玲[1];郭焕[3];吴汉伟[4];江智茂[2];桂耀庭[2];,"[1]北京大学深圳医院,深圳市男性生殖与遗传重点实验室,深圳518036;汕头大学医学院;[2]北京大学深圳医院,深圳市男性生殖与遗传重点实验室,深圳518036;[3]北京大学深圳医院,深圳市男性生殖与遗传重点实验室,深圳518036;广州医科大学;[4]深圳市第二人民医院;",中国男科学杂志,基因;睾丸;计算生物学;精子发生;,R349.6  R698.2,2015,29,2
zhptwk201604016,2,"ISTIC,PKU",胃十二指肠穿孔保守治疗闭合后穿孔病因的早期诊断,10.3760/cma.j.issn.1007-631X.2016.04.016,陈钢;刘业星;庄哲宏;张剑宝;何葵;梁智浩;,"[1]518033,深圳市第四人民医院(深圳市福田人民医院)胃肠外科",中华普通外科杂志,消化性溃疡穿孔;胃镜检查;,,2016,31,4
zhlnyx201305012,4,"ISTIC,PKU",老年2型糖尿病患者颈动脉粥样硬化与胰岛素抵抗的相关分析,10.3760/cma.j.issn.0254-9026.2013.05.012,王田琪[1];李振华[1];刘幼硕[2];李阳华[1];,"[1]518106,深圳市光明新区人民医院内分泌科;[2]中南大学湘雅二医院老年病科;",中华老年医学杂志,"糖尿病,2型;动脉粥样硬化;胰岛素抗药性;",,2013,32,5
syhlzz2012z1135,8,"ISTIC,PKU",防压疮体位垫在俯卧位脊柱手术中的应用研究,10.3760/cma.j.issn.1672-7088.2012.z1.135,傅玉萍;郭健凌;李霞;谢雪莲;,"[1]518103,广东省深圳市宝安区福永人民医院手术室",中国实用护理杂志,体位垫;俯卧位;脊柱手术;护理;,R47,2012,28,z1
zhblx201405011,1,"ISTIC,PKU",双层细胞球模型的建立及其在研究结肠癌细胞-成纤维细胞相互作用对缝隙连接蛋白C x43表达影响中的应用,10.3760/cma.j.issn.0529-5807.2014.05.010,赵志敏[1];林山力[2];文欢[2];邓红[2];,"[1]310058 杭州，浙江大学医学院病理与病理生理学系; 深圳市光明新区人民医院检验科;[2]浙江大学医学院病理与病理生理学系, 杭州,310058;",中华病理学杂志,"结直肠肿瘤;成纤维细胞;细胞交流;细胞系,肿瘤;",,2014,,5
zgylqy201211038,6,"ISTIC,PKU",三维超声成像在甲状腺复杂结节定性诊断的价值与细针穿刺组织活检对比,10.3969/j.issn.1673-5552.2012.11.0038,徐甫[1];肖仕琪[1];邱华文[2];黄清南[2];郭文涛[2];何涛君[3];,"[1]广东医学院附属深圳市福田人民医院体检科B超室,518033;[2]广东医学院附属深圳市福田人民医院外科,518033;[3]广东医学院附属深圳市福田人民医院检验医学部,518033;",中国医疗前沿,甲状腺结节;三维超声;细针穿刺;,R445.1  R446.8,2012,07,11
zgyydk201308063,4,"ISTIC,PKU",鞘内注射不同剂量舒芬太尼联合罗哌卡因分娩镇痛临床疗效观察,10.3969/j.issn.1009-0959.2013.08.063,邓扬;白静珉;袁翔;尚云海;袁春梅;王瑞敏;,"[1]深圳市福田妇幼保健院麻醉科,深圳,518045",中国医药导刊,舒芬太尼;罗哌卡因;分娩镇痛;,R614,2013,,8
shyxjyzz201508001,0,"ISTIC,PKU",尿 hepcidin-25检测在儿童铁缺乏症早期诊断中的应用,10.3969/j.issn.1673-8640.2015.08.001,徐霜清[1];邹小凤[1];马国祥[2];徐克前[3];,"[1]广州金域医学检验中心,广东广州,510330;[2]深圳福永人民医院,广东深圳,518103;[3]中南大学湘雅医学院医学检验系,湖南长沙,410000;",检验医学,hepcidin-25;铁缺乏;诊断试验;性能;,R446.1,2015,,8
syqkyx201303048,24,"ISTIC,PKU",阴道助产术与剖宫产术在足月妊娠临产胎儿宫内窘迫中的应用效果,,杨建恩;刘圣英;黄艳莉;,"[1]518106,广东省深圳市光明新区人民医院产科",中华全科医学,阴道助产术;剖宫产术;足月妊娠胎儿窘迫;,R719.3  R719.8,2013,11,3
zhcsyx201408029,0,"ISTIC,PKU",超声诊断胎儿颈位主动脉弓1例,10.3760/cma.j.issn.1004-4477.2014.08.029,何光智;孔卫萍;国凤梅;吴一彬;周勤鹏;方耿周;杨梅青;,"[1]518106,深圳市光明新区人民医院超声科",中华超声影像学杂志,,,2014,23,8
xdkf201605009,0,"ISTIC,PKU",两种不同Duchenne型肌营养不良症模型鼠神经肌肉接头结构的比较,10.3969/j.issn.2095-4344.2016.05.009,孔杰[1];操基清[2];杨娟[2];陈菲[2];李亚勤[2];张成[2];,"[1]中山大学第一附属医院神经科，广东省广州市 510080; 广州中医药大学附属宝安区中医院脑病科，广东省深圳市 518133;[2]中山大学第一附属医院神经科,广东省广州市,510080;",中国组织工程研究,实验动物;神经损伤与修复动物模型;Duchenne型肌营养不良症;神经肌肉接头;乙酰胆碱受体;,R318,2016,20,5
cqyx201422017,26,"ISTIC,PKU",标本溶血对生化检验结果的干扰和影响及对策研究,10.3969/j.issn.1671-8348.2014.22.017,罗祖军[1];邹德学[2];王强[1];蔡仲仁[1];薛燕芬[1];林棋荣[1];,"[1]深圳市龙岗区横岗人民医院检验科,广东深圳,518115;[2]北京大学深圳医院检验科,广东深圳,518036;",重庆医学,标本溶血;生化检验;影响因素;研究对策;,R446.119,2014,,22
zhptwk201610010,0,"ISTIC,PKU",宽适应证非手术治疗胃十二指肠溃疡穿孔,10.3760/cma.j.issn.1007-631X.2016.10.010,陈钢;刘业星;庄哲宏;张剑宝;谭诗成;张冬辉;何葵;梁智浩;黄睿;,"[1]518033,中山大学附属第八医院(深圳市第四人民医院、深圳市福田人民医院)胃肠外科",中华普通外科杂志,消化性溃疡穿孔;综合疗法;适应证;,,2016,31,10
gdyx201410065,4,"ISTIC,PKU",胸腔镜下肺大泡切除术的手术配合,,黄丽仪;徐继海;李华忠;陈飞强;江丹;,[1]广东省深圳市龙华新区观澜人民医院手术室 518110,广东医学,胸腔镜;肺大泡;手术配合;,,2014,,10
shanxzy201612016,1,"ISTIC,PKU",七厘散穴位贴敷对髋膝关节置换术后深静脉血栓形成的防治,10.3969/j.issn.1000-7369.2016.12.016,张柱基[1];庞瑞明[1];潘海文[2];邢庆嘉[2];谭景超[2];,[1]广东省深圳市宝安中医院 深圳518000;[2]广州中医药大学 广州510000;,陕西中医,静脉血栓形成/中西医结合疗法;穴位贴敷法;@七厘散;,R687.4,2016,37,12
lnxxgbzz201305011,6,"ISTIC,PKU",主动脉内球囊反搏对急性重症心肌炎心力衰竭患者室性心律失常的影响,10.3969/j.issn.1007-9688.2013.05.011,谭振宇[1];杨大浩[1];廖春燕[2];,"[1]深圳市宝安区人民医院心血管内科,广东深圳,518101;[2]深圳市宝安区人民医院内分泌科,广东深圳,518101;",岭南心血管病杂志,室性心律失常;主动脉内球囊反搏;心力衰竭;,R541.7,2013,19,5
zgsyzdx201404020,2,"ISTIC,PKU",线性阵列基因分型技术检测女性尿液中人类乳头瘤病毒,,范世珍;莫莉;陈安彬;,"[1]深圳市福田区中医院 检验科,广东 深圳,518034",中国实验诊断学,人乳头瘤病毒;尿液;筛查;,R446.7,2014,,4
xdkf2014z1030,2,"ISTIC,PKU",引发神经外科患者肺部感染的病原菌分布及其易感因素分析,,李文郎;唐恒锋;谢松生;,"[1]深圳市龙华新区观澜人民医院,广东省深圳市,518110",中国组织工程研究,神经外科;肺部感染;病原菌;易感因素;,,2014,,z1
zgkqhmwkzz201604011,0,"ISTIC,PKU",累及侧颅底肿瘤手术切口的临床分析,,孔杰[1];杨宏宇[1];王宇帆[2];杨辉俊[2];沈时岳[2];王锋[2];,"[1]安徽医科大学北京大学深圳医院 临床学院,广东 深圳518036;北京大学深圳医院 口腔颌面外科,广东深圳518036;[2]北京大学深圳医院 口腔颌面外科,广东深圳,518036;",中国口腔颌面外科杂志,肿瘤;侧颅底;手术切口;,R739.8,2016,14,4
xdhl201318011,4,"ISTIC,PKU",质量管理小组活动对PICC门诊患者治疗间歇期堵管率的影响,10.3760/cma.j.issn.1674-2907.2013.18.008,龚海琴[1];范爱飞[1];贾宏[2];张杰[1];吴清香[3];,"[1]518036,北京大学深圳医院操作治疗区;[2]518036,北京大学深圳医院营养科;[3]518036,北京大学深圳医院门诊办公室;",中华现代护理杂志,PICC;并发症;堵管;质量管理小组;,,2013,19,18
zgqkyx201316007,3,"ISTIC,PKU",社区健康服务机构员工对绩效管理的满意度现状研究,10.3969/j.issn.1007-9572.2013.06.007,王贤初[1];郝晓宁[2];巫云辉[1];杨青[1];邱德星[1];李惠霞[1];麦艳冰[1];,"[1]广东省深圳市光明新区人民医院社区健康服务管理中心,518106;[2]卫生部卫生发展研究中心,北京市,100191;",中国全科医学,社区卫生服务;绩效管理;绩效考核;满意度;,R197,2013,16,16
lcfkzz201309005,6,"ISTIC,PKU",下呼吸道鲍曼不动杆菌感染的临床分布及耐药性分析,10.3969/j.issn.1009-6663.2013.09.005,何臣[1];徐羽中[2];李元广[1];徐效峰[1];,"[1]深圳市宝安区人民医院呼吸内科,广东深圳,518101;[2]深圳市宝安区人民医院检验科,广东深圳,518101;",临床肺科杂志,鲍曼不动杆菌;临床分布;耐药性;,,2013,18,9
yxzs201502067,2,"ISTIC,PKU",剖宫产术后瘢痕妊娠患者介入栓塞联合灌注甲氨蝶呤化疗的临床观察,10.3969/j.issn.1006-2084.2015.02.067,林堆贤[1];邓志锋[1];梅宝富[1];陈红[2];陈琳[1];,"[1]深圳市宝安区人民医院介入科,广东深圳,518101;[2]深圳市宝安区人民医院妇产科,广东深圳,518101;",医学综述,剖宫产;瘢痕妊娠;介入栓塞;灌注甲氨蝶呤化疗;,R713.8,2015,21,2
syfsxzz201608002,0,"ISTIC,PKU",MRI T1 W-SPACE对缺血性脑血管病的诊断价值,10.3969/j.issn.1002-1671.2016.08.002,吴菊芳;李锦;赵均雄;冯晓荣;陈志军;梁立华;,"[1]深圳市福田人民医院影像科,广东 深圳,518003",实用放射学杂志,脑血管病;磁共振成像;血管造影术;,R743  R445.2  R814.43,2016,32,8
zgmyxzz201207016,9,"ISTIC,PKU",调节性T细胞及其分泌的细胞因子在再生障碍性贫血中的意义,10.3969/j.issn.1000-484X.2012.07.016,黄国清[1];刘秋爽[1];程永红[1];黎阳[2];郭敏[3];郭强忠[1];金鑫[1];李文郎[1];,"[1]深圳市宝安区观澜人民医院,深圳,518110;[2]湛江中心人民医院,湛江,5240373;[3]广东省人民医院,广州,510080;",中国免疫学杂志,再生障碍性贫血;T细胞亚群;调节性T细胞;,R733.7,2012,28,7
zhcsyx201411025,0,"ISTIC,PKU",聚焦超声开放血脑屏障联合用药治疗脑胶质瘤的实验研究,10.3760/cma.j.issn.1004-4477.2014.11.024,潘敏[1];张天奉[1];邹超[2];万倩[2];刘新[2];郑海荣[2];,"[1]518034,深圳市福田区中医院超声影像科;[2]中国科学院深圳先进技术研究院;",中华超声影像学杂志,"超声 ,高强聚焦;血脑屏障;神经胶质瘤;微气泡;脂质体;",,2014,,11
zgzyykj201603047,2,"ISTIC,PKU",热敏点灸结合少腹逐瘀汤治疗子宫内膜异位症保守手术后的临床疗效观察,,陈莉;杜昊;张雯;,[1]广东省深圳市宝安中医院 广东深圳518133,中国中医药科技,,,2016,23,3
zgsjjsjbzz201603001,1,"ISTIC,PKU",增强型体外反搏对缺血性脑卒中患者超敏C反应蛋白和内皮素1的影响,10.3969/j.issn.1002-0152.2016.03.001,周国强;黄宗青;张志;肖剑伟;张娟;王玉光;,[1]深圳市福田人民医院神经内科 深圳 518033,中国神经精神疾病杂志,增强型体外反搏;超敏C反应蛋白;内皮素1;缺血性脑卒中;,R743.3,2016,42,3
ykxjz201509011t,0,"ISTIC,PKU",无ROP早产儿视盘周围视网膜神经纤维层及黄斑区视网膜和脉络膜厚度分析,10.13389/j.cnki.rao.2015.0230,郑璟[1];柯晓云[1];徐进[2];张燕[1];陈伟宾[1];,"[1]南方医科大学珠江医院眼科, 广东省广州市,510282;[2]南方医科大学附属深圳宝安人民医院骨关节科, 广东省深圳市,518101;",眼科新进展,光学相干断层扫描;脉络膜;视网膜;早产儿;,,2015,35,9
zgsyxyxzz201502044,1,"ISTIC,PKU",中国汉族人群UGT1A1基因非翻译区序列分析,10.7534/j.issn.1009-2137.2015.02.044,孙顺昌[1];陈群蓉[2];陈曦[1];彭运生[1];,"[1]深圳市宝安区人民医院中心实验室,广东深圳,518101;[2]深圳市宝安区人民医院输血科,广东深圳,518101;",中国实验血液学杂志,中国汉族人群;UGT1A1基因;非翻译区;,Q75,2015,23,2
shandyy201316026,3,"ISTIC,PKU",梅毒孕妇产后血清固定者5年随访结果分析,10.3969/j.issn.1002-266X.2013.16.026,李永双;张志云;张晓丽;,"[1]深圳市光明新区人民医院,深圳,518106",山东医药,梅毒;血清固定;细胞免疫;心理状况;孕妇;随访;,R759.14,2013,53,16
