tlsjyyj201511069,2,"ISTIC,PKU",预防性护理在普外科术后患者静脉导管感染中的应用,10.3969/j.issn.1672-9676.2015.11.068,石喜华;冀满丰;刘京海;,"[1]518109,深圳市 广东省深圳市龙华新区人民医院",护理实践与研究,预防性护理;普外科;静脉导管感染;,,2015,,11
zgsyyy201516064,0,"ISTIC,PKU",手法复位屈曲位固定治疗第2~5掌骨骨折,10.14163/j.cnki.11-5547/r.2015.16.064,王克列;肖春生;叶志辉;马立峰;杨延军;张子清;,"[1]518116,深圳市龙岗区骨科医院",中国实用医药,掌骨骨折;手法复位;屈曲位;固定;,,2015,,16
zgyyzn201430079,1,"ISTIC,PKU",脊柱后路截骨内固定治疗强直性脊柱炎后凸畸形的探讨,,郭志刚[1];魏雪春[2];,"[1]深圳市龙岗区骨科医院,广东 深圳,518116;[2]深圳市宝安区中医院,广东 深圳,518101;",中国医药指南,脊柱后路截骨内固定;强直性脊柱炎后凸畸形;疗效;,R593.23,2014,,30
yycyzx201325028,12,"ISTIC,PKU",不同剂量生大黄粉防治危重病患者胃肠并发症的临床研究,10.3969/j.issn.1673-7210.2013.25.028,余坤城;谢江霞;张晓瑜;,"[1]广东省深圳市龙岗区人民医院急诊科,广东深圳,518172",中国医药导报,危重病患者;胃肠并发症;大黄;剂量;,R573.1  R574.4,2013,10,25
yxllysj201602051,0,"ISTIC,PKU",妊娠期肝内胆汁淤积征对新生儿血胆红素的影响,,许向明[1];黄映彩[2];,[1]广东省深圳市龙岗区人民医院 妇产科 518172;[2]广东省深圳市龙岗区人民医院 检验科 518172;,医学理论与实践,妊娠期肝内胆汁淤积征;新生儿;胆红素;血清;,R714.25,2016,,2
zgsyykzz201211012,2,"ISTIC,PKU",眼烧伤睑球粘连分离后结膜重建的临床疗效分析,10.3760/cma.j.issn.1006-4443.2012.11.012,曾远宏[1];陈家祺[2];周世有[2];,"[1]广东省深圳市龙岗中心医院, 广东深圳,518116;[2]510060 广州,中山大学中山眼科中心,眼科学国家重点实验室;",中国实用眼科杂志,羊膜移植;唇黏膜移植;睑球粘连;结膜重建;,,2012,30,11
sdyy201510029,0,"ISTIC,PKU",肘关节僵直的关节镜治疗,,李国松;赫明堂;马立峰;杨延军;许思亮;张子清;,[1]广东省深圳市龙岗区骨科医院 518116,首都食品与医药,关节镜;肘关节;僵直;疗效;,R684,2015,22,10
zhyygrxzz201316113,9,"ISTIC,PKU",降钙素原及血培养阳性时间对严重败血症早期预后的价值,,叶晓涛[1];习慧明[2];张旭[1];许瑞环[1];,"[1]深圳市龙岗中心医院检验科,广东深圳,518116;[2]北京协和医院检验科,北京,100730;",中华医院感染学杂志,降钙素原;败血症;血培养阳性时间;ROC曲线;,R446,2013,23,16
jslcyxzz201506036,3,"ISTIC,PKU",综合护理干预对急性呼吸衰竭无创通气患者的应用价值,10.7619/jcmp.201506036,樊丹娜;李怡兰;杨静;,[1]广东省深圳市龙华新区人民医院 急诊科，广东 深圳，518109,实用临床医药杂志,护理干预;急性呼吸衰竭;无创通气;,R473,2015,,6
jyyxylc201511018,1,,抗凝血酶 Ⅲ 、D-二聚体及血小板参数与产后出血的相关性探讨,10.3969/j.issn.1672-9455.2015.11.018,郑楚忠[1];唐万兵[1];蔡洁丹[1];高洪丽[1];王蕾[2];韦深[1];,[1]广东省深圳市龙岗区人民医院检验科 518172;[2]广东省深圳市龙岗区人民医院产科 518172;,检验医学与临床,产后出血;抗凝血酶;D-二聚体;血小板;,,2015,12,11
xdzxyjhzz201315053,6,,指动脉终末支皮瓣修复术后血管危象的预防和护理,10.3969/j.issn.1008-8849.2013.15.053,胡利;陈友兰;叶红梅;陈秋娜;雷湘莲;何小燕;,"[1]广东省深圳市龙华新区人民医院,广东,深圳,518109",现代中西医结合杂志,指动脉终末支皮瓣修复术;血管危象;预防;护理;,R473.6,2013,22,15
hbyy201415060,4,,6S 管理模式在种植牙围手术期护理管理中的效果评价,10.3969/j.issn.1002-7386.2014.15.059,杨微;邹红玉;许朝谊;方威苏;,"[1]518109,广东省深圳市龙华新区人民医院口腔科",河北医药,6S管理模式;种植牙;围手术期;护理管理;效果评价;,R473.78,2014,,15
zxyjhxnxgbzz201510014,2,,冠心病分叉病变介入治疗中边支闭塞的预防及处理策略探讨,10.3969/j.issn.1672-1349.2015.10.013,郑云燕;黄凤荣;,[1]广东省深圳市龙华新区人民医院 广东深圳 518109,中西医结合心脑血管病杂志,冠心病分叉病变;介入治疗;边支闭塞;预防及处理策略;,R541.4  R256.2,2015,,10
gwyx-lcsw201324087,5,,血清同型半胱氨酸水平与急性脑梗死的相关性研究,10.3969/j.issn.1673-4130.2013.24.087,刘苑欢[1];魏荣兴[2];朱彩云[1];,"[1]深圳市龙华新区人民医院检验科,广东深圳,518109;[2]深圳市福田区人民医院八卦岭社康中心,广东深圳,518029;",国际检验医学杂志,同型半胱氨酸;急性脑梗死;梗死程度;,,2013,34,24
hainanyx201511015,9,,七氟醚在不同麻醉深度下对老年腹腔镜手术患者术后认知功能的影响,10.3969/j.issn.1003-6350.2015.11.0574,蔡云亮;李安学;李文兵;朱红;黄静;,"[1]深圳市龙岗区人民医院麻醉科,广东 深圳,518172",海南医学,腹腔镜手术;七氟醚;认知功能;神经组织蛋白质S100;,R656,2015,,11
gyzyxyxb201303118,16,,综合护理干预对外科患者术后疼痛程度的价值,10.3969/j.issn.1002-1108.2013.03.0118,黄玉香;沈瑞子;叶红萍;张丽玲;黄珍珠;,"[1]深圳市龙岗中心医院,广东深圳,518116",贵阳中医学院学报,外科手术;综合护理干预;疼痛;,R473.6,2013,35,3
jyyxylc201610050,1,,妊娠期肝内胆汁淤积症胆汁酸、肝酶指标与围生儿预后的关系,10.3969/j.issn.1672-9455.2016.10.050,龚源;,[1]广东省深圳市龙华新区人民医院妇产科 518131,检验医学与临床,妊娠期肝内胆汁淤积症;胆汁酸;天门冬氨酸氨基转氨酶;丙氨酸氨基转氨酶;围生儿;,,2016,13,10
zgnjzz201503027,3,"ISTIC,PKU",椎板间入路椎间孔镜下摘除L5/S1椎间盘突出髓核技术改进探讨,,杨湘江[1];张洪[2];曾月东[1];欧阳冰[1];包杰[1];,"[1]深圳市龙岗中心医院骨科,广东深圳,518116;[2]深圳市新建市属医院筹备办公室,广东深圳,518020;",中国内镜杂志,腰椎间盘突出;内镜;微创手术;椎板间隙入路;,R681.57,2015,21,3
hainanyx201323015,5,"ISTIC,PKU",LEEP治疗宫颈上皮内瘤变256例疗效及其术后复发的影响因素分析,10.3969/j.issn.1003-6350.2013.23.1444,孙华盛;,"[1]深圳市龙华新区人民医院妇科,广东深圳,518109",海南医学,LEEP;宫颈上皮内瘤变;临床疗效;复发;影响因素;,R713.4,2013,24,23
jyyxylc201624062,0,"ISTIC,PKU",尿路曼氏裂头蚴病1例,10.3969/j.issn.1672-9455.2016.24.062,罗秋平;冯春颜;夏勇武;李东演;,[1]广东省深圳市龙华新区人民医院检验科 518109,检验医学与临床,曼氏裂头蚴病;流行病学;临床诊断;,,2016,13,24
scyx201612017,0,"ISTIC,PKU",S-ReSC评分系统对经皮肾镜取石术结石清除的预测价值,10.16252/j.cnki.issn1004-0501-2016.12.017,植凡;梁辉;,"[1]深圳市龙华新区人民医院泌尿外科,广东 深圳,518109",四川医学,经皮肾镜取石术;结石清除率;S-ReSC评分系统;预测;,R699.2,2016,37,12
lchsyyxzz201624020,0,"ISTIC,PKU",继发性肺结核患者外周血中CD4+CD25+FoxP3+Tregs细胞亚群分析,10.3969/j.issn.1671-4695.2016.24.019,魏玉娥[1];魏荣兴[2];刘苑欢[1];刘爱胜[1];,[1]深圳市龙华新区人民医院检验科 广东 深圳 518109;[2]深圳市福田人民医院检验科 广东 深圳 518033;,临床和实验医学杂志,继发性肺结核;CD4+CD25+FoxP3+Tregs细胞;流式细胞术;,,2016,15,24
hainanyxyxb201505035,9,"ISTIC,PKU",右美托咪定对七氟醚复合骶管阻滞小儿麻醒期躁动的预防作用及炎症应激反应的影响,10.13703/j.0255-2930.2015.03.013,余念恩;李平;李安学;,"[1]广东省深圳市龙岗区人民医院麻醉科,广东深圳,518172",海南医学院学报,右美托咪定;苏醒期躁动;七氟醚;炎症;应激;,R614,2015,21,5
lcsxyjy201606026,0,"ISTIC,PKU",不同类型慢性肝炎人群戊型病毒性肝炎IgG抗体流行状况,10.3969/j.issn.1671-2587.2016.06.026,刘晓鸽[1];刘爱胜[2];文艳[3];,"[1]广东省深圳市宝安区福永人民医院检验科, 深圳,518103;[2]深圳市龙华新区人民医院检验科;[3]深圳市光明新区人民医院ICU;",临床输血与检验,戊型病毒性肝炎;乙型病毒性肝炎;丙型病毒性肝炎;流行率;,R373.2+1  R446.61,2016,18,6
sxyxjy201606014,0,"ISTIC,PKU",深圳地区儿童A群致病性链球菌感染流行现状及M蛋白基因分型分析,10.3969/j.issn.1671-7414.2016.06.014,肖海军[1];殷晓晴[2];张慧莲[1];刘芹兰[1];,"[1]深圳市宝安区妇幼保健院检验科,广东深圳,518000;[2]深圳市龙华新区人民医院妇科,广东深圳,518109;",现代检验医学杂志,儿童;A群链球菌;流行;emm基因;分析;,R378.12  Q781,2016,31,6
hbyx201502036,3,"ISTIC,PKU",肿瘤性与非肿瘤性机械性肠梗阻的临床对比研究?,10.3969/j.issn.1006-6233.2015.02.036,曾学燚;,"[1]广东省深圳市龙华新区人民医院普外科,广东 深圳,518000",河北医学,机械性肠梗阻;肿瘤;诊断;,,2015,,2
hainanyx201413020,4,"ISTIC,PKU",腹腔镜下卵巢巧克力囊肿剔除术后联合应用GnRHa的疗效及其对卵巢功能的影响,10.3969/j.issn.1003-6350.2014.13.0748,孙华盛;张影;张利;,"[1]深圳市龙华新区人民医院妇科,广东 深圳,518109",海南医学,子宫内膜异位症;卵巢巧克力囊肿;腹腔镜;促性腺激素释放激素激动剂;,R711.75,2014,,13
zgfybj201511018,1,"ISTIC,PKU",小儿散发性诺如病毒性肠炎的临床分析,10.7620/zgfybj.j.issn.1001-4411.2015.11.18,吴伟[1];周永柏[1];丘惠娴[1];吴伟晴[2];王自财[1];周曙明[1];,[1]深圳市龙岗中心医院儿科 518116;[2]深圳市人民医院儿科;,中国妇幼保健,诺如病毒;轮状病毒;婴幼儿;肠炎;,R725.7,2015,30,11
zgyydk201204031,14,"ISTIC,PKU",120例孕产妇孕期保健的临床观察,10.3969/j.issn.1009-0959.2012.04.031,江白玲;李雪莹;,"[1]深圳市龙岗区人民医院妇产科,深圳,518172",中国医药导刊,孕期保健;孕产妇及新生儿;并发症;临床观察;,R715.3,2012,14,4
ylwszb201604035,1,"ISTIC,PKU",COMPACT血气分析仪和VITROS 350生化分析仪测定碳酸氢根离子浓度相关性研究,10.7687/J.ISSN1003-8868.2016.04.115,姚伟[1];房笃智[2];刘爱胜[3];,"[1]深圳市宝安区松岗人民医院检验科,广东深圳,518101;[2]深圳市宝安区人民医院检验科,广东深圳,518001;[3]深圳市龙华新区人民医院检验科,广东深圳,518110;",医疗卫生装备,COMPACT血气分析仪;VITROS 350生化分析仪;碳酸氢根离子;差异性;相关性;,R318.6  TH772.2,2016,37,4
lnxxgbzz201602003,1,"ISTIC,PKU",体外反搏对动脉粥样硬化性心血管疾病康复的作用,10.3969/j.issn.1007-9688.2016.02.03,许文敏[1];张新霞[1];吴奋生[1];郭冬[2];,"[1]广东医学院附属深圳市福田人民医院心血管内科,广东深圳,518033;[2]深圳市龙华新区人民医院心血管内科,广东深圳,518000;",岭南心血管病杂志,体外反搏;动脉粥样硬化;康复作用;,R543,2016,22,2
jxyxyxb201602014,1,"ISTIC,PKU",不同牙本质脱敏药物临床远期疗效的对照研究,10.13764/j.cnki.ncdm.2016.02.013,王伟[1];李洪忠[2];王慧[3];武斌[1];,"[1]南方医科大学附属深圳市龙华新区人民医院口腔医学中心,广东 深圳,518000;[2]山东省立医院麻醉科,济南,250021;[3]山东中医药大学第二附属医院特检科,济南,250021;",南昌大学学报（医学版）,牙本质过敏症;脱敏疗法;极固宁;氟/钾纳米羟基磷灰石涂膜;氟化亚锡;,R781.2,2016,56,2
zhonggwcwkzz201312020,15,"ISTIC,PKU",腹腔镜与胆道镜联合钬激光治疗肝内胆管结石,,赵守和[1];常永春[1];阎玉矿[2];,"[1]深圳市龙岗中心医院普外科,深圳,516118;[2]深圳市坪山新区人民医院普外科,深圳,518118;",中国微创外科杂志,肝内胆管结石;微创技术;钬激光;腹腔镜;纤维胆道镜;碎石;,R657.4,2013,13,12
xngfyy201611025,0,"ISTIC,PKU",小儿肺炎支原体肺炎感染及耐药情况分析,10.3969/j.issn.1004-0188.2016.11.025,麦惠娟[1];汤美玲[2];,"[1]深圳市龙华新区人民医院儿科,广东深圳,518109;[2]深圳市龙华新区中心医院儿科;",西南国防医药,肺炎;肺炎支原体;耐药情况;儿童;,R375.2,2016,26,11
zgyxwz-jhsyfckxfc201611016,0,"ISTIC,PKU",核糖体蛋白基因S 26单核苷酸多态性与多囊卵巢综合征易感性的相关性研究,10.3969/j.issn.1674-4020.2016.11.16,梁秀文;季新梅;马娟;,"[1]深圳市龙华新区人民医院妇二科, 广东 深圳,518109",中国计划生育和妇产科,多囊卵巢综合征;核糖体蛋白基因S26;基因多态性;,R711.75,2016,8,11
hainanyx201622047,0,"ISTIC,PKU",子宫下段修补术在瘢痕子宫妊娠患者再次剖宫产术中的临床应用,10.3969/j.issn.1003-6350.2016.22.047,陈清梅[1];王芬[1];赖敏[2];,"[1]南方医科大学附属深圳市龙华新区人民医院妇产科,广东 深圳,518019;[2]成都市公共卫生临床医疗中心,四川 成都,610061;",海南医学,瘢痕子宫妊娠;子宫下段修补术;再次剖宫产;疗效;,R719.8,2016,27,22
zgjjssxzz201504028,2,"ISTIC,PKU",臭氧联合射频热凝术治疗颈椎间盘突出症的临床疗效,10.11659/jjssx.1672-5042.09E014012,张昊;周建华;菅新民;胡亚威;张弦;陈少初;卢学有;,"[1]深圳市龙华新区人民医院脊柱外科,广东 深圳,518109",局解手术学杂志,颈椎间盘突出症;射频热凝;臭氧;,R681.5,2015,,4
zhyygrxzz201210090,11,"ISTIC,PKU",ICU与普通病房铜绿假单胞菌感染分布及耐药性分析,,叶晓涛;张旭;,"[1]深圳市龙岗中心医院检验科,广东深圳,518116",中华医院感染学杂志,重症监护病房;铜绿假单胞菌;耐药性;分布;,R378.99+1,2012,22,10
hainanyx201320024,5,"ISTIC,PKU",妊娠期高血压疾病患者血清Apelin水平变化及临床意义,10.3969/j.issn.1003-6350.2013.20.1262,潘菊英;彭菊兰;刘媛媛;,"[1]深圳市龙华新区人民医院产二科,广东深圳,518000",海南医学,妊娠期高血压疾病;子痫前期;Apelin;血脂;,R714.24+6,2013,24,20
zglcys201310010,5,"ISTIC,PKU",自攻型与助攻型微螺钉支抗种植体在双颌前突患者中应用效果比较,10.3969/j.issn.1008-1089.2013.10.010,郑学汜;,"[1]广东省深圳市龙华新区人民医院口腔医学中心,广东深圳,518109",中国临床医生,自攻型;助攻型;微螺钉支抗种植体;双颌前突;,R783.5,2013,41,10
zgmzmjyyzz201505042t,0,"ISTIC,PKU",大鼠同种异体神经支架修复神经缺损的实验研究,,刘良燚;刘凯;张景石;李木卫;王暘;,"[1]深圳市龙岗区骨科医院,广东 深圳,518116",中国民族民间医药,神经支架;神经缺损;大鼠;,R745,2015,,5
zgyxcx201507052,0,"ISTIC,PKU",周围神经缺损修复方法及桥接材料的研究进展,10.3969/j.issn.1674-4985.2015.07.049,李玖能[1];张子清[2];马立峰[2];刘良燚[2];,[1]遵义医学院 广东 珠海 519041;[2]广东省深圳市龙岗区骨科医院;,中国医学创新,周围神经;缺损;修复;桥接材料;,,2015,,7
gwyx-hlxfc201405072,4,"ISTIC,PKU",针对性护理干预对 BiPAP 无创通气治疗 COPD 并Ⅱ型呼吸衰竭患者的临床价值,10.3760/cma.j.issn.1673-4351.2014.05.072,胡建云;谢士吉;杨万英;,"[1]518109,深圳市龙华新区人民医院",国际护理学杂志,BiPAP模式;无创通气;慢性阻塞性肺疾病;Ⅱ型呼吸衰竭;护理措施;,R473.6,2014,,5
syhlzz201203036,3,"ISTIC,PKU",肿瘤患者经PICC采集血标本的可行性研究,10.3760/cma.j.issn.1672-7088.2012.03.117,陶艳玲;管玉梅;吴文娜;束振华;,"[1]518116,广东省深圳市龙岗中心医院护理部",中国实用护理杂志,经外周置入中心静脉导管;血标本;并发症;,R47,2012,28,3
hainanyx201515023,2,"ISTIC,PKU",降钙素原和1，3-β-D葡聚糖联合检测诊断ICU危重患者深部真菌感染的价值,10.3969/j.issn.1003-6350.2015.15.0813,张勇[1];李伟[1];文艳[2];刘爱胜[3];,"[1]深圳市龙华新区中心医院检验科,广东 深圳,518110;[2]深圳市光明新区人民医院ICU,广东 深圳,518106;[3]深圳市龙华新区人民医院检验科,广东 深圳,518109;",海南医学,"降钙素原;1,3-β-D葡聚糖;重症监护室;深部真菌感染;价值;",R61,2015,,15
zgxkx201610018,0,"ISTIC,PKU",女性绝经后阴道出血病变类型和相关因素研究,10.3969/j.issn.1672-1993.2016.10.017,张娇燕[1];陈玉梅[2];童芳[1];甘春燕[1];邓世昌[1];黄新苑[1];,"[1]深圳市龙华新区人民医院社管中心,广东深圳,518109;[2]深圳市第八人民医院妇产科,广东深圳,518000;",中国性科学,绝经;阴道出血;临床原因;病理分析;,R711.51,2016,25,10
tlsjyyj201620027,0,"ISTIC,PKU",隐形矫治技术在矫治牙颌畸形中的应用及护理,10.3969/j.issn.1672-9676.2016.20.026,龙小容;魏波;唐智慧;,"[1]518109,深圳市 广东省深圳市龙华新区人民医院口腔科",护理实践与研究,隐形矫治技术;牙颌畸形;效果;护理;,,2016,13,20
zgfybj201614043,0,"ISTIC,PKU",sTREM-1、CRP对新生儿败血症早期诊断及疗效判断的价值研究,10.7620/zgfybj.j.issn.1001-4411.2016.14.43,丘惠娴[1];吴伟晴[2];黄循斌[1];,"[1]深圳市龙岗中心医院新生儿科,广东深圳,518116;[2]深圳市人民医院,广东深圳,518020;",中国妇幼保健,新生儿败血症;可溶性髓系细胞触发受体-1;C-反应蛋白;,R722,2016,31,14
sxyyzz201620051,0,"ISTIC,PKU",“孕妇学院”个性化助产模式应用效果分析,10.3969/j.issn.0253-9926.2016.20.047,钟丽娜[1];孙玉娟[2];朱惠敏[3];,[1]518109深圳市龙华新区人民医院妇产科;[2]深圳市宝安区石岩人民医院内一科;[3]深圳市龙岗区第五人民医院外二科;,山西医药杂志,,,2016,45,20
xdzxyjhzz201630028,0,"ISTIC,PKU",中药熏蒸联合肌电生物反馈疗法治疗脑卒中后肩手综合征疗效观察,10.3969/j.issn.1008-8849.2016.30.026,林芳毅;陈得胜;,"[1]广东省深圳市龙华新区人民医院,广东深圳,518109",现代中西医结合杂志,中药熏蒸疗法;肌电生物反馈疗法;脑卒中;肩手综合征;,R743.3,2016,25,30
sxyyzz201605035,1,"ISTIC,PKU",腹腔镜胆囊切除术与传统手术临床效果的对比分析,10.3969/j.issn.0253-9926.2016.05.034,张正攀;刘昕;闫振宇;向义;叶劲松;,"[1]716000,深圳市龙华新区人民医院胃肠外科",山西医药杂志,,,2016,45,5
tlsjyyj201507095,2,"ISTIC,PKU",APACHE Ⅱ评分系统在急诊科护理风险中的应用,10.3969/j.issn.1672-9676.2015.07.089,赵华宇;叶珍;谢齐群;,"[1]518109,深圳市 广东省深圳市龙华新区人民医院急诊科",护理实践与研究,APACHE Ⅱ评分系统;急诊;护理风险;满意度;,,2015,,7
syswkzz201402053,1,"ISTIC,PKU",手显微外科智能温控清创装置及其可调托架一体化的研制与应用,10.3969/j.issn.1671-2722.2014.02.051,梁文仙[1];匡星[2];郑悦[2];罗朝晖[1];杨银兰[1];张子清[1];,"[1]深圳市龙岗区骨科医院 手外科 广东 深圳 518116;[2]深圳先进技术研究院,广东 深圳,518055;",实用手外科杂志,手显微外科;智能温控;清创;可调托架;,,2014,,2
hnyx201602014,1,"ISTIC,PKU",评估新评分体系在胃癌切除患者术后的有效性,10.3969/j.issn.1671-7171.2016.02.014,娄夏芳;赖春荣;黄纪缓;杨玉霞;,"[1]深圳市龙华新区人民医院普外科,广东 深圳,518109",医学临床研究,胃肿瘤/外科学;胃切除术;生活质量;,R735.2,2016,33,2
hgzy201402063,1,"ISTIC,PKU",不同抗结核疗法对乙肝合并肺结核患者的肝功保护作用研究,,凌均超;,"[1]深圳市龙华新区疾病预防控制中心第一门诊部,广东深圳,518000",中外医疗,乙肝;肺;结核;肝功能保护;,R782,2014,33,2
sxzlyx201618032,0,"ISTIC,PKU",硫酸钙人工骨填充骨肿瘤刮除后骨缺损的愈合情况,10.3969/j.issn.1672-4992.2016.18.032,唐久阳;吴元成;胡益雄;赖俊成;王清华;胡广平;,"[1]深圳市龙华新区人民医院骨科,广东深圳,518109",现代肿瘤医学,硫酸钙人工骨填充;骨肿瘤;骨缺损;愈合;,R738.1,2016,24,18
zyyjk201516025,0,"ISTIC,PKU",深圳市龙华新区公共场所集中空调通风系统卫生状况,,陈美施;蒙钟琪;肖海清;,"[1]广东省深圳市龙华新区疾病预防控制中心公共卫生科,518131",职业与健康,公共场所;集中空调;检测;合格率;,R126.4,2015,31,16
gxyx201411034,3,"ISTIC,PKU",深圳市足月及近足月新生儿呼吸窘迫综合征的现状调查,10.11675/j.issn.0253-4304.2014.11.29,王章星[1];叶贞志[2];吴本清[3];田鸾英[4];杨传忠[5];刘晓红[6];李晓东[7];吴志军[8];童燕梅[1];邓莉[1];,"[1]南方医科大学附属深圳市龙华新区人民医院新生儿科,深圳市,518109;[2]广东省深圳市光明新区人民医院新生儿科;[3]广东省深圳市人民医院新生儿科;[4]广东省深圳市南山区妇幼保健院新生儿科;[5]广东省深圳市妇幼保健院新生儿科;[6]广东省深圳市儿童医院新生儿科;[7]广东省深圳市南山区人民医院新生儿科;[8]广东省深圳市宝安区妇幼保健院新生儿科,深圳市,518100;",广西医学,新生儿呼吸窘迫综合征;足月儿;近足月儿;调查;深圳市;,R722.1,2014,,11
xyx201304006,12,"ISTIC,PKU",法舒地尔联合养血清脑颗粒治疗慢性脑供血不足的疗效观察,10.3969/g.issn.0253-9802.2013.04.006,谭昌锐;邹立华;李惠;陈小丹;,"[1]广东省深圳市龙岗区人民医院,深圳,518172",新医学,法舒地尔;养血清脑颗粒;慢性脑供血不足;,,2013,44,4
gdyx201214043,2,"ISTIC,PKU",超声对胎儿单侧肾盂分离的动态观测,10.3969/j.issn.1001-9448.2012.14.043,刘宇清;刘滨月;贾保霞;陈金华;周富强;,"[1]广东省深圳市龙岗中心医院超声科,518116",广东医学,超声;胎儿单侧肾盂分离;超声评分法;,R4,2012,33,14
sxyyzz201603005,1,"ISTIC,PKU",突发危重症病例的护理宣教在院前急救中的应用研究,10.3969/j.issn.0253-9926.2016.03.005,高凯先;叶珍;丘文方;,"[1]518109,广东省深圳市龙华新区人民医院急诊科",山西医药杂志,急救医疗服务;健康教育;急症;,,2016,45,3
hnyx201506013,2,"ISTIC,PKU",孕前体质量指数和孕期体质量增长对早产的影响,10.3969/j.issn.1671-7171.2015.06.013,熊海燕;钟敏;杨新凰;黄燕芬;王芬;马令;,"[1]南方医科大学附属深圳市龙华新区人民医院产科,广东 深圳,518109",医学临床研究,人体质量指数;早产;围生医学;,R714.21,2015,,6
tlsjyyj201617071,0,"ISTIC,PKU",微信教育对门诊 PICC 患者社会支持及导管维护依从性的影响,10.3969/j.issn.1672-9676.2016.17.065,龚小兰;张嘉丽;叶雪霞;,"[1]518109,深圳市 广东省深圳市龙华新区人民医院门诊部",护理实践与研究,微信教育;门诊;外周静脉置入中心静脉导管;社会支持;依从性;,,2016,13,17
tlsjyyj201617073,0,"ISTIC,PKU",一站式免费产前筛查护理服务模式在产科门诊中的应用,10.3969/j.issn.1672-9676.2016.17.067,张海霞;李小嫩;张海燕;,"[1]518100,深圳市 深圳市龙华新区人民医院妇产科门诊",护理实践与研究,一站式免费产前筛查;护理服务;产科门诊;,,2016,13,17
gyyxyxb201304012,5,"ISTIC,PKU",LNG-IUS对子宫腺肌症患者血清VEGF及Ang-2水平的影响,10.3969/j.issn.1000-2707.2013.04.012,潘菊英;彭菊兰;刘媛媛;,"[1]深圳市龙华新区人民医院产二科,广东深圳,518000",贵阳医学院学报,子宫腺肌症;血管内皮生长因子;血管生成素-2;左炔诺酮宫内缓释系统;,R711.74,2013,38,4
zfysjjbzz201309014,0,"ISTIC,PKU",正常体检人群颈动脉粥样硬化及危险因素调查,,赵燕;朴春玉;,"[1]深圳市龙岗中心医院,广东深圳,518116",中风与神经疾病杂志,颈动脉;动脉粥样硬化;内膜厚度;危险因素;,R743.1,2013,30,9
zgfybj201435080,3,"ISTIC,PKU",中国可疑血流感染新生儿行血培养阳性率的系统评价和Meta分析,10.7620/zgfybj.j.issn.1001-4411.2014.35.80,曾淑娟[1];赵文利[2];周伟勤[2];臧莉莉[2];池婧涵[2];赵智慧[2];封志纯[2];,[1]深圳市龙岗中心医院;[2]南方医科大学北京军区总医院临床医学院附属八一儿童医院 北京100700;,中国妇幼保健,败血症;新生儿;血培养;阳性率;系统综述;Meta分析;,R17,2014,29,35
tlsjyyj201602005,1,"ISTIC,PKU",阶梯式亚低温治疗心肺复苏患者脑复苏的临床疗效及护理,10.3969/j.issn.1672-9676.2016.02.005,刘秀华;孟金凤;赵华宇;,"[1]518109,深圳市 深圳市龙华新区人民医院急诊科",护理实践与研究,阶梯式亚低温;心肺复苏;脑复苏;护理;,,2016,13,2
yiyqy201421225,0,"ISTIC,PKU",甲型H1N1流感病例与其他流感病例临床特征比较分析,10.3969/j.issn.2095-1752.2014.21.225,曹赫[1];蔡翠玉[2];,[1]深圳市龙华新区疾病预防控制中心 广东深圳 518131;[2]深圳市龙华新区卫生监督所 广东深圳 518109;,医药前沿,甲型H1N1流感;流感;临床特征;,R18,2014,,21
tlsjyyj201616047,0,"ISTIC,PKU",专科护理门诊在PICC置管中的实施效果观察,10.3969/j.issn.1672-9676.2016.16.047,叶雪霞;张嘉丽;杨静;,"[1]518109深圳市,广东省深圳市龙华新区人民医院急诊科",护理实践与研究,PICC;专科护理门诊;并发症;,,2016,13,16
sxyyzz201616040,0,"ISTIC,PKU",腹腔镜胆囊切除术中胆囊三角解剖关系重要性浅析,10.3969/j.issn.0253-9926.2016.16.036,曾学燚;刘昕;陈秀娟;闫振宇;高旭光;蒋晨春;,[1]518109深圳市龙华新区人民医院普外科,山西医药杂志,,,2016,45,16
hbyx201410026,3,"ISTIC,PKU",基层医院药品不良反应报告和监测管理中的问题及解决对策探讨,10.3969/j.issn.1006-6233.2014.10.026,孔芳;,"[1]广东省深圳市龙华新区人民医院景龙社康中心,广东 深圳,518109",河北医学,基层医院;不良反应报告;监管系统;,,2014,,10
