zgyykx201409022,2,,中药泡服加穴位贴敷治疗非酒精性脂肪肝病30例疗效观察,,叶欣[1];张春华[1];刘青[2];胡世平[1];黄雪梅[3];,"[1]深圳市龙岗区中医院,广东深圳,518172;[2]深圳市龙岗中心医院,广东深圳,518116;[3]深圳市龙岗区人民医院,广东深圳,518172;",中国医药科学,非酒精性脂肪肝病;中药泡服;穴位贴敷;,R259,2014,,9
jndxxb201202024,5,"ISTIC,PKU",胸腔积液患者联合检测血清和胸水中CEA、NSE、CYFRA21-1的价值,10.3969/j.issn.1000-9965.2012.02.024,李观强[1];岑慧[2];李文[3];张卫珍[4];许瑞环[5];,"[1]深圳市龙岗区人民医院检验科,广东深圳,518172;[2]深圳市龙岗区人民医院呼吸内科,广东深圳,518172;[3]广东医学院附属医院呼吸科,广东湛江52402;[4]南方医院呼吸科,广东广州,510000;[5]深圳市龙岗中心医院检验科,广东深圳,518116;",暨南大学学报（自然科学与医学版）,癌胚抗原;神经元特异性烯醇化酶;细胞角蛋白19片断;结核性胸腔积液;恶性胸腔积液;组织学分型;,R561,2012,33,2
sxyxjy201603023,1,"ISTIC,PKU",继发性肺结核患者治疗初期FOXP3 TSDR DNA去甲基化变化情况分析,10.3969/j.issn.1671-7414.2016.03.023,武学成[1];冀红霞[2];魏玉娥[3];,"[1]深圳市龙华新区慢性病防治中心,广东深圳,518110;[2]深圳市龙华新区疾病预防控制中心,广东深圳,518110;[3]深圳市龙华新区人民医院检验科,广东深圳,518110;",现代检验医学杂志,"继发性肺结核;调节T细胞去甲基化区域(treg-specific demethylated region FOXP3 TSDR);叉头状/翅膀状螺旋转录因子(forkhead box P3 protein,Foxp3);",R521.5  R392.11,2016,31,3
tlsjyyj201612014,0,"ISTIC,PKU",老年 COPD 患者接种流感疫苗的效果观察与护理,10.3969/j.issn.1672-9676.2016.12.014,邓琼[1];吴世臣[1];张瑞丹[1];徐芳[1];陆小妹[1];黄威[1];张建文[2];,"[1]518109,深圳市 广东省深圳市龙华新区疾病预防控制中心;[2]深圳市龙华新区人民医院;",护理实践与研究,老年人;慢性阻塞性肺病;流感疫苗;护理;,,2016,13,12
sxyyzz201524008,0,"ISTIC,PKU",骨碱性磷酸酶 N-端骨钙素99Tcm-亚甲基二膦酸盐骨显像与早期骨代谢改变,,罗裕旋[1];吴传安[1];杨伟康[1];何小媚[2];魏建伟[3];梁瑞金[3];余树林[3];,"[1]518109,广东省深圳市龙华新区妇幼保健 中心检验科;[2]深圳市龙华新区疾病预防控制中心检验科;[3]深圳市龙华新区人民医院检验科，放射科，病理科;",山西医药杂志,99m锝美罗酸盐;骨钙素;早期骨代谢;碱性磷酸酶;,,2015,,24
yycyzx201612031,1,"ISTIC,PKU",鼠神经生长因子对危重型小儿手足口病患者体液免疫和细胞因子的影响,,陈柏良[1];江明荣[2];周曙明[2];黄循斌[2];谢晓彬[3];,"[1]广东省深圳市龙华新区人民医院梅陇镇社康中心,广东深圳,518131;[2]广东省深圳市龙岗中心医院儿科,广东深圳,518116;[3]广东省深圳市龙岗中心医院妇产科,广东深圳,518116;",中国医药导报,鼠神经生长因子;危重型小儿手足口病;体液免疫;细胞因子;,R725.1,2016,13,12
zfysjjbzz201605012,3,"ISTIC,PKU",养血清脑颗粒治疗卒中后抑郁的疗效及对脑白质结构改变的影响,,许孝南[1];马婷[2];陈旭辉[1];虢周科[3];朱治山[4];刘淑云[5];李梅笑[6];李晶[7];刘相城[5];,"[1]北京大学深圳医院神经内科,广东深圳,518036;[2]哈尔滨工业大学深圳研究生院,广东深圳,518055;[3]深圳市中医院神经内科,广东深圳,518033;[4]深圳市罗湖区人民医院神经内科,广东深圳,518001;[5]深圳市龙华新区人民医院神经内科,广东深圳,518110;[6]深圳市龙岗区人民医院神经内科,广东深圳,518172;[7]深圳市宝安区沙井人民医院神经内科,广东深圳,518104;",中风与神经疾病杂志,卒中后抑郁;弥散张量成像;疗效;养血清脑颗粒;,R743.3,2016,33,5
hsjxzz201414002,11,"ISTIC,PKU",延续性护理模式对老年跌倒患者抑郁症状和生活质量的影响,,黄淑芳[1];叶文秋[1];林绍英[1];李明[1];许海珍[2];林凯思[3];,"[1]广东省深圳市龙岗中心医院,广东深圳,518116;[2]广东省深圳市龙岗区人民医院,广东深圳,518172;[3]广东省深圳市龙岗区第二人民医院,广东深圳,518114;",护士进修杂志,延续性护理;跌倒;抑郁;生活质量;,R473.59,2014,,14
zyyjk201511040,0,"ISTIC,PKU",深圳市龙华新区预防接种门诊设置现状,,潘彩珠[1];罗伟文[2];周世权[1];李梅英[1];,"[1]广东省深圳市龙华新区疾病预防控制中心,518109;[2]深圳市龙华新区人民医院;",职业与健康,预防接种;门诊设置;现状分析;,R197,2015,31,11
hainanyx201620022,0,"ISTIC,PKU",甲磺酸去铁胺治疗骨质疏松的疗效及其对患者骨代谢指标的影响,10.3969/j.issn.1003-6350.2016.20.022,廖庆辉[1];谭秦[2];,"[1]深圳市龙岗区人民医院内分泌科,广东 深圳,518000;[2]深圳市龙岗区中医院肾内科,广东 深圳,518000;",海南医学,甲磺酸去铁胺;老年;女性;骨质疏松;骨密度;骨代谢指标;氧化应激水平;,R681,2016,27,20
lnywylc201503016,2,"ISTIC,PKU",HPLC法测定复元胶囊三七皂苷R1及淫羊藿苷的含量,10.14053/j.cnki.ppcr.201503016,张斯汉[1];李荣亨[2];巫艳芬[3];潘富林[1];蔡威黔[1];陈铿[1];罗光平[1];李萍华[1];黄耿[1];,"[1]深圳市龙岗区人民医院,深圳,518172;[2]重庆医科大学附属第一医院,重庆,400016;[3]深圳市龙岗区中医院,深圳,518172;",实用药物与临床,复元胶囊;三七皂苷R1;淫羊藿苷;含量测定;HPLC;,,2015,18,3
zgwscy201619043,0,"ISTIC,PKU",2013-2015年深圳市龙华新区游泳池水监测结果分析及干预,10.16659/j.cnki.1672-5654.2016.19.110,林亚弟[1];徐芳[2];程子榕[3];蔡妙森[2];,"[1]深圳市龙华新区卫生监督所,广东深圳,518109;[2]深圳市龙华新区疾病预防控制中心,广东深圳,518109;[3]深圳市龙华新区人民医院,广东深圳,518109;",中国卫生产业,游泳池水;合格率;监督;监测;,R19,2016,13,19
zgyykx201607048,0,"ISTIC,PKU",登革热急性发热期患者的部分实验室指标变化规律研究,,余好[1];许少坚[1];孙华杰[1];汪宇婴[2];曹姬[2];,"[1]深圳市龙华新区疾病预防控制中心传染病预防控制重点实验室,广东深圳,518109;[2]深圳市龙华新区人民医院检验科,广东深圳,518109;",中国医药科学,登革热;急性发热期;实验室指标;变化规律;,R512.8,2016,6,7
qqhryxyxb201507032,1,"ISTIC,PKU",血清骨碱性磷酸酶检测与实体瘤骨转移早期临床诊断价值,,何小媚[1];罗裕旋[2];邱群芳[2];杨建军[2];朱飞[2];,"[1]518109,深圳市龙华新区疾病预防控制中心检验科;[2]518109,深圳市龙华新区人民医院检验科;",齐齐哈尔医学院学报,实体瘤;骨转移早期;血清骨碱性磷酸酶;,,2015,,7
zgjcyy201313033,0,"ISTIC,PKU",优化复苏集束化策略对脓毒性休克预后的影响,10.3760/cma.j.issn.1008-6706.2013.13.033,谢江霞[1];阳书坤[2];霍开秀[2];刘雪燕[3];孙大勇[4];余坤城[1];,"[1]深圳市龙岗区人民医院急诊科,广东省深圳,518172;[2]深圳市龙岗区人民医院ICU,广东省深圳,518172;[3]深圳市人民医院急诊科;[4]深圳市龙岗中心医院急诊科;",中国基层医药,"休克,脓毒性;复苏术;预后;随机对照试验;",,2013,20,13
zgzyykj2014z2005,0,"ISTIC,PKU",三七总苷抑制裸鼠胃癌移植瘤中淋巴管生成实验研究,,刘圣活[1];帅心涛[2];胡凤霞[3];陈涛英[1];,[1]深圳市龙岗区中医院 广东 深圳 181720;[2]广州市中山大学化学与化学工程学院 广东 广州 510275;[3]深圳市龙岗区人民医院 广东 深圳 518112;,中国中医药科技,三七总苷;胃癌;微淋巴管密度;微淋巴管特异标记物;,,2014,,z2
jslcyxzz201314045,1,"ISTIC,PKU",鞍区Rathke囊肿的MRI诊断价值,10.7619/jcmp.201314045,周乐夫[1];周洁[2];吴秋辉[2];葛虎[2];向子云[2];,"[1]广东省深圳市龙岗区中医院影像科,广东深圳,518172;[2]广东省深圳市龙岗区人民医院影像科,广东深圳,518172;",实用临床医药杂志,鞍区;Rathke囊肿;磁共振成像;,R739.41,2013,17,14
gdyx201511041,3,"ISTIC,PKU",深圳市社区健康体检人群血脂水平分析,,林锦波[1];刘陈黎[2];张云凤[3];黄雪良[1];巫伟忠[1];罗石友[1];,[1]广东省深圳市龙岗中心医院新生社康中心 518116;[2]广州医科大学附属第一医院微创中心泌尿外科 广州510230;[3]广东省深圳市龙岗区人民医院手术室 518172;,广东医学,健康体检;血脂水平;社区;,,2015,,11
zyyjk201504035,1,"ISTIC,PKU",2013年深圳市龙华新区麻疹流行特征分析,,潘彩珠[1];罗伟文[2];徐芳[1];周世权[1];林巧香[1];,"[1]广东省深圳市龙华新区疾病预防控制中心,518109;[2]深圳市龙华新区人民医院;",职业与健康,麻疹;流行特征;监测;免疫接种;,R181.3,2015,31,4
mdjyxyxb201603008,1,"ISTIC,PKU",多排螺旋CT三维重建技术在孤立性肺结节中的应用,,王刚[1];向子云[2];刘仰生[1];,"[1]深圳市龙岗区骨科医院放射科;[2]深圳市龙岗区人民医院影像科,广东深圳,518116;",牡丹江医学院学报,多排螺旋CT;三维重建技术;计算机辅助诊断;孤立性肺结节效果;,R73,2016,37,3
xdkf201516016,0,"ISTIC,PKU",天然上颌中切牙与种植体应力规律的三维有限元分析,10.3969/j.issn.2095-4344.2015.16.016,万林子[1];孙蕾[1];吴熙凤[2];林臻彦[1];徐良伟[3];刘朕哲[1];徐多玲[1];李阳[1];周延民[4];高永波[1];,"[1]遵义医学院附属深圳市龙岗中心医院,广东省深圳市,518116;[2]深圳市龙岗区人民医院,广东省深圳市,518172;[3]浙江工业大学,浙江省杭州市,310014;[4]吉林大学口腔医院,吉林省长春市,130021;",中国组织工程研究,生物材料;口腔生物材料;种植体;上颌中切牙;三维有限元;广东省自然科学基金;,R318,2015,19,16
zhsywk201301010,2,"ISTIC,PKU",胃旁路术对2型糖尿病大鼠的降糖作用及胰高血糖素样肽-1的影响,10.3760/cma.j.issn.1001-9030.2013.01.010,鲍兴[1];都敏[1];戴璟瑜[1];张杰[1];彭海峰[2];,"[1]518116,深圳市龙岗中心医院普外科;[2]深圳市龙岗区人民医院普外科;",中华实验外科杂志,胃旁路术;2型糖尿病;胰高血糖素样肽-1;,,2013,30,1
hnyx201606003,0,"ISTIC,PKU",慢性肾功能衰竭患者脑钠肽及超敏 C 反应蛋白水平与心力衰竭的相关性,10.3969/j.issn.1671-7171.2016.06.003,胡明亮[1];王丽[1];钟馨[2];莫怡浩[1];李莎[1];曾敏[1];王丹丹[1];,"[1]广东省深圳市龙华新区人民医院肾内科,广东 深圳,518109;[2]广东省深圳市龙岗中心医院肾内科,广东 深圳,518109;",医学临床研究,"肾功能衰竭 ,慢性;脑啡肽类;C 反应蛋白质;心力衰竭;",R692.5,2016,33,6
gwyx-lcsw201315006,11,"ISTIC,PKU",降钙素原检测联合血培养阳性时间评分用于严重败血症患者的预后判断,10.3969/j.issn.1673-4130.2013.15.006,叶晓涛[1];马焕丽[2];陈日炳[3];张旭[2];,"[1]深圳市龙岗区坪地人民医院检验科,广东深圳,518117;[2]深圳市龙岗中心医院检验科,广东深圳,518117;[3]深圳市龙岗区人民医院检验科,广东深圳,518117;",国际检验医学杂志,降钙素原;败血症;血培养阳性时间;ROC曲线;,,2013,34,15
nfhlxb201409023,9,"ISTIC,PKU",老年跌倒患者二级预防的延续性护理,,黄淑芳[1];叶文秋[1];林绍英[1];李明[1];许海珍[2];林凯思[3];,"[1]深圳市龙岗中心医院,广东 深圳,518116;[2]深圳市龙岗区人民医院,广东 深圳,518172;[3]深圳市龙岗区第二人民医院,广东 深圳,518114;",护理学报,延续性护理;跌倒;二级预防;伤害;老年;,R473.59,2014,,9
sdyy201522047,0,"ISTIC,PKU",我院172例药物不良反应(ADR)分析报告,,巫艳芬[1];王玉梅[1];张斯汉[2];,[1]广东省深圳市龙岗区中医院 518172;[2]广东省深圳市龙岗区人民医院 518172;,首都食品与医药,药品不良反应;报告;分析;合理用药;,R969.3,2015,,22
zgsqys201504002,0,"ISTIC,PKU",胆总管结石的微创化治疗,10.3969/j.issn.1007-614x.2015.4.2,王存富[1];彭海峰[2];戴璟瑜[3];鲍兴[3];张杰[3];都敏[2];张环[2];,[1]563003贵州省遵义医学院; 518100广东省深圳市龙岗中心医院;[2]518100广东省深圳市龙岗区人民医院;[3]518100广东省深圳市龙岗中心医院;,中国社区医师,胆总管结石;微创化治疗;ERCP;LC;LCBDE;,,2015,,4
zgmzmjyyzz201605076,2,"ISTIC,PKU",循证护理在急性重症胰腺炎54例中的应用,,欧寿六[1];陈嫦[2];,"[1]深圳市龙岗中心医院重症医学科,广东深圳,518116;[2]深圳市龙岗区中医院重症医学科,广东深圳,518116;",中国民族民间医药,急性重症胰腺炎;循证护理;应用效果;,R473.5,2016,25,5
zyyjk201424023,3,"ISTIC,PKU",2011-2013年深圳市龙华新区疾病预防中心艾滋病VCT点的资料分析,,潘彩珠[1];罗伟文[2];罗经伟[1];周世权[1];,"[1]广东省深圳市龙华新区疾病预防控制中心,518109;[2]深圳市龙华新区人民医院;",职业与健康,艾滋病;自愿咨询检测(VCT);初筛;资料分析;,R181.3,2014,30,24
zgsyyy201330110,2,"ISTIC,PKU",真武汤治疗慢性充血性心力衰竭疗效观察,,叶欣[1];邹立华[2];冯德勇[2];黄雪梅[2];,"[1]518172,深圳市龙岗区中医院;[2]深圳市龙岗区人民医院中医科;",中国实用医药,真武汤;慢性充血性心力衰竭;左室射血分数;临床疗效;,,2013,8,30
yxxxzz201320095,0,"ISTIC,PKU",丹参酮联合阿托伐他汀治疗慢性肾衰竭疗效观察,10.3969/j.issn.1006-1959.2013.20.095,缪建春[1];杨泰源[1];蔡威黔[2];孙大勇[3];,"[1]广东省深圳市龙岗中心医院药剂科,广东 深圳,518116;[2]广东省深圳市龙岗区人民医院药剂科,广东 深圳,518172;[3]广东省深圳市龙岗中心医院心血管内科,广东 深圳,518116;",医学信息,丹参酮;阿托伐他汀;肾衰竭;慢性;,,2013,,20
zgyyzn201412025,0,"ISTIC,PKU",养血祛风止痒汤联合西替利嗪治疗围绝经期妇女皮肤瘙痒症的临床观察,,叶欣[1];黄雪梅[2];谭毅[2];冯德勇[2];,"[1]深圳市龙岗区中医院,广东深圳,518172;[2]深圳市龙岗区人民医院,广东深圳,518172;",中国医药指南,养血祛风止痒汤;围绝经期;妇女;皮肤瘙痒症;,R275.9,2014,,12
shzjzz201510012,2,"ISTIC,PKU",浮针治疗老年顽固性便秘临床观察,10.13460/j.issn.1005-0957.2015.10.0929,丘文静[1];王英杰[2];,"[1]深圳市龙岗区人民医院,深圳,518172;[2]深圳市龙岗中心医院,深圳,518116;",上海针灸杂志,针刺;浮针;便秘;,R246.1,2015,,10
nfhlxb201406021,4,"ISTIC,PKU",大面积脑梗死患者发热危险因素分析与护理对策,,谢美华[1];李惠[1];陈小丹[1];李悦文[2];,"[1]深圳市龙岗区人民医院,广东 深圳,518172;[2]深圳市龙岗中心医院,广东 深圳,518116;",护理学报,"脑梗死,大面积;发热;危险因素;护理;",R473.5,2014,,6
lckqyx201608009,0,"ISTIC,PKU",CGF 联合骨代用品及口腔修复膜在颌骨囊肿手术中的应用,10.3969/j.issn.1003-1634.2016.08.009,李伯友[1];苏铭扬[1];李阳[1];林璇[1];吴熙凤[2];高永波[1];,[1]深圳市龙岗中心医院口腔科 广东 深圳 518116;[2]深圳市龙岗区人民医院口腔科 广东 深圳518172;,临床口腔医学杂志,浓缩生长因子;羟基磷灰石生物陶瓷;口腔修复膜;颌骨囊肿;骨缺损;,R318.08,2016,32,8
sjzxyjhzz201505040,2,"ISTIC,PKU",浮针治疗腹泻型肠易激综合征40例临床观察,10.13935/j.cnKi.sjzx.150533,丘文静[1];王英杰[2];,"[1]深圳市龙岗区人民医院,广东 深圳,518172;[2]深圳市龙岗中心医院,广东 深圳,518116;",世界中西医结合杂志,浮针疗法;腹泻型;肠易激综合征;临床观察;,R245.3  R574,2015,,5
gdybfz201607014,0,"ISTIC,PKU",开窗减压术治疗上颌骨大型囊性病变的临床研究,10.12016/j.issn.2096-1456.2016.07.012,李伯友[1];苏铭扬[1];李阳[1];林璇[1];吴熙凤[2];高永波[1];,"[1]深圳市龙岗中心医院口腔科,广东深圳,518116;[2]深圳市龙岗区人民医院口腔科;",口腔疾病防治,开窗减压术;上颌骨;囊性病变;上颌窦;并发症;,R739.8,2016,24,7
zxyjhxnxgbzz201613005,0,"ISTIC,PKU",心脏脚踝指数对冠状动脉粥样硬化的预测价值分析,10.3969/j.issn.1672-1349.2016.13.005,李博[1];方胜先[1];朱平先[2];吴清华[3];黄雪兰[1];李家梅[1];,"[1]广东省深圳市龙岗中心医院,广东深圳,518116;[2]广东省深圳市龙岗区人民医院;[3]南昌大学二附院;",中西医结合心脑血管病杂志,冠状动脉粥样硬化;心脏脚踝指数;预测价值;最大颈动脉内中膜厚度;,R541.4  R256.2,2016,14,13
zgptwkzz201508022,2,"ISTIC,PKU",血清降钙素原与C反应蛋白在反流性胆管炎中的临床诊疗价值,10.3978/j.issn.1005-6947.2015.08.022,张杰[1];彭海峰[2];王存富[1];戴璟瑜[1];鲍兴[1];都敏[2];张环[2];,"[1]广东省深圳市龙岗中心医院普通外科,广东深圳,518116;[2]广东省深圳市龙岗区人民医院普通外科,广东深圳,518172;",中国普通外科杂志,胆管炎;降钙素原;C反应蛋白质;,R657.4,2015,24,8
tjzyxyxb201503005,2,"ISTIC,PKU",肉苁蓉汤联合PPDO微创埋线治疗老年顽固性便秘临床研究,10.11656/j.issn.1673-9043.2015.03.05,丘文静[1];王英杰[2];,"[1]深圳市龙岗区人民医院中西医结合科,深圳,518172;[2]深圳市龙岗中心医院中医科,深圳,518116;",天津中医药大学学报,肉苁蓉汤;微创埋线;老年顽固性便秘;临床研究;,R574.62,2015,34,3
zgjkjy201611004,0,"ISTIC,PKU",2015年中东呼吸综合征疫情媒体分析与应对措施探讨,10.16168/j.cnki.issn.1002-9982.2016.11.004,刘国恒[1];张萌[2];张克春[3];冯华妹[4];郭浩岩[5];宋铁[2];,"[1]广东省公共卫生研究院,广东广州,511430;[2]广东省疾病预防控制中心,广东广州,511430;[3]深圳市龙华区疾病预防控制中心,广东深圳,518109;[4]广州市增城区疾病预防控制中心,广东广州,511300;[5]中国疾病预防控制中心,北京,102206;",中国健康教育,中东呼吸综合征;媒体监测;舆情监测;,R193  R51,2016,32,11
sjzxyy-e201325014,2,"ISTIC,PKU",Vector 牙周治疗仪治疗慢性牙周炎龈下微生物变化的研究,10.3969/j.issn.1671-3141.2013.25.013,李绍岳[1];杨萍[1];高永波[2];韩琼[2];刘建[2];吴贾涵[2];,"[1]深圳市龙岗区中医院 口腔科,广东 深圳,518172;[2]深圳市龙岗中心医院 口腔科,广东 深圳,518116;",世界最新医学信息文摘（电子版）,Vector 牙周治疗仪;牙龈卟啉单胞菌;福赛坦氏菌;齿垢密螺旋体;Pcr;,R781,2013,,25
cczyxyxb201502054,1,"ISTIC,PKU",温肾蠲痹汤治疗活动期强直性脊柱炎,10.13463/j.cnki.cczyy.2015.02.054,温天燕[1];王英杰[1];丘文静[2];,"[1]深圳市龙岗中心医院中医科,广东深圳,518116;[2]深圳市龙岗区人民医院中西医结合科,广东深圳,518172;",长春中医药大学学报,强直性脊柱炎;温肾蠲痹汤;TNF-α;ESR;CRP;,R289.5,2015,31,2
hainanyx201413006,2,"ISTIC,PKU",灯盏细辛联合氯吡格雷治疗不稳定型心绞痛疗效及其对血液学指标的影响,10.3969/j.issn.1003-6350.2014.13.0734,彭惠媚[1];胡中华[2];李惠[1];陈小丹[1];,"[1]深圳市龙岗区人民医院普通内科,广东 深圳,518172;[2]深圳市龙岗中心医院心血管内科,广东 深圳,518116;",海南医学,灯盏细辛;氯吡格雷;不稳定型心绞痛;血液流变学;,R541.4,2014,,13
gxyx201507032,0,"ISTIC,PKU",蒙特利尔认知评估量表筛查老年轻度认知功能障碍的价值,10.11675/j.issn.0253-4304.2015.07.25,林锦波[1];张云凤[2];巫伟忠[1];许露[1];黄浩[1];,"[1]广东省深圳市龙岗中心医院,深圳市,518116;[2]广东省深圳市龙岗区人民医院,深圳市,518172;",广西医学,认知功能障碍;蒙特利尔认知评估量表;社区诊断;老年人;,R749,2015,,7
qqhryxyxb201514038,4,"ISTIC,PKU",牙周牙髓联合治疗老年人逆行性牙髓炎的疗效观察,,李恩洪[1];陈淑萍[2];黄丽娜[1];,"[1]518000,广东省深圳市龙岗区人民医院;[2]广东省深圳市龙华新区人民医院;",齐齐哈尔医学院学报,牙周治疗;根管治疗;逆行性牙髓炎;老年人;,,2015,,14
qqhryxyxb201521049,3,"ISTIC,PKU",附着龈重建在口腔种植修复中的应用研究,,李恩洪;陈淑萍;黄丽娜;杨立明;武斌;,[1]518172 深圳市龙岗区人民医院，518172 广东，深圳市龙华新区人民医院口腔科,齐齐哈尔医学院学报,附着龈重建;口腔种植;修复;,,2015,,21
tlsjyyj201223015,2,"ISTIC,PKU",慢性呼吸衰竭患者长期家庭氧疗的护理随访研究,10.3969/j.issn.1672-9676.2012.23.015,陈小丹[1];李悦文[2];王美香[1];孙艳芬[1];,"[1]518116,广东省深圳市龙岗区人民医院;[2]深圳市龙岗中心医院;",护理实践与研究,慢性呼吸衰竭;长期家庭氧疗;依从性;,,2012,9,23
zgyydk201212088,0,"ISTIC,PKU",家庭护理干预对终末期血液透析患者临床效果研究,,姜朝霞;陈红珍;区向阳;刘金玲;,"[1]广东省深圳市龙岗区人民医院肾内科,深圳518172;[2]广东省深圳市龙岗中心医院肾内科,深圳518116;[3]广东省深圳市龙岗中心医院泌尿外科,深圳518116;",中国医药导刊,家庭护理干预;终末期血液透析患者;疾病知识知晓率调查表;肾脏疾病生活质量量表;,R473.5,2012,,12
ysbjzn-x201618189,1,"ISTIC,PKU",超短种植体在后牙区应用效果观察,,陈淑萍[1];李恩洪[2];杨立明[1];李小菊[1];,[1]广东省深圳市龙华新区人民医院口腔科;[2]广东省深圳市龙岗区人民医院口腔科;,养生保健指南,牙;短种植体;冠-种植体比例(C/I);,,2016,,18
zxyjhxnxgbzz201311045,0,,山葛黄泽乌汤对代谢综合征大鼠的影响,10.3969/j.issn.1672-1349.2013.11.045,郭洪波[1];罗利梅[2];罗玉梅[1];张秀芳[1];谭琼清[1];,"[1]深圳市龙岗区人民医院,518172;[2]深圳市龙岗中心医院;",中西医结合心脑血管病杂志,代谢综合征;山葛黄泽乌汤;血脂;,R589  R285.5,2013,11,11
hljyx201605035,0,,深圳市社区失能老人现状及其家庭病床服务需求调查,10.3969/j.issn.1004-5775.2016.05.035,钟彩英[1];吴翠平[1];黄树琴[2];李丽文[1];倪殿军[1];夏会敏[1];,"[1]深圳市龙华新区人民医院神经外科,广东深圳,518109;[2]深圳市龙岗区人民医院社管中心,广东深圳,518116;",黑龙江医学,失能老人;生活质量;家庭病床;现状;,R195,2016,40,5
zggrkzzz201201013,2,,口腔诊室空气质量动态研究,10.3969/j.issn.1671-9638.2012.01.013,刘玉春[1];魏跃[1];朱继辉[1];周凤平[1];高永波[2];,"[1]深圳市龙岗区人民医院,广东深圳,518172;[2]深圳市龙岗中心医院,广东深圳,518172;",中国感染控制杂志,口腔诊室;空气污染;空气消毒;医院感染;感染控制;,R181.3+4,2012,11,1
yxwx201503047,1,,种植牙同位点骨屑的收集及应用效果,10.11864/j.issn.1673.2015.03.47,李恩洪[1];杨立明[2];陈淑萍[2];,"[1]广东深圳市龙岗区人民医院,深圳市,518172;[2]广东深圳市龙华新区人民医院,深圳市,518109;",微创医学,同位点;骨屑;骨缺损;自体骨;牙种植体;,R783.3,2015,10,3
yyyxyxb201203011,1,,反复发作的尿路感染患者病原学及耐药性分析,,李广为[1];冯建华[1];罗秀玲[2];乐有为[1];杜广辉[3];杨为民[3];,"[1]深圳市龙岗中心医院泌尿外科;[2]深圳市龙岗区人民医院,广东深圳,518116;[3]华中科技大学同济医学院附属同济医院泌尿外科,湖北武汉,430030;",湖北医药学院学报,尿路感染;革兰阴性菌;耐药性;支原体;衣原体;,R695,2012,31,3
fsbygjy201407009,8,,浮针治疗强直性脊柱炎20例疗效观察,10.3969/j.issn.2095-4174.2014.07.006,王英杰[1];丘文静[2];,"[1]深圳市龙岗中心医院,广东 深圳,518116;[2]深圳市龙岗区人民医院,广东 深圳,518172;",风湿病与关节炎,"脊柱炎,强直性;浮针疗法;腰背疼痛;晨僵;疲劳;",,2014,,7
yxxxzz201634020,0,,干细胞标志Nanog在食管鳞癌组织中表达及预后关系,10.3969/j.issn.1006-1959.2016.34.020,麻成方[1];余征[2];李绍鹏[1];李志华[1];魏春勇[1];汪礼旭[1];洪琼川[1];,"[1]深圳市龙岗中心医院 深圳市第九人民医院 心胸外科,广东 深圳,518116;[2]深圳市龙岗区人民医院体检科,广东 深圳,518116;",医学信息,食管鳞癌;Nanog;,,2016,29,34
fsbygjy201501010,3,,眼针疗法与常规针刺治疗腰椎间盘突出症对照研究,10.3969/j.issn.2095-4174.2015.01.008,王英杰[1];温天燕[1];丘文静[2];,"[1]深圳市龙岗中心医院,广东 深圳,518116;[2]深圳市龙岗区人民医院,广东 深圳,518172;",风湿病与关节炎,腰椎间盘突出症;眼针;疗法;针刺;疗效观察;,,2015,,1
rdyxzz201507042,0,,深圳市龙岗区60岁以上常住居民空腹血糖现况调查,,林锦波[1];陈小良[2];张云凤[3];黄雪良[1];巫伟忠[1];罗石友[1];,"[1]深圳市龙岗中心医院,广东深圳,518116;[2]深圳市光明新区疾病预防控制中心,广东深圳,518106;[3]深圳市龙岗区人民医院,广东深圳,518172;",热带医学杂志,糖尿病;空腹血糖;老年人;,R587.1,2015,15,7
zgsyxyxzz201604037,0,"ISTIC,PKU",树突状细胞促进外周血CRTH2(CD4+CD294+Th2)细胞增殖和辅助B细胞分泌免疫球蛋白,10.7534/j.issn.1009-2137.2016.04.037,田发青[1];李娟[2];李举亨[3];唐玫琴[3];成小慧[3];黄映彩[4];李惠卿[4];,"[1]中山大学附属第一医院血液内科,广东广州510080;深圳市龙岗区人民医院血液内科,广东深圳518172;[2]中山大学附属第一医院血液内科,广东广州,510080;[3]深圳市龙岗区人民医院血液内科,广东深圳,518172;[4]深圳市龙岗区人民医院血细胞实验室,广东深圳,518172;",中国实验血液学杂志,树突状细胞;CRTH2细胞;B细胞;,R392.28,2016,24,4
