jyyxylc201212005,0,,尿液有形成分分析仪的红细胞研究参数及其信息对血尿来源诊断的应用,10.3969/j.issn.1672-9455.2012.12.005,张淑贞;李雪宏;欧丽丽;,[1]广东省深圳市龙岗区葵涌人民医院检验科 518119,检验医学与临床,血尿;红细胞参数;红细胞信息;尿液有形成分分析仪;,R446.12,2012,09,12
zgyy201511011,2,,大剂量缬沙坦对心力衰竭患者神经内分泌及心室重构的影响,,钟庆华;洪雷;方胜先;彭文君;曾小林;,"[1]广东省深圳市龙岗中心医院心血管内科,广东 深圳,518116",中国药业,心力衰竭;缬沙坦;心室功能;血管紧张素;脑钠肽;,R969.4  R972+.4,2015,,11
gwyx-hxxt201616003,0,,缺氧诱导因子1α基因G1790A或导致COPD易感性,10.3760/cma.j.issn.1673-436X.2016.16.003,李冰[1];魏文婷[2];陈淼[3];贾晔然[3];詹文锋[3];张红璇[4];,"[1]518116,深圳市龙岗中心医院ICU;[2]广东省人民医院综合二区,广州,510000;[3]广东省人民医院急危重症医学部,广州,510000;[4]广东省人民医院广东省老年医学研究所,广州,510000;",国际呼吸杂志,缺氧诱导因子1α;慢性阻塞性肺疾病;单核苷酸多态性;,,2016,36,16
wcbx201608004,0,,XAF1转录变异体在结直肠肿瘤中的差异表达,10.3969/j.issn.1008-7125.2016.08.003,周永柏[1];吴伟[1];王继德[2];张亚历[2];,[1]深圳市龙岗中心医院消化科 518116;[2]南方医科大学南方医院消化内科;,胃肠病学,"X连锁凋亡抑制蛋白相关因子1;基因,肿瘤抑制;RNA加工,转录后;转录变异体;结直肠肿瘤;",,2016,21,8
kqhmxfxzz201604012,0,,下颌骨岛区植入种植体的疗效探讨,10.3969/j.issn.1009-3761.2016.04.012,林璇[1];林臻彦[1];李阳[2];,[1]深圳市龙岗中心医院口腔科 广东 518116;[2]遵义医学院附属龙岗中心医院口腔科 广东 518116;,口腔颌面修复学杂志,骨岛;种植体;锥束CT;,R780.5,2016,17,4
hainanyx201420058,3,,急诊输液室药物不良反应及其应急护理措施探讨,10.3969/j.issn.1003-6350.2014.20.1225,赖春娟;李季妮;,"[1]深圳市龙岗中心医院急诊科,广东 深圳,518116",海南医学,急诊输液室;药物不良反应;应急护理;,R472.9,2014,,20
tlsjyyj201303086,2,,社区公众心肺复苏知识和技能培训效果分析,10.3969/j.issn.1672-9676.2013.03.086,黄翠红;王文玓;杨芳;欧瑞燕;邱映明;,"[1]518172,广东省深圳市龙岗区人民医院",护理实践与研究,社区公众;心肺复苏;调查;培训;,,2013,10,3
yxllysj201211068,0,,前瞻性预防措施防范人工髋关节置换术后并发症的护理探讨,10.3969/j.issn.1001-7585.2012.11.068,廖华琴;鲁超;林春燕;常君华;,"[1]广东省深圳市龙岗区葵涌人民医院,518119",医学理论与实践,前瞻性预防措施;人工髋关节置换;护理;,R473.6,2012,25,11
zgfybj201317047,0,"ISTIC,PKU",MMP-9/TIMP-1在稽留流产中的表达及其相关性研究,10.7620/zgfybj.j.issn.1001-4411.2013.28.47,蒋德菊;刘美霞;陈绍玲;,[1]广东省深圳市龙岗中心医院 518116,中国妇幼保健,稽留流产;MMP-9;TIMP-1;,R714.21,2013,28,17
sjzyy201404023,0,"ISTIC,PKU",蜈蚣三七纳米粉预防大鼠术后肠粘连的机制研究,10.3969/j.issn.1673-7202.2014.04.023,黄欣[1];李一鸣[2];徐福琴[1];何明钎[1];邴飞虹[2];,[1]深圳市龙岗区人民医院普外科，深圳，518172;[2]湖北中医药大学药学院中药资源与中药复方重点实验室，武汉，430065;,世界中医药,蜈蚣三七;肠粘连;TNF-α;IL-1β;IL-6;,R285.5,2014,,4
shanxzy201505023,2,"ISTIC,PKU",龙胆泻肝汤加减治疗女性迟发性痤疮及对性激素的影响,10.3969/j.issn.1000-7369.2015.05.023,黎伟珍;郭汉香;张弘;,[1]深圳市龙岗中心医院皮肤科 深圳518116,陕西中医,寻常痤疮/中西医结合疗法;龙胆泻肝汤/治疗应用;,R758.733,2015,,5
gwyx-hlxfc201307077,5,"ISTIC,PKU",ICU鼻饲患者胃残液量与误吸的相关性分析,10.3760/cma.j.issn.1673-4351.2013.07.077,何茹;邹必容;陈秀华;曹枫;,"[1]深圳市龙岗中心医院综合ICU,广东深圳,518116",国际护理学杂志,鼻饲;机械通气;胃残液量;胃蛋白酶;误吸;,R473,2013,32,7
sxyyzz201615025,0,"ISTIC,PKU",双钢板手术治疗 C 型肱骨远端骨折的疗效探讨,10.3969/j.issn.0253-9926.2016.015.021,余英剑;陈伟全;许露;曹瑞治;,[1]518116深圳市龙岗中心医院骨科,山西医药杂志,,,2016,45,15
yycyzx201321004,5,,人参皂苷CK的抗炎及神经保护作用研究,10.3969/j.issn.1673-7210.2013.21.004,刘伟;缪建春;,"[1]广东省深圳市龙岗中心医院药剂科,广东深圳,518116",中国医药导报,人参皂苷CK;小胶质细胞;败血症;脑缺血;,R285.5,2013,10,21
gwyx-hlxfc201307126,5,,人性化护理在外科护理中的应用,10.3760/cma.j.issn.1673-4351.2013.07.126,庄文燕;赵燕;钟红娟;江新娣;曾小丽;,"[1]518116,广东省深圳市龙岗中心医院",国际护理学杂志,外科;人性化护理;护理质量;,R47  C931,2013,32,7
jslcyxzz201404033,4,,改进护理服务措施在体检静脉血采集中的应用效果分析,10.7619/jcmp.201404033,蓝宇萍;,"[1]广东省深圳市龙岗中心医院,广东深圳,518116",实用临床医药杂志,改进;护理服务措施;静脉血采集;护理质量;,R473.5,2014,18,4
zwjkwz201222398,0,,克山病X线诊疗心得,10.3969/j.issn.1672-5085.2012.22.398,庄玉宽;,"[1]深圳市龙岗区葵涌人民医院,518119",中外健康文摘,克山病;诊断;治疗;X线;,R445,2012,09,22
kqhmxfxzz201401004,4,,烤瓷贴面临床效果相关影响因素的回顾性研究,10.3969/j.issn.1009-3761.2014.01.004,杜瑞钿[1];李彦[2];范丹妮[2];吴淑仪[2];,[1]深圳市龙岗中心医院口腔科 广东518116;[2]中山大学光华口腔医学院修复科 中山大学口腔医学研究所 广东 510055;,口腔颌面修复学杂志,牙冠覆盖体;牙瓷料;存留率;回顾性研究;,R783.4,2014,15,1
xdyfyx201214068,5,"ISTIC,PKU",脑出血患者细胞免疫功能变化研究,,周路球;马真;石小峰;尹夕龙;贾军;纠智松;陈国昌;孙大勇;,"[1]广东省深圳市龙岗中心医院神经外科,广东深圳,518116",现代预防医学,脑出血;细胞;免疫;T淋巴细胞亚群;红细胞免疫;,R743.34,2012,39,14
scyx201204046,7,"ISTIC,PKU",脑外伤患者AQP4的表达及其与临床预后的关系,10.3969/j.issn.1004-0501.2012.04.046,欧阳锡华;贾军;刘政委;,"[1]深圳市龙岗中心医院神经外科,广东深圳,518116",四川医学,脑外伤;水通道蛋白4;免疫组化;脑水肿;预后;,R651.15,2012,33,4
yxzs201208018,7,"ISTIC,PKU",脑卒中后肢体功能障碍的循证康复治疗技术,10.3969/j.issn.1006-2084.2012.08.018,田永锋[1];李明亮[2];王明军[1];柳学勇[1];,"[1]深圳市龙岗中心医院康复科,广东,深圳,518116;遵义医学院,贵州,遵义,563003;[2]广东省珠海市遵义医学院第五附属,珠海,医院神经内科,广东,珠海,519100;",医学综述,脑卒中;肢体功能障碍;循证;康复;,R743,2012,18,8
tlsjyyj201614041,0,"ISTIC,PKU",纽曼系统护理模式对肝脏 MRI 动态增强扫描负性情绪及并发症的影响,10.3969/j.issn.1672-9676.2016.14.041,赖文娟;,"[1]518116,深圳市 广东省深圳市龙岗中心医院影像科",护理实践与研究,纽曼系统护理模式;肝脏扫描;负性情绪;并发症;,,2016,13,14
shanxzy201504026,2,"ISTIC,PKU",四磨汤治疗骨折患者及对胃肠功能与免疫功能的影响,10.3969/j.issn.1000-7369.2015.04.026,薛雅瑜;,[1]深圳市龙岗中心医院急诊科 深圳51811,陕西中医,骨折/并发症;胃肠功能/中医药疗法;四磨汤;,S941.3,2015,36,4
tlsjyyj201511002,1,"ISTIC,PKU",抗栓泵与压力带联合应用预防剖宫产术后下肢深静脉血栓的研究,10.3969/j.issn.1672-9676.2015.11.001,朱小芳;李德凤;张福珍;吴雪琴;黄小红;陈娟慧;,"[1]518116,深圳市 广东省深圳市龙岗中心医院产科",护理实践与研究,抗栓泵;压力带;下肢深静脉血栓;预防;,,2015,,11
zgzyjz201401092,4,"ISTIC,PKU",椎旁阻滞联合星状神经节阻滞治疗神经根型颈椎病疗效观察,10.3969/j.issn.1004-745X.2014.01.092,阳世光;余则刚;邹传惠;陈丽嫦;郭锡素;,"[1]广东省深圳市龙岗中心医院,广东深圳,518116",中国中医急症,椎旁阻滞;星状神经节阻滞;颈椎病;神经根型;,R681.5+5,2014,23,1
zwjkwz201217418,0,"ISTIC,PKU",老年人骨折后继发性老化的71例护理体会,10.3969/j.issn.1672-5085.2012.17.418,廖华琴;鲁超;林春燕;黄秋琴;,"[1]深圳市龙岗区葵涌人民医院,518119",中外健康文摘,老年人骨折;继发性老化;护理体会;,R473.6,2012,09,17
xdlcyxswgcxzz201603025,0,"ISTIC,PKU",组蛋白去乙酰化酶抑制剂治疗胰腺炎的研究进展,10.3760/cma.j.issn.1674-1927.2016.03.018,凌涛;谢佳;孙大勇;,"[1]深圳市龙岗中心医院急诊科,广东深圳,518116",中华生物医学工程杂志,,,2016,22,3
ahzyxyxb201603009,0,"ISTIC,PKU",稳心颗粒对慢性心力衰竭患者临床预后的影响,10.3969/j.issn.2095-7246.2016.03.009,匡荣仁[1];李云鹏[2];洪雷[1];曾小林[1];徐燕[1];,"[1]深圳市龙岗中心医院心内科,广东深圳,518116;[2]南方医科大学珠江医院心内科,广东广州,510280;",安徽中医药大学学报,慢性心力衰竭;稳心颗粒;临床预后;生存分析;,R541.6,2016,35,3
rdyxzz201505012,2,"ISTIC,PKU",GBE对HIBD新生大鼠脑组织MMP-9及TIMP-1表达影响的研究,,曹巧玲;王瑞华;陈广斌;史治宙;庞国象;,"[1]深圳市龙岗区人民医院儿科,广东深圳,518172",热带医学杂志,银杏叶提取物;缺氧缺血性脑损伤;新生大鼠;MMP-9;TIMP-1;,R965,2015,15,5
sxykdxxb201408026,3,"ISTIC,PKU",腹腔镜早期手术联合清胰汤治疗重症急性胰腺炎临床分析,10.13753/j.issn.1007-6611.2014.08.026,刘继东;阎玉矿;廖红霞;鲍兴;辛乐;,"[1]深圳市龙岗中心医院普通外科,深圳,518116",山西医科大学学报,腹腔镜;腹腔灌洗;重症急性胰腺炎;清胰汤;,R657.51,2014,45,8
hainanyx201314002,1,"ISTIC,PKU",金纳多对大鼠急性脊髓损伤内质网应激蛋白GADD153/CHOP表达的影响,10.3969/j.issn.1003-6350.2013.14.0844,王德桂[1];马泽民[2];吕国华[2];侯明[1];戴哲浩[2];邓幼文[2];,"[1]深圳市龙岗区人民医院骨科,广东 深圳,518172;[2]中南大学湘雅二医院脊柱外科,湖南 长沙,410011;",海南医学,脊髓损伤;内质网应激;细胞凋亡;CHOP;金纳多;,R-332,2013,24,14
yycyzx201235014,2,"ISTIC,PKU","""渐处理""对肺缺血再灌注损伤的保护作用",10.3969/j.issn.1673-7210.2012.35.014,麻日虎[1];李莹[1];王玉旋[2];张静[1];,"[1]广东省深圳市龙岗区人民医院外科,广东深圳,518172;[2]山西省肿瘤医院胸外科,山西太原,030013;",中国医药导报,缺血再灌注损伤;缺血后处理;渐处理;肺;大鼠;,R563,2012,9,35
gwyx-jscbfc201401012,0,"ISTIC,PKU",蓝氏贾第鞭毛虫致急性腹泻1例并文献复习,10.3760/cma.j.issn.1673-4122.2014.01.012,黄映彩;崔海燕;李朝辉;吴丽珊;,"[1]深圳市龙岗区人民医院检验科, 深圳,518172",国际医学寄生虫病杂志,,,2014,41,1
zgjjfsyzhyxzz201402015,0,"ISTIC,PKU",非诺贝特和吡格列酮联合应用对代谢综合征患者动脉粥样硬化的影响,10.3969/j.issn.1673-6966.2014.02.011,吴晨方[1];彭文[1];柴湘平[1];周胜华[1];罗玉梅[2];,"[1]中南大学湘雅二医院,长沙,410011;[2]深圳市龙岗区人民医院;",中国急救复苏与灾害医学杂志,非诺贝特;吡格列酮;代谢综合征;动脉粥样硬化;,R54,2014,,2
zgxdptwkjz201402023,0,"ISTIC,PKU",头孢曲松钠相关性胆囊结石豚鼠胆汁和血清总胆汁酸的变化,10.3969/j.issn.1009-9905.2014.02.023,梁小燕[1];邱晓俊[1];钟毓杰[2];刘忠民[2];,[1]广东医学院肝胆外科教研室 广东 湛江524023;[2]深圳市龙岗区人民医院普外科 广东 深圳518172;,中国现代普通外科进展,胆囊结石;头孢曲松钠;豚鼠;,R657.4,2014,17,2
zgyydk201204077,3,"ISTIC,PKU",导乐陪伴护理模式对分娩的影响,10.3969/j.issn.1009-0959.2012.04.077,谭亚杰;陆小娟;张庚秀;,"[1]广东省深圳市龙岗区人民医院产科,深圳,518172",中国医药导刊,导乐陪伴;分娩;产程;产科并发症;,R473.71,2012,14,4
gwyx-lcsw201611015,0,"ISTIC,PKU",泌尿生殖系感染患者尿液中沙眼衣原体、淋球菌、解脲脲原体感染分析,10.3969/j.issn.1673-4130.2016.11.015,罗艺;徐文莉;张洪德;李康;廖长征;,[1]广东省深圳市龙岗中心医院中心实验室 518116,国际检验医学杂志,泌尿生殖系统感染;尿液;聚合酶链反应;沙眼衣原体;淋球菌;解脲脲原体;,,2016,37,11
tlsjyyj201611052,0,"ISTIC,PKU",600名健康体检人群的骨密度检查结果分析与护理干预,10.3969/j.issn.1672-9676.2016.11.047,庄文燕;仪立志;李玉梅;赵燕;周瑞媚;,"[1]518116,深圳市 广东省深圳市龙岗中心医院体检科",护理实践与研究,骨密度检查;绝经女性;护理干预;,,2016,13,11
jbkzzz201301013,11,"ISTIC,PKU",2008-2010年深圳市手足口病就诊情况及病原学研究,,杨洪[1];何雅青[1];张海龙[1];冼慧霞[1];姚相杰[1];罗敏[1];刘慧英[2];何学森[2];,"[1]深圳市疾病预防控制中心重大传染病监控实验室,广东深圳,518055;[2]深圳市龙岗中心医院预防保健科,广东深圳,518116;",中华疾病控制杂志,手足口病;肠道病毒;传染病;,R512.57,2013,17,1
tlsjyyj201611054,0,"ISTIC,PKU",神经外科危重患者发生下呼吸道感染的因素分析及护理对策,10.3969/j.issn.1672-9676.2016.11.049,付芳;徐琼英;温映霞;,"[1]518116,深圳市 深圳市龙岗中心医院急诊科",护理实践与研究,神经外科;下呼吸道感染;危险因素;护理对策;,,2016,13,11
sxyyzz201415011,3,"ISTIC,PKU",纤维蛋白凝胶携载血管内皮生长因子修复大鼠坐骨神经损伤的组织学观察,,刘恒;曹瑞治;,[1]518116深圳市龙岗中心医院骨关节科,山西医药杂志,坐骨神经病;血管内皮生长因子类;药物载体;纤维蛋白凝胶;,,2014,,15
hainanyx201324017,4,"ISTIC,PKU",高度宫颈上皮内瘤变电环切术后复发的预测因素,10.3969/j.issn.1003-6350.2013.24.1509,李玉芳;刘美霞;郭端英;,"[1]深圳市龙岗中心医院妇产科,广东 深圳,518116",海南医学,宫颈上皮内瘤样变;环形电切术;复发;预测因素;,R730.1,2013,24,24
gyzyxyxb201505022,1,"ISTIC,PKU",间歇式充气加压仪预防肠癌根治术患者下肢深静脉血栓效果,10.3969/j.issn.1002-1108.2015.05.022,叶春丽;祝研华;张绿云;彭冬雪;罗美莲;,"[1]深圳市龙岗中心医院,广东深圳,518116",贵阳中医学院学报,间歇式充气加压仪;肠癌护理;深静脉血栓;,R473.73,2015,37,5
gwyx-lcsw201610024,0,"ISTIC,PKU",3种不同方法检测乙型肝炎病毒的诊断性能比较,10.3969/j.issn.1673-4130.2016.10.024,陈建霞;许瑞环;黄衍锋;张旭;,"[1]深圳市龙岗中心医院检验科,广东深圳,518116",国际检验医学杂志,乙型肝炎病毒;酶联免疫法;电化学发光法;聚合酶链式反应法;,,2016,37,10
gwyx-zyzyfc201306011,1,"ISTIC,PKU",蜈蚣三七纳米粉对大鼠术后肠黏连的预防作用,10.3760/cma.j.issn.1673-4246.2013.06.011,黄欣[1];李一鸣[2];徐福琴[1];何明钎[1];丘自挺[1];邴飞虹[2];,"[1]518172,深圳市龙岗区人民医院普外科;[2]湖北中医药大学药学院中药资源与中药复方重点实验室,武汉,430065;",国际中医中药杂志,蜈蚣三七;肠黏连;大鼠;,,2013,35,6
hainanyx201323047,4,"ISTIC,PKU",社区高血压患者规范化管理的效果评价,10.3969/j.issn.1003-6350.2013.23.1476,李季妮;赖春娟;李春红;,"[1]深圳市龙岗中心医院全科,广东 深圳,518116",海南医学,高血压;社区;规范化管理;效果评价;,R544.1,2013,24,23
gwyx-lcsw201323016,4,"ISTIC,PKU",网织血小板检测对特发性血小板减少性紫癜的诊断价值,10.3969/j.issn.1673-4130.2013.23.016,陈建霞;黄衍锋;张旭;黄望香;,"[1]深圳市龙岗中心医院检验科,广东深圳,518116",国际检验医学杂志,"紫癜,血小板减少性,特发性;血小板计数;诊断;网织血小板;",,2013,34,23
hqzyy201401019,0,"ISTIC,PKU",曾庆祥主任医师运用脾胃学说的临床经验,10.3969/j.issn.1674-1749.2014.01.019,邹立华;,"[1]广东省深圳市龙岗区人民医院中西医结合科,518172",环球中医药,曾庆祥;脾胃学说;临床经验;,R249,2014,7,1
rdyxzz201304023,10,"ISTIC,PKU",硝普钠与硝酸甘油治疗高血压危象并急性左心功能不全的疗效观察,,唐细生;胡平;,"[1]深圳市龙岗中心医院内科,广东深圳,518116",热带医学杂志,硝普钠;硝酸甘油;高血压危象;左心功能不全;,R544.1,2013,13,4
sjzyy201401020,0,"ISTIC,PKU",曾庆祥运用补肾法的临床经验,10.3969/j.issn.1673-7202.2014.01.018,邹立华;,[1]深圳市龙岗区人民医院，深圳，518172,世界中医药,曾庆祥;补肾法;临床经验;,R243  R256.5,2014,,1
yxzs201504040,2,"ISTIC,PKU",高频超声在骶尾部肌骨疾病中的应用进展,10.3969/j.issn.1006-2084.2015.04.039,尹倩;陈一武;王晓刚(综述);鄂占森(审校);,"[1]遵义医学院附属深圳市龙岗中心医院超声科,广东 深圳,518116",医学综述,高频超声;骶尾部;肌肉骨骼;,R455.1,2015,,4
hlglzz201304018,5,"ISTIC,PKU",局域空气层流机对口腔种植手术室两种空气消毒方法的效果观察,10.3969/j.issn.1671-315X.2013.04.018,周利文[1];高永波[1];李莉莉[2];舒香云[1];林东晓[1];陈丽璇[1];,"[1]广东省深圳市龙岗中心医院口腔科,518116;[2]吉林大学口腔医院感染控制办公室,长春市,130041;",护理管理杂志,局域空气层流机;口腔种植;手术室;空气消毒;,R472.1,2013,13,4
yxzs201609020,0,"ISTIC,PKU",高频超声在男性会阴部肌骨疾病中的应用进展,10.3969/j.issn.1006-2084.2016.09.020,曲涛;尹倩;,"[1]遵义医学院附属深圳市龙岗中心医院超声科,广东深圳,518116",医学综述,高频超声;男性会阴部;肌肉骨骼;,R455.1,2016,22,9
gwyx-hlxfc201609024,0,"ISTIC,PKU",肛周给药护理在肛周疾病结扎切除术术后患者中的应用,10.3760/cma.j.issn.1673-4351.2016.09.024,廖志平;叶红萍;,"[1]518100,广东省深圳市龙岗中心医院中医肛肠科",国际护理学杂志,肛周;给药护理;疼痛;尿潴留;,,2016,35,9
sxyyzz201413052,3,"ISTIC,PKU",空心钉治疗股骨颈骨折的闭合复位及置钉技巧,,刘恒;曹瑞治;,"[1]518116,广东省深圳市龙岗中心医院骨关节科",山西医药杂志,,,2014,,13
lcfkzz201210028,2,"ISTIC,PKU",乌司他丁联合参麦注射液治疗ALI的疗效研究,10.3969/j.issn.1009-6663.2012.10.028,邹立华;李惠;陈小丹;邓忠慧;,"[1]深圳,深圳市龙岗区人民医院,广东,518172",临床肺科杂志,急性肺损伤;乌司他丁;参麦注射液;,R563.8,2012,17,10
yxzs201202042,7,"ISTIC,PKU",高频超声在颈部肌肉骨骼系统疾病中的应用,10.3969/j.issn.1006-2084.2012.02.042,陈峥;柳展梅;吕海霞;张颖;,"[1]深圳市龙岗中心医院超声科,广东,深圳,518116",医学综述,高频超声;颈部;肌肉骨骼;,R445.1,2012,18,2
yxyxxzz201604014,0,"ISTIC,PKU",下颌下腺导管结石640层CT诊断价值,,王秀荣;谢尚煌;梁冰;申云霞;胡卫东;,[1]广东省深圳市龙岗中心医院医学影像科广东深圳 518116,医学影像学杂志,"下颌下腺导管;涎石症;体层摄影术,X线计算机;",R781  R814.42,2016,26,4
rdyxzz201608009,0,"ISTIC,PKU",缺铁性贫血与慢性病贫血的鉴别诊断,,黄衍锋[1];郑望春[2];丘衍博[1];刘雄伟[1];陈建霞[1];许瑞环[1];,"[1]深圳市龙岗中心医院检验科,广东深圳,518116;[2]深圳市龙岗区中心血站检验科,广东深圳,518172;",热带医学杂志,慢性病性贫血;总铁结合力;红细胞分布宽度;,R447  R556,2016,16,8
qlhlzz201608003,0,"ISTIC,PKU",标准化护理策略在脑脊液引流患者中的应用,10.3969/j.issn.1006-7256.2016.08.003,付芳;徐琼英;温映霞;,[1]深圳市龙岗中心医院 广东深圳518116,齐鲁护理杂志,神经外科;脑脊液引流;标准化策略;护理质量;,R473.6,2016,22,8
qlhlzz201608011,0,"ISTIC,PKU",基于多元化护理需求的治疗性沟通在泌尿系统疾病合并糖尿病手术患者中的应用,10.3969/j.issn.1006-7256.2016.08.011,沈明凤;张庆;黄春明;,[1]深圳市龙岗中心医院 广东深圳518116,齐鲁护理杂志,多元化护理需求;治疗性沟通;泌尿系统;糖尿病;,R473.6,2016,22,8
sjzxyjhzz2013z1021,0,"ISTIC,PKU",四磨汤口服液配合腹部按摩治疗白领女性功能性便秘50例观察,,尹超群;杨卫华;,"[1]深圳市龙岗区人民医院,深圳,518113",世界中西医结合杂志,,,2013,8,z1
zxyjhxnxgbzz201607033,0,"ISTIC,PKU",出血性脑梗死病人基质金属蛋白酶9与高敏C反应蛋白动态变化的临床意义,10.3969/j.issn.1672-1349.2016.07.033,李慧明;,[1]深圳市龙岗中心医院 深圳 518116,中西医结合心脑血管病杂志,出血性脑梗死;基质金属蛋白酶 9;高敏 C反应蛋白;动态变化;,R743  R255,2016,14,7
zgjcyy201215088,6,,老年高血压病患者应用临床护理路径的效果评价,10.3760/cma.j.issn.1008-6706.2012.15.088,叶素惠;池韵清;李慧明;张珺;,"[1]深圳市龙岗中心医院保健科,广东省深圳,518116",中国基层医药,老年人;高血压;临床护理路径(CNP);效果;,R544.1,2012,19,15
zhonggba201508023,1,,深圳市某医院住院分娩产妇费用与影响因素分析,10.3969/j.issn.1672-2566.2015.08.023,钟倩君[1];钟晓[2];,"[1]518122,深圳市 深圳市坪山区妇幼保健院;[2]518116深圳市深圳市龙岗中心医院;",中国病案,住院费用;住院分娩;剖宫产;影响因素;,,2015,,8
zhlcyszz201323080,0,,α-硫辛酸对2型糖尿病大鼠肝脏脂质沉积的改善作用,10.3877/cma.j.issn.1674-0785.2013.23.081,史治宙[1];郭中秋[1];谭娅琴[1];万新红[1];武革[2];陈晓兵[3];黄继平[1];陈玉华[1];,"[1]518172,广东省深圳市龙岗区人民医院内分泌科;[2]广东医学院附属医院内分泌科;[3]深圳市华侨城医院外科;",中华临床医师杂志（电子版）,"硫辛酸;糖尿病,2型;肝脏脂质沉积;",,2013,,23
zwkjzlml-yyws201416019,18,,特布他林联合布地奈德雾化吸入治疗支气管哮喘临床疗效,,叶春幸;卓宋明;马真;孙俊生;申严;李娜;,"[1]深圳市龙岗中心医院呼吸内科,广东深圳,518000",中国现代医生,特布他林;布地奈德;支气管哮喘;,R562.25,2014,52,16
zgrdyx201608005,0,,CD200在重症中暑大鼠中的表达及其与炎症因子关系,10.13604/j.cnki.46-1064/r.2016.08.05,陈荣琳[1];童华生[2];曹枫[1];符少平[1];段鹏凯[2];陆杰富[2];,"[1]深圳市龙岗中心医院重症医学科,广东深圳,518116;[2]广州军区广州总医院重症医学科,解放军热区损伤与组织修复重点实验室,广东广州515000;",中国热带医学,中暑;CD200;炎症;细胞因子;,R594.12,2016,16,8
hnsysjjbzz201606025,0,,前交通动脉破裂微小动脉瘤的血管内治疗,10.3969/j.issn.1673-5110.2016.06.025,陈委[1];叶宇[1];欧阳锡华[1];仪立志[1];刘政委[1];黄理金[2];石小峰[1];,[1]广东深圳市龙岗中心医院神经外科 深圳 518116;[2]南方医科大学第三附属医介入科神经外科 广州 510630;,中国实用神经疾病杂志,微小动脉瘤;破裂;血管内治疗;,R739.4,2016,19,6
qlhlzz201606013,0,,持续质量改进对老年股骨粗隆骨折患者术后康复及关节功能的影响,10.3969/j.issn.1006-7256.2016.06.011,钟红娟;曹瑞治;蒋小蓉;邹粉珍;李风英;,[1]深圳市龙岗中心医院 广东深圳 518116,齐鲁护理杂志,持续质量改进;老年股骨粗隆骨折;康复护理;关节功能;生活质量;,R473.6,2016,22,6
hqzyy201304018,1,,曾庆祥主任医师运用温热药的临床验案,10.3969/j.issn.1674-1749.2013.04.018,邹立华;,"[1]518172,深圳市龙岗区人民医院神经内科",环球中医药,曾庆祥;温热药;临床经验;,R249,2013,6,4
gdywkzz201302022,1,,医源性胆管损伤23例临床分析,10.3969/j.issn.1007-1954.2013.02.022,郭卫;刘忠民;杨栋;钟毓杰;,"[1]深圳市龙岗区人民医院普外科,广东深圳,518172",肝胆胰外科杂志,胆管损伤;原因;预防;,R657.4,2013,25,2
hainanyx201214051,6,,静脉内心电图引导PICC尖端定位的效果分析,10.3969/j.issn.1003-6350.2012.14.051,邓志妤;陈敏;黄明毅;张平;,"[1]深圳市龙岗中心医院心电图室,深圳广东,518116",海南医学,静脉内;心电图;PICC;,R540.4+1,2012,23,14
hainanyx201217002,2,,乙型肝炎患者血清中TLR2和TLR4的表达及其意义,10.3969/j.issn.1003-6350.2012.17.002,万彦彬;李观强;李朝辉;,"[1]深圳市龙岗区人民医院检验科,广东深圳,517182",海南医学,乙型肝炎;TLR2;TLR4;诊断;酶联免疫吸附实验;,R512.6,2012,23,17
hbyx201311005,0,,应用Bentall手术治疗马凡氏综合征的体外循环管理策略,10.3969/j.issn.1006-6233.2013.11.005,杨丽娜[1];汪涛[1];凌庆[2];蓝远敏[1];刘凤莲[1];何世琼[1];,"[1]广东省深圳市龙岗区人民医院心胸外科,广东 深圳,518172;[2]广东省深圳市人民医院心外科,广东 深圳,518000;",河北医学,体外循环;马凡氏综合征;Bentall手术;,,2013,19,11
lcfkzz201311017,0,,足月儿呼吸窘迫综合征发病危险因素的研究,10.3969/j.issn.1009-6663.2013.11.017,刘燕;刘海霞;麦水强;,"[1]深圳,深圳市龙岗区人民医院儿科,广东,518172",临床肺科杂志,呼吸窘迫综合征;足月儿;危险因素;,,2013,18,11
yycyzx201203024,3,,连续气道正压通气对阻塞性睡眠呼吸暂停患者血流动力学的影响,10.3969/j.issn.1673-7210.2012.03.024,王合金;阳书坤;孙艳芬;徐福琴;,"[1]深圳市龙岗区人民医院,广东深圳,518172",中国医药导报,睡眠呼吸暂停综合征;血流动力学;连续气道正压通气;,R563.9,2012,09,3
