bhdxxb201202017,10,,结肠癌患者血清中IL-8和VEGF的检测及临床意义,10.3969/j.issn.1009-4822.2012.02.017,项立;胡卫东;陈涛英;龙子义;谢俊萍;蓝宇萍;杨兵;,"[1]深圳市龙岗中心医院,广东深圳,518116",北华大学学报：自然科学版,结肠癌;白介素-8;血管内皮生长因子;,R735,2012,13,2
qqhryxyxb201522083,4,,门诊老年输液患者焦虑的护理体会,,洪晓丹;冉启蓉;刘开香;,"[1]518116,深圳市龙岗中心医院输液室",齐齐哈尔医学院学报,门诊;老年输液病人;焦虑;护理;体会;,,2015,,22
zgyyzn201425243,6,,社区糖尿病合并低血糖实施优质护理对预后的影响探讨,,张秀玲;,"[1]深圳市龙岗中心医院,广东深圳,518116",中国医药指南,糖尿病合并低血糖;社区;优质护理;护理方法;,R473.5,2014,,25
hbgfyy201505010,1,,非小细胞肺癌术后并发呼吸衰竭影响因素分析和静息肺功能检测临床价值,10.3969/j.issn.2095-140X.2015.05.010,陈雄[1];王文[2];张静[1];林士军[1];,"[1]深圳市龙岗区人民医院呼吸内科, 广东 深圳,518172;[2]湖南省人民医院心胸外科, 长沙,410000;",解放军医药杂志,"癌,非小细胞肺;呼吸功能不全;呼吸功能试验;危险因素;",R730.26,2015,,5
xdyfyx201518043,1,,2012-2014深圳市龙岗区年流感病原学监测及病毒基因分析,,吴洁[1];刘丽红[1];李静媚[2];李刚[2];金玉娟[2];邹惠英[1];,"[1]深圳市龙岗区人民医院预防保健科,广东深圳,518172;[2]深圳市龙岗区疾病预防控制中心,广东深圳,518172;",现代预防医学,流感病毒;监测;基因分析;,R183.3,2015,42,18
bfyx201505068,1,,两种根管糊剂在热牙胶根管充填中的应用效果,,李恩洪;杨立明;陈淑萍;,[1]深圳市龙岗区人民医院口腔科 深圳 518172,北方药学,根管糊剂;热牙胶;急性反应;填充;,R781.05,2015,,5
zgyyzn201402048,7,,皮瓣移植修复手外伤组织缺损的临床探析,,古汉南;李木卫;黄少耿;陈品锟;,"[1]广东省深圳市龙岗中心医院手外科专科医院,广东深圳,518116",中国医药指南,皮瓣移植修复;手外伤;组织缺损;,R622+.1,2014,,2
xlys-x201524203,0,,护士分层次管理实践中岗位责任制的体现,,杨芳;陈瑞玲;胡冰;王国香;许海珍;唐潘红;,[1]深圳市龙岗区人民医院护理部 广东深圳 518172,心理医生,连续性排班;小组责任制;护士岗位层级;,R471,2015,21,24
yxxxzz201548626,0,,局麻纤支镜胸交感神经链切断术术后1年随访,10.3969/j.issn.1006-1959.2015.48.626,徐继庆;陈亮;张波;林士军;刘玉春;,[1]深圳市龙岗区人民医院 广东 深圳 518172,医学信息,纤维支气管镜;胸交感神经链切断术;手汗症;随访研究;,,2015,,48
zgyykx201403047,3,,手术压疮的预见性护理管理研究,,陈少梅;张云凤;唐潘红;,"[1]广东省深圳市龙岗区人民医院,广东深圳,518172",中国医药科学,压疮;手术;护理管理;,R473.6,2014,,3
jilinyx201404036,3,,高血压脑出血合并应激性溃疡危险因素分析,,杨亚敏;兰周华;吴红添;刘子科;,"[1]广东省深圳市龙岗区人民医院神经外科,广东,深圳,518000",吉林医学,高血压脑出血;应激性溃疡;危险因素;,,2014,35,4
zgyytj201502032,1,,ICD合并编码案例分析,10.3969/j.issn.1006-5253.2015.02.032,古莲香;叶演红;邱华珍;,"[1]518172,深圳市龙岗区人民医院 广东省深圳市",中国医院统计,临床诊断;合并编码;案例分析;,,2015,,2
xdyyyxx201502024,1,,细支气管肺泡细胞癌的影像学表现及其诊断价值(附17例报告),,林焕兴[1];李伟明[1];曾旋华[1];叶演红[2];,"[1]深圳市龙岗区慢性病防治院放射科,广东省深圳市,518172;[2]广东省深圳市龙岗区人民医院信息科,广东省深圳市,518172;",现代医用影像学,细支气管肺泡细胞癌;DR;螺旋CT;影像学表现;,,2015,24,2
syswkzz201203020,9,,第2趾甲皮瓣及足背皮瓣修复全指脱套伤,10.3969/j.issn.1671-2722.2012.03.019,陈飞;王克列;李木卫;杨延军;张子清;,"[1]深圳市龙岗中心医院手外科,广东深圳,518116",实用手外科杂志,指损伤;组织移植;修复;,R6,2012,26,3
rdyxzz201508005,2,,TRIM28在胃癌中的表达与沉默对胃癌细胞增殖和凋亡的影响,,曾锻;陈鸿程;李世通;杨兵;,"[1]深圳市龙岗中心医院消化内科,广东深圳,518116",热带医学杂志,三结构域蛋白28;胃癌;细胞增殖;细胞凋亡;,R735.2,2015,15,8
nmgzyy201511027,0,,补气益肺中药治疗支原体感染反复发作的临床观察,10.3969/j.issn.1006-0979.2015.11.027,鲁大军;,"[1]广东省深圳市龙岗区人民医院,518172",内蒙古中医药,支原体感染;反复发作;补气益肺中药;临床疗效;,R259,2015,34,11
bfyx201511046,0,,布地奈德空气压缩雾化吸入治疗慢性咳嗽疗效观察,,杨海涛;,[1]深圳市龙岗区人民医院千林山居社康 深圳 518116,北方药学,慢性咳嗽;布地奈德雾化吸入剂;疗效;,R441.5,2015,,11
ylzb201511059,0,,医院医疗设备维修的创新思维,10.3969/j.issn.1002-2376.2015.11.059,李俊满;,"[1]深圳市龙岗区人民医院 设备科,广东深圳,518172",医疗装备,医疗设备;维修;创新思维;,R197.39,2015,,11
hljyx201511020,0,,运动康复训练对强直性脊柱炎患者功能状态康复的影响,10.3969/j.issn.1004-5775.2015.11.020,陈妙兰;叶肖红;邱映明;李惠;邹立华;,"[1]深圳市龙岗区人民医院,广东深圳,518172",黑龙江医学,强直性脊柱炎;运动;康复;功能;疗效;,R49,2015,39,11
qqhryxyxb201507075,1,,流程管理在外伤性重型颅脑损伤患者手术救治护理配合中的应用效果,,卢志为;罗秀玲;陈纪英;,"[1]518172,深圳市龙岗区人民医院消毒供应室",齐齐哈尔医学院学报,流程管理;外伤性重型颅脑损伤;护理配合;效果;,,2015,,7
ddyx201402073,3,,HPV感染与宫颈癌前病变及宫颈癌关系的研究,10.3969/j.issn.1009-4393.2014.2.073,向明;,[1]广东 518172 广东省深圳市龙岗区人民医院,当代医学,HPV感染;宫颈癌前病变;宫颈癌;关系;,,2014,,2
bfyx201509040,4,,异丙托溴铵三联药合雾化吸入治疗小儿喘息性肺炎的临床应用效果观察,,刘伟;陈璐;,[1]广东省深圳市龙岗中心医院药剂科 深圳 518116,北方药学,布地奈德;异丙托溴胺;沙丁胺醇;雾化吸入;喘息性肺炎;,R725.6,2015,,9
hnsysjjbzz201521024,0,,不同中成药辅助治疗紧张型头痛的有效性及安全性评价,10.3969/j.issn.1673-5110.2015.21.024,谭昌锐;邹立华;李惠;陈小丹;,[1]广东深圳市龙岗区人民医院 深圳 518172,中国实用神经疾病杂志,紧张型头痛;头痛宁胶囊;养血清脑颗粒;临床疗效;不良反应;,R741.041,2015,,21
jkr201419024,6,,疏肝解郁胶囊治疗脑卒中后抑郁的效果观察,,曾小丽;李玉梅;庄文燕;郭盛;,"[1]深圳市龙岗中心医院体检科,深圳,518116",中国当代医药,疏肝解郁胶囊;盐酸帕罗西汀片;脑卒中;,R743.3,2014,21,19
swcx201217032,3,,净石灵胶囊联合体外冲击波碎石术治疗复杂性肾结石临床疗效分析,,邝世航[1];冯建华[1];徐斯君[2];李小华[1];邹贤辉[1];,[1]深圳市龙岗中心医院泌尿外科 广东深圳518116;[2]龙岗中心医院银珠岭社康中心 广东深圳518116;,现代生物医学进展,净石灵胶囊;体外冲击波碎石术;经皮肾镜碎石取石;净石灵胶囊联合体外冲击波碎石术;,R692.4,2012,12,17
hnsysjjbzz201520047,0,,高血压脑出血早期血压波动对血肿扩大的影响,10.3969/j.issn.1673-5110.2015.20.047,董广宇[1];兰周华[1];张清平[2];许海珍[1];,[1]广东深圳市龙岗区人民医院神经外科 深圳 518172;[2]广东深圳市第四人民医院神经外科 深圳 518000;,中国实用神经疾病杂志,高血压;脑出血;血压波动;血肿扩大;,R743.34,2015,,20
jzyxyxb201505033,0,,眼科术后俯卧位患者非手术眼眼压升高的临床分析及护理对策,,黄小花;谢美华;,"[1]深圳市龙岗区人民医院眼科,广东 深圳,518172",辽宁医学院学报,俯卧位;非手术眼;眼压升高;临床分析;护理对策;,R473.77,2015,36,5
qqhryxyxb201505057,1,,影响社区支气管哮喘患者病情的危险因素分析,,彭惠媚;李惠;陈小丹;,"[1]深圳市龙岗区人民医院, 广东,518172",齐齐哈尔医学院学报,社区;哮喘;危险因素;预防措施;,,2015,36,5
wsjjyj201502019,1,,医院开展全程健康体检服务的探索,,尹超群;,"[1]广东省深圳市龙岗区人民医院,广东 深圳,518113",卫生经济研究,,R197.3,2015,,2
zwkjzlml-yyws201420023,2,,超声检查在产前胎儿肢体畸形筛查中的临床价值,,范国裕;黎明;,"[1]深圳市龙岗区人民医院超声科,广东深圳,518172",中国现代医生,产前检查;超声;胎儿畸形;,R445.1  R714.5,2014,,20
xdyyws201410084,6,,老年高血压患者保健问题及应对措施分析,10.3969/j.issn.1009-5519.2014.10.081,刘耿科;,"[1]深圳市龙岗中心医院,广东深圳,518172",现代医药卫生,高血压;社区保健护理;老年人;,,2014,,10
fcyyc201503005,0,,罕见染色体复杂易位伴不良孕育史四例,10.3868/j.issn.2095-1558.2015.03.005,刘露[1];罗小金[2];郭岩芸[3];王绍娟[4];,"[1]563000,遵义医学院研究生院;[2]563000 遵义医学院研究生院; 广东省深圳市龙岗区妇幼保健院;[3]广东省深圳市龙岗区妇幼保健院;[4]广东省深圳市龙岗区人民医院;",妇产与遗传（电子版）,"易位, 遗传;不良孕育史;复发性流产;",R596,2015,5,3
ylzb201509058,0,,医院医疗设备维修的创新思维,10.3969/j.issn.1002-2376.2015.09.058,李俊满;,"[1]深圳市龙岗区人民医院 设备科,广东深圳,518172",医疗装备,医疗设备;维修;创新思维;,R197.39,2015,28,9
jyyxylc201518039,0,,降钙素原及 CD64在小儿化脓性脑膜炎测定中的应用,10.3969/j.issn.1672-9455.2015.18.039,赖馨;陈丽芳;陈辉雄;,[1]广东省深圳市龙岗区人民医院检验科 518172,检验医学与临床,病毒性脑膜炎;化脓性脑膜炎;降钙素原;C反应蛋白;中性粒细胞CD64;,,2015,,18
zgwzxzz201210119,0,,超声在无症状性肾癌诊断中的应用158例分析,,古琼芳;李益红;徐振萍;曾振强;,[1]广东省深圳市龙岗区人民医院体检科 518172,中国误诊学杂志,肾肿瘤/超声检查;体格检查;,R730.4,2012,12,10
zhzdxdzzz201404012,5,,外伤性癫痫的诊断分类及流行病学特点,10.3877/cma.j.issn.2095-655X.2014.04.012,孔文龙;石小峰;蒙剑锋;仪立志;黄凯雄;纠智松;贾军;,"[1]518116,深圳市龙岗中心医院神经外科",中华诊断学电子杂志,颅脑损伤;癫痫;诊断;流行病学研究特征;,,2014,,4
zwkjzlml-yyws201311001,4,,人脐带间充质干细胞向心肌细胞诱导分化并体内移植的研究,,汪涛[1];林晓波[2];杨丽娜[1];吴毅[2];陈晓东[2];马桂霞[2];,"[1]深圳市龙岗区人民医院心胸外科,广东深圳,518172;[2]汕头大学医学院第二附属医院儿科,广东汕头,515041;",中国现代医生,脐带;干细胞;心肌样细胞;移植;,R542.22,2013,51,11
qqhryxyxb201412096,2,,门诊手术病人术前聚焦解决模式心理干预的应用研究,,张云凤;陈玉巧;黄丽莉;彭菊花;宋思贤;,"[1]518172,广东深圳市龙岗区人民医院手术室",齐齐哈尔医学院学报,聚焦解决模式;门诊手术;应用;,,2014,,12
zgmzyxzz201517001,0,,主动脉A型夹层外科手术患者的体外循环管理,10.3969/j.issn.1672-0369.2015.17.001,杨丽娜[1];汪涛[1];赵萍[2];蓝远敏[1];陈亮[1];,"[1]广东省深圳市龙岗区人民医院心胸血管外科,广东 深圳,518172;[2]广东省深圳市人民医院心外科;",中国民康医学,体外循环;主动脉夹层;深低温停循环;选择性脑灌注;,R654,2015,,17
zgsyyy201224005,5,,丹参素对新生大鼠缺氧缺血性脑损伤脑组织SOD、MDA的影响,10.3969/j.issn.1673-7555.2012.24.005,林少珠[1];陈广斌[2];吴铁[3];林坚涛[3];,"[1]广东医学院附属医院儿科,湛江,524001;[2]深圳市龙岗区人民医院药剂科;[3]广东医学院中药研究所;",中国实用医药,缺氧缺血;脑;丹参素;超氧化物歧化酶;丙二醛;新生大鼠;,R722.1,2012,07,24
zwkjzlml-yyws201309035,4,,安全目标管理在降低产科护理不良事件中的应用效果研究,,梁桂芳;,"[1]广东省深圳市龙岗区人民医院产科,广东深圳,518000",中国现代医生,安全目标管理;产科;护理不良事件;护理质量;,R197.32,2013,51,9
hnsysjjbzz201516024,0,,腰大池外引流在治疗重度脑室出血中的早期应用效果,10.3969/j.issn.1673-5110.2015.16.024,董广宇[1];兰周华[1];张清平[2];许海珍[1];,[1]广东深圳市龙岗区人民医院神经外科 深圳 518172;[2]广东深圳市第四人民医院神经外科 深圳 518033;,中国实用神经疾病杂志,脑室出血;侧脑室外引流;腰大池外引流;,R743.34,2015,,16
yxxxzz201502294,1,,成人急性气管-支气管炎门诊临床治疗分析,10.3969/j.issn.1006-1959.2015.02.294,陈雄;,"[1]深圳市龙岗区人民医院,广东 深圳,518000",医学信息,成人;急性气管支气管炎;治疗分析;,,2015,,2
hgzy201330034,3,,120例新生儿窒息的高危因素分析,,潘伟韶;,"[1]深圳市龙岗区人民医院,广东深圳,518172",中外医疗,新生儿;窒息;高危因素;,R722,2013,32,30
zgckyx201408021,3,,雷贝拉唑联合莫沙必利治疗老年胃食管反流病临床观察,10.13429/j.cnki.cjcr.2014.08.021,邱伟忠;陈雄;叶秀文;叶建华;李峭峰;,[1]518172 广东省深圳市龙岗区人民医院,中国临床研究,胃食管反流病;雷贝拉唑;莫沙必利;,R571,2014,27,8
zgyxcx201410032,6,,晚期产后大出血动脉栓塞治疗的效果分析,10.3969/j.issn.1674-4985.2014.10.032,钟小琼;刘美霞;,[1]广东省深圳市龙岗中心医院 广东 深圳 518116,中国医学创新,晚期产后出血;动脉栓塞;满意度;疗效;,,2014,,10
gdyxyxb201304031,7,,复方苦参注射液联合盐酸羟考酮缓释片治疗骨转移瘤疼痛的疗效观察,10.3969/j.issn.1005-4057.2013.04.031,吴大英;郭予武;吴志海;刘锦新;杨楚钦;李霞;,"[1]广东省深圳市龙岗中心医院,广东深圳,518116",广东医学院学报,复方苦参注射液;盐酸羟考酮;癌症疼痛;生存质量;,R738.1,2013,31,4
scyxzz201414077,1,,男性尿道损伤行腔镜与开放性手术治疗48例临床疗效分析,10.13214/j.cnki.cjotadm.2014.14.076,刘雷[1];陈楚义[1];李坚伟[1];黄星华[2];李冠奕[2];周建华[1];,"[1]深圳市龙岗区人民医院泌尿外科,广东深圳,518172;[2]广东医学院;",中国伤残医学,尿道损伤;腔镜;开放性手术;,R699.6,2014,,14
sjzxyy-e201563140,0,,推进公职人员绩效考核改革发展,10.3969/j.issn.1671-3141.2015.63.140,余跃跃;,"[1]广东省深圳市龙岗区人民医院人事科,广东 深圳,518172",世界最新医学信息文摘（连续型电子期刊）,改革;绩效考核;,d035.2,2015,,63
zghtyyzz201205025,9,,综合护理干预对手足口病合并脑炎患儿疗效观察,10.3969/j.issn.1672-9463.2012.05.025,韩颖;,"[1]广东省深圳市龙岗中心医院儿科,518116",中国现代医药杂志,手足口病;并发症;脑炎;病毒;,R473.72,2012,14,5
zgxdyyyy201315188,7,,小儿佝偻病患病情况调查及预防措施治疗总结,10.3969/j.issn.1673-9523.2013.15.188,杨晓红;,"[1]广东省深圳市龙岗中心医院同乐社康中心,518116",中国现代药物应用,佝偻病;患病情况;预防治疗;,,2013,7,15
syyjzz201507032,0,,抗-Mur 抗-E抗体合并自身抗体的配血处理,,郑楚忠[1];唐万兵[1];郑望春[2];温程荣[2];,[1]广东省深圳市龙岗区人民医院 518172;[2]广东省深圳市龙岗区中心血站;,实用医技杂志,,,2015,,7
mzgjykzz201410052,5,,激素冲击联合奥曲肽球后注射治疗甲状腺相关眼病,10.3980/j.issn.1672-5123.2014.10.51,彭细峰;姜文浩;颜坚;邓江涛;,"[1]518116,中国广东省深圳市龙岗中心医院眼科",国际眼科杂志,甲基强的松龙;奥曲肽;甲状腺相关眼病;,,2014,,10
zgyxwz-jlxfc201604010,2,,不同方法清洁尿道口对脊髓损伤反射性膀胱功能障碍留置尿管患者的影响,10.3969/j.issn.1674-3768.2016.04.010,郑醒云;简翠芬;刘金莉;罗雪珠;,"[1]深圳市龙岗中心医院神经外科, 广东深圳,518116",中国临床护理,留置尿管;尿道口;消毒;护理;,,2016,8,4
gdybfz201301008,0,,Carisolv在乳磨牙龋治疗中效能的体外研究,,李红文;耿发云;曾宪涛;姚馨蕙;耿晓瑞;王丽;,"[1]深圳市龙岗中心医院耳鼻咽喉科医院口腔科,深圳市耳鼻咽喉研究所,广东深圳518172",广东牙病防治,伢典;乳磨牙龋;微渗漏;微拉伸粘接强度;,R783.2,2013,21,1
guizhouyy201404009,2,,经皮肾镜取石术临床资料比较及围手术期出血相关因素分析,10.3969/j.ISSN.1000-744X.2014.04.009,刘雷[1];陈楚义[1];郑锦标[1];黄星华[2];李冠奕[2];周建华[1];,"[1]深圳市龙岗区人民医院泌尿外科,广东深圳,518172;[2]广东医学院,广东湛江,524023;",贵州医药,经皮肾镜取石术;出血;危险因素;,R692.4,2014,,4
zgxdyyyy201513150,0,,早期综合护理在65例脑瘫合并吸入性肺炎患儿中的应用价值分析,10.14164/j.cnki.cn11-5581/r.2015.13.150,黄丽雅[1];陈瑞玲[2];黄淑媛[1];黄涌森[1];,"[1]518116,深圳市龙岗区社会福利中心;[2]深圳市龙岗区人民医院儿科;",中国现代药物应用,早期综合护理;脑瘫;吸入性肺炎;体格智力发育;,,2015,9,13
zwyxyj201321068,7,,耳鼻喉住院患者67例焦虑状态调查及护理策略,10.3969/j.issn.1674-6805.2013.21.068,黄巧玲;,[1]深圳市龙岗中心医院 广东 深圳 518116,中外医学研究,耳鼻喉患者;护理;焦虑;,R473.76,2013,,21
hsjbzz201203009,5,,脉络丛乳头状瘤的磁共振诊断(附10例报告),10.3969/j.issn.1009-3257.2012.03.009,朱宇辉[1];詹勇[1];蒋超梅[2];周洁[1];向子云[1];,"[1]广东省深圳市龙岗区人民医院影像科,广东深圳,518172;[2]云南省曲靖市第一人民医院放射科,云南曲靖,655000;",罕少疾病杂志,脉络丛乳头状瘤;磁共振成像;,R730.264,2012,19,3
jilinyx201433103,1,,土豆片贴敷联合 TDP 照射治疗输液外渗的疗效观察,10.3969/j.issn.1004-0412.2014.33.103,周秀娟;包永兰;陈文贵;,"[1]广东省深圳市龙岗区人民医院五联社康中心,广东 深圳,518172",吉林医学,土豆片;TDP 照射;静脉输液;外渗;硫酸镁外敷;,,2014,,33
syzxyjhlc201506018,0,,麻杏银翘败毒汤治疗儿童急性化脓性扁桃体炎临床疗效观察,10.13638/j.issn.1671-4040.2015.06.018,舒小妹[1];谢建祥[2];,[1]广东省深圳市龙岗区人民医院 深圳518172;[2]南昌大学第一附属医院 江西南昌330006;,实用中西医结合临床,急性化脓性扁桃体炎;麻杏银翘败毒汤;临床疗效;,R766.18,2015,15,6
qqhryxyxb201313077,7,,护理健康教育对断指再植术后功能训练的效果观察,,钟小妮;杨黎霞;罗善珍;周慧慧;苏文翠;,"[1]深圳市龙岗中心医院手外科专科医院,518116",齐齐哈尔医学院学报,健康教育;护理;断指再植;功能训练;,,2013,34,13
qqhryxyxb201508072,4,,舒适护理模式在口腔科的临床应用,,肖丽娟;林御贤;张志娟;,"[1]深圳市龙岗中心医院, 广东,518116",齐齐哈尔医学院学报,舒适护理;口腔科;满意度;医疗常识;,,2015,,8
zgmzmjyyzz201511063,0,,高通量透析对维持性血液透析27例营养状况的影响,,陈铿;李萍华;潘富林;,"[1]广东省深圳市龙岗区人民医院肾内科,广东深圳,518172",中国民族民间医药,高通量透析;维持性血液透析;低通量透析;营养状况;,R459.5,2015,,11
szzxyjhzz201516062,2,,头孢克洛缓释胶囊治疗急性细菌性上呼吸道感染临床疗效观察,10.16458/j.cnki.1007-0893.2015.16.062,蓝金全[1];秦又发[1];周炳丰[2];,"[1]东莞市第三人民医院,广东东莞,523000;[2]深圳市龙岗中心医院,广东深圳,518000;",深圳中西医结合杂志,头孢克洛缓释胶囊;上呼吸道感染;头孢氨苄胶囊;,R562,2015,25,16
zwnxjkyj201511011,0,,浅析苦参碱抗肿瘤作用机制及研究进展,,罗芳兰[1];严英[2];,[1]广东医学院研究生学院 524003;[2]广东省深圳市龙岗区人民医院 518000;,中外女性健康研究,苦参碱;抗肿瘤;机制;,,2015,,11
bqnjyxyxb201502007,4,,手术治疗48例外伤性肝脾破裂的临床分析,10.16485/j.issn.2095-7858.2015.02.005,古仲相;黄国炜;,"[1]518116,广东省深圳市龙岗中心医院急诊外科",白求恩医学杂志,肝脾破裂;手术治疗;应激反应;,R655,2015,,2
qqhryxyxb201511032,0,,输卵管妊娠改良术式配合中西医治疗效果的研究,,吴璇;廖思兰;陈光玉;曾月兰;,"[1]518172,深圳市龙岗区人民医院",齐齐哈尔医学院学报,输卵管妊娠;改良术式;中西医治疗;,,2015,,11
hnsysjjbzz201312060,7,,神经外科术前护理常见风险问题及应对措施,10.3969/j.issn.1673-5110.2013.12.060,庄文燕;仪立志;孔文龙;龙芝灵;周秀红;张伟珍;,"[1]广东深圳市龙岗中心医院,深圳,518116",中国实用神经疾病杂志,神经外科;术前护理;常见风险问题;应对措施;,R473.74,2013,16,12
zgsyyy201210001,9,,冠心病患者血清SAA、IL-6、TNF-α和hs-CRP检测及临床意义探讨,10.3969/j.issn.1673-7555.2012.10.001,张珺;李慧明;叶素惠;,"[1]518116,深圳市龙岗中心医院保健科",中国实用医药,冠状动脉疾病;血清淀粉样蛋白A;白介素-6;肿瘤坏死因子-α;超敏C-反应蛋白;,R541.4,2012,07,10
zgyytj201405031,1,,影响手术操作编码准确性的因素及处理策略,10.3969/j.issn.1006-5253.2014.05.031,叶演红;邢庆芳;古莲香;,"[1]518172,深圳市龙岗区人民医院信息科 广东省",中国医院统计,手术名称;手术编码;准确性;,,2014,,5
zgyykx201224114,4,,肺炎患儿反应性血小板增多症的临床分析,,刘燕;刘海霞;,"[1]深圳市龙岗区人民医院儿科,广东深圳,518172",中国医药科学,肺炎;血小板增多症;儿童;,R563,2012,2,24
zgyyzn201209016,9,,术中体温对麻醉后苏醒和拔管时间影响分析,10.3969/j.issn.1671-8194.2012.09.016,陈丽嫦;邹传惠;郭秋娥;祝妍华;,"[1]广东省深圳市龙岗中心医院,广东深圳,518116",中国医药指南,术中体温;麻醉;苏醒时间;拔管时间;,R614,2012,10,9
syqkyx201204036,3,,出血性脑梗死患者MMP-9与hs-CRP动态变化及临床意义,,张珺;李慧明;叶素惠;陈瑾;邱小雅;刘琼;,"[1]518116, 广东省深圳市龙岗中心医院保健科",中华全科医学,出血性脑梗死;基质金属蛋白酶-9;高敏C反应蛋白;,R743.33,2012,10,4
bfyx201505121,0,,维格列汀对T2DM患者抗氧化应激作用的研究,,郭中秋;廖庆辉;赖康保;史治宙;谭娅琴;陈玉华;王娟;,[1]广东省深圳市龙岗区人民医院内分泌代谢科 深圳 518000,北方药学,糖尿病;MDA;SOD;8-OHdG;维格列汀;,R589.1,2015,,5
lnjzyxzz201603015,2,,区域化急诊信息平台在院前与院内抢救的作用,10.3969/j.issn.1671-301X.2016.03.015,梁进[1];孙大勇[2];何彩银[3];郑伟[1];刘阳[1];周一波[1];叶志辉[1];,[1]深圳市坪山新区妇幼保健院急诊科 518122;[2]深圳市龙岗中心医院急诊科;[3]深圳市龙岗区社会福利中心医务部;,岭南急诊医学杂志,前急救;院内抢救;信息平台;无缝对接;,,2016,21,3
ylzb201408026,5,,GE LOGIQ系列彩色多普勒超声诊断仪典型故障分析与维修,10.3969/j.issn.1002-2376.2014.08.026,周丽华[1];牟强善[2];吴浙君[3];,"[1]深圳市龙岗中心医院,广东深圳,518116;[2]山东大学齐鲁医院日照分院,山东日照,276800;[3]杭州市余杭区第五人民医院,浙江杭州,311100;",医疗装备,超声诊断仪;故障分析;维修;,TH774,2014,27,8
bhdxxb201303020,7,,儿科塑型性支气管炎特征分析,10.11713/j.issn.1009-4822.2013.03.020,王自财[1];张小莉[1];郑跃杰[2];李晓楠[2];吴伟[1];周曙明[1];,"[1]深圳市龙岗中心医院,广东深圳,518116;[2]深圳市儿童医院,广东深圳,518026;",北华大学学报（自然科学版）,塑型性支气管炎;儿科;临床特征;,R563.4,2013,14,3
yiyqy201514193,0,,MR在剖宫产术后子宫复旧及切口愈合过程中的临床应用,10.3969/j.issn.2095-1752.2015.14.193,向子云;詹勇;周洁;吴秋辉;,[1]深圳市龙岗区人民医院 广东 深圳 518172,医药前沿,,R445,2015,,14
zgyyzn201423049,5,,电化学发光免疫分析法检测维生素D试剂盒性能验证,,何国坚;肖庆;韦庆文;,"[1]深圳市龙岗中心医院,广东 深圳,518116",中国医药指南,维生素D;电化学发光免疫分析法;性能验证;,R392,2014,,23
zwyxyj201423046,5,,优质护理在产妇分娩中的应用观察,,梁玉婵;周瑞媚;冯丽娜;,[1]深圳市龙岗中心医院 广东 深圳 518116,中外医学研究,优质护理;产妇;分娩;,R473.7,2014,,23
jths201315027,7,,社区康复护理指导对COPD稳定期病人肺功能影响分析,10.3969/j.issn.1674-4748.2013.15.026,王瑞香;,"[1]广东省深圳市龙岗中心医院嶂背社区健康服务中心,518116",全科护理,社区康复护理指导;慢性阻塞性肺疾病稳定期;肺功能;,R473.5,2013,11,15
gdyxyxb201202012,5,,输尿管硬镜钬激光治疗输尿管结石139例临床分析,10.3969/j.issn.1005-4057.2012.02.012,周建华;陈楚义;郑锦标;李剑军;陈少梅;,"[1]广东省深圳市龙岗区人民医院泌尿外科,广东深圳,518172",广东医学院学报,输尿管结石;钬激光;输尿管镜;,R693  R312,2012,30,2
syqkyx201208051,0,,自拟桂枝茯苓汤治疗异位妊娠30例效果观察,,林盈;,"[1]518172,广东省深圳市龙岗区人民医院妇产科",中华全科医学,桂枝茯苓汤;异位妊娠;中医疗法;,R714.22,2012,10,8
yxxxzz201513308,0,,选择DHS内固定治疗股骨转子间骨折的分析体会,10.3969/j.issn.1006-1959.2015.13.308,王剑峰;,"[1]广东深圳市龙岗区人民医院,广东 深圳,518000",医学信息,股骨转子间骨折;动力髋螺钉;内固定方式;,,2015,,13
