syqkyx201204055,8,"ISTIC,PKU",城中村居民心理现况及其影响因素研究,,黄智前[1];陈喜志[1];叶进军[2];黄吟[3];张惠卿[3];,"[1]518114, 广东省深圳市龙岗区沙湾医院精神卫生科;[2]深圳市龙岗中心医院普外科;[3]深圳市龙岗区第二人民医院药剂科;",中华全科医学,城中村居民;心理健康;Kessler10(K10)量表;现况调查;,R195  R395.1,2012,10,4
qqhryxyxb201511080,5,"ISTIC,PKU",临床护理路径在子宫肌瘤切除术中的应用效果,,颜美荣;,"[1]深圳市光明新区人民医院, 广东,518106",齐齐哈尔医学院学报,临床护理路径;子宫肌瘤切除术;应用效果;,,2015,,11
jkr201416019,8,"ISTIC,PKU",早期颅骨修补联合脑室腹腔分流术治疗脑外伤患者的临床效果观察,,党伟;李明;陈雪江;胡志卿;魏川江;,"[1]深圳市光明新区人民医院神经外科,深圳,518106",中国当代医药,颅脑创伤;去骨瓣减压术;颅骨修补;脑室腹腔分流术;脑积水;,R651.1,2014,,16
zhyxcszz201407006,9,"ISTIC,PKU",VACTERL联合征的产前超声诊断分析,10.3877/cma.j.issn.1672-6448.2014.07.006,秦凤真;李胜利;华轩;姚远;毕静茹;袁鹰;余蓉;,"[1]518028,南方医科大学附属深圳市妇幼保健院超声科",中华医学超声杂志（电子版）,"超声检查,产前;胎儿;先天畸形;VACTERL联合征;",,2014,,7
ylbjqj201603068,2,"ISTIC,PKU",进展性脑卒中相关危险因素的临床探讨,10.3969/j.issn.1674-4659.2016.03.0399,邹湉;凌秋平;,"[1]深圳市龙岗区第二人民医院神经内科,广东深圳,518112",临床医学工程,进展性脑卒中;危险因素;血管狭窄;高血糖;脑缺血;,R743.3,2016,23,3
ddzys201606076,0,"ISTIC,PKU",《医学衷中参西录》心悸病治疗特色浅析,10.16808/j.cnki.issn1003-7705.2016.06.076,黄芬[1];张炜宁[2];朱文娟[1];,"[1]湖南中医药大学,湖南长沙,410208;[2]广东省深圳市福田区中医院,广东深圳,518000;",湖南中医杂志,《医学衷中参西录》;张锡纯;心悸病;治疗特色;,R2-5,2016,32,6
tsyxyxb201607047,1,"ISTIC,PKU",米索前列醇不同给药途径对于宫腔镜术前宫颈软化效果的临床研究,10.3969/j.issn.1004-7115.2016.07.047,孟德祺;冯春宇;陈美华;,"[1]深圳市龙岗区第二人民医院,广东 深圳,518000",泰山医学院学报,米索前列醇;给药途径;宫腔镜;宫颈软化;,R714,2016,37,7
xdzdyzl201622002,0,"ISTIC,PKU",全腔镜与腔镜辅助胃癌根治全胃切除术的临床疗效比较,10.3969/j.issn.1001-8174.2016.22.002,梁世妙[1];吴丽玲[2];许乙威[1];许建平[1];,"[1]深圳市龙岗区第二人民医院普通外科,广东深圳,518000;[2]深圳市第三人民医院,广东深圳,518000;",现代诊断与治疗,全腔镜胃癌根治全胃切除术;腔镜辅助胃癌根治全胃切除术;疗效;,R735.2,2016,27,22
xdzdyzl201622045,0,"ISTIC,PKU",布地奈德联合盐酸氨溴索雾化吸入治疗小儿支气管肺炎效果观察,10.3969/j.issn.1001-8174.2016.22.045,杜宇;,"[1]深圳市龙岗区第二人民医院,广东深圳,518112",现代诊断与治疗,小儿支气管肺炎;布地奈德;盐酸氨溴索;雾化吸入治疗;,R563.12,2016,27,22
btyxyxb201611073,0,"ISTIC,PKU",临床支持中心在提高病人满意度中的作用,,何海春;林凯思;黄丽清;,"[1]深圳市龙岗区第二人民医院,广东 深圳,518112",包头医学院学报,临床支持中心;病人满意度;作用;,,2016,32,11
ddzys201606003,0,"ISTIC,PKU",补阳还五汤联合阿托伐他汀治疗糖尿病周围神经病变30例临床观察,10.16808/j.cnki.issn1003-7705.2016.06.003,许霞;吴俊贤;张丽雯;唐棣华;杨以超;,"[1]湖南中医药大学附属深圳市福田区中医院,广东深圳,518034",湖南中医杂志,糖尿病周围神经病变;中西医结合疗法;补阳还五汤;阿托伐他汀;,R259.872,2016,32,6
syyjzz201611004,0,"ISTIC,PKU",胎儿心脏三血管平面M型超声成像,,陈涛;王爽;,[1]广东省深圳市龙岗区第二人民医院 518112,实用医技杂志,胎儿心脏;肺动脉;主动脉;超声检查;,,2016,23,11
haixyx201512004,5,"ISTIC,PKU",夏枯草现代研究进展述要,10.3969/j.issn.1006-3765.2015.12.004,陈蕾[1];周倩[2];,[1]广东省深圳市福田区中医院 深圳 518034;[2]山东中医药大学药学院 济南 250355;,海峡药学,夏枯草;本草考证;化学成分;药理作用;临床应用;质量评价;,R282.73,2015,27,12
lcfkzz201507057,6,"ISTIC,PKU",小儿支气管哮喘相关影响因素分析研究,10.3969/j.issn.1009-6663.2015.07.056,柯宇星;郑洁丽;吴春远;,"[1]南方医科大学附属深圳市妇幼保健院儿科, 广东 深圳,518028",临床肺科杂志,,,2015,,7
syyfyx201504015,3,"ISTIC,PKU",深圳市2009-2013年传染病突发公共卫生事件流行病学分析及风险评估研究,10.3969/j.issn.1006-3110.2015.04.015,逯建华;何建凡;谢旭;谢建滨;许舒乐;,"[1]深圳市疾病预防控制中心,广东深圳,518055",实用预防医学,传染病;突发公共卫生事件;流行病学分析;风险评估;,R181.3,2015,22,4
qlhlzz201602013,0,,流产后关爱服务对门诊流产女性术后避孕与意外妊娠的影响,10.3969/j.issn.1006-7256.2016.02.013,刘云英;刘志良;甘小清;,[1]深圳市妇幼保健院 广东深圳518028,齐鲁护理杂志,流产后关爱;人工流产;意外妊娠;,R473.71,2016,22,2
lcjsyxzz201201004t,1,,难治性与非难治性强迫症患者生活质量比较研究,,周云飞[1];刘铁榜[1];刘妹[2];余常红[1];闫小华[1];方亚明[1];冯征[1];翁茵茵[1];,"[1]广东省深圳市康宁医院,518003;[2]深圳市人民医院;",临床精神医学杂志,强迫症;生活质量量表;,R749.7,2012,22,1
syyfyx201512042,1,,深圳市艾滋病病例报告灰色预测,10.3969/j.issn.1006-3110.2015.012.042,谭京广;杨峥嵘;陈琳;刘少础;罗亦娟;谢炜;,"[1]深圳市疾病预防控制中心,广东深圳,518055",实用预防医学,艾滋病;模型;灰色预测;病例报告;,R512.91,2015,22,12
yycyzx201212068,0,,儿童急性肾损伤的早期护理干预,10.3969/j.issn.1673-7210.2012.12.068,黄玉玲[1];黄秀玲[2];,"[1]广东省深圳市龙岗区第二人民医院儿科,广东深圳,518112;[2]广东省深圳市第七人民医院,广东深圳,518081;",中国医药导报,急性肾损伤;儿童;护理;,R726.9,2012,09,12
ynbzz201204003,0,,远达性视网膜损伤综合征1例,10.3969/j.issn.1671-6450.2012.04.003,毛彦琪;刘贵锋;,"[1]广东省深圳市龙岗区第二人民医院眼科,518112",疑难病杂志,远达性视网膜损伤综合征;诊断;治疗;,R779.1,2012,11,4
zyyjk201612016,1,,塑化剂DEHP诱导HepG2细胞胰岛素抵抗作用的研究,,吕子全;黄素丽;张艳炜;张倩;吴双;邱杨燊;柯跃斌;,"[1]深圳市疾病预防控制中心,深圳市现代医学分子生物重点实验室,分子生物医学检验科,广东深圳518055",职业与健康,邻苯二甲酸酯;邻苯二甲酸二(2-乙基己)酯;HepG2细胞;胰岛素抵抗;,R12,2016,32,12
zgyxcx201628026,1,,临床护理路径对ICU重型颅脑损伤患者发生应激性溃疡的影响,10.3969/j.issn.1674-4985.2016.28.026,文艳;梁健娜;李芳兰;,[1]广东省深圳市光明新区人民医院 广东 深圳 518106,中国医学创新,临床护理路径;重型颅脑损伤;应激性溃疡;ICU;,,2016,13,28
syyfyx201604036,0,,间隔流动分析法测定水中总磷,10.3969/j.issn.1006-3110.2016.04.036,陈慧玲[1];黄倩羽[2];许欣欣[1];毛丽莎[1];朱舟[1];,"[1]深圳市疾病预防控制中心,广东深圳,518055;[2]北京大学深圳医院;",实用预防医学,间隔流动分析仪;水样;总磷;钼酸铵;,R123.1,2016,23,4
gzyxyxb201202006,0,,早期自然流产患者PAF-R及VEGF表达水平的研究,10.3969/j.issn.1008-1836.2012.02.006,徐俊;冯春宇;周俊;郑坚;林子;周伟新;,"[1]深圳市龙岗区第二人民医院妇产科,广东深圳,518112",广州医学院学报,早期自然流产;血小板活化因子受体;血管内皮生长因子;绒毛;蜕膜;,R714.21,2012,40,2
gwyx-bdxfc201602007,0,,2010-2014年北京大学深圳医院筛查的HIV感染者的流行病学特征分析,10.3760/cma.j.issn.1673-4092.2016.02.007,吴延杰[1];申红卫[2];张海龙[3];何俊涛[4];,"[1]518036,广东深圳 北京大学深圳医院;[2]深圳市福田区疾病预防控制中心;[3]深圳市疾病预防控制中心;[4]深圳市职业病防治院;",国际病毒学杂志,筛查;监测;HIV;流行病学特征;,,2016,23,2
hjyjkzz201312021,2,"ISTIC,PKU",深圳地铁1～5号线地下车站运营前空气卫生质量调查,,刘国红;慈捷元;余淑苑;周国宏;刘宁;冯锦姝;王玮;,"[1]深圳市疾病预防控制中心环境卫生科,广东,518055",环境与健康杂志,地铁车站;运营前;空气质量;,R122.2,2013,30,12
zgswyyy201604003,0,"ISTIC,PKU",婴幼儿配方奶粉中3-氯丙醇酯的GC-MS法测定及暴露危险分析,10.3969/j.issn.1006-9577.2016.04.003,许欣欣;陈慧玲;刘红河;康莉;毛丽莎;,"[1]深圳市疾病预防控制中心,广东 深圳,518055",中国食物与营养,气相色谱-质谱联用;3-氯丙醇酯(3-MCPD酯);婴幼儿配方奶粉;,,2016,22,4
qqhryxyxb201632036,0,"ISTIC,PKU",论抓好医疗管理对构建和谐医患关系的作用,10.3969/j.issn.1002-1256.2016.32.036,杨剑;,"[1]深圳市龙岗区第二人民医院福群社区健康服务中心, 广东,518112",齐齐哈尔医学院学报,医疗管理;和谐;医患关系;,,2016,37,32
zgzyjz201301016,0,"ISTIC,PKU",滋阴活血方对自发性高血压大鼠氧化应激反应的影响,10.3969/j.issn.1004-745X.2013.01.016,吕明[1];张炜宁[2];,"[1]湖南中医药大学,湖南长沙,410007;[2]广东省深圳市福田区中医院,广东深圳,518034;",中国中医急症,中药;高血压;氧化应激;p22phox蛋白;滋阴活血方;,R285.5,2013,22,1
zgmzmjyyzz201621036,0,"ISTIC,PKU",丹田降脂丸治疗高脂血症临床观察,,徐凤娇;,"[1]深圳市龙岗区第二人民医院雪象社区,广东深圳,518000",中国民族民间医药,丹田降脂丸;高脂血症;临床效果;,R256.2,2016,25,21
zgfybj201329052,1,"ISTIC,PKU",X线立体定位引导真空负压旋切活检乳腺微小钙化灶的手术难点及分析,10.7620/zgfybj.j.issn.1001-4411.2013.28.52,李欢;王恩礼;张文夏;钟春嫦;刘洁玲;,"[1]南方医科大学附属深圳市妇幼保健院乳腺外科,广东深圳,518048",中国妇幼保健,X线立体定位;乳腺微小钙化灶;活检;手术技巧;,R737.9,2013,28,29
zgyxwz-ekxfc201406026,8,"ISTIC,PKU",儿童急性下呼吸道感染2368例病原学分析,10.3969/j.issn.1674-3865.2014.06.026,张旭光;卢仕仰;黄从付;汪培勤;饶福光;万智;,"[1]深圳市龙岗区妇幼保健院儿科, 广东深圳,518172",中国中西医结合儿科学,呼吸道感染/诊断;病原学;儿童;,R562,2014,6,6
hnyxyj201609032,1,"ISTIC,PKU",闭合复位弹性髓内钉与切开复位克氏针内固定治疗小儿前臂双骨折的疗效对比,10.3969/j.issn.1004-437X.2016.09.032,胡雄飞;,[1]深圳市光明新区人民医院 骨二科 广东 深圳 518106,河南医学研究,小儿前臂双骨折;闭合复位弹性髓内钉;切开复位克氏针内固定;,R726.8,2016,25,9
zgyxcx201615024,2,"ISTIC,PKU",系统化整体护理干预在开放性骨折感染防治中的应用,10.3969/j.issn.1674-4985.2016.15.024,钟德霞;席晓颖;曾伟清;,[1]广东省深圳市光明新区人民医院 广东 深圳 518106,中国医学创新,开放性骨折;护理干预;感染;生活质量;,,2016,13,15
hainanyxyxb201613033,3,"ISTIC,PKU",不同麻醉方式对腹腔镜子宫切除术患者炎症反应及氧化应激反应的影响,10.13210/j.cnki.jhmu.20160315.011,王晓光;李戈辉;齐晓非;刘丹勇;,"[1]深圳市妇幼保健院麻醉科,广东 深圳,518028",海南医学院学报,腹腔镜子宫切除术;麻醉;硬膜外;氧化应激;,R614  R713.4,2016,22,13
ddzys201512093,1,"ISTIC,PKU",中医药治疗骨质疏松症的研究概况,,尤志强[1];林松青[2];王彬[1];,"[1]湖南中医药大学,湖南长沙,410208;[2]广东省深圳市福田区中医院,广东深圳,518034;",湖南中医杂志,"骨质疏松症;中医药疗法;综述,学术性;",R274.91,2015,31,12
jkr201405014,8,"ISTIC,PKU",孕期体重管理对围生期结局的影响,,陈美华[1];刘继群[1];万蕴华[1];潘秀玲[1];龙隽[2];,"[1]深圳市龙岗区第二人民医院妇产科,深圳,518112;[2]深圳市罗湖医院妇产科,深圳,518100;",中国当代医药,孕期;体重管理;围生期结局;,R714.7,2014,21,5
zgjkjy201201014,3,"ISTIC,PKU",广东省深圳市龙岗区孕期妇女出生缺陷相关知信行调查,,张绍强[1];廖瑞容[2];张玲[3];陈文英[3];夏洪波[3];,"[1]广东省深圳市龙岗区健康教育所,广东深圳,518172;[2]广东省深圳市龙岗区卫生局,广东深圳,518172;[3]广东省深圳市龙岗区妇幼保健院,广东深圳,518172;",中国健康教育,孕期妇女;出生缺陷;知信行;,R193  R174,2012,28,1
jkr201535029,5,"ISTIC,PKU",布地奈德吸入治疗小儿急性感染性喉炎的临床研究,,汪培勤;马莹莹;罗建军;,"[1]深圳市龙岗区妇幼保健院小儿内科,深圳,518172",中国当代医药,布地奈德;空气压缩泵超声雾化;吸入治疗;急性感染性喉炎;,R725.6,2015,,35
bbyxyxb201209030,1,"ISTIC,PKU",婴幼儿复发鹅口疮血常规分析,10.3969/j.issn.1000-2200.2012.09.030,蒋俊豪;,"[1]广东省深圳市龙岗区妇幼保健院,口腔科,518172",蚌埠医学院学报,鹅口疮;婴幼儿;血常规;,R782.6,2012,37,9
xxyxyxb201412025,4,"ISTIC,PKU",护士对管道护理的知识-态度-行为现况调查,10.7683/xxyxyxb.2014.12.025,牟园芬[1];龙云[2];吕丰梅[1];冯清洲[1];余红[1];,"[1]深圳市第七人民医院护理部,广东深圳518081;[2]深圳市妇幼保健院,广东深圳518001;",新乡医学院学报,护士;管道护理;知识-态度-行为;多因素分析;,R473.6,2014,31,12
haixyx201610079,0,"ISTIC,PKU",口服阿奇霉素治疗儿童呼吸道支原体、衣原体混合感染的临床疗效及不良反应观察,10.3969/j.issn.1006-3765.2016.10.079,杜宇;,[1]深圳市龙岗区第二人民医院深圳518112,海峡药学,阿奇霉素;呼吸道混合感染;不良反应;口服;,R969.4,2016,28,10
jilinyx201610006,0,"ISTIC,PKU",高危产妇清宫术后给予人工周期及透明质酸钠联合治疗预防宫腔粘连的效果分析,10.3969/j.issn.1004-0412.2016.10.006,吴贤菊;邹晓玲;徐妹;,"[1]广东省深圳市龙岗区第二人民医院妇科,广东 深圳,518112",吉林医学,高危产妇;透明质酸钠;清宫术;人工周期;宫腔粘连;,,2016,37,10
qkyxlcyjy201605012,0,"ISTIC,PKU",Kessler10量表评价城中村居民心理健康与生活方式之间的关系研究,10.13558/j.cnki.issn1672-3686.2016.05.012,黄智前[1];陈蕾[1];黄琴娣[1];黄吟[2];邓泉[1];,"[1]深圳市龙岗区第七人民医院全科医学科, 广东深圳,518114;[2]深圳市龙岗区第二人民医院药学部;",全科医学临床与教育,Kessler10量表;心理健康;生活方式;,,2016,14,5
zgcthmrizz201502023,7,"ISTIC,PKU",DTI在足月新生儿窒息后脑损伤中的应用,10.3969/j.issn.1672-5131.2015.02.22,张翔亚;曹满瑞;杜牧;朱志军;刘炳光;郑昌业;,[1]南方医科大学附属深圳市妇幼保健院放射科 广东 深圳 518028,中国CT和MRI杂志,窒息后脑损伤;足月新生儿;弥散张量成像;各向异性分数;,R722.12  R445.2,2015,,2
zgmxbyfykz201203017,8,"ISTIC,PKU",深圳市妇女子宫颈人乳头瘤病毒感染分子流行病学分析,,王月云[1];彭绩[2];周海滨[2];谢建生[1];刘植华[1];,"[1]深圳市妇幼保健院保健部,广东省,518048;[2]深圳市慢性病防治中心;",中国慢性病预防与控制,子宫颈癌;筛查;人乳头瘤病毒;感染率;基因;,R737.3,2012,20,3
xdzdyzl201609112,2,"ISTIC,PKU",系统护理干预对老年髋关节置换术后关节和认知功能的疗效分析,,唐世洁;魏川江;唐世平;,"[1]深圳市光明新区人民医院骨外科,广东 深圳,518106",现代诊断与治疗,系统护理;老年髋关节置换术;关节功能;认知功能;,R473.6,2016,27,9
ddyx201513078,5,"ISTIC,PKU",头孢地尼胶囊联合奥硝唑分散片治疗盆腔炎的疗效探讨,10.3969/j.issn.1009-4393.2015.13.078,史维玲;,[1]广东 518106 深圳市光明新区人民医院,当代医学,盆腔炎;头孢地尼胶囊;奥硝唑分散片;,,2015,21,13
syyfyx201507012,2,"ISTIC,PKU",深圳市活禽市场活禽经营人员H7N9禽流感病毒抗体水平及感染危险因素调查,10.3969/j.issn.1006-3110.2015.07.012,唐秀娟;房师松;吕星;武伟华;彭博;王昕;,"[1]深圳市疾病预防控制中心,广东深圳,518055",实用预防医学,H7N9禽流感;抗体水平;危险因素;活禽市场;活禽经营人员;,R511.7,2015,22,7
jkxlxzz201205004,0,"ISTIC,PKU",健康教育对首发精神分裂症患者治疗效果的影响,,岳丽萍[1];冯飞[2];徐国建[2];,"[1]中国 河南省荣康医院,洛阳,471013;[2]深圳市康宁医院;",中国健康心理学杂志,健康教育;精神分裂症;服药依从性;简明精神病量表;,B84,2012,20,5
zgggws201305023,5,"ISTIC,PKU",苯并芘对人支气管上皮细胞周期影响,,李玲;,"[1]深圳市疾病预防控制中心环境卫生科,广东,518055",中国公共卫生,苯并芘(BaP);细胞周期;p53;失调毛细血管扩张突变基因(ATM);,R99,2013,29,5
syyfyx201606017,3,"ISTIC,PKU",2012-2014年深圳市5岁以下儿童肺炎流行特征与病原学分析,10.3969/j.issn.1006-3110.2016.06.017,靳淑雁[1];刘世新[1];郑静[2];刘珺[1];陈素丽[1];,"[1]深圳市妇幼保健院预防保健科,广东 深圳,518028;[2]深圳市医学信息中心;",实用预防医学,儿童;肺炎;流行特征;病原学;,R725.6,2016,23,6
nfhlxb201403012,10,"ISTIC,PKU",住院患者护理工作满意度量表的编制及信度效度检验,,王璐[1];史铁英[2];尹安春[2];刘启贵[3];,"[1]大连医科大学附属第一医院，辽宁 大连 116011; 深圳市妇幼保健院，广东 深圳 518001;[2]大连医科大学附属第一医院,辽宁 大连,116011;[3]大连医科大学,辽宁 大连,116044;",护理学报,住院患者;满意度;护理;量表;,R192.6,2014,,3
hbyy201216085,1,"ISTIC,PKU",积雪治糜汤结合西医治疗肝胃郁热型糜烂性胃炎疗效观察,10.3969/j.issn.1002-7386.2012.16.085,葛欣;李彤;,"[1]广东省深圳市福田区中医院,518034",河北医药,积雪治糜汤;肝胃郁热;糜烂性胃炎;中西医结合;,R573.3,2012,34,16
hbzyxyxb201202005,2,"ISTIC,PKU",化痰祛瘀片对稳定性冠心病患者外周血中血管内皮祖细胞及血脂的影响,10.3969/j.issn.1008-987x.2012.02.05,王健;丁琼;,"[1]广东省深圳市福田区中医院,广东深圳,518034",湖北中医药大学学报,冠心病;中西医结合疗法;血脂;内皮细胞;流式细胞术;,R285.5,2012,14,2
hyhjkx201406022,0,"ISTIC,PKU",福田红树林自然保护区沉积物重金属污染现状及生态风险评价,,邓利[1];张慧敏[2];劳大荣[1];申顺爱[1];,"[1]深圳大学生命科学学院,深圳市海洋生物资源与生态环境重点实验室,广东深圳518060;[2]深圳市疾病预防控制中心,广东深圳518055;",海洋环境科学,福田红树林;表层沉积物;重金属;生态风险;自然保护区;,P736  X55,2014,33,6
gyzyxyxb201204101,1,"ISTIC,PKU",慢性胃病脾胃湿热证论治浅析,10.3969/j.issn.1002-1108.2012.04.101,黄亮[1];杨燕[2];杨桂林[1];吴其恺[1];,"[1]深圳市第三人民医院,广东深圳,518020;[2]深圳市福田区中医院,广东深圳,518055;",贵阳中医学院学报,慢性胃病;脾胃湿热证;论治;,R573,2012,34,4
zgsyyy201636086,0,"ISTIC,PKU",独生女围生期焦虑、抑郁心理状态及心理干预的改善作用研究,10.14163/j.cnki.11-5547/r.2016.36.086,李璐;李笑天;,"[1]518106,深圳市光明新区人民医院",中国实用医药,独生女;围生期;焦虑、抑郁;心理干预;,,2016,11,36
zgyxcx201634006,0,"ISTIC,PKU",蛛网膜腔出血后脑组织氧自由基代谢的实验研究,10.3969/j.issn.1674-4985.2016.34.006,董广宇[1];禹婷婷[2];吴春波[1];王新军[1];廖一凡[1];,[1]广东省深圳市龙岗区人民医院 广东 深圳 518172;[2]广东省深圳市康宁医院;,中国医学创新,兔;蛛网膜下腔出血;丙二醛;超氧化物歧化酶;脑水肿;,,2016,13,34
lnxdlcwk201604022,1,"ISTIC,PKU",青少年尿路感染细菌分布以及耐药性分析,10.3969/j.issn.1009-976X.2016.04.022,吴斌;,"[1]518106,广东深圳 深圳市光明新区人民医院",岭南现代临床外科,尿路感染;细菌分布;耐药分析;青少年;,R691.3,2016,16,4
zyyjk201308034,2,"ISTIC,PKU",2009-2011年深圳市龙岗区肠道传染病流行病学分析,,叶伟雄[1];黄宇燕[2];陈嘉慧[1];,"[1]广东省深圳市龙岗区疾病预防控制中心流行病科,518172;[2]深圳市龙岗区妇幼保健院;",职业与健康,肠道传染病;流行病学;,R181.8,2013,29,8
xnyxyxb201606034,0,"ISTIC,PKU",中西医结合护理联合药物治疗维持性血液透析患者皮肤瘙痒的临床观察,10.16751/j.cnki.2095-4646.2016.06.0529,陈晓霞;潘智鹍;陈远珍;许武红;,"[1]深圳市光明新区人民医院,广东深圳,518106",湖北科技学院学报（医学版）,皮肤瘙痒;中西医护理干预;血液透析;,R473.75,2016,30,6
hgzy201322004,10,"ISTIC,PKU",康妇消炎栓联合微波理疗对慢性盆腔炎治疗的疗效探讨,10.3969/j.issn.1674-0742.2013.22.004,林新秀[1];蔡世娟[2];李文清[2];,"[1]广东省深圳市光明新区人民医院,广东深圳,518106;[2]广东省深圳市龙华新区人民医院,广东深圳,518109;",中外医疗,康妇消炎栓;微波理疗;疗效;,R4,2013,32,22
jkr201611033,2,"ISTIC,PKU",人工泪液辅助治疗中老年睑板腺功能障碍所致干眼症的临床疗效,,姚新旺;,"[1]深圳市光明新区人民医院眼科,广东深圳,518106",中国当代医药,人工泪液;睑板腺功能障碍;干眼症;中老年;对比敏感度;,R771,2016,23,11
zgfybj201222016,4,"ISTIC,PKU",NICU早产儿与足月新生儿感染病原菌特性对比研究,,黄桂芳;李金华;,"[1]深圳市妇幼保健院,518028",中国妇幼保健,儿科重症监护病房;病原菌;耐药性;合理用药;,R722,2012,27,22
zgxdyyyy201614161,1,,利培酮治疗精神分裂症的不良反应观察及护理干预,10.14164/j.cnki.cn11-5581/r.2016.14.161,周建军;秦性好;,"[1]深圳市康宁医院, 深圳市心理健康重点实验室,518020",中国现代药物应用,利培酮;精神分裂症;不良反应;护理干预;,,2016,10,14
zwnxjkyj201622058,0,,护理干预对恢复期精神分裂症的效果分析,10.3969/j.issn.2096-0417.2016.22.058,张宇平;,"[1]深圳市康宁医院客服中心,广东深圳,518020",中外女性健康研究,护理干预;恢复期精神分裂症;护理效果;,,2016,,22
shswyxgc201603017,0,,经阴道超声检查与激素检测在多囊卵巢综合征诊断中的价值分析,10.3969/j.issn.1674-1242.2016.03.013,郭金强;李欠娇;,"[1]广东省深圳市龙岗区第二人民医院超声科 深圳,518112",生物医学工程学进展,超声检查;激素检测;多囊卵巢综合征;,R445.1,2016,37,3
bfyx201609111,0,,Livin在不同病理分型脂溢性角化病组织中表达的研究,,许向前[1];陈勇飞[2];梁伟容[3];张弘[1];,[1]深圳市龙岗中心医院 深圳市第九人民医院 皮肤科 深圳 518116;[2]深圳市龙岗区第二人民医院皮肤科 深圳 518101;[3]深圳市大鹏新区南澳人民医院皮肤科 深圳 518121;,北方药学,脂溢性角化病;病理分型;Livin;免疫组织化学;,R752.5,2016,13,9
zgfybj201324017,3,"ISTIC,PKU",剖宫产术中综合处理预防双胎产后出血,10.7620/zgfybj.j.issn.1001-4411.2013.28.17,张奕;王忠;,[1]深圳市妇幼保健院产科 518028,中国妇幼保健,双胎;剖宫产;产后出血;缝合术;,R719.8,2013,28,24
syyfyx201410005,4,"ISTIC,PKU",2010-2013年深圳市罗湖区育龄期妇女风疹IgG抗体水平及发病情况,10.3969/j.issn.1006-3110.2014.10.005,杨洁[1];黄芳[2];林喜乐[1];刘卫民[1];卓菲[1];蔡春林[1];付丹凤[1];,"[1]深圳市罗湖区疾病预防控制中心,广东深圳,518003;[2]深圳市疾病预防控制中心;",实用预防医学,风疹;IgG抗体;几何平均浓度;阳性率;育龄期妇女;,R511.2,2014,21,10
zgmryxzz201208105,1,"ISTIC,PKU",儿童包皮环扎术并发症发生的原因及预防,10.3969/j.issn.1008-6455.2012.08.105,马文建;卢雨前;,[1]深圳市龙岗区妇幼保健院外科 深圳518172,中国美容医学,包茎;包皮环扎器扎术;并发症;,,2012,21,8
gwyx-fybj201202005,2,"ISTIC,PKU",深圳市龙岗区5岁以下儿童死亡情况分析,10.3969/j.issn.1673-5293.2012.02.005,张绍强[1];张玲[2];邹丹玲[2];陈文英[2];冯文成[2];夏洪波[2];,"[1]深圳市龙岗区健康教育所,广东,深圳,518172;[2]深圳市龙岗区妇幼保健院,广东,深圳,518172;",中国妇幼健康研究,5岁以下儿童;死亡率;死亡原因;性别比;,R17,2012,23,2
syyylczz201206081,0,"ISTIC,PKU",重度子痫前期合并甲型H1N1流感重症肺炎1例报告,10.3969/j.issn.1672-6170.2012.06.081,杨善标;王美香;冯燕豫;,"[1]广东省深圳市龙岗区妇幼保健院内科,广东深圳,518172",实用医院临床杂志,,R563.1  R511.7  R714.244,2012,09,6
szzxyjhzz201614091,0,"ISTIC,PKU",异型南五味子总三萜小鼠急性毒性试验结果分析,10.16458/j.cnki.1007-0893.2016.14.091,邓鸣;,"[1]深圳市福田区中医院,广东深圳,518034",深圳中西医结合杂志,异型南五味子;总三萜;类风湿性关节炎;动物实验;,R332  R593.22,2016,26,14
syyfyx201506008,2,"ISTIC,PKU",3种金黄色葡萄球菌基因分型技术的评估,10.3969/j.issn.1006-3110.2015.06.008,王冰;李迎慧;,"[1]深圳市疾病预防控制中心,广东深圳,518055",实用预防医学,金黄色葡萄球菌;基因分型;多位点熔解曲线体系;葡萄球菌蛋白A序列分析;脉冲场凝胶电泳;,R378,2015,22,6
gjyywsdb201623058,0,"ISTIC,PKU",住院早产儿母乳喂养对早产儿近期转归的影响,10.3760/cma.j.issn.1007-1245.2016.23.058,万丽;徐芮;叶贞志;,"[1]518106,深圳市光明新区人民医院新生儿科",国际医药卫生导报,住院;早产儿;早期母乳喂养;,,2016,22,23
