zgrsghbzz201506015,2,"ISTIC,PKU",深圳地区2014年柯萨奇病毒A组4型VP1区基因特征分析,10.3969/cjz.j.issn.1002-2694.2015.06.015,姚相杰[1];何雅青[1];蔡春林[2];卓菲[2];杨贵清[2];,"[1]深圳市疾病预防控制中心重大传染病监控实验室,深圳,518055;[2]深圳市罗湖区疾病预防控制中心微生物检验科,深圳,518020;",中国人兽共患病学报,疱疹性咽峡炎;柯萨奇病毒A组4型;VP1序列分析;亚型;,R373.2,2015,31,6
fxcsxb201406007,5,"ISTIC,PKU",HPLC-MS/MS法同时测定粮食中脱氧雪腐镰刀菌烯醇及其衍生物,10.3969/j.issn.1004-4957.2014.06.007,李瑞园;刘红河;康莉;,"[1]深圳市疾病预防控制中心,广东深圳,518055",分析测试学报,高效液相色谱-串联质谱法(HPLC-MS/MS);脱氧雪腐镰刀菌烯醇;霉菌毒素;粮食;,O657.63  S852.44,2014,33,6
xdyfyx201208003,19,"ISTIC,PKU",乙肝相关疾病住院病人经济负担及影响因素分析,,李晓强[1];许红霞[1];樊学敏[1];武震[1];李玉芳[2];张顺祥[3];庄贵华[4];张毓洪[1];,"[1]宁夏医科大学公共卫生学院,宁夏银川,750004;[2]宁夏医科大学附属医院;[3]深圳市疾病预防控制中心;[4]西安交通大学医学院;",现代预防医学,乙型肝炎;经济负担;影响因素;,R512.6+2,2012,39,8
gwyx-nxgjbfc201510005,1,"ISTIC,PKU",诱导型一氧化氮合酶基因多态性与中国汉族人群缺血性卒中的关联性,10.3760/cma.j.issn.1673-4165.2015.10.005,张艳炜[1];韩京军[2];李山山[1];黄三丰[1];,"[1]518055,深圳市疾病预防控制中心分子生物医学检验科;[2]广东医学院附属福田人民医院心胸外科, 深圳,518033;",国际脑血管病杂志,"卒中;脑缺血;一氧化氮合酶Ⅱ型;多态现象,遗传学;危险因素;",,2015,23,10
zgxxcbfzzz201503010,2,"ISTIC,PKU",淡水螺类三旋丽卷螺的物种鉴定及其潜在适生区分析,10.16250/j.32.1374.2015069,李晓恒[1];高世同[1];顾文彪[2];张仪[2];郭云海[2];,[1]广东省深圳市疾病预防控制中心 深圳518055;[2]中国疾病预防控制中心寄生虫病预防控制研究所，卫生部寄生虫病原与媒介生物学重点实验室，世界卫生组织疟疾 血吸虫病和丝虫病合作中心;,中国血吸虫病防治杂志,医学贝类;物种鉴定;扁卷螺科;丽卷螺属;三旋丽卷螺;生物入侵;,Q959.1,2015,,3
xdyy201503032,2,"ISTIC,PKU",X 线检查用于诊断骨关节创伤软组织改变的临床价值,10.3969/j.issn.1671-332X.2015.03.033,李雄辉;舒永辉;刘爱纯;,[1]深圳市龙岗区第三人民医院 广东深圳518115,现代医院,X线;创伤软组织改变;内外翻位;MRI;,,2015,,3
jilinyx201509042,2,"ISTIC,PKU",联合应用沙丁胺醇与布地奈德雾化吸入治疗小儿毛细支气管炎的效果观察,10.3969/j.issn.1004-0412.2015.09.042,吴俊峰;林观尚;,"[1]广东省深圳市龙岗区第三人民医院,广东 深圳,518115",吉林医学,布地奈德;沙丁胺醇;雾化吸入;毛细支气管炎;临床疗效;,,2015,,9
xdfckjz201510013,0,"ISTIC,PKU",CIN治疗后评估手段及随访时间的临床研究,10.13283/j.cnki.xdfckjz.2015.10.013,李晴;汪艳珠;黄卓敏;金平;,"[1]深圳市妇幼保健院妇科子宫颈疾病诊治中心,深圳,518048",现代妇产科进展,宫颈鳞状上皮内瘤变;HPV检测;液基细胞学检查;阴道镜检查;阳性/阴性预测值;,R737.33,2015,,10
bfyx201511059,0,"ISTIC,PKU",肛滴平喘汤对慢性阻塞性肺疾病急性发作期的疗效,,洪继波;易恒安;,[1]深圳市龙岗区第三人民医院 深圳 518115,北方药学,阻塞性肺病;急性发作;肛滴平喘汤;临床效果;,R563.9,2015,,11
xdzdyzl201514064,1,"ISTIC,PKU",自动胶圈套扎法与传统手术治疗Ⅱ-Ⅲ期内痔的临床疗效比较,,喻登明;张禄芳;李康平;黄连焕;桂鹏;,"[1]深圳市龙岗区第三人民医院,广东 深圳,518115",现代诊断与治疗,自动胶圈套扎法;传统手术;内痔;肛垫;,R675.18,2015,26,14
gwyx-lcsw201324033,8,"ISTIC,PKU",手术治疗前后血浆D-二聚体及纤维蛋白原水平的变化,10.3969/j.issn.1673-4130.2013.24.033,梁红梅[1];唐万兵[2];,"[1]广东省深圳市龙岗区第二人民医院检验科,广东深圳,518112;[2]广东省深圳市龙岗区人民医院检验科,广东深圳,518172;",国际检验医学杂志,纤维蛋白;纤维蛋白原降解物;纤维蛋白原;预后;,,2013,34,24
tlsjyyj201622046,0,"ISTIC,PKU",精益管理模式在供应室管理中的应用,10.3969/j.issn.1672-9676.2016.22.046,钟德霞;席晓颖;麦桃香;,"[1]518106,深圳市 深圳市光明新区人民医院",护理实践与研究,精益管理模式;供应室;切口感染;防控;,,2016,13,22
rdyxzz201507042,0,"ISTIC,PKU",深圳市龙岗区60岁以上常住居民空腹血糖现况调查,,林锦波[1];陈小良[2];张云凤[3];黄雪良[1];巫伟忠[1];罗石友[1];,"[1]深圳市龙岗中心医院,广东深圳,518116;[2]深圳市光明新区疾病预防控制中心,广东深圳,518106;[3]深圳市龙岗区人民医院,广东深圳,518172;",热带医学杂志,糖尿病;空腹血糖;老年人;,R587.1,2015,15,7
gwyx-zyzyfc201611024,0,"ISTIC,PKU",《针灸易学》的临床实用性浅析,10.3760/cma.j.issn.1673-4246.2016.11.019,徐小滨[1];刘贯宇[2];孙海舒[3];,"[1]黑龙江中医药大学大学图书馆特藏室,哈尔滨,150040;[2]518000,广东省深圳市光明新区人民医院康复科;[3]中国中医科学院中医药信息研究所多媒体资源研究室,北京,100700;",国际中医中药杂志,,,2016,38,11
jkr201520048,1,"ISTIC,PKU",PFNA内固定联合中医综合疗法治疗老年股骨粗隆间骨折的临床效果,,徐彦钦;,"[1]深圳市龙岗区第三人民医院中西医结合骨科,深圳,518115",中国当代医药,PFNA内固定;中医疗法;老年;股骨粗隆间骨折;,R683.42,2015,,20
xdzdyzl201521051,0,"ISTIC,PKU",个性化方案应用于糖尿病合并高血压患者社区干预的模式探讨,,陈钦宏;欧阳玲;,"[1]深圳市龙岗区第三人民医院华乐社康中心,广东 深圳,518000",现代诊断与治疗,个性化干预;社区干预;糖尿病;高血压;,R544.1,2015,26,21
fsxsj201308021,11,"ISTIC,PKU",快速MRI对胎儿胼胝体发育不全的诊断价值及与超声对照研究,10.3969/j.issn.1000-0313.2013.08.021,杜牧;曹满瑞;赵弘;谢肇峰;,"[1]南方医科大学附属深圳市妇幼保健院放射科,深圳,518028",放射学实践,胎儿;胼胝体发育不全;磁共振成像;超声;,R445.2  R714.53,2013,28,8
xdyfyx201611025,0,"ISTIC,PKU",不同提取方法对粪便中短链脂肪酸含量及稳定性的影响,,康莉[1];吴彬彬[2];罗茜[2];刘桂华[1];王春萍[2];杨致一[2];潘永龙[2];梁岩[2];,"[1]深圳市疾病预防控制中心,广东深圳,518055;[2]中国科学院深圳先进技术研究院食品安全与环境技术研究室,广东深圳,518055;",现代预防医学,短链脂肪酸;稳定性;高效液相色谱法;操作分类单元;,R115,2016,43,11
yxzs201516056,3,"ISTIC,PKU",个体化管理对门诊妊娠期糖尿病母婴结局的影响,10.3969/j.issn.1006-2084.2015.16.056,龙隽[1];杨海燕[1];邓志娇[1];陈美华[2];,"[1]深圳市罗湖区人民医院妇产科,广东 深圳,518100;[2]深圳市龙岗区第二人民医院妇产科,广东 深圳,518112;",医学综述,妊娠期糖尿病;个体化管理;母婴结局;,R714.2,2015,,16
gxyx201604039,1,"ISTIC,PKU",药物性肝损伤168例临床分析,10.11675/j.issn.0253-4304.2016.04.39,温祝杜[1];胡国信[2];郑洁[3];杨剑[4];陈智明[4];,"[1]广东省深圳市龙岗区第二人民医院社康中心,深圳市518100;广州医科大学研究生学院,广州市510000;[2]北京大学深圳医院感染科,深圳市,518100;[3]北京大学深圳医院中医科,深圳市,518100;[4]广州医科大学研究生学院,广州市,510000;",广西医学,药物性肝损伤;临床特征;预后;致病药物;,R994.11,2016,38,4
hsjxzz201424015,7,"ISTIC,PKU",导乐分娩对产妇抑郁症的影响及临床护理分析,,潘雅梅;詹爱丁;,"[1]广东省深圳市妇幼保健院,广东深圳,518028",护士进修杂志,导乐分娩;抑郁症;焦虑-抑郁自评量表;爱丁堡产后抑郁量表;护理;,R471  R714,2014,,24
tlsjyyj201605066,2,"ISTIC,PKU",中西医结合治疗乳腺增生症的疗效与护理,10.3969/j.issn.1672-9676.2016.05.063,杨灶金;黄美娟;曾秋霞;,"[1]518106,深圳市 广东省深圳市光明新区人民医院",护理实践与研究,乳腺增生;乳癖舒胶囊;三苯氧胺;,,2016,13,5
xdyfyx201611029,0,"ISTIC,PKU",超高效液相色谱-电喷雾串联质谱法测定食品包装材料中3种有机锡化合物的迁移量,,许欣欣;陈慧玲;毛丽莎;刘红河;康莉;,"[1]深圳市疾病预防控制中心,广东深圳,518055",现代预防医学,超高效液相色谱-电喷雾串联质谱;三甲基锡;三丁基锡;三苯基锡;食品包装材料;,R115,2016,43,11
zhyfyx201509020,1,"ISTIC,PKU",三氯乙烯非致癌性毒性研究进展,10.3760/cma.j.issn.0253-9624.2015.09.016,黄培武;李绚;刘威;刘建军;,[1]518055深圳市疾病预防控制中心现代毒理学重点实验室,中华预防医学杂志,三氯乙烯;职业暴露;毒性作用;流行病学研究;机制研究;,,2015,,9
amydy201407085,0,"ISTIC,PKU",双腔支气管导管插管的围麻醉期系统护理干预分析,,江铮;赵嫣霞;李炆珈;,"[1]深圳市光明新区中心医院,广东深圳,518107",按摩与康复医学,围麻醉期;系统护理;双腔支气管导管插管;效果;,R473.5,2014,,7
qqhryxyxb201504042,2,,NLR 与 CA-125在子宫内膜异位症诊断中的应用研究,,彭巧捷;张波;王秀梅;,"[1]518116,深圳市龙岗区第三人民医院",齐齐哈尔医学院学报,子宫内膜;异位症;诊断;,,2015,,4
ylbjqj201502031,2,,微创穿刺引流在脑出血合并脑疝中的应用研究,10.3969/j.issn.1674-4659.2015.02.0192,张益民;,"[1]深圳市龙岗区第三人民医院外二科,广东深圳,518115",临床医学工程,脑出血;脑疝;微创穿刺引流术;应用效果;,R743.34  R651.1+1,2015,22,2
zgrdyx201611023,0,"ISTIC,PKU",一例重症肝病/艾滋病病例与HIV携带者和正常对照免疫学差异分析,10.13604/j.cnki.46-1064/r.2016.11.23,黎桂连[1];聂李平[2];杨峥嵘[1];石向东[1];梁春萍[1];王晓辉[1];,"[1]深圳市疾病预防控制中心,广东深圳,518055;[2]北京大学深圳医院,广东深圳,518036;",中国热带医学,人类免疫缺陷病毒;乙肝病毒;双重感染;免疫学特征;,R512.91,2016,16,11
lnjzyxzz201501031,2,"ISTIC,PKU",心理护理在院前急救支气管哮喘患者中的应用,10.3969/j.issn.1671-301X.2015.01.031,李冬梅;秦崇臻;何晴;,[1]深圳市急救中心院前科 518000,岭南急诊医学杂志,支气管哮喘;急性发作;院前急救;心理护理;,,2015,,1
xdzdyzl201512145,1,"ISTIC,PKU",产前护理干预对硬膜外麻醉无痛分娩的效果,,李小敏;,"[1]深圳市龙岗区第三人民医院,广东 深圳,518115",现代诊断与治疗,产前护理干预;硬膜外麻醉;无痛分娩;,R715.9,2015,26,12
hljyy201503082,1,"ISTIC,PKU",丙种球蛋白无反应性川崎病临床危险因素和治疗方案的探讨,10.14035/j.cnki.hljyy.2015.03.080,谢俊锋;,[1]深圳市龙岗区第三人民医院 深圳市龙岗区518115,黑龙江医药,丙种球蛋白;无反应;川崎病;危险因素;治疗;,R725.9,2015,,3
sxyxjy201603042,1,"ISTIC,PKU",儿童呼吸道感染患者金黄色葡萄球菌的分离与耐药性分析,10.3969/j.issn.1671-7414.2016.03.042,刘青[1];樊冰[2];,"[1]深圳市光明新区人民医院检验科,广东深圳,518106;[2]深圳市第二人民医院检验科,广东深圳,518000;",现代检验医学杂志,金黄色葡萄球菌;耐甲氧西林金黄色葡萄球菌;儿科;呼吸道感染;耐药性;,R378.11  R446.5,2016,31,3
zgrdyx201611007,0,"ISTIC,PKU",HLA-A*02、A*24基因多态性与中国汉族人群HIV-1易感性的关系,10.13604/j.cnki.46-1064/r.2016.11.07,王晓辉;宋俊敏;杨峥嵘;陈琳;谭京广;,"[1]深圳市疾病预防控制中心艾滋病预防控制科,广东深圳,518055",中国热带医学,艾滋病毒;人类白细胞抗原;易感性;基因多态性;,R394,2016,16,11
zgbjyy-x201212581,0,"ISTIC,PKU",深圳市某区2002-2011年HIV/艾滋病流行状况分析,10.3969/j.issn.1004-7484(x).2012.12.581,胡鹏飞;葛亮;杨飞鹏;,"[1]深圳市光明新区疾病预防控制中心,广东,深圳,518101",中国保健营养（下旬刊）,HIV/艾滋病;监测;流行特征;,,2012,22,12
zgbjyy-z201204055,0,"ISTIC,PKU",深圳市光明新区大运场馆病媒生物监测结果分析,,王广力;刘义;王铁强;郑庆鸣;魏天忠;,[1]深圳市光明新区疾病预防控制中心 广东 深圳518106,中国保健营养（中旬刊）,大运场馆;病媒生物;密度监测;,R384.2,2012,,4
zgbjyy-x201208588,0,"ISTIC,PKU",深圳市光明新区某工厂1131名工人在岗期间职业健康检查结果,10.3969/j.issn.1004-7484(x).2012.08.588,吴注辉[1];葛亮[2];胡鹏飞[2];,"[1]深圳市光明新区卫生监督所,广东,深圳,518107;[2]深圳市光明新区疾病预防控制中心,广东,深圳,518107;",中国保健营养（下旬刊）,工人;在岗期间;职业健康检查;,R131,2012,22,8
zgxdyyyy201511121,1,"ISTIC,PKU",补肾中药辨证结合塞来昔布对膝关节骨性关节炎（肾阳虚证）患者疗效及症状的影响,10.14164/j.cnki.cn11-5581/r.2015.11.121,黄乐辉;李雄辉;成钊敏;刘阳灿;,"[1]518115,深圳市龙岗区第三人民医院外五科",中国现代药物应用,膝关节骨性关节炎;补肾中药;塞来昔布;疗效;,,2015,,11
zgrdyx201611004,0,"ISTIC,PKU",一株HIV-101_AE/07_BC独特重组病毒近全长基因组分析,10.13604/j.cnki.46-1064/r.2016.11.04,黄旭和[1];于国龙[2];周平平[3];颜瑾[2];赵锦[4];陈琳[4];林鹏[2];何翔[3];,"[1]中山大学公共卫生学院,广东广州510080;广东省疾病预防控制中心广东省公共卫生研究院,广东广州511430;[2]广东省疾病预防控制中心艾滋病预防控制所,广东广州,511430;[3]广东省疾病预防控制中心广东省公共卫生研究院,广东广州,511430;[4]深圳市疾病预防控制中心,广东深圳,518055;",中国热带医学,HIV-1;重组;近全长基因组;系统进化;,R512.91,2016,16,11
hainanyx201317011,11,"ISTIC,PKU",妊娠期高血压疾病孕妇凝血功能的对照研究,10.3969/j.issn.1003-6350.2013.17.1045,赵映华[1];吴雪琴[1];何勤径[2];,"[1]深圳市龙岗中心医院妇产科,广东 深圳,518116;[2]深圳市龙岗区妇幼保健院妇产科,广东深圳,518116;",海南医学,妊娠高血压疾病;凝血功能;围生期;,R714.24+6,2013,24,17
hlykf201511018,2,"ISTIC,PKU",网络虚拟社区在糖尿病院后血糖管理和不良事件控制中的应用,10.3969/j.issn.1671-9875.2015.11.018,刘素芳;凌秋平;黄海燕;,"[1]广东省深圳市龙岗区第二人民医院,广东深圳,518112",护理与康复,糖尿病;血糖管理;不良事件;虚拟社区;,R492,2015,14,11
jyyxylc201618039,0,"ISTIC,PKU",CT对原发性中枢神经系统淋巴瘤的诊断价值及与病理检查的对照研究,10.3969/j.issn.1672-9455.2016.18.039,王雁;,[1]广东省深圳市康宁医院放射科 518000,检验医学与临床,原发性;中枢神经系统;淋巴瘤;CT;临床表现;,,2016,13,18
qlhlzz201614064,0,"ISTIC,PKU",窄带成像技术在早期诊断咽喉部肿瘤中的应用,10.3969/j.issn.1006-7256.2016.14.064,陈粉珊;陈志鹏;熊姗姗;马东升;李文生;林贵德;王建蔚;,[1]深圳市龙岗区第二人民医院 广东深圳518112,齐鲁护理杂志,窄带成像技术;早期诊断;咽喉部肿瘤;,R739.65,2016,22,14
zgnjzz201304001,3,"ISTIC,PKU",阴道镜联合高危型人乳头瘤病毒检测在宫颈非典型鳞状细胞中的意义,,谭旭东;唐红装;陈淑苹;车爱文;李家梁;,"[1]广东省深圳市龙岗区妇幼保健院病理科,广东深圳,518172",中国内镜杂志,阴道镜;人乳头状瘤病毒;不典型鳞状细胞;,R713  R711.74,2013,19,4
gwyx-lcsw201614049,0,"ISTIC,PKU",常规剂量肝素锂和氟化钠抗凝对毛细管电泳法检测 HbA1c的影响,10.3969/j.issn.1673-4130.2016.14.049,陈群;黄华;吴愿如;李立波;邓宝佳;,[1]广东省深圳市龙岗区第二人民医院检验科 518112,国际检验医学杂志,肝素锂;氟化钠;抗凝;毛细管电泳;HbA1c;,,2016,37,14
zjlcyx201607023,0,"ISTIC,PKU",慢性肾病患儿血清1，25-二羟维生素D3水平与并发症及肾功能关系,,张艳[1];张水林[2];,"[1]518100,广东省深圳市龙岗区第二人民医院;[2]518000,广东省深圳市宝安区中心医院;",浙江临床医学,"血清1,25-二羟维生素D3;慢性肾病患儿;并发症;肾功能;",,2016,18,7
zhldwszyb201412001,3,"ISTIC,PKU",三氯乙烯致细胞免疫和体液免疫参与的混合型变态反应研究,10.3760/cma.j.issn.1001-9391.2014.12.001,徐新云;李学余;刘月峰;,"[1]518055,深圳市疾病预防控制中心毒理学研究室",中华劳动卫生职业病杂志,三氯乙烯;变态反应;细胞免疫;体液免疫;,,2014,32,12
tlsjyyj201619077,0,"ISTIC,PKU",居家评估在预防社区居家老年人跌倒危险风险中的临床应用,10.3969/j.issn.1672-9676.2016.19.069,乐安琪;张华;涂玉玲;,"[1]518106,深圳市 广东省深圳市光明新区人民医院公明社区健康服务中心",护理实践与研究,社区;老年人;跌倒;危险因素;居家评估;,,2016,13,19
lcfsxzz201212002,13,"ISTIC,PKU",动脉自旋标记技术在脑肿瘤术前评估中的应用研究,,朱记超[1];娄明武[1];张方璟[2];赖文娟[1];胡卫东[1];范义[1];陈燕萍[3];,"[1]518116,广东省深圳市龙岗中心医院医学影像科;[2]518028,广东省深圳市妇幼保健院放射科;[3]南方医科大学附属南方医院影像中心,广州,510515;",临床放射学杂志,脑肿瘤;动脉自旋标记;动态磁敏感对比增强;磁共振成像;,,2012,31,12
zgsyzdx201507019,5,"ISTIC,PKU",改良的子宫内膜取样器在子宫内膜病变活检早期诊断中的应用,,陈小琳;金平;赵娟;宋振;,"[1]深圳市妇幼保健院 妇二科,广东 深圳,518017",中国实验诊断学,子宫内膜取样器;子宫内膜病变;早期诊断;组织样本质量;,R711.74,2015,,7
gwyx-lcsw201413012,6,"ISTIC,PKU",急性脑梗死患者血小板参数及聚集率变化的临床意义,10.3969/j.issn.1673-4130.2014.13.012,梁红梅[1];黄华[1];邓宝佳[1];郭珍万[1];唐万兵[2];甘志彪[3];,"[1]广东省深圳市龙岗区第二人民医院检验科,广东深圳,518112;[2]广东省深圳市龙岗区人民医院输血科,广东深圳,518172;[3]广东省深圳市人民医院检验科 518001;",国际检验医学杂志,脑梗死;血小板计数;血小板聚集;,,2014,,13
yycyzx201222051,14,"ISTIC,PKU",四逆散加味治疗慢性萎缩性胃炎的疗效观察及机制探讨,10.3969/j.issn.1673-7210.2012.22.051,赵翠丽;蔡智刚;,"[1]湖南中医药大学附属深圳市福田区中医院,广东深圳,518034",中国医药导报,慢性萎缩性胃炎;四逆散;转化生长因子-α;临床观察;,R573.3,2012,09,22
gjyywsdb201207003,1,"ISTIC,PKU",HPV-18病毒E2与E6在宫颈病变中的表达与意义,10.3760/cma.j.issn.1007-1245.2012.07.003,黄卓敏[1];王楚莹[1];古衍[1];姚吉龙[1];谢建生[2];,"[1]518028,南方医科大学附属深圳市妇幼保健院妇科;[2]518028,南方医科大学附属深圳市妇幼保健院中心实验室;",国际医药卫生导报,人乳头瘤病毒18;E2;E6;宫颈上皮内瘤变;宫颈癌;,R194,2012,18,7
syzdyzlzz201605010,0,"ISTIC,PKU",深圳地区羊水染色体异常与多态性产前诊断分析,10.13507/j.issn.1674-3474.2016.05.010,罗小金;郭岩芸;朱自然;魏凤香;,"[1]深圳市龙岗区妇幼保健院产前诊断中心实验室,广东深圳,518172",中华实用诊断与治疗杂志,产前诊断;染色体;异常核型;多态性;,,2016,30,5
syzxyjhlc201505002,1,"ISTIC,PKU",药饼灸治疗膀胱过度活动综合征的临床体会,10.13638/j.issn.1671-4040.2015.05.002,李莉[1];谢杨春[1];黎石放[2];邓永诚[1];,[1]广东省深圳市坪山新区人民医院 深圳518118;[2]广东省深圳市龙岗区第三人民医院 深圳518115;,实用中西医结合临床,膀胱过度活动症;徐长卿药饼灸;托特罗定片;功能训练;,R694,2015,15,5
hnyxyj201505018,1,"ISTIC,PKU",沙丁胺醇联合布地奈德雾化吸入治疗小儿毛细支气管炎的效果观察,10.3969/j.issn.1004-437X.2015.05.018,吴俊峰;,[1]深圳市龙岗区第三人民医院 儿内科 广东 深圳 518115,河南医学研究,布地奈德;沙丁胺醇;雾化吸入;毛细支气管炎;临床疗效;,R725.6,2015,,5
qqhryxyxb201510007,1,"ISTIC,PKU",沙美特罗／氟替卡松治疗慢性阻塞性肺疾病的临床观察,,李麒;丘俏芳;张涛;袁伟芳;,"[1]518115,广东省深圳市龙岗区第三人民医院",齐齐哈尔医学院学报,慢性阻塞性肺疾病;沙美特罗;氟替卡松;疗效;,,2015,,10
jilinyx201515167,1,"ISTIC,PKU",护理风险干预在心力衰竭合并心律失常患者中的应用效果,10.3969/j.issn.1004-0412.2015.15.167,雷金花;,"[1]广东省深圳市龙岗区第三人民医院护理部,广东 深圳,518115",吉林医学,护理风险干预;心衰;心律失常;治疗效果;,,2015,,15
zgggws201501004,6,"ISTIC,PKU",深圳市19例人感染H7N9禽流感确诊病例流行病学分析,10.11847/zgggws2015-31-01-04,秦彦珉;梅树江;谢旭;孔东锋;唐秀娟;程聪;,"[1]深圳市疾病预防控制中心传染病防制科,广东518055",中国公共卫生,人感染H7N9禽流感;流行病学;分析;,R511.7,2015,31,1
xdhl201525022,3,"ISTIC,PKU",治疗性沟通对抑郁症患者治疗依从性和应对方式的影响,10.3760/cma.j.issn.1674-2907.2015.25.016,谢淑娟;江帆;黎群;,"[1]518020,深圳市康宁医院门诊部 深圳市心理健康实验室",中华现代护理杂志,抑郁症;治疗性沟通;依从性;应对方式;,,2015,,25
sxhlzz201519039,3,"ISTIC,PKU",模块式教育计划在老年骨质疏松症病人健康教育中的应用研究,10.3969/j.issn.1009-6493.2015.19.039,江育琴;叶玲;张莉;郑春丽;徐江玲;,"[1]广东省深圳市龙岗区第二人民医院,518112",护理研究,骨质疏松症;老年人;模块式教育计划;健康教育;自我护理能力;,R473.6,2015,,19
sxhlzz201615008,1,"ISTIC,PKU",家庭病床服务对社区护士职业紧张程度的影响及对策,10.3969/j.issn.1009-6493.2016.15.007,麦艳冰;黄旭娟;陈玉明;,"[1]深圳市光明新区人民医院,518106",护理研究,家庭病床;社区护理;职业紧张;工作压力;付出;回报失衡;,R473.2,2016,30,15
gyzyxyxb201303121,9,"ISTIC,PKU",产科护理中不安全因素调查与防范对策的探讨,10.3969/j.issn.1002-1108.2013.03.0121,李萍华;,"[1]深圳市龙岗区第二人民医院,广东深圳,518112",贵阳中医学院学报,产科护理;不安全因素;干预对策;防范;,R473.71,2013,35,3
zgggws201610025,0,"ISTIC,PKU",深圳中小学生骨折流行病学和骨折后心理特征分析,10.11847/zgggws2016-32-10-25,周丽;黄园园;熊华威;谌丁艳;,"[1]深圳市疾病预防控制中心学校卫生科,广东,518020",中国公共卫生,中小学生;骨折;流行病学;心理特征;,R181.2,2016,32,10
qqhryxyxb201409090,4,"ISTIC,PKU",个案管理模式对ER阳性乳腺癌生命质量的影响研究,,何芳;宋淑芬;何慧;,"[1]广东, 深圳市急救中心,518035",齐齐哈尔医学院学报,乳腺癌;ER阳性;个案全程管理模式;应用价值;,,2014,35,9
lcjsyxzz201404028,6,"ISTIC,PKU",流浪精神病患者合并躯体疾病调查,10.3969/j.issn.1005-3220.2014.04.028,邓先华;张美燕;毕建强;许玉梅;时君;,"[1]518000,深圳市康宁医院 深圳市心理健康实验室",临床精神医学杂志,流浪精神病患者;躯体疾病;,R749.3,2014,,4
jths201425027,3,"ISTIC,PKU",改良饮食模式对脑卒中后吞咽困难病人的效果评价,10.3969/j.issn.1674-4748.2014.25.027,陶金凤;,"[1]广东省深圳市龙岗区第三人民医院,518115",全科护理,脑卒中;吞咽困难;饮食模式;临床效果;,R473.5,2014,,25
gwyx-lcsw201520010,2,"ISTIC,PKU",高尔基体蛋白73联合甲胎蛋白、α-L 岩藻糖苷酶、α-抗胰蛋白酶检测对原发性肝癌的诊断价值,10.3969/j.issn.1673-4130.2015.20.010,黄华;梁红梅;胥慧;周庭雄;王建蔚;,"[1]深圳市龙岗区第二人民医院,广东深圳,518112",国际检验医学杂志,原发性肝癌;高尔基体蛋白73;甲胎蛋白;α-L岩藻糖苷酶;α-抗胰蛋白酶;,,2015,,20
lcfsxzz201503029,2,"ISTIC,PKU",扩散加权成像在正常胎儿脑发育中的应用,,郑昌业[1];曹满瑞[2];刘炳光[2];朱志军[2];杜牧[2];张翔亚[2];,"[1]510182,广州医科大学;[2]518028,南方医科大学附属深圳市妇幼保健院放射科;",临床放射学杂志,胎儿;脑发育;扩散加权成像;表观扩散系数;,,2015,34,3
tlsjyyj201303052,10,"ISTIC,PKU",门诊换药室感染的相关因素分析与预防措施,10.3969/j.issn.1672-9676.2013.03.052,黄春霞;曾萍;陈萍红;,"[1]518112,广东省深圳市龙岗区第二人民医院门诊换药室",护理实践与研究,门诊换药室;医院感染;相关因素;预防措施;,,2013,10,3
lcjsyxzz201604032,0,"ISTIC,PKU",丁螺环酮和安非他酮治疗抗抑郁药物相关的性功能障碍的研究现况,,曾玲芸;江帆;曹长安;,"[1]深圳市心理健康实验室, 广东省深圳市康宁医院,518020",临床精神医学杂志,丁螺环酮;安非他酮;5-羟色胺再摄取抑制剂;性功能障碍;抗抑郁药物;,R749,2016,26,4
lnyxybj201603014,0,"ISTIC,PKU",老年终末期肾病患者血红蛋白与甲状旁腺素及超敏C反应蛋白相关性的研究,10.3969/j.issn.1008-8296.2016.03.14,陈恩平[1];梁馨苓[2];李锐钊[2];马建超[2];张丽[2];杜丽根[1];,"[1]深圳市龙岗区第二人民医院,深圳市,518112;[2]510080广州市,广东省人民医院,广东省医学科学院肾内科血液净化中心;",老年医学与保健,终末期肾脏病;血红蛋白;甲状旁腺素;超敏C反应蛋白;,R692,2016,22,3
