zgyxzb201408042,2,"ISTIC,PKU",TBA-120FR全自动生化分析仪的故障分析及维修,10.3969/J.ISSN.1672-8270.2014.08.042,周丽华[1];牟强善[2];吴浙君[3];武娟[4];,[1]深圳市龙岗中心医院设备科 广州深圳518116;[2]日照市东港区人民院设备科 山东日照276800;[3]余杭区第五人民医院设备科 浙江杭州311100;[4]深圳市龙岗区妇幼保健院 广东深圳518116;,中国医学装备,,R197.39,2014,11,8
rdyxzz201403010,3,"ISTIC,PKU",非结核分枝杆菌耐药性特征及聚合酶链式反应检测方法的建立,,林世平[1];林一曼[2];石晓路[2];扈庆华[2];吕东月[2];邱亚群[2];李迎慧[2];,"[1]深圳市慢性病防治中心,广东深圳,518020;[2]深圳市疾病预防控制中心,广东深圳,518055;",热带医学杂志,非结核分枝杆菌;药敏;聚合酶链式反应;测序;,R446.5,2014,14,3
zgyyzn201212326,7,"ISTIC,PKU",妊娠梅毒173例临床分析,10.3969/j.issn.1671-8194.2012.12.326,张志云;曾凡杞;李永双;冉灵芝;林定庄;,"[1]广东省深圳市光明新区人民医院,广东,深圳,518106",中国医药指南,妊娠梅毒;妊娠结局;先天梅毒;,R714.2,2012,10,12
gwyx-lcsw201221003,3,"ISTIC,PKU",三氯乙烯药疹样皮炎患者外周血常规及T淋巴细胞亚群变化的观察,10.3969/j.issn.1673-4130.2012.21.003,张艳芳[1];李培茂[1];张志敏[1];罗斌[1];邓丽丹[1];刘威[2];刘建军[2];,"[1]深圳市职业病防治院卫生检测科,广东深圳,518001;[2]深圳市疾病预防控制中心,广东深圳,518035;",国际检验医学杂志,三氯乙烯;药疹样皮炎;T细胞亚群;,,2012,33,21
xdzdyzl201416036,0,"ISTIC,PKU",尼尔雌醇治疗更年期综合征的疗效观察,,史维玲;,"[1]深圳市光明新区人民医院,广东 深圳,518106",现代诊断与治疗,尼尔雌醇;更年期综合症;治疗效果;,R749.4,2014,,16
tsyxyxb201408015,0,"ISTIC,PKU",地佐辛复合罗哌卡因用于产妇硬膜外全产程分娩镇痛的效果观察,10.3969/j.issn.1004-7115.2014.08.015,谭国芳;李振华;,"[1]深圳市光明新区人民医院,广东 深圳,518106",泰山医学院学报,地佐辛;罗哌卡因;分娩镇痛;硬膜外;,R714,2014,,8
zyyjk201311010,4,"ISTIC,PKU",深圳市食源性疾病网络监测预警体系研究,,李思果;彭朝琼;黄薇;张锦周;许舒乐;刘建平;梁浩;曾护国;,"[1]广东省深圳市疾病预防控制中心营养与食品卫生科,518055",职业与健康,食源性疾病;网络监测;预警体系;,R155.3,2013,29,11
zgyyzn201424182,0,"ISTIC,PKU",胆囊切除术前后肝外胆管直径变化与胆囊收缩素关系的临床研究,,彭伟雄;熊勇;王心吉;张奕文;,"[1]深圳市光明新区人民医院,广东 深圳,518106",中国医药指南,胆囊切除术;肝外胆管;胆囊收缩素;,R575.6,2014,,24
zgcjwsbj201408031,0,"ISTIC,PKU",组建糖尿病俱乐部的做法和体会,10.3969/j.issn.1001-568X.2014.08.0031,麦艳冰;李惠霞;麦合权;,[1]深圳市光明新区人民医院 广东深圳518106,中国初级卫生保健,糖尿病;健康教育;糖尿病俱乐部;,R193,2014,28,8
ylbjqj201408037,0,"ISTIC,PKU",FloTrac／Vigilo监测下两种麻醉药物组合在脊柱手术中行控制性降压的临床研究,10.3969/j.issn.1674-4659.2014.08.1021,谭国芳[1];钟曌[2];胡冬华[2];汪梦霞[2];唐杰坷[2];梁健明[2];严彦念[2];吴晓意[2];高兰[2];,"[1]深圳市光明新区人民医院麻醉科,广东深圳,518106;[2]暨南大学第一临床医学院麻醉学教研室,广东广州,510632;",临床医学工程,控制性降压;应激反应;内皮素;血栓素月圆;,R614.2,2014,,8
gjyywsdb201416033,0,"ISTIC,PKU",空心双头加压螺钉在桡骨小头骨折内固定术中的应用,10.3760/cma.j.issn.1007-1245.2014.16.033,宋晖;刘麟;周彬;廖怡清;王兆利;,"[1]518106,深圳市光明新区人民医院骨科二区",国际医药卫生导报,挠骨小头骨折;内固定;空心双头加压螺钉;,,2014,20,16
zgrdyx201311041,4,"ISTIC,PKU",深圳市2012年流感监测结果分析,,王昕;房师松;程小雯;吴春利;吕星;张仁利;唐秀娟;马汉武;,"[1]深圳市疾病预防控制中心,深圳市科技创新委重大传染病监控重点实验室,广东深圳518055",中国热带医学,流感;监测;规律;,R181.8+1,2013,13,11
yiyqy201416222,0,"ISTIC,PKU",高压氧治疗新生儿缺氧缺血性脑病的临床疗效观察,10.3969/j.issn.2095-1752.2014.16.222,肖湘香;,[1]广东省深圳市龙岗区第二人民医院新生儿科 518112,医药前沿,新生儿;缺氧缺血性脑病;高压氧;,R459.6,2014,,16
zgcfy201403080,3,"ISTIC,PKU",宫腹腔镜联合术诊治输卵管性不孕症的护理配合,,黄泓[1];张璇[2];徐小瑜[2];,"[1]深圳市罗湖区妇幼保健院,广东深圳,518021;[2]深圳市龙岗区妇幼保健院,广东深圳,518116;",中国处方药,宫腹腔镜;输卵管性不孕;护理;,,2014,,3
zgyyzn201335257,2,"ISTIC,PKU",欣普贝生与催产素用于足月妊娠促宫颈成熟及引产的临床效果比较,,杨静;杨建恩;,"[1]广东省深圳市光明新区人民医院产科,广东 深圳,518106",中国医药指南,足月妊娠;促宫颈成熟;引产;欣普贝生;催产素;,R714.2,2013,,35
bfyx201503116,0,"ISTIC,PKU",多维铁口服液治疗婴幼儿缺铁性贫血的临床研究,,周海山[1];夏洪波[2];,[1]广东省深圳市坪山新区妇幼保健院 深圳 518122;[2]广东省深圳市龙岗区妇幼保健院 深圳 518172;,北方药学,多维铁口服液;婴幼儿缺铁性贫血;临床疗效;,R723.2,2015,,3
zgzl201307005,2,"ISTIC,PKU",深圳市低收入妇女人群宫颈癌防治知识知晓及筛查参与情况分析,10.11735/j.issn1004-0242.2013.07.A005,李晓英;刘植华;王月云;朱社宁;梁绮文;史红梅;詹爱丁;,"[1]深圳市妇幼保健院,广东深圳,518048",中国肿瘤,低收入人群;宫颈癌;知晓率;筛查率;,R737.31,2013,22,7
zwyxyj201411031,1,"ISTIC,PKU",血脂、脂肪肝与心电图的分析,,马东秀;,[1]深圳市光明新区人民医院 广东 深圳 518106,中外医学研究,脂肪肝;血脂;心电图;,R54,2014,,11
zyyj201405008,0,"ISTIC,PKU",深圳市龙岗区麻疹发病时间与节气特征性的调查分析,10.3969/j.issn.1001-6910.2014.05.08,陈香[1];孙玉芳[1];彭涛[2];谢森[1];赵细丽[1];,"[1]深圳市龙岗区第二人民医院,广东深圳,518112;[2]深圳市龙岗区坂田街道预防保健所,广东深圳,518129;",中医研究,麻疹;节气;运气学说;圆形统计分析;深圳市;调查/分析;,R511.1,2014,27,5
zhyxcszz201205012,8,"ISTIC,PKU",胎儿胆囊异常的产前超声诊断及意义,10.3877/cma.j.issn.1672-6448.2012.05.014,王银;李胜利;陈琮瑛;文华轩;姚远;毕静茹;廖玉媚;,"[1]南方医科大学附属深圳市妇幼保健院超声科,518028",中华医学超声杂志（电子版）,超声检查;产前;胆囊异常;,R445.1  R714.5,2012,09,5
yxxxzz201508029,0,"ISTIC,PKU",双胞胎儿童使用不同氟化物2年预防乳牙龋效果的对比研究,10.3969/j.issn.1006-1959.2015.08.029,陈周焕;南小思;王唯希;,"[1]深圳市龙岗区妇幼保健院口腔科,广东深圳,518172",医学信息,氟化涂料;氟化泡沫;乳牙;龋病;,,2015,28,8
zywsyyjjy201302017,3,"ISTIC,PKU",职业卫生监督中的几个问题探讨,,张红升[1];张矗[2];刘松[1];张献兴[1];刘清香[1];,"[1]深圳市光明新区疾病预防控制中心(卫生监督所),深圳,518107;[2]深圳市宝安区石岩预防保健所(卫生监督所),深圳,518108;",职业卫生与应急救援,职业卫生;监督;用人单位;,X921,2013,31,2
hljzyy201501025,0,"ISTIC,PKU",不同病性证素对老年高血压病患者氧化应激的影响,,姚灿坤;刘学耀;唐新征;林华;蔡智刚;,[1]深圳市福田区中医院 518034,黑龙江中医药,老年高血压病;病性证素;氧化应激;,,2015,44,1
hljzyy201501016,0,"ISTIC,PKU",引经药对高血压病患者血压变异性影响的临床研究,,张炜宁;刘学耀;唐新征;姚灿坤;林华;王慧;,[1]深圳市福田区中医院 518034,黑龙江中医药,引经药;高血压病;血压变异性;,,2015,44,1
sjzxyy-e201517121,0,"ISTIC,PKU",药物冲洗鼻腔在化脓性鼻窦炎治疗中的疗效观察,10.3969/j.issn.1671-3141.2015.17.121,丁琼;杜美娟;,"[1]广东省深圳市福田区中医院耳鼻喉科,广东,518033",世界最新医学信息文摘（连续型电子期刊）,鼻窦炎;鼻腔冲洗;药物剂量;药物选择;,R765.04+2,2015,,17
zwyxyj201420026,0,"ISTIC,PKU",药物自我处置模式训练对精神障碍疗效的影响观察,,叶小英;杨颖佳;顾雯;王秋玲;孔志;李敏智;,[1]深圳市康宁医院 深圳市心理健康实验室 广东 深圳 518020,中外医学研究,药物自我处置模式训练;精神障碍;,R749.1,2014,,20
zgrdyx201310017,4,"ISTIC,PKU",深圳市盐田区2009～2012年手足口病流行病学特征分析,,李标[1];谢锦尧[1];林瑞彬[1];吴虹[1];李雪梅[1];高世同[2];,"[1]深圳市盐田区疾病预防控制中心,广东深圳,518081;[2]深圳市疾病预防控制中心,广东深圳,518055;",中国热带医学,手足口病;流行病学特征;婴幼儿;分析;,R512.5,2013,13,10
hnsysjjbzz201321006,2,"ISTIC,PKU",喹硫平与利培酮治疗阿尔茨海默病精神行为异常的临床疗效及安全性分析,,廖春平;李学武;王荣业;吴东辉;陈周文;,"[1]广东深圳市康宁医院门诊部,深圳,518020",中国实用神经疾病杂志,喹硫平;利培酮;阿尔茨海默病;精神行为症状;,R749.1+6,2013,16,21
zgsyyy201421210,0,,深圳市宝安区松岗街道2010~2012年体检人群高血压监测分析,,郑振喜[1];张晓丽[2];,"[1]518105,深圳市宝安区松岗预防保健所门诊部;[2]深圳市光明新区人民医院;",中国实用医药,体检;高血压;监测;预防;,,2014,,21
amydy201407060,0,,检测血浆microRNA-499在早期诊断急性心肌梗死中的临床价值,,余其振;张立波;罗楚;张文;李阳华;栗洋;李红;,"[1]深圳市光明新区人民医院,广东深圳,518106",按摩与康复医学,急性心肌梗死;microRNA-499;肌钙蛋白I;诊断;临床价值;,R541.4,2014,,7
rdyxzz201409030,0,,深圳市某小学一起水痘暴发疫情的现场流行病学调查,,张振[1];廖玉学[1];邓凯杰[2];郑晓钧[2];李丽廉[2];司徒潮满[2];,"[1]深圳市疾病预防控制中心,广东深圳518055;[2]深圳市福田区疾病预防控制中心,广东深圳518040;",热带医学杂志,水痘;暴发疫情;现场流行病学调查;,R511.5,2014,14,9
zgyyzn201419010,0,,HPLC测定头孢呋辛酯片的含量及有关物质,,李裕基;张璇;闫小华;,"[1]深圳市康宁医院,广东深圳,518020",中国医药指南,头孢呋辛酯片;HPLC;含量;有关物质;,R927.2,2014,,19
xdzdyzl201503014,0,,“丹参三藤汤”配合枕颌牵引治疗椎动脉型颈椎病的临床疗效观察,,刘兴利;徐宁达;,"[1]深圳市福田区中医院,广东 深圳,518034",现代诊断与治疗,丹参三藤汤;枕颌牵引;椎动脉型颈椎病;疗效;,R681,2015,,3
ddyylc201412048,2,,为妊娠糖尿病患者进行干化学法快速血糖仪检测与全自动生化仪检测的结果分析,,林建春;,[1]深圳市龙岗区妇幼保健院检验科 广东 深圳 518172,当代医药论丛,血糖;干化学法;全自动生化仪;结果比较;,R587.1,2014,,12
zwyxyj201416060,2,,老年中风患者护理不安全因素分析及对策,,吴蒙;,[1]深圳市福田区中医院 广东 深圳 518000,中外医学研究,老年中风患者;不安全因素;对策;,R47,2014,,16
zgrdyx201409034,0,,颚口线虫病的流行病学、临床特点及其诊治,,高世同;,"[1]深圳市疾病预防控制中心,广东深圳518055",中国热带医学,颚口线虫病;流行病学;诊治;文献综述;,R532.1,2014,14,9
xdzdyzl201504081,0,,无痛型尿道拭子在男性患者尿道分泌物取样中的应用,,张丽珍;卢雨前;杨乙;张旋;,"[1]深圳市龙岗区妇幼保健院,广东 深圳,518172",现代诊断与治疗,无痛型尿道拭子;尿道分泌物取样;男性不孕;疼痛;解脲支原体;,R695  R374.1,2015,,4
zgyykx201504044,0,,替牙期儿童龋齿与饮食习惯、口腔卫生习惯关系的研究,,陈周焕;南小思;杨雅;王唯希;,"[1]深圳市龙岗区妇幼保健院口腔科,广东深圳,518172",中国医药科学,饮食习惯;口腔卫生习惯;龋齿;替牙期;,R788,2015,,4
jyjxlt201440118,1,,中医临床教育应遵循师承之道,,彭志华;韩霞;冯军;,"[1]深圳市福田区中医院,广东 深圳,518034",教育教学论坛,师承教育;中医特色;人才培养;,G642,2014,,40
yxxxzz201324629,1,,天麻醒脑胶囊联合氟桂利嗪治疗血管神经性头痛的疗效观察,,张群峰[1];朱仕荣[2];郑若璟[2];,"[1]深圳市龙岗区第二人民医院药剂科,广东 深圳,518000;[2]深圳市福田区人民医院,广东 深圳,518000;",医学信息,血管神经性头痛;氟桂利嗪;天麻醒脑胶囊;布洛芬;,,2013,,24
zgrdyx201407006,1,,硒代蛋氨酸与亚硒酸钠对EV71在体内外增值的影响,,黄飞雁[1];张仁利[2];张起文[3];刘凤仁[3];,"[1]深圳市龙岗区坪地预防保健所,广东 深圳518117;[2]深圳市疾病预防控制中心重大传染病监控重点实验室,广东 深圳518055;[3]深圳市龙岗区疾病预防控制中心,广东 深圳518116;",中国热带医学,肠道病毒属;小鼠;硒代蛋氨酸;亚硒酸钠;,R373.2,2014,14,7
zwyxyj201420063,0,,异位妊娠介入术后疼痛的护理干预效果分析,,周秀英[1];颜美荣[1];张雯[2];,[1]深圳市光明新区人民医院 广东 深圳 518106;[2]深圳市宝安区中医院;,中外医学研究,腹腔镜;介入治疗;异位妊娠;妇科疾病;综合护理;,R714.2,2014,,20
scjsws201402015,0,,深圳市某企业员工睡眠状况与心理状况及其关系,10.3969/j.issn.1007-3256.2014.02.010,曾玲芸;江帆;曹长安;,"[1]518020,深圳市康宁医院",四川精神卫生,企业员工;心理健康;睡眠;,R749.4+1,2014,,2
ddyx201412003,0,,胎膜早破妊娠结局分析,10.3969/j.issn.1009-4393.2014.12.003,陈美华[1];旷文佳[1];龙隽[2];,"[1]广东 518112 广东省深圳市龙岗区第二人民医院妇产科;[2]518100,广东省深圳市罗湖医院妇产科;",当代医学,胎膜早破;分娩方式;母婴并发症;,,2014,,12
zgyydk201204008,8,,胎心监护对胎心监护脐带异常的预测价值及542例脐带异常分析,10.3969/j.issn.1009-0959.2012.04.008,巫寒梅;,"[1]广东省深圳市妇幼保健院产科,深圳,518048",中国医药导刊,胎心监护;脐带异常;预测;,R714.56,2012,14,4
zyyjk201323043,3,,2008-2012年深圳市水痘疫情的流行病学特征,,黄芳;谢旭;唐秀娟;,"[1]广东省深圳市疾病预防控制中心,518005",职业与健康,水痘;流行病学;深圳;,R181.3,2013,29,23
zgbjyy-x201404140,0,,糖尿病视网膜病变与血清胆红素水平、血脂的关系,10.3969/j.issn.1004-7484(x).2014.04.140,彭伟;王艾萍;孙建西;毛彦琪;刘贵锋;,"[1]深圳市龙岗区第二人民医院,广东深圳,518116",中国保健营养（下旬刊）,糖尿病视网膜病变;胆红素;血脂;相关性;,,2014,24,4
zhfylcyxzz201206013,6,,乳腺癌新辅助化疗后前哨淋巴结活检的临床应用价值,10.3877/cma.j.issn.1673-5250.2012.06.013,郑爱秋[1];刘瑞霞[2];朱运添[1];周颉[1];刘敏[1];石剑[1];傅建民[1];,"[1]南方医科大学附属深圳市妇幼保健院乳腺甲状腺科,深圳,518028;[2]深圳市人民医院龙华分院;",中华妇幼临床医学杂志（电子版）,乳腺癌;新辅助化疗;前哨淋巴结;,,2012,8,6
zgyyzn201407186,1,,68例妊高征孕产妇的临床观察及护理,,周秀英;,"[1]广东省深圳市光明新区人民医院,广东 深圳,518106",中国医药指南,妊娠高血压综合征;临床观察;护理干预;,R714.24+6  R473.71,2014,,7
gwyx-kqyx201306014,3,,深圳市3~4岁儿童母亲口腔保健知识态度行为的调查,10.7518/gjkq.2013.06.011,刘芸;张强;黄星星;,[1]南方医科大学附属深圳市妇幼保健院口腔病防治中心 深圳 518048,国际口腔医学杂志,口腔保健;健康教育;儿童;母亲;,R780.1,2013,,6
zgwzxzz201213095,0,,九种生物标记物在区分细菌与病毒感染中的应用,,钟岸[1];张伟[1];范世珍[2];王毅[1];王娟[3];,"[1]深圳市孙逸仙心血管医院检验科,广东深圳,518020;[2]广东省深圳市福田区中医院检验科 518034;[3]广东省深圳市报业集团诊所 518000;",中国误诊学杂志,细菌感染/诊断;病毒性疾病/诊断;生物学标记;,R515  R51,2012,12,13
xdlchl201412015,0,,护士长对360度绩效考评体验的质性研究,10.3969/j.issn.1671-8283.2014.12.012,丁蓉;朱社宁;王璐;秦茸蓉;,[1]南方医科大学附属深圳市妇幼保健院护理部，广东深圳，518028,现代临床护理,护士长;360度绩效考评;质性研究;,R47,2014,,12
zglcys201412016,0,,磁共振弥散张量神经束示踪术定量评价早产新生儿皮质脊髓束的临床观察,10.3969/j.issn.1008-1089.2014.12.016,何健龙[1];全显跃[1];曹满瑞[2];朱志军[2];张方璟[2];杜牧[2];,"[1]南方医科大学珠江医院影像诊断中心,广东 广州,510280;[2]南方医科大学深圳市妇幼保健院,广东 深圳,518000;",中国临床医生,磁共振;弥散张量成像;神经束示踪术;早产新生儿;皮质脊髓束;,R277.15+1,2014,,12
zgzyykj2014z1331,0,,PRECEDE模式健康教育对固定正畸患者治疗影响的对比研究,,姜肖梅;陈香;张晓磊;佘媛媛;,[1]南方医科大学附属深圳市妇幼保健院口腔病防治中心 广东 深圳 518048,中国中医药科技,PRECEDE模式;正畸治疗;脱矿;,,2014,,z1
jkr201234036,4,,阿司匹林、阿托伐他汀、青霉素联合治疗急性脑梗死的临床观察,10.3969/j.issn.1674-4721.2012.34.036,梁兰;陈茜;邬丹丹;,"[1]深圳市龙岗区第二人民医院,广东深圳,518112",中国当代医药,急性脑梗死;阿司匹林;阿托伐他汀;青霉素;联合治疗;高敏C反应蛋白;纤维蛋白原;,R743,2012,19,34
rdyxzz201301029,8,,2006-2011年深圳市集体食堂食物中毒流行病学分析,,罗贤如;黄薇;张锦周;刘建平;王舟;潘柳波;范兴;张志航;,"[1]深圳市疾病预防控制中心,广东深圳,518055",热带医学杂志,食物中毒;流行病学研究;副溶血性弧菌;,R595.7,2013,13,1
scyxzz201310172,2,,糖尿病前期人群焦虑情绪对疾病早期发现和生活质量影响研究,10.3969/j.issn.1673-6567.2013.10.172,董建仙;李常青;陈玉明;,"[1]深圳市光明新区人民医院,广东 深圳,518132",中国伤残医学,焦虑情绪;糖尿病发现;生活质量;,R587.1,2013,,10
hkhtyy201310060,2,,医患纠纷对外科年轻护士心理影响及院内培训措施,,黄美娟[1];梁建娜[1];黄海兰[2];,"[1]深圳市光明新区人民医院,深圳,518106;[2]佛山市南海区第三人民医院北院,佛山,528241;",航空航天医学杂志,综合性医院;护士心理健康状态;护患纠纷;相关因素;,R471,2013,24,10
lnpfxbkzz201303016,3,,外来务工者下肢丹毒发病危险因素分析,10.3969/j.issn.1674-8468.2013.03.016,李永双;张志云;,"[1]深圳市光明新区人民医院皮肤科,广东,深圳,518106",皮肤性病诊疗学杂志,丹毒;发病;危险因素;,R753.5,2013,20,3
cdyy201401033,1,,100例小儿安全型留置针的应用体会,10.11851/j.issn.1673-1557.2014.01.033,田桂荣;,"[1]深圳市光明新区人民医院,广东,深圳,518106",现代临床医学,安全型;留置针;儿童;,R473.72,2014,40,1
zgrdyx201303016,7,,深圳市大沙河、观澜河藁杆双脐螺分布及其生态环境调查,,高世同[1];李晓恒[1];黄少玉[2];谢旭[1];梅树江[1];阮彩文[2];黄达娜[1];,"[1]深圳市疾病预防控制中心,广东深圳,518055;[2]广东省疾病预防控制中心,广东广州,510300;",中国热带医学,藁杆双脐螺;调查;大沙河;观澜河;深圳市;,R384.9,2013,13,3
zgyxcx201334015,1,,解剖型钛板内固定及致密植骨治疗跟骨关节内骨折,10.3969/j.issn.1674-4985.2013.34.015,陈志林;袁太珍;廖建中;曾司伟;龚国龄;李作灵;,[1]广东省深圳市龙岗区第二人民医院 广东 深圳 518112,中国医学创新,跟骨骨折;解剖型钛板;内固定;人工骨;,,2013,,34
zgyyzn201334312,1,,冠心病患者血小板聚集功能与炎性因子关系的研究,,刘圣林;,"[1]深圳市龙岗区第二人民医院,广东 深圳,518000",中国医药指南,冠心病;血小板;聚集功能;炎性因子;,R541.4,2013,,34
jilinyx201334096,1,,产妇心理状态对分娩结果的影响及护理干预,,黄志芳;曾育玲;陈文霞;,"[1]广东省深圳市龙岗区第二人民医院,广东,深圳,518112",吉林医学,心理状态;分娩方式;护理干预;,,2013,34,34
nmgzyy201418185,0,,鼻内翻性乳头状瘤经泪前隐窝进路手术护理体会,,刘艳;陈绮琴;李小风;,[1]广东省深圳市光明新区人民医院五官科 518106,内蒙古中医药,内翻性乳头状瘤;泪前隐窝;围手术期;护理;,R473.76,2014,33,18
chkx201206020,1,"ISTIC,PKU",疾病监测预警与应急处置系统的数据集成模式,,姬伟[1];曹春香[2];吴信才[3];程锦泉[4];吴永胜[4];,"[1]遥感科学国家重点实验室/中国科学院遥感应用研究所,北京100101;中国地质大学(武汉)信息工程学院,武汉430074;[2]遥感科学国家重点实验室/中国科学院遥感应用研究所,北京,100101;[3]中国地质大学(武汉)信息工程学院,武汉,430074;[4]深圳市疾病预防控制中心,深圳,518020;",测绘科学,监测预警;应急处置;数据整合;目录服务;增量更新;,P208,2012,37,6
jilinyx201418085,0,"ISTIC,PKU",颅内肿瘤应用镜辅助钬激光技术治疗近期效果分析,,陈雪江;,"[1]广东省深圳市光明新区人民医院神经外科,广东深圳,518106",吉林医学,颅内肿瘤;镜;钬激光技术;近期效果;,,2014,,18
jilinyx201418119,0,"ISTIC,PKU",健康教育对社区老年糖尿病患者遵医行为的影响,,高倩谊;,"[1]广东省深圳市光明新区人民医院西田社区健康服务中心,广东深圳,518106",吉林医学,健康教育;社区;糖尿病;遵医行为;血糖;,,2014,,18
qqhryxyxb201412083,0,"ISTIC,PKU",早产儿暖箱细菌污染和不同湿化水之间联系的分析,,徐芮;杨艺;顾红;,"[1]518106,深圳市光明新区人民医院新生儿科",齐齐哈尔医学院学报,湿化水;暖箱;细菌污染;早产儿;,,2014,,12
jyyxylc201412022,0,"ISTIC,PKU",UF-1000i尿沉渣分析仪与显微镜检测尿液小圆上皮细胞对比分析及参考值建立,10.3969/j.issn.1672-9455.2014.12.022,阳建[1];余赛红[1];文艳[2];刘爱胜[3];,[1]广东省深圳市宝安区沙井人民医院检验科 518104;[2]广东省深圳市光明新区人民医院ICU 518106;[3]广东省深圳市龙华新区人民医院检验科 518109;,检验医学与临床,UF-1000i尿沉渣分析仪;显微镜;小圆上皮细胞;对比分析;参考区间;,,2014,,12
rdyxzz201307029,5,"ISTIC,PKU",2006-2011年深圳市传染病突发公共卫生事件流行病学特征,,李媛;吕秋莹;谢旭;梅树江;马汉武;曹彬;孔东锋;唐秀娟;,"[1]深圳市疾病预防控制中心,广东深圳,518055",热带医学杂志,传染病;突发公共卫生事件;流行病学;,R183,2013,13,7
amydy201406103,0,"ISTIC,PKU",宫腔镜术中实施护理干预的效果观察,,程长秀[1];李丽明[1];傅羽龙[2];,"[1]深圳市光明新区人民医院手术室,广东深圳,518106;[2]深圳市龙岗中心医院麻醉科,广东深圳,518116;",按摩与康复医学,宫腔镜手术;护理配合;效果;,R473.71,2014,,6
zgyyzn201329194,2,"ISTIC,PKU",糖尿病患者饮食问题及社区护理干预研究,10.3969/j.issn.1671-8194.2013.29.194,彭秋平;,"[1]深圳市光明新区人民医院,广东深圳,518000",中国医药指南,糖尿病患者;饮食问题;社区护理干预;,R473.5,2013,,29
jilinyx201417121,0,"ISTIC,PKU",经口内径路咽旁间隙肿瘤摘除患者的围手术期护理分析,,刘艳;巫菊芳;周建设;邓秋优;曾庆玲;朱周平;,"[1]广东省深圳市光明新区人民医院耳鼻喉科,广东 深圳,518106",吉林医学,咽旁间隙肿瘤;口内径路;围手术期;护理;,,2014,,17
hgzy201415001,0,"ISTIC,PKU",精神障碍住院患者的流行病学特征及相关危险因素分析,,叶小英;杨颖佳;顾雯;王秋玲;孔志;李敏智;,[1]深圳市康宁医院急性干预科，深圳市心理健康实验室，广东深圳 518020,中外医疗,精神障碍;住院患者;流行病学;特征;危险因素;,R4,2014,,15
zgetbjzz201202024,1,"ISTIC,PKU",儿童卫生保健服务中的性别差异研究,,张绍强[1];张玲[2];陈文英[2];冯文成[2];夏洪波[2];,"[1]深圳市龙岗区健康教育所,广东深圳,518172;[2]深圳市龙岗区妇幼保健院,广东深圳,518172;",中国儿童保健杂志,保健服务;性别差异;儿童;,R174,2012,20,2
jyyxylc201406029,0,"ISTIC,PKU",血常规参数联合红细胞脆性在珠蛋白生成障碍性贫血初筛中的应用研究,10.3969/j.issn.1672-9455.2014.06.029,曾思强[1];向华国[2];曾锦婷[2];范木怀[3];,[1]广东省深圳市龙岗区第二人民医院 518112;[2]广东省深圳市宝安区福永人民医院中心实验室 518103;[3]广东省深圳市大鹏新区妇幼保健院 518108;,检验医学与临床,血常规参数;红细胞脆性;珠蛋白生成障碍性贫血;筛查;,,2014,,6
ylbjqj201308046,4,"ISTIC,PKU",“治未病”理论在冠心病护理中的应用,10.3969/j.issn.1674-4659.2013.08.1013,麦少云;刘映霞;,"[1]广东省深圳市福田区中医院治未病中心,广东深圳,518034",临床医学工程,治未病;冠心病;护理;,R248.1,2013,20,8
ylbjqj201308046,4,,“治未病”理论在冠心病护理中的应用,10.3969/j.issn.1674-4659.2013.08.1013,麦少云;刘映霞;,"[1]广东省深圳市福田区中医院治未病中心,广东深圳,518034",临床医学工程,治未病;冠心病;护理;,R248.1,2013,20,8
jcyxlt201426068,1,,孕早期孕妇血清β-HCG PAPP-A预测妊娠高血压综合征的价值研究,,皮回春;刘秀菊;吴曼贞;徐玲;高玉山;,"[1]深圳市龙岗区妇幼保健院,广东 深圳,518172",基层医学论坛,妊娠高血压综合征;人绒毛膜促性腺激素;妊娠相关蛋白A;预测价值;,,2014,,26
